{"origem": "catarse", "categoria_teste_mencoes": {"saloes_humor": false, "hqmix": false, "ccxp": true, "fiq": true, "angelo_agostini": false, "politica": true, "questoes_genero": false, "lgbtqiamais": false, "terror": false, "humor": false, "herois": false, "disputa": false, "ficcao_cientifica": false, "fantasia": false, "folclore": false, "zine": false, "webformatos": false, "erotismo": false, "religiosidade": false, "jogos": false, "midia_independente": false}, "recompensas_menor_nominal": 60.0, "recompensas_menor_ajustado": 80.9357989865925, "recompensas_quantidade": 1, "autoria_id": 1094985, "autoria_nome": "ana luiza lacerda", "autoria_nome_publico": "ana luiza lacerda", "autoria_classificacao": "feminino", "autoria_classificacao_id": 4, "social_seguidores": 13, "social_newsletter": false, "social_sub_contribuicoes_amigos": true, "social_sub_novos_seguidores": true, "social_sub_posts_projeto": true, "social_projetos_contribuidos": 5, "social_projetos_publicados": 2, "geral_municipio": "Belo Horizonte", "geral_uf": "MG", "geral_uf_br": "MG", "geral_city_id": 1634, "geral_content_rating": 1, "geral_contributed_by_friends": false, "geral_capa_imagem": false, "geral_capa_video": true, "geral_dias_campanha": 13, "geral_data_fim": "2019-11-19T02:59:59.999999", "geral_data_ini": "2019-10-06T02:26:20.363511", "geral_meta": 1500.0, "geral_meta_corrigida": 2023.3949746648125, "geral_arrecadado": 2700.0, "geral_arrecadado_corrigido": 3642.1109543966622, "geral_percentual_arrecadado": 180.0, "geral_conteudo_adulto": false, "geral_posts": 3, "geral_project_id": 104090, "geral_modalidade": "flex", "geral_titulo": "Pluri ", "geral_status": "successful", "geral_total_contribuicoes": 57, "geral_total_apoiadores": 57, "geral_sobre": "Meu nome \u00e9 Ana Luiza Lacerda , sou ilustradora e arquiteta de S\u00e3o Paulo morando em Belo Horizonte. H\u00e1 3 anos tenho trabalhado em projetos envolvendo ilustra\u00e7\u00e3o e agora estou lan\u00e7ando meu primeiro quadrinho autoral \u201cPluri\".\nPluri \u00e9 um projeto adaptado do meu TCC da Escola de Arquitetura que nasceu da minha pr\u00f3pria hist\u00f3ria de redescobrimento do desenho durante a faculdade e da identifica\u00e7\u00e3o com a hist\u00f3ria de outros alunos que passaram pela mesma situa\u00e7\u00e3o.\nO processo do TCC foi incr\u00edvel, constru\u00eddo por muitas m\u00e3os a partir de experi\u00eancias coletivas dentro da Escola. Trazendo essas hist\u00f3rias como pano de fundo ele discutiu a uni\u00e3o entre desenho e arquitetura, investigando suas origens e desdobramentos com foco nas implica\u00e7\u00f5es dentro do campo da arquitetura.\nPluri, por sua vez, faz uma releitura desse TCC mas trazendo como tema principal as trajet\u00f3rias de retomada da pr\u00e1tica do desenho. Espero que outras pessoas se identifiquem com essa proposta e se sintam incentivadas a descobrirem ou redescobrirem o desenho de uma maneira pessoal e singular.\nO quadrinho tamb\u00e9m tem um car\u00e1ter interativo e traz nele exerc\u00edcios de desenho e express\u00e3o gr\u00e1fica  que s\u00e3o fruto de oficinas coletivas ministradas na Escola de Arquitetura com diversos grupos de pessoas durante o TCC. Esses exerc\u00edcios fazem parte da hist\u00f3ria mas est\u00e3o colocados de forma que o leitor pode tamb\u00e9m explor\u00e1-los junto com os protagonistas.\nA hist\u00f3ria pincela a rela\u00e7\u00e3o espec\u00edfica do desenho com um estudante de arquitetura, uma vez que traz aspectos reais vividos por pessoas da faculdade, mas o quadrinho n\u00e3o \u00e9 apenas para pessoas que tem algum tipo de rela\u00e7\u00e3o com a arquitetura. Pluri \u00e9 um convite a uma autoreflex\u00e3o, \u00e9 sobre se encontrar, sobre escolhas, e \u00e9 para todos que querem se deixar encantar pela pr\u00e1tica do desenho.\nA campanha vai funcionar da seguinte forma:\nPara o meu projeto o lan\u00e7amento no catarse ser\u00e1 como um pr\u00e9 venda. Optei pelo financiamento flex, ou seja, independente da meta ser ou n\u00e3o atingida o projeto vai acontecer! Mas seria muito bacana conseguir que Pluri seja financiado e bater a meta!\nDurante Outubro e Novembro ocorrer\u00e1 essa pr\u00e9-venda e a capta\u00e7\u00e3o de recursos. Em Novembro ser\u00e1 a impress\u00e3o do livro e das recompensas. Nos dias 5 a 8 de Dezembro acontecer\u00e1 o lan\u00e7amento na CCXP19 e depois durante Dezembro e Janeiro vou fazer os envios para os apoiadores!\nVoce pode apoiar aqui pelo catarse mesmo adquirindo um dos kits de recompensas mas tamb\u00e9m pode divulgar esse projeto que ajuda muito tamb\u00e9m!\nEssas s\u00e3o as recompensas que voc\u00ea pode adquirir apoiando meu projeto!\nTudo isso com frete gr\u00e1tis\nS\u00e3o muitas possibilidades para ningu\u00e9m ficar de fora, ent\u00e3o garanta o seu, compartilhe com os amigos e me acompanhe nas redes sociais !\nOl\u00e1s, meu nome \u00e9 Ana Luiza, tenho 23 anos, moro em Belo Horizonte, sou ilustradora, formada em Arquitetura pela UFMG.\nMeu TCC que originou a proposta desse quadrinho foi desenvolvido entre 2018 e 2019 orientado pelos incr\u00edveis Jos\u00e9 Cabral e Diego Fagundes que se abriram a minhas ideias malucas e me ajudaram com tudo que precisei.\nEste projeto tem sido uma experi\u00eancia muito especial. Estou colocando muito trabalho e carinho em Pluri, espero que voc\u00eas gostem!\nObrigada!", "categoria_multirrotulo_lda": {"0": 0.2, "1": 0.0, "2": 0.2, "3": 0.2, "4": 0.4, "5": 0.0, "6": 0.4, "7": 0.0, "8": 0.4, "9": 0.0, "10": 0.4, "11": 0.4, "12": 0.6, "13": 0.0, "14": 0.2, "15": 0.2, "16": 0.8, "17": 0.0, "18": 0.0, "19": 0.0, "20": 0.0, "21": 0.0, "22": 0.2, "23": 0.2, "24": 0.0, "25": 0.0, "26": 0.0, "27": 0.2, "28": 0.0, "29": 0.0, "30": 0.2, "31": 0.0, "32": 0.0, "33": 0.0, "34": 0.2, "35": 0.2, "36": 0.2, "37": 0.0, "38": 0.2, "39": 0.0, "40": 0.2, "41": 0.4, "42": 0.2, "43": 0.2, "44": 0.0, "45": 0.2, "46": 0.0, "47": 0.0, "48": 0.4, "49": 0.0}, "categoria_entidades": ["nome", "ana luiza lacerda", "ilustradora", "arquiteta de s\u00e3o paulo", "belo horizonte", "3 anos", "projetos", "ilustra\u00e7\u00e3o", "primeiro quadrinho autoral", "pluri", "projeto", "tcc da escola de arquitetura", "pr\u00f3pria hist\u00f3ria de redescobrimento do desenho", "faculdade", "identifica\u00e7\u00e3o", "hist\u00f3ria", "alunos", "mesma situa\u00e7\u00e3o", "processo do tcc", "m\u00e3os a partir de experi\u00eancias coletivas", "escola", "hist\u00f3rias como pano de fundo", "uni\u00e3o entre desenho", "arquitetura", "origens", "desdobramentos com foco nas implica\u00e7\u00f5es", "campo da arquitetura", "vez", "releitura desse tcc", "tema principal", "trajet\u00f3rias de retomada da pr\u00e1tica do desenho", "pessoas", "proposta", "desenho", "maneira pessoal", "quadrinho", "car\u00e1ter interativo", "exerc\u00edcios de desenho", "express\u00e3o gr\u00e1fica", "fruto de oficinas coletivas", "escola de arquitetura com diversos grupos de pessoas", "tcc", "exerc\u00edcios", "parte da hist\u00f3ria", "colocados de forma", "leitor", "protagonistas", "hist\u00f3ria pincela", "rela\u00e7\u00e3o espec\u00edfica do desenho", "estudante de arquitetura", "aspectos reais", "pessoas da faculdade", "tipo de rela\u00e7\u00e3o", "convite", "autoreflex\u00e3o", "escolhas", "pr\u00e1tica do desenho", "campanha", "seguinte forma", "lan\u00e7amento no catarse", "um pr\u00e9 venda", "financiamento flex", "meta", "outubro", "novembro", "pr\u00e9-venda", "capta\u00e7\u00e3o de recursos", "impress\u00e3o do livro", "recompensas", "dias 5 a 8 de dezembro", "lan\u00e7amento na ccxp19", "dezembro", "janeiro", "envios", "apoiadores", "catarse", "um dos kits de recompensas", "frete gr\u00e1tis", "possibilidades", "amigos", "redes sociais", "ol\u00e1s", "ana luiza", "23 anos", "arquitetura pela ufmg", "proposta desse quadrinho", "incr\u00edveis jos\u00e9 cabral", "diego fagundes", "ideias malucas", "experi\u00eancia", "trabalho", "carinho em pluri"]}