{"origem": "catarse", "categoria_teste_mencoes": {"saloes_humor": false, "hqmix": false, "ccxp": true, "fiq": false, "angelo_agostini": false, "politica": false, "questoes_genero": false, "lgbtqiamais": false, "terror": false, "humor": false, "herois": false, "disputa": false, "ficcao_cientifica": false, "fantasia": false, "folclore": false, "zine": false, "webformatos": false, "erotismo": false, "religiosidade": true, "jogos": false, "midia_independente": false}, "recompensas_menor_nominal": 400.0, "recompensas_menor_ajustado": 539.5719932439499, "recompensas_quantidade": 1, "autoria_id": 400517, "autoria_nome": "\u00e9rica sena de ara\u00fajo", "autoria_nome_publico": "\u00e9rica sena", "autoria_classificacao": "feminino", "autoria_classificacao_id": 4, "social_seguidores": 1, "social_newsletter": false, "social_sub_contribuicoes_amigos": true, "social_sub_novos_seguidores": true, "social_sub_posts_projeto": true, "social_projetos_contribuidos": 1, "social_projetos_publicados": 1, "geral_municipio": "S\u00e3o Paulo", "geral_uf": "SP", "geral_uf_br": "SP", "geral_city_id": 5274, "geral_content_rating": 1, "geral_contributed_by_friends": false, "geral_capa_imagem": false, "geral_capa_video": true, "geral_dias_campanha": 40, "geral_data_fim": "2019-11-18T02:59:59.999999", "geral_data_ini": "2019-10-08T05:40:00.260564", "geral_meta": 12000.0, "geral_meta_corrigida": 16187.1597973185, "geral_arrecadado": 3396.1, "geral_arrecadado_corrigido": 4581.101115639446, "geral_percentual_arrecadado": 28.300833333333333, "geral_conteudo_adulto": false, "geral_posts": 0, "geral_project_id": 104592, "geral_modalidade": "flex", "geral_titulo": "DES\u00cdGNIO", "geral_status": "successful", "geral_total_contribuicoes": 42, "geral_total_apoiadores": 41, "geral_sobre": "Em uma das aulas no quarto ano do curso de moda na faculdade Santa Marcelina a \u00c9rica fez um trabalho em que precisou expressar seu tema de pesquisa de TCC em alguma outra linguagem: ela escolheu os quadrinhos! Assim nasceu \"Des\u00edgnio\", em parceria com o matem\u00e1tico e roteirista Thales Soares.\nO nome da hist\u00f3ria \u00e9 uma refer\u00eancia \u00e0 publica\u00e7\u00e3o \"Disegno. Desenho. Des\u00edgnio\" organizado pela artista Edith Derdyk e que virou livro de cabeceira da \u00c9rica esse ano. Al\u00e9m da HQ, Des\u00edgnio est\u00e1 nascendo tamb\u00e9m em monografia e como cole\u00e7\u00e3o de moda. A publica\u00e7\u00e3o ser\u00e1 lan\u00e7ada durante a Comic Con Experience 2019, no Artist's Alley!\nDes\u00edgnio \u00e9 uma hist\u00f3ria sobre desenho ilustrada por algu\u00e9m que escolheu o desenho como sua principal ferramenta de comunica\u00e7\u00e3o na moda e nas artes gr\u00e1ficas.\nSINOPSE\nLogo ap\u00f3s sua aposentadoria for\u00e7ada, Teresa recebe a visita de um anjo que lhe concede um impressionante dom divido: qualquer coisa que ela desenhar vai se materializar, saindo do papel e tornando-se real. Em troca, o anjo pede um \u00fanico favor:\n\u201cEu quero que voc\u00ea desenhe Deus\u201d.\nMal sabe o anjo que Teresa abandonou o nanquim e desistiu da arte por se achar incapaz de produzir desenhos como antigamente. Mas mesmo que ela ainda estivesse em seu auge, como poderia algu\u00e9m desenhar Deus sem nunca t\u00ea-lo visto?\nSe ela falhar, toda a realidade entrar\u00e1 em colapso e o universo se extinguir\u00e1.\nPROCESSO CRIATIVO\nA personagem principal da nossa hist\u00f3ria \u00e9 inspirada em uma Teresa do mundo real. A Teresa Dias que nasceu em Recife mas hoje mora em S\u00e3o Paulo tamb\u00e9m \u00e9 ilustradora. A partir dela nasceu nossa protagonista.\nESPECIFICA\u00c7\u00d5ES DA PUBLICA\u00c7\u00c3O\nRECOMPENSAS\nPara fazer isso acontecer criamos essa campanha no Catarse para financiar a impress\u00e3o do livro onde voc\u00ea poder\u00e1 comprar sua c\u00f3pia e ganhar recompensas exclusivas: marca p\u00e1ginas ilustrado, adesivos, prints, camisetas, ecobags, bordados e artes exclusivas!\nEm cada uma das recompensas est\u00e1 indicada a forma como voc\u00ea receber\u00e1 a HQ: em m\u00e3os ou atrav\u00e9s dos correios.\nSOBRE OS AUTORES\nThales Soares \u00e9 o roteirista de Des\u00edgnio. Ele \u00e9 matem\u00e1tico, artista e contador de hist\u00f3rias. J\u00e1 escreveu muitas hist\u00f3rias, publicou contos, criou uma narrativa maluca para seu TCC em matem\u00e1tica e publica um quadrinho online e peri\u00f3dico em seu site www. universodecontos.com. Desde pequeno gosta muito de criar universos e de utilizar seus personagens, atrav\u00e9s de situa\u00e7\u00f5es mirabolantes, para expressar e transmitir sentimentos e emo\u00e7\u00f5es indescrit\u00edveis  que permeiam sua mente.\n\u00c9rica Sena \u00e9 uma estudante de moda, ilustradora e sapateira. \u00c9 apaixonada pelo universo da literatura (especialmente literatura brasileira) desde sua inf\u00e2ncia, quando cursou o ensino fundamental na escola municipal Cec\u00edlia Meireles. Iniciou seu caminho na literatura aos 12 anos na Academia Estudantil de Letras e desde que come\u00e7ou sua gradua\u00e7\u00e3o em moda na Faculdade Santa Marcelina ela tem se dedicado ao mundo do desenho. Des\u00edgnio \u00e9 sua estreia oficial como ilustradora, \u00c9rica estar\u00e1 no Artist's Alley da CCXP 2019!\nO QUE \u00c9 CATARSE?\nO Catarse \u00e9 uma forma de financiamento coletivo que visa auxiliar artistas independentes a lan\u00e7arem no mercado suas obras. Assim voc\u00ea pode apoiar os artistas que voc\u00ea gosta incentivando a produ\u00e7\u00e3o de sua arte e recebendo v\u00e1rias recompensas por isso.\nA campanha deste projeto \u00e9 flex\u00edvel, ou seja, mesmo que a meta inicial n\u00e3o seja atingida, o livro ser\u00e1 lan\u00e7ado. Dessa forma, voc\u00ea ir\u00e1 receber de forma garantida todos as recompensas equivalentes ao pacote que voc\u00ea escolheu ao realizar sua contribui\u00e7\u00e3o.", "categoria_multirrotulo_lda": {"0": 0.4, "1": 0.2, "2": 0.6, "3": 0.2, "4": 0.6, "5": 0.0, "6": 0.8, "7": 0.4, "8": 0.4, "9": 0.4, "10": 0.4, "11": 0.6, "12": 0.6, "13": 0.0, "14": 0.2, "15": 0.4, "16": 0.6, "17": 0.0, "18": 0.2, "19": 0.6, "20": 0.0, "21": 0.2, "22": 0.6, "23": 0.4, "24": 0.0, "25": 0.4, "26": 0.2, "27": 0.6, "28": 0.2, "29": 0.4, "30": 0.6, "31": 0.2, "32": 0.2, "33": 0.0, "34": 0.2, "35": 0.6, "36": 0.4, "37": 0.6, "38": 0.4, "39": 0.0, "40": 0.2, "41": 0.2, "42": 0.6, "43": 0.4, "44": 0.0, "45": 0.4, "46": 0.0, "47": 0.0, "48": 0.4, "49": 0.2}, "categoria_entidades": ["uma das aulas no quarto ano do curso de moda na faculdade santa marcelina", "\u00e9rica", "trabalho", "tema de pesquisa de tcc", "linguagem", "quadrinhos", "des\u00edgnio", "parceria", "matem\u00e1tico", "roteirista thales soares", "nome da hist\u00f3ria", "refer\u00eancia \u00e0 publica\u00e7\u00e3o", "disegno", "desenho", "artista edith derdyk", "livro de cabeceira da \u00e9rica", "ano", "hq", "monografia", "cole\u00e7\u00e3o de moda", "publica\u00e7\u00e3o", "comic con experience 2019", "artist 's alley", "hist\u00f3ria sobre desenho", "principal ferramenta de comunica\u00e7\u00e3o na moda", "artes gr\u00e1ficas", "sinopse", "aposentadoria for\u00e7ada", "teresa", "visita", "anjo", "impressionante dom", "coisa", "papel", "troca", "\u00fanico favor", "deus", "nanquim", "arte", "incapaz", "desenhos", "auge", "realidade", "colapso", "universo", "processo criativo", "personagem principal", "hist\u00f3ria", "teresa do mundo real", "teresa dias", "recife", "s\u00e3o paulo", "protagonista", "especifica\u00e7\u00f5es da publica\u00e7\u00e3o", "campanha no catarse", "impress\u00e3o do livro", "c\u00f3pia", "recompensas exclusivas", "marca p\u00e1ginas", "prints", "camisetas", "ecobags", "bordados", "artes exclusivas", "uma das recompensas", "forma", "m\u00e3os", "correios", "sobre os", "thales soares", "roteirista de des\u00edgnio", "contador de hist\u00f3rias", "hist\u00f3rias", "contos", "narrativa maluca", "tcc em matem\u00e1tica", "quadrinho online", "peri\u00f3dico", "site www", "universos", "personagens", "situa\u00e7\u00f5es mirabolantes", "sentimentos", "emo\u00e7\u00f5es indescrit\u00edveis", "mente", "\u00e9rica sena", "estudante de moda", "ilustradora", "sapateira", "universo da literatura", "literatura brasileira", "inf\u00e2ncia", "ensino fundamental na escola municipal cec\u00edlia meireles", "caminho na literatura aos 12 anos na academia estudantil de letras", "gradua\u00e7\u00e3o em moda na faculdade santa marcelina", "mundo do desenho", "estreia oficial como ilustradora", "artist 's alley da ccxp 2019", "que", "catarse", "forma de financiamento coletivo", "artistas independentes", "mercado", "obras", "artistas", "produ\u00e7\u00e3o", "recompensas", "campanha deste projeto", "meta inicial", "livro", "recompensas equivalentes ao pacote", "contribui\u00e7\u00e3o"]}