{"origem": "catarse", "categoria_teste_mencoes": {"saloes_humor": false, "hqmix": true, "ccxp": false, "fiq": false, "angelo_agostini": false, "politica": false, "questoes_genero": false, "lgbtqiamais": false, "terror": true, "humor": true, "herois": false, "disputa": false, "ficcao_cientifica": false, "fantasia": false, "folclore": false, "zine": true, "webformatos": false, "erotismo": false, "religiosidade": false, "jogos": true, "midia_independente": false}, "recompensas_menor_nominal": 90.0, "recompensas_menor_ajustado": 118.26651463881124, "recompensas_quantidade": 1, "autoria_id": 93002, "autoria_nome": "marcel ibaldo", "autoria_nome_publico": "marcel e marcelli ibaldo", "autoria_classificacao": "coletivo", "autoria_classificacao_id": 2, "social_seguidores": 120, "social_newsletter": true, "social_sub_contribuicoes_amigos": true, "social_sub_novos_seguidores": true, "social_sub_posts_projeto": true, "social_projetos_contribuidos": 175, "social_projetos_publicados": 3, "geral_municipio": "Porto Alegre", "geral_uf": "RS", "geral_uf_br": "RS", "geral_city_id": 4178, "geral_content_rating": 1, "geral_contributed_by_friends": false, "geral_capa_imagem": false, "geral_capa_video": true, "geral_dias_campanha": 60, "geral_data_fim": "2020-12-05T02:59:59.999999", "geral_data_ini": "2020-10-05T03:37:24.637551", "geral_meta": 10000.0, "geral_meta_corrigida": 13140.723848756805, "geral_arrecadado": 12858.0, "geral_arrecadado_corrigido": 16896.342724731498, "geral_percentual_arrecadado": 128.58, "geral_conteudo_adulto": false, "geral_posts": 36, "geral_project_id": 109036, "geral_modalidade": "aon", "geral_titulo": "T\u00ea Rex: ZapZombie", "geral_status": "successful", "geral_total_contribuicoes": 201, "geral_total_apoiadores": 169, "geral_sobre": "Campanha de financiamento coletivo do livro em quadrinhos T\u00ea Rex: ZapZombie\nT\u00ea Rex \u00e9 uma s\u00e9rie de tiras de humor sobre uma tiranossaura nerd lidando com os dilemas do colecionismo, a loucura cotidiana \u00e0 sua volta e as dificuldades do que \u00e9 estar crescendo sendo a \"esquisita\" que sempre tem mais livros do que consegue ler.\nObra criada de maneira conjunta por pai e filha quando ela tinha 7 anos, conta com roteiro de Marcel Ibaldo (vencedor no Trof\u00e9u HQMIX e premiado no Silent Manga Audition , no Jap\u00e3o) e arte de sua filha de 13 anos Marcelli, T\u00ea Rex \u00e9 uma s\u00e9rie de tiras que apresenta o nerdismo desde a sua origem, na pr\u00e9-Hist\u00f3ria, protagonizada por dinossauros em um contexto que n\u00e3o \u00e9 t\u00e3o diferente assim do que vivemos hoje. Para conhecer mais da s\u00e9rie visite: https://www.instagram.com/terexhq/\ninalista no Pr\u00eamio LeBlanc , indicada em duas categorias do Trof\u00e9u HQMIX 2019 e vencedora no 4\u00ba Trof\u00e9u GibiFest , a s\u00e9rie teve o primeiro livro, T\u00ea Rex: Spoilerfobia lan\u00e7ado em 2018 pela Editora AVEC, sendo ainda publicada mensalmente na revista Action Hiken e com tiras novas online toda semana nas redes sociais.\nE agora chegou a hora de a segunda temporada da s\u00e9rie migrar pro impresso na forma do livro T\u00ea Rex: ZapZombie, com 120 p\u00e1ginas ilustradas em aquarela que expandem o universo pr\u00e9-Hist\u00f3rico nerd desbravando eventos que se assemelham a muito da realidade atual, com o tom ora cr\u00edtico, ora fofinho, que caracteriza a s\u00e9rie.\nO financiamento coletivo visa arcar com os custos de impress\u00e3o e o envio dos livros aos apoiadores, demais recompensas, al\u00e9m da taxa que o catarse recebe dos projetos financiados. O livro ir\u00e1 conter uma compila\u00e7\u00e3o de tiras da s\u00e9rie al\u00e9m de extras exclusivos. O financiamento coletivo \u00e9 uma ferramenta segura que visa uma esp\u00e9cie de pr\u00e9-venda do material realizado pelo autor, e que em caso de n\u00e3o atingir a meta garante a devolu\u00e7\u00e3o do dinheiro a todos os apoiadores. Mas isso n\u00e3o vai acontecer porque vamos atingir a meta e o livro vai chegar lind\u00e3o na sua casa! :D\nAs recompensas do projeto est\u00e3o ao lado e v\u00e3o do pdf do livro, passando pelo livro ZapZombie impresso, al\u00e9m do primeiro livro, Spoilerfobia e tamb\u00e9m marca-p\u00e1ginas, im\u00e3 de geladeira com tira exclusiva, chaveiro em mdf, artes em aquarela e at\u00e9 um jogo de tabuleiro da T\u00ea Rex e uma tira original em aquarela utilizada neste livro!! Preparamos tudo da forma mais artesanal que foi poss\u00edvel, pra o m\u00e1ximo que conseguirmos deixar cada recompensa com um aspecto \u00fanico, diferenciado e que mostre o nosso carinho na produ\u00e7\u00e3o desse material a cada um que apoiar!\nE pros apoiadores ligeiros temos uma recompensa com frete gr\u00e1tis, limitada, al\u00e9m de brindes exclusivos pra quem apoiar logo nas primeiras 48 horas de campanha, dando direito a um kit de adesivos e um chaveiro em mdf exclusivo da campanha no Catarse!\nCARACTER\u00cdSTICAS DO LIVRO:\n- Lind\u00e3o; - Formato 20cm X 11cm ; - Capa em papel supremo de alta alvura; - 120 P\u00e1ginas; - Impress\u00e3o colorida em papel P\u00d3LEN SOFT 80g/m\u00b2. AUTORES:\nMarcelli Ibaldo Quadrinhista de 13 anos, nerd apaixonada por dinossauros, finalista no trof\u00e9u HQMIX e pr\u00eamio Le Blanc e vencedora do trof\u00e9u Gibifest, Marcelli come\u00e7ou cedo no mundo dos quadrinhos, teve participa\u00e7\u00e3o em alguns one-shots e fanzines e lan\u00e7ou o premiado livro T\u00ea Rex: Spoilerfobia com 11 anos. Agora desenha a s\u00e9rie T\u00ea Rex junto com seu pai, Marcel Ibaldo, brother, que trabalha no roteiro.\nMarcel Ibaldo\nAutor de mais de 50 HQs publicadas, dirigiu curtas, organizou exposi\u00e7\u00f5es, tocou em in\u00fameros shows de rock e desenhou/roteirizou v\u00e1rios projetos, passando por storyboard para curta-metragens, charges, tiras para jornal, one-shots e HQs longas. Premiado no Trof\u00e9u GibiFest, Trof\u00e9u HQMIX e Silent Manga Audition, atualmente roteiriza a premiada s\u00e9rie de tiras T\u00ea Rex, ilustrada por sua filha Marcelli.\nALGUMAS RESENHAS DA T\u00ca REX:", "categoria_multirrotulo_lda": {"0": 0.2, "1": 0.2, "2": 0.6, "3": 0.4, "4": 0.8, "5": 0.4, "6": 0.8, "7": 0.2, "8": 0.8, "9": 0.4, "10": 0.2, "11": 1.0, "12": 0.4, "13": 0.2, "14": 0.4, "15": 0.4, "16": 0.6, "17": 0.0, "18": 0.2, "19": 0.2, "20": 0.4, "21": 0.4, "22": 0.6, "23": 0.4, "24": 0.0, "25": 0.4, "26": 0.2, "27": 0.8, "28": 0.4, "29": 0.2, "30": 0.6, "31": 0.2, "32": 0.2, "33": 0.2, "34": 0.2, "35": 0.6, "36": 0.6, "37": 0.4, "38": 0.8, "39": 0.2, "40": 0.4, "41": 0.8, "42": 0.8, "43": 0.6, "44": 0.0, "45": 0.2, "46": 0.0, "47": 0.0, "48": 0.4, "49": 0.4}, "categoria_entidades": ["campanha de financiamento coletivo do livro em quadrinhos t\u00ea rex", "zapzombie", "t\u00ea rex", "s\u00e9rie de tiras de humor", "tiranossaura nerd", "dilemas do colecionismo", "loucura cotidiana", "volta", "dificuldades", "livros", "obra", "maneira conjunta por pai", "filha", "7 anos", "roteiro de marcel ibaldo", "vencedor no trof\u00e9u hqmix", "silent manga audition", "jap\u00e3o", "arte", "filha de 13 anos marcelli", "s\u00e9rie de tiras", "nerdismo", "origem", "pr\u00e9-hist\u00f3ria", "dinossauros", "contexto", "s\u00e9rie", "inalista no pr\u00eamio leblanc", "duas categorias do trof\u00e9u hqmix 2019", "vencedora no 4\u00ba trof\u00e9u gibifest", "primeiro livro", "spoilerfobia", "2018 pela editora avec", "revista action hiken", "tiras novas online", "semana nas redes sociais", "hora", "segunda temporada da s\u00e9rie", "impresso na forma do livro t\u00ea rex", "120 p\u00e1ginas", "aquarela", "universo pr\u00e9-hist\u00f3rico nerd", "eventos", "realidade atual", "tom", "financiamento coletivo", "custos de impress\u00e3o", "envio dos livros aos apoiadores", "taxa", "catarse", "projetos", "livro", "compila\u00e7\u00e3o de tiras da s\u00e9rie", "extras exclusivos", "ferramenta segura", "esp\u00e9cie de pr\u00e9-venda do material", "autor", "caso", "meta", "devolu\u00e7\u00e3o do dinheiro", "apoiadores", "lind\u00e3o", "casa", "recompensas do projeto", "lado", "pdf do livro", "livro zapzombie", "marca-p\u00e1ginas", "im\u00e3 de geladeira", "exclusiva", "chaveiro em mdf", "artes em aquarela", "jogo de tabuleiro da t\u00ea rex", "uma tira original em aquarela", "forma", "m\u00e1ximo", "recompensa", "aspecto \u00fanico", "carinho na produ\u00e7\u00e3o desse material", "apoiadores ligeiros", "recompensa com frete gr\u00e1tis", "brindes exclusivos", "primeiras 48 horas de campanha", "direito", "kit de adesivos", "chaveiro em mdf exclusivo da campanha no catarse", "caracter\u00edsticas do livro", "formato 20 cm x 11 cm", "capa em papel supremo de alta alvura", "impress\u00e3o", "papel p\u00f3len soft 80g", "m\u00b2", "autores", "marcelli ibaldo quadrinhista de 13 anos", "finalista no trof\u00e9u hqmix", "pr\u00eamio le blanc", "vencedora do trof\u00e9u gibifest", "marcelli", "mundo dos quadrinhos", "participa\u00e7\u00e3o", "one-shots", "fanzines", "premiado livro t\u00ea rex", "spoilerfobia com 11 anos", "s\u00e9rie t\u00ea rex", "pai", "marcel ibaldo", "brother", "roteiro", "50 hqs", "exposi\u00e7\u00f5es", "in\u00fameros shows de rock", "roteirizou", "storyboard para curta-metragens", "charges", "tiras para jornal", "hqs longas", "trof\u00e9u", "trof\u00e9u hqmix", "premiada s\u00e9rie de tiras t\u00ea rex", "filha marcelli", "algumas resenhas da t\u00ea rex"]}