{"origem": "catarse", "categoria_teste_mencoes": {"saloes_humor": false, "hqmix": false, "ccxp": false, "fiq": false, "angelo_agostini": false, "politica": false, "questoes_genero": false, "lgbtqiamais": false, "terror": false, "humor": false, "herois": false, "disputa": false, "ficcao_cientifica": false, "fantasia": false, "folclore": false, "zine": false, "webformatos": false, "erotismo": false, "religiosidade": false, "jogos": false, "midia_independente": false}, "recompensas_menor_nominal": 185.0, "recompensas_menor_ajustado": 244.117964925929, "recompensas_quantidade": 1, "autoria_id": 338350, "autoria_nome": "guilherme infante", "autoria_nome_publico": "guilherme infante", "autoria_classificacao": "masculino", "autoria_classificacao_id": 3, "social_seguidores": 641, "social_newsletter": false, "social_sub_contribuicoes_amigos": true, "social_sub_novos_seguidores": true, "social_sub_posts_projeto": true, "social_projetos_contribuidos": 46, "social_projetos_publicados": 7, "geral_municipio": "Ipatinga", "geral_uf": "MG", "geral_uf_br": "MG", "geral_city_id": 1925, "geral_content_rating": 1, "geral_contributed_by_friends": false, "geral_capa_imagem": false, "geral_capa_video": true, "geral_dias_campanha": 60, "geral_data_fim": "2020-05-01T02:59:59.999999", "geral_data_ini": "2020-03-01T03:01:55.074443", "geral_meta": 26000.0, "geral_meta_corrigida": 34308.47074634678, "geral_arrecadado": 42662.01, "geral_arrecadado_corrigido": 56294.93546405206, "geral_percentual_arrecadado": 164.08465384615386, "geral_conteudo_adulto": false, "geral_posts": 14, "geral_project_id": 110977, "geral_modalidade": "aon", "geral_titulo": "Capirotinho - 5 Anos", "geral_status": "successful", "geral_total_contribuicoes": 520, "geral_total_apoiadores": 515, "geral_sobre": "H\u00e1 cinco anos surgia essa pequena entidade rubro-balofa de olhos branco-esbugalhados que tagarela conselhos question\u00e1veis e de moral duvidosa aos ouvidos de um tal de Guilherme Infante.\nBom, meia d\u00e9cada e alguns livros depois, chega essa edi\u00e7\u00e3o de luxo e comemorativa da vida do Capirotinho.\nUma edi\u00e7\u00e3o com 240 p\u00e1ginas, totalmente colorida, com centenas de tirinhas, material extra sobre a cria\u00e7\u00e3o do personagem, dezenas de ilustra\u00e7\u00f5es de artistas convidados e muito material in\u00e9dito.\nAgora que o livro est\u00e1 apresentado, vamos ao projeto no Catarse.\nEsse livro ser\u00e1 lan\u00e7ado totalmente de forma independente. Vou desenhar, escrever e diagramar todo o projeto.\nEntretanto, um projeto mais delicado como esse tem um custo alto. Nesse momento o Catarse surge como uma plataforma de financiamento coletivo que serve como uma pr\u00e9-venda recheada de brindes.\nDessa forma, a sua contribui\u00e7\u00e3o garante recompensas exclusivas e ajuda na publica\u00e7\u00e3o dessa edi\u00e7\u00e3o de luxo comemorativa.\nH\u00e1 v\u00e1rias formas de colaborar, com recompensas diversas, que v\u00e3o desde o livro em PDF at\u00e9 est\u00e1tuas ou kits com diversos livros. Aqui no projeto voc\u00ea poder\u00e1 ver e entender todas as formas e valores de contribui\u00e7\u00e3o.\nAbaixo segue a foto e as especifica\u00e7\u00f5es da est\u00e1tua do Capirotinho:\nEssa miniatura foi desenvolvida em parceria com o MattosBox Studio. Conhe\u00e7am os demais trabalhos atrav\u00e9s do perfil @mattosbox_studio no Instagram.\nAh! Vale lembrar que os integrantes do Clubinho dos Ca\u00eddos receber\u00e3o um livro exclusivo e in\u00e9dito das cr\u00f4nicas do Capirotinho ao final da campanha! Clique aqui e conhe\u00e7a o clubinho.\nAl\u00e9m da meta inicial, que ir\u00e1 garantir a produ\u00e7\u00e3o do livro, criei outras melhorias que podem ser inclu\u00eddas ao projeto de acordo com o valor arrecadado.\nR$ 26.000 - Produ\u00e7\u00e3o do livro;\nR$ 32.000 - Em adi\u00e7\u00e3o \u00e0s recompensas anteriores, todos recebem adesivo e marcador de p\u00e1gina;\nR$ 38.000 - Em adi\u00e7\u00e3o \u00e0s recompensas anteriores, todos recebem \u00edm\u00e3 de geladeira e cart\u00f5es postais;\nR$ 60.000 - Em adi\u00e7\u00e3o \u00e0s recompensas anteriores, o livro deixar\u00e1 de ter orelha, mas contar\u00e1 com capa dura.\nEis as datas que ir\u00e3o guiar todo o projeto, a produ\u00e7\u00e3o e entrega, prevista para o m\u00eas de junho.\n01/03 - In\u00edcio da campanha;\n30/04 - Final da campanha;\n22/05 - Repasse dos valores arrecadados;\n25/05 - Envio \u00e0 gr\u00e1fica;\n10/06 - Entrega da gr\u00e1fica e in\u00edcio dos envios das recompensas aos apoiadores.\nImportante: as datas est\u00e3o sujeitas a altera\u00e7\u00e3o por atraso ou adiantamento da produ\u00e7\u00e3o. Qualquer m\u00ednima altera\u00e7\u00e3o no cronograma ser\u00e1 avisada aos apoiadores com a maior anteced\u00eancia poss\u00edvel.\nGuilherme Infante tem 33 anos, \u00e9 mineiro, mora em Ipatinga e trabalha como cartunista h\u00e1 cinco anos.\nCapirotinho - 5 Anos \u00e9 seu primeiro livro de 2020, mas o garoto t\u00e1 doido e vai se arrebentar para conseguir lan\u00e7ar mais alguns ainda esse ano.\nOu seja, o rapaz anda meio sem tempo porque est\u00e1 trabalhando muito!\nSe voc\u00ea deseja patrocinar ou anunciar a sua empresa no livro, entre em contato.\nguilhermeinfante@gmail.com", "categoria_multirrotulo_lda": {"0": 0.4, "1": 0.0, "2": 0.2, "3": 0.2, "4": 0.4, "5": 0.0, "6": 0.4, "7": 0.2, "8": 0.2, "9": 0.0, "10": 0.0, "11": 0.6, "12": 0.2, "13": 0.0, "14": 0.0, "15": 0.4, "16": 0.2, "17": 0.0, "18": 0.0, "19": 0.2, "20": 0.0, "21": 0.0, "22": 0.2, "23": 0.2, "24": 0.0, "25": 0.2, "26": 0.0, "27": 0.2, "28": 0.0, "29": 0.2, "30": 0.6, "31": 0.2, "32": 0.0, "33": 0.0, "34": 0.2, "35": 0.2, "36": 0.2, "37": 0.0, "38": 0.2, "39": 0.0, "40": 0.2, "41": 0.4, "42": 0.4, "43": 0.2, "44": 0.0, "45": 0.2, "46": 0.0, "47": 0.0, "48": 0.4, "49": 0.0}, "categoria_entidades": ["cinco anos", "pequena entidade rubro-balofa de olhos branco-esbugalhados", "conselhos question\u00e1veis", "moral duvidosa aos ouvidos", "guilherme infante", "meia d\u00e9cada", "livros", "edi\u00e7\u00e3o de luxo", "comemorativa da vida do capirotinho", "edi\u00e7\u00e3o com 240 p\u00e1ginas", "centenas de tirinhas", "material extra", "cria\u00e7\u00e3o do personagem", "ilustra\u00e7\u00f5es de artistas", "material in\u00e9dito", "livro", "projeto no catarse", "forma independente", "diagramar", "projeto", "custo alto", "momento", "catarse", "plataforma de financiamento coletivo", "pr\u00e9-venda", "brindes", "forma", "contribui\u00e7\u00e3o", "recompensas exclusivas", "ajuda na publica\u00e7\u00e3o dessa edi\u00e7\u00e3o de luxo comemorativa", "formas", "recompensas diversas", "livro em pdf at\u00e9 est\u00e1tuas", "kits", "valores de contribui\u00e7\u00e3o", "foto", "especifica\u00e7\u00f5es da est\u00e1tua do capirotinho", "miniatura", "parceria", "mattosbox studio", "trabalhos", "perfil @mattosbox_studio no instagram", "integrantes do clubinho dos ca\u00eddos", "livro exclusivo", "in\u00e9dito das cr\u00f4nicas do capirotinho ao final da campanha", "clubinho", "meta inicial", "produ\u00e7\u00e3o do livro", "melhorias", "projeto de acordo", "valor", "adi\u00e7\u00e3o \u00e0s recompensas anteriores", "adesivo", "marcador de p\u00e1gina", "\u00edm\u00e3 de geladeira", "cart\u00f5es postais", "orelha", "capa dura", "datas", "produ\u00e7\u00e3o", "entrega", "m\u00eas de junho", "in\u00edcio da campanha", "final da campanha", "22/05", "repasse dos valores", "25/05", "envio \u00e0 gr\u00e1fica", "10/06", "entrega da gr\u00e1fica", "in\u00edcio dos envios das recompensas aos apoiadores", "importante", "altera\u00e7\u00e3o por atraso", "adiantamento da produ\u00e7\u00e3o", "m\u00ednima altera\u00e7\u00e3o no cronograma", "apoiadores", "maior anteced\u00eancia poss\u00edvel", "33 anos", "ipatinga", "cartunista", "capirotinho", "5 anos", "primeiro livro de 2020", "garoto", "ano", "rapaz", "tempo", "empresa no livro", "contato"]}