{"origem": "catarse", "categoria_teste_mencoes": {"saloes_humor": false, "hqmix": false, "ccxp": false, "fiq": true, "angelo_agostini": false, "politica": false, "questoes_genero": false, "lgbtqiamais": false, "terror": false, "humor": false, "herois": false, "disputa": false, "ficcao_cientifica": false, "fantasia": false, "folclore": false, "zine": false, "webformatos": false, "erotismo": false, "religiosidade": false, "jogos": false, "midia_independente": false}, "recompensas_menor_nominal": 200.0, "recompensas_menor_ajustado": 263.91131343343676, "recompensas_quantidade": 1, "autoria_id": 785103, "autoria_nome": "heitor coelho", "autoria_nome_publico": "heitor coelho", "autoria_classificacao": "masculino", "autoria_classificacao_id": 3, "social_seguidores": 24, "social_newsletter": true, "social_sub_contribuicoes_amigos": true, "social_sub_novos_seguidores": true, "social_sub_posts_projeto": true, "social_projetos_contribuidos": 13, "social_projetos_publicados": 1, "geral_municipio": "Belo Horizonte", "geral_uf": "MG", "geral_uf_br": "MG", "geral_city_id": 1634, "geral_content_rating": 1, "geral_contributed_by_friends": false, "geral_capa_imagem": false, "geral_capa_video": true, "geral_dias_campanha": 30, "geral_data_fim": "2020-04-07T02:59:59.999999", "geral_data_ini": "2020-03-07T16:05:23.946554", "geral_meta": 12000.0, "geral_meta_corrigida": 15834.678806006204, "geral_arrecadado": 1920.0, "geral_arrecadado_corrigido": 2533.5486089609926, "geral_percentual_arrecadado": 16.0, "geral_conteudo_adulto": false, "geral_posts": 2, "geral_project_id": 111055, "geral_modalidade": "aon", "geral_titulo": "Peda\u00e7os", "geral_status": "failed", "geral_total_contribuicoes": 45, "geral_total_apoiadores": 45, "geral_sobre": "Bem vindos a campanha de Peda\u00e7os, uma hist\u00f3ria em quadrinhos sobre despedidas, entregas, aprendizados e recome\u00e7os que anseia por sair do digital e ganhar vida em um livro impresso. Para isso \u00e9 preciso de uma ajuda especial para que esse projeto aconte\u00e7a. O Autor pretende levar esse lan\u00e7amento para o FIQ 2020, o maior festival de quadrinhos nacionais que acontecer\u00e1 em Belo Horizonte - MG nesse mesmo ano. Os colaboradores  que decidirem apoiar esse projeto receberam recompensas  que varia de acordo com a categoria que escolheu apoiar. Vamos saber mais um pouco sobre a HQ?\nAp\u00f3s participar do FIQ Jovem (Oficina de quadrinhos p\u00f3s FIQ) em 2018 e aprender as v\u00e1rias formas de contar uma hist\u00f3ria atrav\u00e9s dos quadrinhos, surgiu Peda\u00e7os. Era pra ser apenas uma hist\u00f3ria curta de 4 p\u00e1ginas, mas acabei percebendo que havia muita coisa a se contar sobre a trajet\u00f3ria desse coelho. Ent\u00e3o surgiu a ideia de estender a narrativa do personagem em mais situa\u00e7\u00f5es e em um novo formato. Pretendo trazer n\u00e3o somente a hist\u00f3ria em quadrinho, mas tamb\u00e9m uma galeria de artes dos meus amigos artistas queridos e um pouco do processo de feitura da HQ.\nUm coelho precisa partir mas sente que seu cora\u00e7\u00e3o n\u00e3o pertence mais a ele e decide doa-lo. Mas quando menos espera ele recupera seu cora\u00e7\u00e3o de uma forma inesperada para ele. A partir dai sua jornada come\u00e7a.\nA premissa \u00e9: Quanto e at\u00e9 quando se doar compensa? Atrav\u00e9s das despedidas da vida, aprendizados e recome\u00e7os nosso querido coelho vai evoluindo e aprendendo a usar seu cora\u00e7\u00e3o.\nO quadrinho de Peda\u00e7os \u00e9 uma hist\u00f3ria muda, ou seja, sem textos e di\u00e1logos, \u00fanica, fechada e totalmente em cores. Apesar da est\u00e9tica ser de livros infantis, a premissa \u00e9 mais profunda e a mensagem passada abrange todas as idades, sendo assim, p\u00fablico livre.\nUma pr\u00e9via das p\u00e1ginas:\n* Voc\u00ea pode conferir a Introdu\u00e7\u00e3o da HQ no formato antigo atrav\u00e9s do link: https://www.behance.net/gallery/75581547/Pedacos-HQ\nCapa:\nObs.: Todas as c\u00f3pias impressas ser\u00e3o assinadas!\nCORA\u00c7\u00c3O ROMPANTE\nR$35 -Apenas para os 15 primeiros apoiadores-\nPDF + nome na HQ\nHQ impressa e assinada + frete incluso\n1 Marca p\u00e1gina\n1 Adesivo\n1 Botton\nCaso o projeto arrecade R$15.000 ser\u00e1 impresso o dobro de HQ e os apoiadores de R$30 ou mais ganharam um postal extra exclusivo de brinde. De acordo com o aumento de arrecada\u00e7\u00e3o, mais metas estendidas poder\u00e3o ser adicionadas!\nHeitor Coelho, Animador, Ilustrador e Quadrinista. Graduado em Cinema de Anima\u00e7\u00e3o e Artes Digitais pela UFMG e participante do FIQ Jovem 2018. Amante da cultura pop/nerd e apaixonado por contar hist\u00f3rias atrav\u00e9s de sua arte. Peda\u00e7os \u00e9 seu primeiro livro de hist\u00f3ria em quadrinhos.\nInstagram: @coelho_heitor\nbehance.net/heitorc", "categoria_multirrotulo_lda": {"0": 0.4, "1": 0.0, "2": 0.2, "3": 0.0, "4": 0.4, "5": 0.0, "6": 0.6, "7": 0.4, "8": 0.4, "9": 0.2, "10": 0.2, "11": 0.4, "12": 0.4, "13": 0.0, "14": 0.2, "15": 0.0, "16": 0.6, "17": 0.0, "18": 0.2, "19": 0.4, "20": 0.2, "21": 0.2, "22": 0.2, "23": 0.2, "24": 0.0, "25": 0.4, "26": 0.0, "27": 0.2, "28": 0.2, "29": 0.2, "30": 0.4, "31": 0.0, "32": 0.2, "33": 0.0, "34": 0.0, "35": 0.2, "36": 0.0, "37": 0.2, "38": 0.4, "39": 0.2, "40": 0.0, "41": 0.4, "42": 0.2, "43": 0.4, "44": 0.0, "45": 0.2, "46": 0.0, "47": 0.0, "48": 0.2, "49": 0.0}, "categoria_entidades": ["campanha de peda\u00e7os", "hist\u00f3ria em quadrinhos sobre despedidas", "entregas", "aprendizados", "recome\u00e7os", "digital", "vida", "livro", "preciso", "ajuda especial", "projeto", "autor", "lan\u00e7amento", "fiq 2020", "maior festival de quadrinhos nacionais", "belo horizonte", "mg nesse mesmo ano", "colaboradores", "recompensas", "acordo", "categoria", "um pouco", "hq", "fiq jovem", "oficina de quadrinhos p\u00f3s fiq", "formas", "hist\u00f3ria", "quadrinhos", "peda\u00e7os", "uma hist\u00f3ria curta de 4 p\u00e1ginas", "coisa", "trajet\u00f3ria desse coelho", "ideia", "narrativa do personagem", "situa\u00e7\u00f5es", "novo formato", "hist\u00f3ria em quadrinho", "galeria de artes", "amigos artistas", "processo de feitura da hq", "coelho", "cora\u00e7\u00e3o", "forma inesperada", "dai", "jornada", "premissa", "despedidas da vida", "querido coelho", "quadrinho de peda\u00e7os", "textos", "di\u00e1logos", "cores", "est\u00e9tica", "livros infantis", "mensagem passada", "idades", "p\u00fablico livre", "pr\u00e9via das p\u00e1ginas", "introdu\u00e7\u00e3o da hq no formato antigo", "link", "https://www.behance.net/gallery/75581547/pedacos-hq", "capa", "obs", "c\u00f3pias impressas", "cora\u00e7\u00e3o rompante", "35 -apenas", "15 primeiros apoiadores-", "pdf", "nome na hq", "frete incluso", "1 marca p\u00e1gina", "1 adesivo", "1 botton", "dobro de hq", "apoiadores", "postal extra exclusivo de brinde", "aumento de arrecada\u00e7\u00e3o", "metas", "heitor coelho", "animador", "ilustrador", "quadrinista", "graduado em cinema de anima\u00e7\u00e3o", "artes digitais pela ufmg", "participante do fiq jovem 2018", "amante da cultura pop", "hist\u00f3rias", "arte", "primeiro livro de hist\u00f3ria em quadrinhos", "instagram", "@coelho_heitor", "behance.net/heitorc"]}