{"origem": "catarse", "categoria_teste_mencoes": {"saloes_humor": false, "hqmix": false, "ccxp": false, "fiq": false, "angelo_agostini": true, "politica": false, "questoes_genero": false, "lgbtqiamais": false, "terror": false, "humor": false, "herois": true, "disputa": false, "ficcao_cientifica": true, "fantasia": true, "folclore": false, "zine": true, "webformatos": false, "erotismo": false, "religiosidade": false, "jogos": false, "midia_independente": false}, "recompensas_menor_nominal": 76.0, "recompensas_menor_ajustado": 100.27628924495085, "recompensas_quantidade": 1, "autoria_id": 1322422, "autoria_nome": "zarabatana books", "autoria_nome_publico": "zarabatana books", "autoria_classificacao": "empresa", "autoria_classificacao_id": 1, "social_seguidores": 415, "social_newsletter": false, "social_sub_contribuicoes_amigos": true, "social_sub_novos_seguidores": false, "social_sub_posts_projeto": false, "social_projetos_contribuidos": 9, "social_projetos_publicados": 12, "geral_municipio": "S\u00e3o Paulo", "geral_uf": "SP", "geral_uf_br": "SP", "geral_city_id": 5274, "geral_content_rating": 1, "geral_contributed_by_friends": false, "geral_capa_imagem": false, "geral_capa_video": true, "geral_dias_campanha": 45, "geral_data_fim": "2020-07-03T02:59:59.999999", "geral_data_ini": "2020-05-18T14:16:24.382213", "geral_meta": 20000.0, "geral_meta_corrigida": 26388.49716972391, "geral_arrecadado": 30592.66, "geral_arrecadado_corrigido": 40364.716091216294, "geral_percentual_arrecadado": 152.9633, "geral_conteudo_adulto": false, "geral_posts": 25, "geral_project_id": 115929, "geral_modalidade": "flex", "geral_titulo": "Bando de Dois - Edi\u00e7\u00e3o Especial Colorida", "geral_status": "successful", "geral_total_contribuicoes": 336, "geral_total_apoiadores": 310, "geral_sobre": "Bando de Dois \u00e9 um marco na hist\u00f3ria das publica\u00e7\u00f5es de quadrinhos no Brasil. Com 4 edi\u00e7\u00f5es j\u00e1 esgotadas, a graphic novel \u00e9 um sucesso de cr\u00edtica e p\u00fablico e ganhou na \u00e9poca de seu lan\u00e7amento os principais pr\u00eamios do mercado brasileiro de HQs. Al\u00e9m disso, foi selecionada como Melhor HQ Nacional, pelo site Universo HQ e Blog dos Quadrinhos (Paulo Ramos); e Melhor HQ pelo site O Grito e Blog Gibizada (Telio Navega).\nAgora a Zarabatana Books est\u00e1 preparando uma edi\u00e7\u00e3o especial, colorida, capa dura, formato grande (22,3 x 30,0 cm), para comemorar os 10 anos do lan\u00e7amento da graphic novel. Participe de nossa campanha no Catarse, garanta seu exemplar com desconto e tamb\u00e9m diversos brindes e combos especiais.\nBando de Dois - Zarabatana Books Roteiro e desenhos de Danilo Beyruth \u2022 Cores de Fabien Alquier Edi\u00e7\u00e3o especial colorida, capa dura, formato 22,3 x 30,0 cm Prazo para in\u00edcio da entrega dos livros: Setembro 2020 Envio: somente para o Brasil.\nO Autor\nDanilo Beyruth nasceu em S\u00e3o Paulo em 1973. Em 2007 come\u00e7ou a publicar Necronauta , um her\u00f3i com a miss\u00e3o de transportar as almas dos mortos. As cinco edi\u00e7\u00f5es independentes no formato fanzine posteriormente foram reunidas em um volume pela editora HQM em 2009 . O segundo volume, com HQs in\u00e9ditas, foi publicado pela Zarabatana Books em 2011 .\nEm 2009 Beyruth foi selecionado pelo ProAC - Programa de A\u00e7\u00e3o Cultural da Secretaria da Cultura de S\u00e3o Paulo para produzir a sua primeira graphic novel . Escreveu e desenhou Bando de Dois , a hist\u00f3ria de Tinhoso e Cav\u00eara di Boi, os \u00faltimos sobreviventes de um grupo de 20 cangaceiros , publicada pela Zarabatana Books em 2010.\nLevando para o canga\u00e7o o clima dos westerns italianos, o \u00e1lbum foi bem recebido pela cr\u00edtica, valendo ao autor o Pr\u00eamio Angelo Agostini (Melhor Lan\u00e7amento de 2010) e o Trof\u00e9u HQ Mix em tr\u00eas categorias (Melhor Desenhista Nacional, Melhor Roteirista Nacional e Melhor Edi\u00e7\u00e3o Especial Nacional). Nos anos seguintes, Bando de Dois ganharia edi\u00e7\u00f5es na Argentina, em Portugal , na Pol\u00f4nia e na Fran\u00e7a, sendo esta \u00faltima a primeira edi\u00e7\u00e3o colorida da obra.\nEm 2012, dentro da cole\u00e7\u00e3o Graphic MSP , lan\u00e7a o \u00e1lbum Astronauta - Magnetar e ganha o trof\u00e9u HQ Mix , como Melhor Desenhista Nacional. Nos anos seguintes viriam Astronauta - Singularidade , S\u00e3o Jorge , Astronauta - Assimetria , Samurai Shir\u00f4 , Astronauta - Entropia e Love Kills.", "categoria_multirrotulo_lda": {"0": 0.0, "1": 0.0, "2": 0.2, "3": 0.2, "4": 0.2, "5": 0.6, "6": 0.0, "7": 0.2, "8": 0.0, "9": 0.0, "10": 0.0, "11": 0.4, "12": 0.2, "13": 0.0, "14": 0.0, "15": 0.2, "16": 0.0, "17": 0.0, "18": 0.0, "19": 0.0, "20": 0.0, "21": 0.0, "22": 0.2, "23": 0.4, "24": 0.0, "25": 0.0, "26": 0.0, "27": 0.4, "28": 0.0, "29": 0.0, "30": 0.2, "31": 0.0, "32": 0.0, "33": 0.0, "34": 0.2, "35": 0.2, "36": 0.6, "37": 0.2, "38": 0.2, "39": 0.0, "40": 0.4, "41": 0.2, "42": 0.2, "43": 0.0, "44": 0.0, "45": 0.0, "46": 0.0, "47": 0.2, "48": 0.2, "49": 0.0}, "categoria_entidades": ["bando de dois", "marco na hist\u00f3ria das publica\u00e7\u00f5es de quadrinhos no brasil", "4 edi\u00e7\u00f5es", "graphic", "sucesso de cr\u00edtica", "p\u00fablico", "\u00e9poca", "lan\u00e7amento", "principais pr\u00eamios do mercado brasileiro de hqs", "melhor hq nacional", "site universo hq", "blog dos quadrinhos", "paulo ramos", "melhor hq pelo site", "grito", "blog gibizada", "telio navega", "zarabatana books", "edi\u00e7\u00e3o especial", "capa dura", "formato grande", "22,3 x 30,0 cm", "10 anos do lan\u00e7amento da graphic novel", "participe", "campanha no catarse", "exemplar com desconto", "brindes", "combos especiais", "zarabatana books roteiro", "desenhos de danilo beyruth", "cores de fabien alquier edi\u00e7\u00e3o especial colorida", "formato 22,3 x 30,0 cm prazo para in\u00edcio da entrega dos livros", "setembro 2020 envio", "brasil", "autor", "danilo beyruth", "s\u00e3o paulo em 1973", "necronauta", "her\u00f3i", "miss\u00e3o", "almas dos mortos", "cinco edi\u00e7\u00f5es independentes no formato fanzine", "volume pela editora hqm em 2009", "segundo volume", "hqs in\u00e9ditas", "zarabatana books em 2011", "2009 beyruth", "proac", "programa de a\u00e7\u00e3o cultural da secretaria da cultura de s\u00e3o paulo", "primeira graphic novel", "hist\u00f3ria de tinhoso", "cav\u00eara di boi", "\u00faltimos sobreviventes", "grupo de 20 cangaceiros", "zarabatana books em 2010", "canga\u00e7o", "clima dos westerns italianos", "\u00e1lbum", "cr\u00edtica", "pr\u00eamio angelo agostini", "melhor lan\u00e7amento de 2010", "trof\u00e9u hq mix em tr\u00eas categorias", "melhor desenhista nacional", "melhor roteirista nacional", "melhor edi\u00e7\u00e3o especial nacional", "anos seguintes", "edi\u00e7\u00f5es na argentina", "portugal", "pol\u00f4nia", "fran\u00e7a", "\u00faltima", "primeira edi\u00e7\u00e3o colorida da obra", "cole\u00e7\u00e3o graphic msp", "\u00e1lbum astronauta", "magnetar", "trof\u00e9u hq mix", "astronauta", "singularidade", "s\u00e3o jorge", "assimetria", "samurai shir\u00f4", "entropia", "love kills"]}