{"origem": "catarse", "categoria_teste_mencoes": {"saloes_humor": false, "hqmix": true, "ccxp": false, "fiq": false, "angelo_agostini": false, "politica": true, "questoes_genero": false, "lgbtqiamais": false, "terror": false, "humor": true, "herois": false, "disputa": false, "ficcao_cientifica": false, "fantasia": false, "folclore": false, "zine": false, "webformatos": false, "erotismo": false, "religiosidade": false, "jogos": false, "midia_independente": false}, "recompensas_menor_nominal": 450.0, "recompensas_menor_ajustado": 597.2651119919997, "recompensas_quantidade": 1, "autoria_id": 108632, "autoria_nome": "gilmar", "autoria_nome_publico": "cartunista das cavernas", "autoria_classificacao": "masculino", "autoria_classificacao_id": 3, "social_seguidores": 321, "social_newsletter": false, "social_sub_contribuicoes_amigos": true, "social_sub_novos_seguidores": true, "social_sub_posts_projeto": false, "social_projetos_contribuidos": 16, "social_projetos_publicados": 8, "geral_municipio": "S\u00e3o Paulo", "geral_uf": "SP", "geral_uf_br": "SP", "geral_city_id": 5274, "geral_content_rating": 1, "geral_contributed_by_friends": false, "geral_capa_imagem": false, "geral_capa_video": true, "geral_dias_campanha": 35, "geral_data_fim": "2020-07-19T02:59:59.999999", "geral_data_ini": "2020-06-13T15:01:06.547798", "geral_meta": 18000.0, "geral_meta_corrigida": 23890.604479679987, "geral_arrecadado": 33915.9, "geral_arrecadado_corrigido": 45015.07513735437, "geral_percentual_arrecadado": 188.42166666666668, "geral_conteudo_adulto": false, "geral_posts": 13, "geral_project_id": 117357, "geral_modalidade": "aon", "geral_titulo": "Brasil 2019 em Charges - 2\u00aa Edi\u00e7\u00e3o", "geral_status": "successful", "geral_total_contribuicoes": 563, "geral_total_apoiadores": 542, "geral_sobre": "Brasil 2019 em Charges - 2\u00aa Edi\u00e7\u00e3o\n\u00c9 um projeto de publica\u00e7\u00e3o de livro com charges produzidas pelo cartunis ta Gilmar (Cartunista Das Cavernas ) durante o ano de 2019.\nA ideia \u00e9 que este livro registre de maneira cr\u00edtica, e, atrav\u00e9s do humor, alguns dos principais acontecimentos pol\u00edticos do ano absolutamente tenebrosos na hist\u00f3ria pol\u00edtica do Brasil.\nPara viabilizar esta segunda edi\u00e7\u00e3o do projeto, optei pelo financiamento coletivo. Se voc\u00ea tem afinidade com as ideias aqui colocadas e gostaria de ter este momento documentado em charges, conto com seu apoio. Ent\u00e3o vamos nessa!!!\nO livro ter\u00e1 100 p\u00e1ginas coloridas no formato 20 x 20cm.\nO autor\nMeu nome \u00e9 Gilmar Machado, o Cartunista Das Cavernas. Trabalho na \u00e1rea h\u00e1 mais de 30 anos, publicando em jornais, revistas e livros no Brasil e em Portugal. Publiquei 10 livros de tiras e quadrinhos, 5 deles adotados pelo governo para distribui\u00e7\u00e3o em bibliotecas p\u00fablicas. Tive alguns pr\u00eamios durante este tempo, entre eles o Pr\u00eamio HQMix de Melhor Cartunista Brasileiro e o Pr\u00eamio Jornal\u00edstico Vladmir Herzog de Anistia e Direitos Humanos. Hoje, devido as editoras e jornais impressos respiram por aparelhos, venho atuando e mantendo o meu trabalho vivo atrav\u00e9s das m\u00eddias e redes sociais. Gostaria de dizer que o trabalho das charges desenvolvidas durante o ano \u00e9 essencialmente express\u00e3o emocional a partir de toda a indigna\u00e7\u00e3o que vivo diariamente acompanhando os fatos pol\u00edticos do Brasil.\nCronograma\nJunho: Campanha de financiamento coletivo no Catarse\nJulho: Impress\u00e3o\nAgosto: Entrega do projeto finalizado para todos os apoiadores.\nRecompensas\nOp\u00e7\u00e3o para quem deseja dar o livro de presente.\nSer\u00e1 autografado e enviado para o endere\u00e7o da pessoa presenteada.\nOs dados da pessoa ser\u00e3o solicitados ao apoiador via question\u00e1rio que ser\u00e1 enviado pelo e-mail logo que finalizar o projeto.\nAh! Pode enviar o livro para bolsominion tamb\u00e9m, t\u00e1?\nLivro Mistif\u00f3rio : Colet\u00e2nea de tiras publicadas em jornais e revistas. Um verdadeiro mix de temas comportamentais e sociais.\nISBN: 978-85- 66157-06- 02\nEncaderna\u00e7\u00e3o: Brochura\nFormato: 21,5 x 21,5cm\nN\u00ba de p\u00e1ginas: 115\nColorido.\nLivro O Cramulh\u00e3o e o Desencarnado : Quadrinho realizado em parceria com o roteirista Lillo Parra.\nISBN 978-85-919436-1-6\nEncaderna\u00e7\u00e3o: Brochura\nFormato: 20,5 x 27,5cm\nN\u00ba de p\u00e1ginas: 136\nColorido\nOriginais\nCharges originais, tra\u00e7o sob papel sulfite branco e reciclado formato 20 x 30cm\nMarcador de p\u00e1gina e adesivo\nPara algumas op\u00e7\u00f5es de recompensas.\nCamiseta - Cole\u00e7\u00e3o Cartunista das Cavernas - Que Isso Camarada", "categoria_multirrotulo_lda": {"0": 0.6, "1": 0.0, "2": 0.2, "3": 0.2, "4": 0.2, "5": 0.2, "6": 0.0, "7": 0.0, "8": 0.0, "9": 0.0, "10": 0.2, "11": 0.4, "12": 0.4, "13": 0.0, "14": 0.0, "15": 0.2, "16": 0.0, "17": 0.0, "18": 0.0, "19": 0.0, "20": 0.0, "21": 0.0, "22": 0.2, "23": 0.2, "24": 0.0, "25": 0.0, "26": 0.0, "27": 0.4, "28": 0.0, "29": 0.0, "30": 0.2, "31": 0.2, "32": 0.0, "33": 0.4, "34": 0.2, "35": 0.2, "36": 0.4, "37": 0.0, "38": 0.2, "39": 0.0, "40": 0.2, "41": 0.2, "42": 0.2, "43": 0.0, "44": 0.0, "45": 0.0, "46": 0.0, "47": 0.2, "48": 0.2, "49": 0.0}, "categoria_entidades": ["brasil 2019 em charges", "2\u00aa edi\u00e7\u00e3o", "projeto de publica\u00e7\u00e3o de livro com charges", "cartunis", "gilmar", "cartunista das cavernas", "ano de 2019", "ideia", "livro", "maneira cr\u00edtica", "humor", "principais acontecimentos pol\u00edticos do ano", "tenebrosos na hist\u00f3ria pol\u00edtica do brasil", "segunda edi\u00e7\u00e3o do projeto", "financiamento coletivo", "afinidade", "ideias", "momento documentado em charges", "conto", "apoio", "100 p\u00e1ginas", "formato 20 x 20 cm", "autor", "nome", "gilmar machado", "\u00e1rea", "30 anos", "jornais", "revistas", "livros no brasil", "portugal", "10 livros de tiras", "quadrinhos", "governo para distribui\u00e7\u00e3o em bibliotecas p\u00fablicas", "pr\u00eamios", "tempo", "pr\u00eamio hqmix de melhor cartunista brasileiro", "pr\u00eamio jornal\u00edstico vladmir herzog de anistia", "direitos humanos", "editoras", "jornais impressos", "aparelhos", "trabalho vivo", "m\u00eddias", "redes sociais", "trabalho das charges", "ano", "express\u00e3o emocional a partir", "indigna\u00e7\u00e3o", "fatos pol\u00edticos do brasil", "cronograma", "junho", "campanha de financiamento coletivo no catarse", "julho", "impress\u00e3o", "agosto", "entrega do projeto", "apoiadores", "recompensas", "op\u00e7\u00e3o", "livro de presente", "endere\u00e7o da pessoa", "dados da pessoa", "apoiador via question\u00e1rio", "e-mail", "projeto", "livro para bolsominion", "livro mistif\u00f3rio", "colet\u00e2nea de tiras", "verdadeiro mix de temas comportamentais", "isbn", "978-85- 66157-06- 02", "encaderna\u00e7\u00e3o", "brochura", "formato", "21,5 x 21,5 cm", "n\u00ba de p\u00e1ginas", "colorido", "cramulh\u00e3o", "desencarnado", "quadrinho", "parceria", "roteirista lillo parra", "isbn 978-85-919436-1-6", "20,5 x 27,5 cm", "originais", "charges originais", "tra\u00e7o sob papel sulfite branco", "formato 20 x 30 cm", "marcador de p\u00e1gina", "op\u00e7\u00f5es de recompensas", "camiseta", "cole\u00e7\u00e3o cartunista das cavernas", "camarada"]}