{"origem": "catarse", "categoria_teste_mencoes": {"saloes_humor": false, "hqmix": false, "ccxp": false, "fiq": false, "angelo_agostini": false, "politica": true, "questoes_genero": false, "lgbtqiamais": false, "terror": true, "humor": false, "herois": false, "disputa": false, "ficcao_cientifica": false, "fantasia": false, "folclore": false, "zine": false, "webformatos": false, "erotismo": false, "religiosidade": false, "jogos": false, "midia_independente": false}, "recompensas_menor_nominal": 5.0, "recompensas_menor_ajustado": 6.570361924378402, "recompensas_quantidade": 1, "autoria_id": 727689, "autoria_nome": "clara carvalho", "autoria_nome_publico": "clara carvalho", "autoria_classificacao": "feminino", "autoria_classificacao_id": 4, "social_seguidores": 14, "social_newsletter": false, "social_sub_contribuicoes_amigos": true, "social_sub_novos_seguidores": true, "social_sub_posts_projeto": false, "social_projetos_contribuidos": 18, "social_projetos_publicados": 1, "geral_municipio": "Jo\u00e3o Pessoa", "geral_uf": "PB", "geral_uf_br": "PB", "geral_city_id": 2659, "geral_content_rating": 1, "geral_contributed_by_friends": false, "geral_capa_imagem": true, "geral_capa_video": true, "geral_dias_campanha": null, "geral_data_fim": null, "geral_data_ini": "2020-10-21T03:20:15.349367", "geral_meta": null, "geral_meta_corrigida": null, "geral_arrecadado": 0, "geral_arrecadado_corrigido": 0.0, "geral_percentual_arrecadado": 0.0, "geral_conteudo_adulto": false, "geral_posts": 1, "geral_project_id": 123217, "geral_modalidade": "sub", "geral_titulo": "Red Oni", "geral_status": "successful", "geral_total_contribuicoes": 0, "geral_total_apoiadores": 0, "geral_sobre": "Ol\u00e1!! Meu nome \u00e9 Clara Carvalho e eu sou uma ilustradora freelancer, al\u00e9m de desenheira de webgibis. Estou trazendo \u00e0 vida meu primeiro projeto s\u00f3lido, chamado Red Oni . \u00c9 uma hist\u00f3ria de fantasia, a\u00e7\u00e3o e terror sobre uma serva que \u00e9 jogada de um precip\u00edcio por sua governante. Momentos antes de morrer, ela conhece uma entidade que faz um acordo que a ajudar\u00e1 com sua busca por vingan\u00e7a, contanto que ela passe a servi-lo.\nEu posto essa hist\u00f3ria um cap\u00edtulo por vez, e muitas vezes eu fico ocupada fazendo meus trabalhos de freelance pra me comprometer 100% ao projeto. Esse catarse vai me permitir a dedicar mais do meu tempo ao quadrinho pra que eu possa atualizar a hist\u00f3ria num ritmo mais consistente, e aos pouquinhos eu vou aprendendo mais sobre a pr\u00f3pria m\u00eddia e aumentando o padr\u00e3o de qualidade com cada cap\u00edtulo!\nCada apoio conta nessa jornada, ent\u00e3o estou muito grata por toda a ajuda que eu posso ter!\nEspero que goste do meu trabalho, e tenha um bom dia!!", "categoria_multirrotulo_lda": {"0": 0.4, "1": 0.0, "2": 0.0, "3": 0.2, "4": 0.2, "5": 0.0, "6": 0.4, "7": 0.0, "8": 0.6, "9": 0.0, "10": 0.2, "11": 0.2, "12": 0.4, "13": 0.2, "14": 0.2, "15": 0.0, "16": 0.4, "17": 0.0, "18": 0.0, "19": 0.0, "20": 0.2, "21": 0.0, "22": 0.0, "23": 0.0, "24": 0.0, "25": 0.2, "26": 0.2, "27": 0.2, "28": 0.4, "29": 0.0, "30": 0.2, "31": 0.2, "32": 0.0, "33": 0.0, "34": 0.0, "35": 0.2, "36": 0.0, "37": 0.0, "38": 0.4, "39": 0.0, "40": 0.0, "41": 0.4, "42": 0.2, "43": 0.0, "44": 0.0, "45": 0.2, "46": 0.0, "47": 0.0, "48": 0.0, "49": 0.0}, "categoria_entidades": ["nome", "clara carvalho", "ilustradora freelancer", "desenheira de webgibis", "vida", "primeiro projeto s\u00f3lido", "red oni", "hist\u00f3ria de fantasia", "a\u00e7\u00e3o", "terror", "serva", "jogada", "precip\u00edcio", "governante", "momentos", "entidade", "acordo", "busca por vingan\u00e7a", "posto", "hist\u00f3ria", "cap\u00edtulo por vez", "vezes", "trabalhos de freelance", "projeto", "catarse", "tempo ao quadrinho", "hist\u00f3ria num ritmo", "pouquinhos", "pr\u00f3pria m\u00eddia", "padr\u00e3o de qualidade", "cap\u00edtulo", "apoio", "jornada", "grata", "ajuda", "trabalho", "bom dia"]}