{"origem": "catarse", "categoria_teste_mencoes": {"saloes_humor": false, "hqmix": false, "ccxp": false, "fiq": false, "angelo_agostini": false, "politica": false, "questoes_genero": false, "lgbtqiamais": false, "terror": false, "humor": false, "herois": false, "disputa": true, "ficcao_cientifica": false, "fantasia": false, "folclore": true, "zine": true, "webformatos": false, "erotismo": false, "religiosidade": true, "jogos": false, "midia_independente": false}, "recompensas_menor_nominal": 80.0, "recompensas_menor_ajustado": 100.95068843301125, "recompensas_quantidade": 1, "autoria_id": 1394190, "autoria_nome": "ver-o-gibi", "autoria_nome_publico": "editora ver-o-gibi", "autoria_classificacao": "empresa", "autoria_classificacao_id": 1, "social_seguidores": 26, "social_newsletter": false, "social_sub_contribuicoes_amigos": true, "social_sub_novos_seguidores": true, "social_sub_posts_projeto": true, "social_projetos_contribuidos": 6, "social_projetos_publicados": 1, "geral_municipio": "Bel\u00e9m", "geral_uf": "PA", "geral_uf_br": "PA", "geral_city_id": 2440, "geral_content_rating": 1, "geral_contributed_by_friends": false, "geral_capa_imagem": false, "geral_capa_video": true, "geral_dias_campanha": 60, "geral_data_fim": "2021-05-01T02:59:59.999999", "geral_data_ini": "2021-03-01T03:03:37.272019", "geral_meta": 4000.0, "geral_meta_corrigida": 5047.534421650562, "geral_arrecadado": 1440.0, "geral_arrecadado_corrigido": 1817.1123917942025, "geral_percentual_arrecadado": 36.0, "geral_conteudo_adulto": false, "geral_posts": 2, "geral_project_id": 132561, "geral_modalidade": "aon", "geral_titulo": "By Night em Santa Helena", "geral_status": "failed", "geral_total_contribuicoes": 34, "geral_total_apoiadores": 34, "geral_sobre": "Pela Noite em Santa Helena.\nSanta Helena do Gr\u00e3o-Par\u00e1 \u00e9 uma cidade fict\u00edcia situada na Regi\u00e3o Norte do Brasil, uma g\u00eamea sombria de Bel\u00e9m do Par\u00e1 , onde criaturas m\u00edsticas circundam pelas sombras e becos. \u00c9 nela que encontramos Mike , filho de um negro norte-americano com uma ind\u00edgena da regi\u00e3o amaz\u00f4nica, em sua cruzada para manter mitos e lendas em harmonia com o resto da sociedade.\nMike \u00e9 um sujeito casca-grossa, disposto a fazer de tudo para que seja mantida a ordem das coisas em sua cidade, cujo submundo permeado de mitos da regi\u00e3o vive em p\u00e9 de guerra com os que vieram de fora.\nCom sua escopeta em punho, batizada de forma singela como Lili Batid\u00e3o , ele cruza as ruas de Santa Helena do Gr\u00e3o-Par\u00e1, atento a cada beco ou ruela tomada pelas sombras, pois \u00e9 dali que podem surgir as mais perigosas criaturas.\nP\u00e1gina da HQ By Night em Santa Helena\nP\u00e1gina dupla da HQ\nP\u00e1gina da HQ By Night em Santa Helena\nSobre a Revista\nA revista em quadrinhos By Night em Santa Helena ter\u00e1 32 p\u00e1ginas, no formato 17x26cm, miolo em preto e branco, papel offset (120g), capa em cores, triplex (250g).\nSobre o Autor\nDSantos \u00e9 um quadrinhista paraense que j\u00e1 realizou v\u00e1rios trabalhos, entre os quais podemos destacar para a Heavy Metal Magazine , Kingstone Bible , Aspen Comics , Space Goat , al\u00e9m de editoras americanas independentes e tamb\u00e9m para a editora francesa Hachette .\nDono de um estilo inconfund\u00edvel e bastante detalhista, uma de suas \u00faltimas HQs publicadas foi a \"Milagres\" , na revista O Poderoso Maximus Premium , da Editora Universo Fant\u00e1stico , em 2020. Cabe tamb\u00e9m ressaltar que ele foi o capista da referida revista.\nPara conhecer mais sobre o trabalho do artista \u00e9 s\u00f3 clicar aqui .\nSobre a Meta a ser Batida\nA meta estimada para este projeto \u00e9 de R$ 4.000 (Quatro mil Reais) , o necess\u00e1rio para cobrir os custos de impress\u00e3o e envio das revistas e recompensas.\nNo caso do valor estipulado ser alcan\u00e7ado no decorrer do projeto, metas estendidas ser\u00e3o propostas, com novas e exclusivas recompensas.\nSobre as Recompensas\nOs pacotes de recompensas deste projeto s\u00e3o compostos pela revista impressa, prints A4 em P&B, nome do apoiador nos agradecimentos, al\u00e9m da oportunidade de ter seu rosto aparecendo em cena, como um coadjuvante da HQ, ou adquirir artes originais.\nAlcan\u00e7ada a meta, todos os apoiadores receber\u00e3o um bookplate autografado.\nSobre a Editora\nA Editora Ver-O-Gibi nasceu da necessidade de dar mais visibilidade aos quadrinhistas da regi\u00e3o Norte do Brasil .\nNo Par\u00e1 , onde a editora est\u00e1 situada, existe uma gama enorme de quadrinhistas supertalentosos, que muitas vezes n\u00e3o encontram canais por onde escoar sua arte.\n\u00c9 nesse panorama que surge a Ver-O-Gibi , com a inten\u00e7\u00e3o de valorizar o artista da regi\u00e3o, que sonha em publicar seu trabalho sem precisar migrar para o mercado estrangeiro.", "categoria_multirrotulo_lda": {"0": 0.2, "1": 0.0, "2": 0.2, "3": 0.4, "4": 0.2, "5": 0.0, "6": 0.0, "7": 0.2, "8": 0.4, "9": 0.2, "10": 0.4, "11": 0.2, "12": 0.2, "13": 0.0, "14": 0.2, "15": 0.0, "16": 0.4, "17": 0.0, "18": 0.2, "19": 0.2, "20": 0.2, "21": 0.2, "22": 0.4, "23": 0.2, "24": 0.0, "25": 0.4, "26": 0.2, "27": 0.6, "28": 0.4, "29": 0.0, "30": 0.2, "31": 0.2, "32": 0.2, "33": 0.0, "34": 0.0, "35": 0.4, "36": 0.0, "37": 0.2, "38": 0.4, "39": 0.0, "40": 0.0, "41": 0.2, "42": 0.4, "43": 0.2, "44": 0.0, "45": 0.2, "46": 0.0, "47": 0.0, "48": 0.0, "49": 0.0}, "categoria_entidades": ["noite em santa helena", "santa helena do gr\u00e3o-par\u00e1", "cidade fict\u00edcia", "regi\u00e3o norte do brasil", "g\u00eamea sombria de bel\u00e9m do par\u00e1", "criaturas m\u00edsticas", "sombras", "becos", "mike", "filho", "negro norte-americano", "ind\u00edgena da regi\u00e3o amaz\u00f4nica", "cruzada", "mitos", "lendas em harmonia", "resto da sociedade", "sujeito casca-grossa", "ordem das coisas", "cidade", "submundo", "mitos da regi\u00e3o", "p\u00e9 de guerra", "escopeta em punho", "forma singela como lili batid\u00e3o", "ruas de santa helena do gr\u00e3o-par\u00e1", "atento", "beco", "ruela", "perigosas criaturas", "p\u00e1gina da hq by night em santa helena", "p\u00e1gina dupla da hq", "revista", "revista em quadrinhos by night em santa helena", "32 p\u00e1ginas", "formato 17x26 cm", "miolo em preto", "papel offset", "120 g", "capa em cores", "250 g", "autor", "quadrinhista paraense", "trabalhos", "heavy metal magazine", "kingstone bible", "aspen comics", "space goat", "editoras americanas independentes", "editora francesa hachette", "dono", "estilo inconfund\u00edvel", "uma", "\u00faltimas hqs", "milagres", "poderoso maximus premium", "editora universo fant\u00e1stico", "capista", "trabalho do artista", "meta", "projeto", "quatro mil reais", "necess\u00e1rio", "custos de impress\u00e3o", "envio das revistas", "caso do valor", "metas", "exclusivas recompensas", "recompensas", "pacotes de recompensas deste projeto", "prints a4 em p&b", "nome do apoiador nos agradecimentos", "oportunidade", "rosto", "cena", "coadjuvante da hq", "artes originais", "apoiadores", "bookplate", "editora", "editora ver-o-gibi", "necessidade", "visibilidade aos quadrinhistas da regi\u00e3o norte do brasil", "par\u00e1", "gama enorme de quadrinhistas supertalentosos", "vezes", "canais por onde", "arte", "panorama", "ver-o-gibi", "inten\u00e7\u00e3o", "artista da regi\u00e3o", "trabalho", "mercado estrangeiro"]}