{"origem": "catarse", "categoria_teste_mencoes": {"saloes_humor": false, "hqmix": false, "ccxp": false, "fiq": false, "angelo_agostini": false, "politica": false, "questoes_genero": false, "lgbtqiamais": false, "terror": true, "humor": true, "herois": false, "disputa": true, "ficcao_cientifica": true, "fantasia": false, "folclore": false, "zine": false, "webformatos": false, "erotismo": false, "religiosidade": false, "jogos": true, "midia_independente": false}, "recompensas_menor_nominal": 50.0, "recompensas_menor_ajustado": 62.512819575101034, "recompensas_quantidade": 1, "autoria_id": 1322422, "autoria_nome": "zarabatana books", "autoria_nome_publico": "zarabatana books", "autoria_classificacao": "empresa", "autoria_classificacao_id": 1, "social_seguidores": 415, "social_newsletter": false, "social_sub_contribuicoes_amigos": true, "social_sub_novos_seguidores": false, "social_sub_posts_projeto": false, "social_projetos_contribuidos": 9, "social_projetos_publicados": 12, "geral_municipio": "Campinas", "geral_uf": "SP", "geral_uf_br": "SP", "geral_city_id": 4818, "geral_content_rating": 1, "geral_contributed_by_friends": false, "geral_capa_imagem": false, "geral_capa_video": true, "geral_dias_campanha": 90, "geral_data_fim": "2021-07-20T02:59:59.999999", "geral_data_ini": "2021-04-20T20:08:36.461685", "geral_meta": 20000.0, "geral_meta_corrigida": 25005.127830040412, "geral_arrecadado": 32450.0, "geral_arrecadado_corrigido": 40570.81990424057, "geral_percentual_arrecadado": 162.25, "geral_conteudo_adulto": false, "geral_posts": 17, "geral_project_id": 135030, "geral_modalidade": "flex", "geral_titulo": "Mega de Salvador Sanz", "geral_status": "successful", "geral_total_contribuicoes": 282, "geral_total_apoiadores": 218, "geral_sobre": "Fic\u00e7\u00e3o-cient\u00edfica, terror, fant\u00e1stico. Os leitores brasileiros das graphic novels de Salvador Sanz j\u00e1 sabem que ele \u00e9 mestre em criar mundos, personagens e criaturas fant\u00e1sticas. Agora a Zarabatana Books apresenta para os apoiadores do Catarse a \u00faltima cria\u00e7\u00e3o do aclamado autor argentino.\nZarabatana Books Meta: R$ 20.000,00 Flex Prazo da campanha: 90 dias Prazo para in\u00edcio da entrega dos livros: Julho 2021 Envio: somente para o Brasil.\nMega Edi\u00e7\u00e3o especial colorida, capa dura, 104 p\u00e1ginas, formato 21,4 x 30,0 cm, papel couch\u00ea 170 g/m2.\nImagine kaijus, os monstros japoneses parentes de Godzilla, em plena Montevid\u00e9u, no Uruguai. Partindo dessa ideia Salvador Sanz monta sua nova HQ colorida fant\u00e1stica, com imagens e cenas incr\u00edveis.\nOs Chacais, criaturas imortais que surgiram no Big Bang, perderam a guerra. Seus inimigos, os Longevos, constru\u00edram uma pris\u00e3o inexpugn\u00e1vel para encarcerar os chacais por toda a eternidade, j\u00e1 que n\u00e3o conheciam a morte.\nEssa pris\u00e3o era o terceiro planeta do sistema solar. Milh\u00f5es de anos depois, a pris\u00e3o continua ali, sob os nossos p\u00e9s, e algu\u00e9m est\u00e1 tentando libertar os prisioneiros.\nRECOMPENSAS ESPECIAIS\nPrint colorido Mega 21 x 29 cm Vertical\nPrint colorido Mega 21 x 29 cm Horizontal\nNOTURNO\nNOVIDADE! A Zarabatana est\u00e1 preparando uma nova edi\u00e7\u00e3o da primeira graphic novel de Salvador Sanz publicada no Brasil e que estava esgotada: Noturno.\nUtilizando sua talentosa arte e t\u00e9cnica narrativa, Sanz nos transporta para uma Argentina ao mesmo tempo fant\u00e1stica e real, onde nos faz acompanhar um inacredit\u00e1vel conto de fantasia e terror, nesta que j\u00e1 pode ser considerada uma graphic novel cl\u00e1ssica do g\u00eanero.\n21 x 28 cm - 144 p\u00e1ginas - P&B - papel couch\u00ea 150 g\nO AUTOR\nSalvador Sanz nasceu em Buenos Aires em 1975. Em 1994, participou como editor e autor na cria\u00e7\u00e3o da revista Catzole . Foi publicado na revista franco-argentina Ex Abrupto , na antologia de autores do Mercosul Sudam\u00e9rika e, em 2005, desenhou a s\u00e9rie Angela Della Morte para a revista Basti\u00f3n Unlimited . Tamb\u00e9m se aventurou na anima\u00e7\u00e3o; trabalhou no filme Mercano, el Marciano e dirigiu dois curtas: El Inivisor e Gorgonas , este \u00faltimo ganhador como melhor curta de anima\u00e7\u00e3o na Comicon 2005, em San Diego, EUA, entre outros pr\u00eamios. Em 2006, publicou Legi\u00e3o , que mais tarde chegou ao mercado americano atrav\u00e9s da IDW Publishing . Em 2007, publicou Desfigurado pela Ex Abrupto Ediciones , compila\u00e7\u00e3o da s\u00e9rie publicada em Catzole . Atualmente combina sua atividade de quadrinista com a realiza\u00e7\u00e3o de story-boards para cinema e publicidade, al\u00e9m de dar aulas sobre quadrinhos. Obras publicadas pela Zarabatana Books no Brasil: Noturno , Angela Della Morte 1 , Legi\u00e3o , O Esqueleto - volumes 1, 2 e 3 . Tamb\u00e9m com edi\u00e7\u00e3o brasileira o livro ilustrado por Sanz: O Chamado de Cthulhu , de H. P. Lovecraft, pela Editora Skript.", "categoria_multirrotulo_lda": {"0": 0.0, "1": 0.0, "2": 0.4, "3": 0.4, "4": 0.6, "5": 0.8, "6": 0.2, "7": 0.2, "8": 0.0, "9": 0.4, "10": 0.2, "11": 0.6, "12": 0.4, "13": 0.0, "14": 0.0, "15": 0.4, "16": 0.2, "17": 0.4, "18": 0.2, "19": 0.2, "20": 0.4, "21": 0.2, "22": 0.4, "23": 0.4, "24": 0.0, "25": 0.4, "26": 0.2, "27": 1.0, "28": 0.6, "29": 0.0, "30": 0.4, "31": 0.2, "32": 0.2, "33": 0.0, "34": 0.2, "35": 0.8, "36": 0.2, "37": 0.2, "38": 0.6, "39": 0.0, "40": 0.4, "41": 0.4, "42": 0.6, "43": 0.0, "44": 0.0, "45": 0.2, "46": 0.0, "47": 0.2, "48": 0.2, "49": 0.2}, "categoria_entidades": ["terror", "leitores brasileiros das graphic novels de salvador sanz", "mestre", "mundos", "personagens", "criaturas fant\u00e1sticas", "zarabatana books", "apoiadores", "\u00faltima cria\u00e7\u00e3o do aclamado autor argentino", "zarabatana books meta", "20.000,00 flex prazo da campanha", "90 dias prazo para in\u00edcio da entrega dos livros", "julho 2021 envio", "brasil", "mega edi\u00e7\u00e3o especial colorida", "capa dura", "104 p\u00e1ginas", "formato 21,4 x 30,0 cm", "papel couch\u00ea 170 g", "m2", "kaijus", "monstros japoneses parentes de godzilla", "plena montevid\u00e9u", "uruguai", "ideia salvador sanz", "nova hq", "imagens", "cenas incr\u00edveis", "chacais", "criaturas imortais", "big bang", "guerra", "inimigos", "longevos", "pris\u00e3o inexpugn\u00e1vel", "eternidade", "morte", "pris\u00e3o", "terceiro planeta do sistema solar", "milh\u00f5es de anos", "p\u00e9s", "prisioneiros", "print", "mega 21 x 29 cm vertical", "mega 21 x 29 cm horizontal", "noturno", "novidade", "zarabatana", "nova edi\u00e7\u00e3o da primeira graphic novel de salvador sanz", "talentosa arte", "t\u00e9cnica narrativa", "sanz", "argentina ao mesmo tempo fant\u00e1stica", "inacredit\u00e1vel conto de fantasia", "graphic", "cl\u00e1ssica do g\u00eanero", "21 x 28 cm", "144 p\u00e1ginas", "p&b", "papel couch\u00ea 150 g", "autor", "salvador sanz", "buenos aires em 1975", "editor", "autor na cria\u00e7\u00e3o da revista catzole", "revista franco-argentina ex abrupto", "antologia de autores do mercosul sudam\u00e9rika", "s\u00e9rie angela della morte", "revista basti\u00f3n unlimited", "anima\u00e7\u00e3o", "filme mercano", "el marciano", "dois curtas", "el inivisor", "gorgonas", "\u00faltimo ganhador como melhor curta de anima\u00e7\u00e3o na comicon 2005", "san diego", "eua", "pr\u00eamios", "legi\u00e3o", "mercado americano", "idw publishing", "ex abrupto ediciones", "compila\u00e7\u00e3o da s\u00e9rie", "catzole", "atividade de quadrinista", "realiza\u00e7\u00e3o de story-boards para cinema", "publicidade", "aulas sobre quadrinhos", "obras", "zarabatana books no brasil", "angela della morte 1", "esqueleto", "volumes 1", "edi\u00e7\u00e3o brasileira", "livro", "chamado de cthulhu", "h. p. lovecraft", "editora skript"]}