{"origem": "catarse", "categoria_teste_mencoes": {"saloes_humor": false, "hqmix": false, "ccxp": false, "fiq": false, "angelo_agostini": false, "politica": true, "questoes_genero": false, "lgbtqiamais": false, "terror": false, "humor": false, "herois": false, "disputa": false, "ficcao_cientifica": false, "fantasia": false, "folclore": false, "zine": false, "webformatos": false, "erotismo": false, "religiosidade": false, "jogos": false, "midia_independente": true}, "recompensas_menor_nominal": 107.0, "recompensas_menor_ajustado": 127.76204945789974, "recompensas_quantidade": 1, "autoria_id": 785889, "autoria_nome": "rodrigo machado da rosa", "autoria_nome_publico": "figura editora", "autoria_classificacao": "empresa", "autoria_classificacao_id": 1, "social_seguidores": 1949, "social_newsletter": true, "social_sub_contribuicoes_amigos": true, "social_sub_novos_seguidores": true, "social_sub_posts_projeto": true, "social_projetos_contribuidos": 33, "social_projetos_publicados": 30, "geral_municipio": "S\u00e3o Paulo", "geral_uf": "SP", "geral_uf_br": "SP", "geral_city_id": 5274, "geral_content_rating": 1, "geral_contributed_by_friends": false, "geral_capa_imagem": false, "geral_capa_video": true, "geral_dias_campanha": 30, "geral_data_fim": "2021-11-12T02:59:59.999999", "geral_data_ini": "2021-10-12T23:03:32.699219", "geral_meta": 80000.0, "geral_meta_corrigida": 95523.02763207458, "geral_arrecadado": 175352.0, "geral_arrecadado_corrigido": 209376.92426674423, "geral_percentual_arrecadado": 219.19, "geral_conteudo_adulto": false, "geral_posts": 6, "geral_project_id": 145109, "geral_modalidade": "aon", "geral_titulo": "PERRAMUS", "geral_status": "successful", "geral_total_contribuicoes": 1203, "geral_total_apoiadores": 1194, "geral_sobre": "A pr\u00e9-venda do Catarse fechou, mas voc\u00ea pode comprar o livro em nosso site com frete gr\u00e1tis: www.figuraeditora.com . Disponibilidad imediata.\nLAN\u00c7ADO EM 2021\nUma noite, um esconderijo de opositores pol\u00edticos da ditadura que assola o pa\u00eds \u00e9 invadido pelos Marechais, o esquadr\u00e3o da morte do regime. O nosso protagonista consegue fugir da morte, mas n\u00e3o da culpa por abandonar os seus companheiros. No entanto, no prost\u00edbulo em que passa a noite encontra um consolo. Poder\u00e1 escolher entre tr\u00eas op\u00e7\u00f5es: a sorte, o prazer e o esquecimento. Ele escolhe o esquecimento, e com isso, ganha um novo nome: Perramus, e uma nova luta da qual, desta vez, n\u00e3o fugir\u00e1.\nPerramus \u00e9 um acerto de contas em quadrinhos com a ditadura que assolou a Argentina entre os anos 1970/80.\nUma f\u00e1bula fant\u00e1stica da mem\u00f3ria da Am\u00e9rica Latina.\nObra-prima do mestre do desenho Alberto Breccia e do escritor, editor e jornalista Juan Sasturain, Perramus \u00e9 um livro ic\u00f4nico da hist\u00f3ria da HQ latinoamericana e do mundo. Os quatro volumes da obra \u2013 dos quais tr\u00eas eram in\u00e9ditos no Brasil \u2013 , ser\u00e3o publicados pela primeira vez no pa\u00eds em uma edi\u00e7\u00e3o integral de 512 p\u00e1ginas.\nParticipe da pr\u00e9-venda no Catarse e assine seu nome em mais essa edi\u00e7\u00e3o imperd\u00edvel da Figura Editora.\nA EDI\u00c7\u00c3O\nPerramus ter\u00e1 512 p\u00e1ginas, capa dura, com miolo em preto e branco, impresso em papel Couch\u00ea 115 g., capa dura e formato A4: 21 x 30 cm. A tradu\u00e7\u00e3o \u00e9 de Ernani Ss\u00f3.\nVALORES\nNas primeiras 48 horas, voc\u00ea poder\u00e1 adquirir a Perramus por apenas R$ 107 (+ R$ 25 de frete, na \u201cRecompensas A\u201d). Na Recompensa\u201cB\u201d ter\u00e1 a mesma oferta, mas com a retirada em lojas da cidade de S\u00e3o Paulo.\nDepois disso, o valor passa a ser de R$ 115 (+ frete de R$ 25).\nNas livrarias, Perramus custar\u00e1 R$ 165 .", "categoria_multirrotulo_lda": {"0": 0.0, "1": 0.2, "2": 0.4, "3": 0.4, "4": 0.4, "5": 0.0, "6": 0.4, "7": 0.0, "8": 0.0, "9": 0.0, "10": 0.0, "11": 0.2, "12": 0.4, "13": 0.0, "14": 0.2, "15": 0.2, "16": 0.2, "17": 0.0, "18": 0.0, "19": 0.0, "20": 0.2, "21": 0.0, "22": 0.2, "23": 0.4, "24": 0.0, "25": 0.0, "26": 0.0, "27": 0.2, "28": 0.0, "29": 0.2, "30": 0.2, "31": 0.0, "32": 0.0, "33": 0.0, "34": 0.2, "35": 0.2, "36": 0.6, "37": 0.0, "38": 0.2, "39": 0.2, "40": 0.2, "41": 0.4, "42": 0.2, "43": 0.2, "44": 0.0, "45": 0.2, "46": 0.0, "47": 0.2, "48": 0.6, "49": 0.2}, "categoria_entidades": ["pr\u00e9-venda do catarse", "livro", "site com frete gr\u00e1tis", "www.figuraeditora.com", "disponibilidad imediata", "lan\u00e7ado em 2021", "noite", "esconderijo de opositores pol\u00edticos da ditadura", "pa\u00eds", "marechais", "esquadr\u00e3o da morte do regime", "protagonista", "morte", "culpa", "companheiros", "entanto", "prost\u00edbulo", "consolo", "tr\u00eas op\u00e7\u00f5es", "sorte", "prazer", "esquecimento", "novo nome", "perramus", "nova luta", "vez", "acerto de contas em quadrinhos", "ditadura", "argentina", "anos 1970/80", "f\u00e1bula fant\u00e1stica da mem\u00f3ria da am\u00e9rica latina", "obra-prima do mestre do desenho alberto breccia", "escritor", "editor", "jornalista juan sasturain", "livro ic\u00f4nico da hist\u00f3ria da hq latinoamericana", "mundo", "quatro volumes da obra", "in\u00e9ditos no brasil", "vez no pa\u00eds", "edi\u00e7\u00e3o integral de 512 p\u00e1ginas", "participe da pr\u00e9-venda no catarse", "nome", "edi\u00e7\u00e3o imperd\u00edvel da figura editora", "edi\u00e7\u00e3o", "512 p\u00e1ginas", "capa dura", "miolo em preto", "papel couch\u00ea 115 g.", "formato a4", "21 x 30 cm", "tradu\u00e7\u00e3o", "ernani ss\u00f3", "valores", "primeiras 48 horas", "25 de frete", "recompensas a", "recompensa\u201cb", "mesma oferta", "retirada em lojas da cidade de s\u00e3o paulo", "valor", "frete", "livrarias"]}