{"origem": "catarse", "categoria_teste_mencoes": {"saloes_humor": false, "hqmix": false, "ccxp": false, "fiq": false, "angelo_agostini": false, "politica": false, "questoes_genero": false, "lgbtqiamais": false, "terror": false, "humor": false, "herois": false, "disputa": false, "ficcao_cientifica": false, "fantasia": false, "folclore": false, "zine": false, "webformatos": false, "erotismo": false, "religiosidade": false, "jogos": false, "midia_independente": false}, "recompensas_menor_nominal": 500.0, "recompensas_menor_ajustado": 829.5064561492022, "recompensas_quantidade": 1, "autoria_id": 135313, "autoria_nome": "alexandre leoni gomes", "autoria_nome_publico": "alexandre leoni", "autoria_classificacao": "masculino", "autoria_classificacao_id": 3, "social_seguidores": 88, "social_newsletter": false, "social_sub_contribuicoes_amigos": true, "social_sub_novos_seguidores": true, "social_sub_posts_projeto": true, "social_projetos_contribuidos": 5, "social_projetos_publicados": 1, "geral_municipio": "Campo Grande", "geral_uf": "MS", "geral_uf_br": "MS", "geral_city_id": 1510, "geral_content_rating": 1, "geral_contributed_by_friends": false, "geral_capa_imagem": false, "geral_capa_video": true, "geral_dias_campanha": 60, "geral_data_fim": "2015-08-29T23:59:59.999999", "geral_data_ini": "2015-06-30T22:47:37.971534", "geral_meta": 7000.0, "geral_meta_corrigida": 11613.09038608883, "geral_arrecadado": 24475.0, "geral_arrecadado_corrigido": 40604.34102850345, "geral_percentual_arrecadado": 349.64285714285717, "geral_conteudo_adulto": false, "geral_posts": 14, "geral_project_id": 14560, "geral_modalidade": "aon", "geral_titulo": "A Vida Oculta de Fernando Pessoa", "geral_status": "successful", "geral_total_contribuicoes": 544, "geral_total_apoiadores": 540, "geral_sobre": "Fernando Pessoa foi um dos maiores poetas do s\u00e9culo XX e a sua obra n\u00e3o conhece fronteiras. Por\u00e9m, grande parte da sua vida est\u00e1 envolta em mist\u00e9rio.\nAqui contamos essa hist\u00f3ria: quem foi, realmente, Fernando Pessoa.\nA Vida Oculta de Fernando Pessoa \u00e9 um hist\u00f3ria que conta de forma alternativa a origem dos heter\u00f4nimos do poeta e que revela alguns dos segredos mais bem guardados da sua vida.\n- Meta Inicial R$ 7.000 [ALCAN\u00c7ADA]\nO projeto vai sair do papel! Todos os apoiadores receber\u00e3o as recompensas que escolheram at\u00e9 Dezembro de 2015.\n- Meta Estendida R$ 9.000 [ALCAN\u00c7ADA]\n- Meta Estendida R$ 12.000 [ALCAN\u00c7ADA]\n- Meta Estendida R$ 15.000 [ALCAN\u00c7ADA]\n- Meta Estendida R$ 20.000\nApesar do Catarse ser um site brasileiro, voc\u00ea pode apoiar o projeto na mesma sem preju\u00edzo das recompensas a que tem direito. A vantagem \u00e9 que o Real hoje vale aproximadamente 1/3 do Euro, ou seja, o apoio no valor de R$35 rondar\u00e1 os 10 \u20ac \u0005!\nO valor do frete e forma de envio para destinos fora do Brasil ser\u00e3o combinados individualmente com cada apoiador estrangeiro.\n\u2022 Reportagem na Globo\n\u2022 Jornal portugu\u00eas Di\u00e1rio de Not\u00edcias\n\u2022 Jornal luso-canadense A voz de Portugal\nJovem escritor portugu\u00eas de 27 anos, licenciado em Pedagogia, que tem trabalhado os \u00faltimos 5 anos junto de v\u00e1rias faixas et\u00e1rias para cultivar o valor do pensamento cr\u00edtico, cient\u00edfico e art\u00edstico. Com liga\u00e7\u00f5es ao mundo da m\u00fasica, dos quadrinhos e da poesia, acredita que a arte serve de ve\u00edculo de express\u00e3o do seu pensamento.\nIlustrador de 26 anos natural de Campo Grande - MS, tem experi\u00eancia com publicidade, anima\u00e7\u00e3o, games e hist\u00f3rias em quadrinhos. Por muitos anos publicou  e editou quadrinhos de forma independente no site www.trovaoquadrinhos.blogspot.com e atrav\u00e9s de uma dessas hist\u00f3rias conheceu o Andr\u00e9. Hoje, al\u00e9m de se dedicar a este projeto, faz ilustra\u00e7\u00f5es como freelancer e hangouts quinzenais no canal Bate-papo Ilustrado , onde entrevista outros ilustradores brasileiros.\nAl\u00e9m do livro impresso de A Vida Oculta de Fernando Pessoa, temos alguns outros \u00edtens dentro das recompensas:\n\u2022 Poster A3\n* Hist\u00f3ria em Quadrinhos The Search\n* Sketch original feito e assinado por Alexandre Leoni, dedicado ao apoiador. O conte\u00fado da imagem ser\u00e1 combinado diretamente com o apoiador.\n\u2022 Miniatura do Fernando Pessoa\nEscolha o pacote de recompensas que cabe no seu bolso, contribua para garantir seu exemplar do livro e n\u00e3o se esque\u00e7a de AJUDAR A DIVULGAR este projeto para todos seus amigos!", "categoria_multirrotulo_lda": {"0": 0.2, "1": 0.2, "2": 0.6, "3": 0.4, "4": 0.6, "5": 0.0, "6": 0.6, "7": 0.2, "8": 0.4, "9": 0.2, "10": 0.2, "11": 0.4, "12": 0.4, "13": 0.0, "14": 0.4, "15": 0.2, "16": 0.4, "17": 0.0, "18": 0.2, "19": 0.2, "20": 0.2, "21": 0.2, "22": 0.4, "23": 0.6, "24": 0.0, "25": 0.4, "26": 0.2, "27": 0.8, "28": 0.4, "29": 0.2, "30": 0.6, "31": 0.2, "32": 0.2, "33": 0.0, "34": 0.2, "35": 0.6, "36": 0.6, "37": 0.6, "38": 0.6, "39": 0.4, "40": 0.2, "41": 0.6, "42": 0.6, "43": 0.4, "44": 0.0, "45": 0.6, "46": 0.0, "47": 0.2, "48": 0.4, "49": 0.2}, "categoria_entidades": ["fernando pessoa", "um dos maiores poetas do s\u00e9culo xx", "obra", "fronteiras", "grande parte", "vida", "envolta em mist\u00e9rio", "hist\u00f3ria", "vida oculta de fernando pessoa", "forma alternativa", "origem dos heter\u00f4nimos do poeta", "segredos", "guardados", "inicial", "alcan\u00e7ada", "projeto", "papel", "apoiadores", "recompensas", "dezembro de 2015", "meta", "catarse", "site brasileiro", "projeto na mesma sem preju\u00edzo das recompensas", "direito", "vantagem", "real", "1/3 do euro", "apoio no valor", "\u0005", "valor do frete", "forma de envio para destinos", "brasil", "apoiador estrangeiro", "reportagem na globo", "jornal portugu\u00eas di\u00e1rio de not\u00edcias", "jornal luso-canadense", "voz de portugal", "jovem escritor portugu\u00eas de 27 anos", "licenciado em pedagogia", "\u00faltimos 5 anos", "faixas et\u00e1rias", "valor do pensamento cr\u00edtico", "liga\u00e7\u00f5es ao mundo da m\u00fasica", "quadrinhos", "poesia", "arte", "ve\u00edculo de express\u00e3o", "pensamento", "ilustrador de 26 anos natural de campo grande", "ms", "experi\u00eancia com publicidade", "anima\u00e7\u00e3o", "games", "hist\u00f3rias em quadrinhos", "anos", "quadrinhos de forma independente no site www.trovaoquadrinhos.blogspot.com", "uma dessas hist\u00f3rias", "andr\u00e9", "ilustra\u00e7\u00f5es como freelancer", "hangouts quinzenais no canal bate-papo", "entrevista", "ilustradores brasileiros", "livro", "\u00edtens", "poster a3", "hist\u00f3ria em quadrinhos the search", "alexandre leoni", "apoiador", "conte\u00fado da imagem", "miniatura do fernando pessoa", "pacote de recompensas", "bolso", "exemplar do livro", "ajudar", "amigos"]}