{"origem": "catarse", "categoria_teste_mencoes": {"saloes_humor": false, "hqmix": false, "ccxp": false, "fiq": false, "angelo_agostini": false, "politica": true, "questoes_genero": false, "lgbtqiamais": false, "terror": false, "humor": false, "herois": true, "disputa": false, "ficcao_cientifica": false, "fantasia": false, "folclore": false, "zine": false, "webformatos": false, "erotismo": false, "religiosidade": false, "jogos": false, "midia_independente": false}, "recompensas_menor_nominal": 34.0, "recompensas_menor_ajustado": 37.496478075187234, "recompensas_quantidade": 1, "autoria_id": 213576, "autoria_nome": "reginaldo aguiar gomes", "autoria_nome_publico": "r\u00e9gis rocha", "autoria_classificacao": "masculino", "autoria_classificacao_id": 3, "social_seguidores": 53, "social_newsletter": false, "social_sub_contribuicoes_amigos": true, "social_sub_novos_seguidores": true, "social_sub_posts_projeto": true, "social_projetos_contribuidos": 176, "social_projetos_publicados": 5, "geral_municipio": "S\u00e3o Paulo", "geral_uf": "SP", "geral_uf_br": "SP", "geral_city_id": 5274, "geral_content_rating": 1, "geral_contributed_by_friends": false, "geral_capa_imagem": false, "geral_capa_video": true, "geral_dias_campanha": 90, "geral_data_fim": "2022-09-20T02:59:59.999999", "geral_data_ini": "2022-06-21T20:59:08.479459", "geral_meta": 1400.0, "geral_meta_corrigida": 1543.972626625357, "geral_arrecadado": 1095.0, "geral_arrecadado_corrigido": 1207.6071615391184, "geral_percentual_arrecadado": 78.21428571428571, "geral_conteudo_adulto": false, "geral_posts": 7, "geral_project_id": 153363, "geral_modalidade": "flex", "geral_titulo": "Muitos Mundos", "geral_status": "successful", "geral_total_contribuicoes": 20, "geral_total_apoiadores": 20, "geral_sobre": "Tudo come\u00e7a com uma ideia.\nJ\u00e1 ficou em d\u00favida? Se tivesse agido diferente, o que aconteceria?\nMuitos Mundos, acompanha as decis\u00f5es e as muitas realidades de um criador an\u00f4nimo... que pode at\u00e9 ser voc\u00ea.\nMuitos Mundos: - 14 hist\u00f3rias curtas! - Capa Colorida; - 32 p\u00e1ginas em PB; - 16x23cm.\nVeja uma das hist\u00f3rias:\nVoc\u00ea pode aproveitar e ainda levar junto:\n- Imp\u00e9rio : A realidade foi invadida por nazi(r)fascistas da segunda dimens\u00e3o. Atrav\u00e9s dos celulares, eles contaminam os desavisados e continuam propagando sua mensagem de \u00f3dio. Entre diversas for\u00e7as de resist\u00eancia, uma tem anos de pr\u00e1tica, preparados e afiados para a luta. Conhe\u00e7a o Imp\u00e9rio.\n- Her\u00f3i: Incurs\u00e3o: Um navio voador surge dos c\u00e9us de S\u00e3o Paulo, levando caos por onde passa. Cabe ao Her\u00f3i e sua fam\u00edlia descobrir o que est\u00e1 acontecendo e salvar todos os poss\u00edveis no caminho.\nResumindo, fica assim:\nNas primeiras 72hs do projeto, teremos uma recompensa especial!\nUm sketch personalizado baseada em foto que voc\u00ea enviar\u00e1, como se estivesse em um dos universos do personagem. A imagem ser\u00e1 em branco e preto no tamanho A6 (105 x 148 mm) em um offset 90g.\nTem que correr pra garantir a sua!\nR\u00e9gis Rocha \u00e9 quadrinista e ilustrador. Utiliza arte digital para dar vida a um mundo anal\u00f3gico. Publica quadrinhos e livros infantis com foco na representatividade negra.\nMinistra oficinas e palestras sobre a representa\u00e7\u00e3o negra nos quadrinhos, trabalhando tanto a forma visual quanto a sociol\u00f3gica e hist\u00f3rica.\nSeus trabalhos mais conhecidos, s\u00e3o os quadrinhos da s\u00e9rie Her\u00f3i e os livros infantis Her\u00f3i, O Menino Mais Poderoso do Mundo (2017) e Baby, A Maravilha Mirim (2018).\nConhe\u00e7a mais em afrodinamic.com ou instagram.com/afrodinamic\nJunho/2022 - In\u00edcio da Campanha no Catarse\nAgosto/2022 - Revista pronta e revisada. Confec\u00e7\u00e3o dos brindes dos apoiadores da op\u00e7\u00e3o 72HS\nSetembro /2022 - Fim da Campanha / Envio para Gr\u00e1fica\nOutubro/2022 - Distribui\u00e7\u00e3o para apoiadores e lan\u00e7amento\nSe ficou alguma d\u00favida, \u00e9 s\u00f3 me chamar aqui ou no insta... s\u00f3 n\u00e3o vale deixar de apoiar!", "categoria_multirrotulo_lda": {"0": 0.2, "1": 0.2, "2": 0.6, "3": 0.2, "4": 0.6, "5": 0.2, "6": 0.8, "7": 0.2, "8": 0.2, "9": 0.2, "10": 0.2, "11": 0.4, "12": 0.6, "13": 0.0, "14": 0.0, "15": 0.4, "16": 0.4, "17": 0.0, "18": 0.2, "19": 0.2, "20": 0.2, "21": 0.2, "22": 0.4, "23": 0.4, "24": 0.0, "25": 0.4, "26": 0.0, "27": 0.6, "28": 0.2, "29": 0.4, "30": 0.6, "31": 0.0, "32": 0.2, "33": 0.0, "34": 0.2, "35": 0.4, "36": 0.4, "37": 0.2, "38": 0.6, "39": 0.0, "40": 0.4, "41": 0.2, "42": 0.4, "43": 0.6, "44": 0.0, "45": 0.6, "46": 0.0, "47": 0.0, "48": 0.4, "49": 0.4}, "categoria_entidades": ["ideia", "d\u00favida", "mundos", "decis\u00f5es", "realidades", "criador an\u00f4nimo", "14 hist\u00f3rias curtas", "capa colorida", "32 p\u00e1ginas em pb", "16x23 cm", "uma das hist\u00f3rias", "imp\u00e9rio", "realidade", "nazi(r)fascistas da segunda dimens\u00e3o", "celulares", "desavisados", "mensagem de \u00f3dio", "for\u00e7as de resist\u00eancia", "anos de pr\u00e1tica", "luta", "her\u00f3i", "incurs\u00e3o", "navio voador", "c\u00e9us de s\u00e3o paulo", "caos por onde", "fam\u00edlia", "poss\u00edveis no caminho", "primeiras 72hs do projeto", "recompensa especial", "sketch", "foto", "um dos universos do personagem", "imagem", "branco", "preto no tamanho a6", "105 x 148 mm", "offset 90 g.", "r\u00e9gis rocha", "ilustrador", "arte digital", "vida", "mundo anal\u00f3gico", "quadrinhos", "livros infantis com foco na representatividade negra", "ministra oficinas", "palestras", "representa\u00e7\u00e3o negra nos quadrinhos", "forma visual", "sociol\u00f3gica", "trabalhos", "quadrinhos da s\u00e9rie her\u00f3i", "livros infantis her\u00f3i", "menino mais poderoso do mundo", "baby", "maravilha mirim", "afrodinamic.com", "junho/2022", "in\u00edcio da campanha no catarse", "agosto/2022", "revista pronta", "confec\u00e7\u00e3o dos brindes dos apoiadores da op\u00e7\u00e3o", "setembro /2022", "fim da campanha", "envio para gr\u00e1fica", "outubro/2022", "distribui\u00e7\u00e3o para apoiadores", "lan\u00e7amento", "insta"]}