{"origem": "catarse", "categoria_teste_mencoes": {"saloes_humor": false, "hqmix": false, "ccxp": false, "fiq": false, "angelo_agostini": false, "politica": false, "questoes_genero": false, "lgbtqiamais": false, "terror": true, "humor": false, "herois": false, "disputa": false, "ficcao_cientifica": true, "fantasia": true, "folclore": false, "zine": false, "webformatos": false, "erotismo": false, "religiosidade": false, "jogos": false, "midia_independente": false}, "recompensas_menor_nominal": 250.0, "recompensas_menor_ajustado": 275.4755894419352, "recompensas_quantidade": 1, "autoria_id": 488800, "autoria_nome": "nat\u00e1lia vasques lopes de oliveira ugolini", "autoria_nome_publico": "nani vasques", "autoria_classificacao": "feminino", "autoria_classificacao_id": 4, "social_seguidores": 10, "social_newsletter": false, "social_sub_contribuicoes_amigos": true, "social_sub_novos_seguidores": true, "social_sub_posts_projeto": true, "social_projetos_contribuidos": 2, "social_projetos_publicados": 1, "geral_municipio": "Londrina", "geral_uf": "PR", "geral_uf_br": "PR", "geral_city_id": 2980, "geral_content_rating": 1, "geral_contributed_by_friends": false, "geral_capa_imagem": false, "geral_capa_video": true, "geral_dias_campanha": 40, "geral_data_fim": "2022-11-10T02:59:59.999999", "geral_data_ini": "2022-09-30T21:45:17.049879", "geral_meta": 45000.0, "geral_meta_corrigida": 49585.60609954834, "geral_arrecadado": 1875.0, "geral_arrecadado_corrigido": 2066.066920814514, "geral_percentual_arrecadado": 4.166666666666667, "geral_conteudo_adulto": false, "geral_posts": 4, "geral_project_id": 155655, "geral_modalidade": "flex", "geral_titulo": "Amigos Monstros", "geral_status": "successful", "geral_total_contribuicoes": 26, "geral_total_apoiadores": 26, "geral_sobre": "Ol\u00e1 pessoal tudo bem? Aqui que fala \u00e9 Nani Vasques! T\u00f4 aqui para apresentar um pouquinho do Livro Amigos Monstros para voc\u00eas. Para poder fazer ele sair do status de projeto e se tornar realidade precisamos de muitos amigos monstros que estejam dispostos a apoiar nosso sonho! Ent\u00e3o eu escrevi um pouco para entenderem como funciona essa magia!\nCOMO SER\u00c1 O LIVRO AMIGOS MONSTROS DEPOIS DE IMPRESSO?\n\u00c9 um livro ilustrado em t\u00e9cnica mista de aquarela e digital que conta a hist\u00f3ria da Menina  e de seus Amigos Monstros. Ele ser\u00e1 de capa dura 18x18cm e 100 p\u00e1ginas coloridas! Isso mesmo ele ser\u00e1 lind\u00e3o e cheio de aventuras!\nE SOBRE O QUE \u00c9 A HIST\u00d3RIA?\nA Menina gostava de sonhar que era astronauta, em um de seus sonhos foi engolida por uma grande criatura. Dentro das entranhas dessa criatura encontra uma ilha muito peculiar. quando se da conta percebe que perdeu algo que lhe era muito precioso, ela precisa mergulhar em lagos profundos e cavernas para achar o que sumiu...  monstrinhos de v\u00e1rios tipos, se juntam a sua volta, \"o que ser\u00e1 essa coisa?\", ela tamb\u00e9m era um monstro para eles.  Apesar de suas diferen\u00e7as eles mostram s\u00e3o muito mais do que criaturas estranhas, s\u00e3o companheiros de aventura.\nEspero que o que foi perdido seja achado.\nMAS NANI COMO FUNCIONA ESSE NEG\u00d3CIO A\u00cd DO CATARSE?\nBom o Catarse funciona com o sistema de financiamento coletivo, ou seja varias pessoas ajudam a tornar um projeto realidade ajudando com um valor, sejam valores pequenos ou valores mais altos! Aqui do lado direito da tela voc\u00ea vai ser que existem algumas possibilidades, e o mais legal \u00e9 que dependendo do valor que ajudar ganha brindes exclusivos campanha! Inclusive o pr\u00f3prio livro f\u00edsico tamb\u00e9m \u00e9 uma possibilidade.\nQUAL \u00c9 A VANTAGEM DE INVESTIR NO CATARSE E N\u00c3O COMPRAR DEPOIS QUE O LIVRO LAN\u00c7AR?\nAjudando com algum valor no Catarse voc\u00ea acaba ganhado brindes que s\u00f3 estar\u00e3o dispon\u00edveis para os apoiadores e tamb\u00e9m pode adquirir o pr\u00f3prio livro f\u00edsico por um valor bem menor do que ele ser\u00e1 vendido no final quando for produzido!\nQUAIS S\u00c3O AS RECOMPENSAS?:\nmarca p\u00e1gina:\ncart\u00e3o postal:\nCaderno de capa flex\u00edvel:\nEspero que gostem e ajudem a compartilhar nossas aventuras!!!\nVejo voc\u00eas na Ilha Monstro!", "categoria_multirrotulo_lda": {"0": 0.0, "1": 0.0, "2": 0.0, "3": 0.0, "4": 0.0, "5": 0.0, "6": 0.4, "7": 0.0, "8": 0.4, "9": 0.0, "10": 0.0, "11": 0.0, "12": 0.2, "13": 0.0, "14": 0.0, "15": 0.0, "16": 0.8, "17": 0.0, "18": 0.0, "19": 0.2, "20": 0.0, "21": 0.0, "22": 0.0, "23": 0.0, "24": 0.0, "25": 0.0, "26": 0.0, "27": 0.0, "28": 0.0, "29": 0.0, "30": 0.0, "31": 0.0, "32": 0.0, "33": 0.2, "34": 0.0, "35": 0.0, "36": 0.0, "37": 0.0, "38": 0.0, "39": 0.0, "40": 0.0, "41": 0.0, "42": 0.0, "43": 0.0, "44": 0.0, "45": 0.4, "46": 0.0, "47": 0.0, "48": 0.0, "49": 0.0}, "categoria_entidades": ["pessoal", "nani vasques", "pouquinho do livro amigos monstros", "status de projeto", "realidade", "amigos monstros", "sonho", "magia", "ser\u00e1", "livro amigos monstros depois de impresso", "livro", "t\u00e9cnica", "aquarela", "hist\u00f3ria da menina", "capa dura 18x18 cm", "100 p\u00e1ginas", "cheio de aventuras", "que", "hist\u00f3ria", "menina", "astronauta", "um", "sonhos", "grande criatura", "entranhas dessa criatura", "ilha", "conta", "lagos profundos", "cavernas", "monstrinhos", "tipos", "volta", "coisa", "monstro", "diferen\u00e7as", "criaturas estranhas", "companheiros de aventura", "nani como funciona", "neg\u00f3cio a\u00ed do catarse", "catarse", "sistema de financiamento coletivo", "varias pessoas", "projeto realidade", "valor", "valores pequenos", "valores", "lado direito da tela", "possibilidades", "brindes exclusivos campanha", "pr\u00f3prio livro f\u00edsico", "possibilidade", "investir no catarse", "valor no catarse", "brindes", "dispon\u00edveis", "apoiadores", "menor", "final", "as recompensas", "marca p\u00e1gina", "cart\u00e3o postal", "caderno de capa flex\u00edvel", "aventuras", "voc\u00eas na ilha monstro"]}