{"origem": "catarse", "categoria_teste_mencoes": {"saloes_humor": false, "hqmix": true, "ccxp": false, "fiq": false, "angelo_agostini": true, "politica": false, "questoes_genero": false, "lgbtqiamais": false, "terror": true, "humor": false, "herois": true, "disputa": false, "ficcao_cientifica": false, "fantasia": false, "folclore": false, "zine": false, "webformatos": false, "erotismo": true, "religiosidade": false, "jogos": true, "midia_independente": false}, "recompensas_menor_nominal": 51.0, "recompensas_menor_ajustado": 56.01872779251218, "recompensas_quantidade": 1, "autoria_id": 392581, "autoria_nome": "renata c b lzz", "autoria_nome_publico": "renata c b lzz", "autoria_classificacao": "feminino", "autoria_classificacao_id": 4, "social_seguidores": 90, "social_newsletter": false, "social_sub_contribuicoes_amigos": true, "social_sub_novos_seguidores": true, "social_sub_posts_projeto": true, "social_projetos_contribuidos": 65, "social_projetos_publicados": 5, "geral_municipio": "S\u00e3o Paulo", "geral_uf": "SP", "geral_uf_br": "SP", "geral_city_id": 5274, "geral_content_rating": 1, "geral_contributed_by_friends": false, "geral_capa_imagem": false, "geral_capa_video": true, "geral_dias_campanha": 89, "geral_data_fim": "2023-03-01T02:59:59.999999", "geral_data_ini": "2022-12-01T16:56:11.811716", "geral_meta": 6400.0, "geral_meta_corrigida": 7029.801134746626, "geral_arrecadado": 1284.33, "geral_arrecadado_corrigido": 1410.7163267795524, "geral_percentual_arrecadado": 20.06765625, "geral_conteudo_adulto": false, "geral_posts": 9, "geral_project_id": 159915, "geral_modalidade": "flex", "geral_titulo": "O \u00daltimo Acampamento", "geral_status": "successful", "geral_total_contribuicoes": 31, "geral_total_apoiadores": 31, "geral_sobre": "Das participantes do Gibi de Menininha: Historietas de Terror e Putaria (vencedor do 35\u00ba Trof\u00e9u Angelo Agostini e 31\u00ba HQMix ambos em 2019); Gibi de Menininha: O Faroeste \u00e9 mais embaixo (vencedor do 32\u00ba HQMix em 2020); Gibi de Menininha: Contos de F<3das; N\u00e3o ligue, Isso \u00e9 coisa de Mulher (vencedor do 38\u00ba Trof\u00e9u Angelo Agostini); N\u00e3o tem, Isso \u00e9 coisa de Mulher!\nMari Santtos e Renata C B Lzz apresentam a continua\u00e7\u00e3o de O \u00daltimo Jogo: O \u00daltimo Acampamento.\nNossa, mas \u00e9 sempre O \u00daltimo alguma coisa? SIM! Depois dos traumas que nossos her\u00f3is passam, duvido quererem passar de novo hahaha\nO \u00da ltimo Acampamento Talita, Julio e Roberto se encontram para mais uma aventura, desta vez em um acampamento em Atibaia, interior de S\u00e3o Paulo. Nada como um pouco de f\u00e9rias depois de uma batelada de provas. Uma hist\u00f3ria de terror estilo Buffy: a ca\u00e7a vampiros, com influ\u00eancias das hist\u00f3rias brasileiras. Assim come\u00e7amos a expans\u00e3o do O \u00daltimo Universo!\nComo ser\u00e1 o Gibi\nSeguindo os padr\u00f5es do anterior, ser\u00e1 em formato gibizinho com 32 p\u00e1ginas. Aqui uma pr\u00e9via da capa (escolhida pelo p\u00fablico) com os detalhes da revista:\nAs duas primeiras p\u00e1ginas de O \u00daltimo Acampamento!!!\nTodas as recompensas ser\u00e3o ou enviadas via correio ou e-mail", "categoria_multirrotulo_lda": {"0": 0.0, "1": 0.0, "2": 0.0, "3": 0.0, "4": 0.0, "5": 0.0, "6": 0.0, "7": 0.2, "8": 0.0, "9": 0.0, "10": 0.0, "11": 0.0, "12": 0.0, "13": 0.0, "14": 0.0, "15": 0.0, "16": 0.0, "17": 0.0, "18": 0.0, "19": 0.0, "20": 0.2, "21": 0.0, "22": 0.0, "23": 0.0, "24": 0.0, "25": 0.0, "26": 0.0, "27": 0.0, "28": 0.2, "29": 0.0, "30": 0.0, "31": 0.0, "32": 0.0, "33": 0.0, "34": 0.0, "35": 0.0, "36": 0.0, "37": 0.0, "38": 0.0, "39": 0.0, "40": 0.0, "41": 0.0, "42": 0.0, "43": 0.0, "44": 0.0, "45": 0.2, "46": 0.0, "47": 0.0, "48": 0.0, "49": 0.0}, "categoria_entidades": ["participantes do gibi de menininha", "historietas de terror", "putaria", "vencedor do 35\u00ba trof\u00e9u angelo agostini", "31\u00ba hqmix", "gibi de menininha", "faroeste", "embaixo", "vencedor do 32\u00ba hqmix em 2020", "contos de f<3das", "coisa de mulher", "vencedor do 38\u00ba trof\u00e9u angelo agostini", "mari santtos", "renata c b lzz", "continua\u00e7\u00e3o", "\u00faltimo jogo", "\u00faltimo acampamento", "nossa", "coisa", "sim", "traumas", "her\u00f3is", "novo hahaha", "\u00fa ltimo acampamento talita", "julio", "roberto", "uma aventura", "vez", "acampamento em atibaia", "interior de s\u00e3o paulo", "f\u00e9rias", "batelada de provas", "hist\u00f3ria de terror estilo buffy", "ca\u00e7a vampiros", "influ\u00eancias das hist\u00f3rias brasileiras", "expans\u00e3o", "\u00faltimo universo", "gibi", "padr\u00f5es do anterior", "formato gibizinho com 32 p\u00e1ginas", "pr\u00e9via da capa", "p\u00fablico", "detalhes da revista", "duas primeiras p\u00e1ginas", "recompensas", "via correio", "e-mail"]}