{"origem": "catarse", "categoria_teste_mencoes": {"saloes_humor": false, "hqmix": false, "ccxp": false, "fiq": true, "angelo_agostini": false, "politica": false, "questoes_genero": false, "lgbtqiamais": false, "terror": false, "humor": false, "herois": false, "disputa": false, "ficcao_cientifica": false, "fantasia": false, "folclore": false, "zine": false, "webformatos": false, "erotismo": false, "religiosidade": false, "jogos": false, "midia_independente": false}, "recompensas_menor_nominal": 150.0, "recompensas_menor_ajustado": 163.9086450161586, "recompensas_quantidade": 1, "autoria_id": 1484138, "autoria_nome": "dan dos santos borges", "autoria_nome_publico": "dan borges", "autoria_classificacao": "masculino", "autoria_classificacao_id": 3, "social_seguidores": 12, "social_newsletter": false, "social_sub_contribuicoes_amigos": true, "social_sub_novos_seguidores": true, "social_sub_posts_projeto": true, "social_projetos_contribuidos": 10, "social_projetos_publicados": 1, "geral_municipio": "Salvador", "geral_uf": "BA", "geral_uf_br": "BA", "geral_city_id": 620, "geral_content_rating": 1, "geral_contributed_by_friends": false, "geral_capa_imagem": false, "geral_capa_video": true, "geral_dias_campanha": 181, "geral_data_fim": "2024-01-01T02:59:59.999999", "geral_data_ini": "2023-01-17T21:52:40.061624", "geral_meta": 7500.0, "geral_meta_corrigida": 8195.43225080793, "geral_arrecadado": 1260.0, "geral_arrecadado_corrigido": 1376.8326181357322, "geral_percentual_arrecadado": 16.8, "geral_conteudo_adulto": false, "geral_posts": 1, "geral_project_id": 160003, "geral_modalidade": "flex", "geral_titulo": "Kaw\u00f3", "geral_status": "successful", "geral_total_contribuicoes": 22, "geral_total_apoiadores": 22, "geral_sobre": "Kaw\u00f3 \u00e9 um conto sobre luta, sobreviv\u00eancia, poder e responsabilidade. Talvez pare\u00e7a um pouco contradit\u00f3rio a princ\u00edpio, mas quando se leva uma vida de opress\u00e3o e o poder de revidar finalmente est\u00e1 a seu alcance, a barreira entre justi\u00e7a e vingan\u00e7a pode ser facilmente ultrapassada! Nesta hist\u00f3ria forte e emocionante, o autor Jeo Pinho aborda com um toque de fantasia e outras vezes com muito realismo, como o preconceito nos limita a uma vis\u00e3o simpl\u00f3ria da f\u00e9 e suas infinitas manifesta\u00e7\u00f5es.\nUma garota herda um antigo artefato da sua av\u00f3, que a princ\u00edpio lhe parece apenas um acess\u00f3rio inofensivo. O que ela n\u00e3o sabia, \u00e9 que o objeto est\u00e1 na sua fam\u00edlia h\u00e1 muitas gera\u00e7\u00f5es e guarda uma for\u00e7a misteriosa de prote\u00e7\u00e3o e justi\u00e7a ! Mas todo grande poder traz consequ\u00eancias e a jovem Iracema talvez n\u00e3o esteja preparada para o peso desse fardo!\nJeo Pinho nasceu em Salvador, Bahia, no ano de 74. Come\u00e7ou os rabiscos aos 8 anos inspirado nas anima\u00e7\u00f5es da Disney que passavam na TV e um tempo depois descobriu o fant\u00e1stico mundo das Hist\u00f3rias em Quadrinhos.\nEm 1994 come\u00e7ou a trabalhar com sua arte fazendo retratos e caricaturas, e paralelamente aprofundava seus conhecimentos em arte sequencial com o quadrinista Oliver Borges e um tempo depois com Dan Borges.\n\u00c9 certificado pelo Museu de Arte Moderna da Bahia (MAM), em Desenho Criativo e Desenho de observa\u00e7\u00e3o, onde cursou em 1990 e 2001.\nFoi membro ativo do grupo de quadrinistas da Aurora Comics, que aconteceu entre 2005 e 2015, tendo alguns dos seus trabalhos publicados nas p\u00e1ginas das HQs lan\u00e7adas de forma f\u00edsica e digital.\nAtualmente Jeo Pinho est\u00e1 se dedicando a uma s\u00e9rie de contos de sua autoria, com temas mais pessoais e focados no universo cultural de matrizes africanas.\nKaw\u00f3 \u00e9 a apenas o primeiro. Fique atento ao que est\u00e1 por vir.\nTodo or\u00e7amento arrecadado ser\u00e1 utilizado no custeio da produ\u00e7\u00e3o, taxas do Catarse e envio do projeto. Desde j\u00e1 agrade\u00e7o muito a colabora\u00e7\u00e3o de todos para que esse projeto ganhe vida e seja impresso.", "categoria_multirrotulo_lda": {"0": 0.4, "1": 0.2, "2": 0.6, "3": 0.2, "4": 0.8, "5": 0.4, "6": 0.4, "7": 0.2, "8": 0.0, "9": 0.2, "10": 0.2, "11": 0.8, "12": 0.4, "13": 0.0, "14": 0.0, "15": 0.2, "16": 0.2, "17": 0.0, "18": 0.2, "19": 0.4, "20": 0.2, "21": 0.2, "22": 0.4, "23": 0.4, "24": 0.0, "25": 0.2, "26": 0.0, "27": 0.8, "28": 0.2, "29": 0.2, "30": 0.6, "31": 0.0, "32": 0.2, "33": 0.0, "34": 0.2, "35": 0.4, "36": 0.4, "37": 0.2, "38": 0.4, "39": 0.2, "40": 0.4, "41": 0.6, "42": 0.4, "43": 0.6, "44": 0.0, "45": 0.6, "46": 0.0, "47": 0.2, "48": 0.6, "49": 0.4}, "categoria_entidades": ["kaw\u00f3", "conto sobre luta", "sobreviv\u00eancia", "poder", "responsabilidade", "contradit\u00f3rio a princ\u00edpio", "vida de opress\u00e3o", "alcance", "barreira entre justi\u00e7a", "vingan\u00e7a", "hist\u00f3ria forte", "autor jeo pinho", "toque de fantasia", "vezes", "realismo", "preconceito", "vis\u00e3o simpl\u00f3ria da f\u00e9", "infinitas manifesta\u00e7\u00f5es", "garota herda", "antigo artefato", "av\u00f3", "princ\u00edpio", "acess\u00f3rio inofensivo", "objeto", "fam\u00edlia", "gera\u00e7\u00f5es", "for\u00e7a misteriosa de prote\u00e7\u00e3o", "justi\u00e7a", "grande poder", "consequ\u00eancias", "jovem iracema", "preparada", "peso desse fardo", "jeo pinho", "salvador", "bahia", "ano de 74", "rabiscos aos 8 anos", "anima\u00e7\u00f5es da disney", "tv", "um tempo", "fant\u00e1stico mundo das hist\u00f3rias em quadrinhos", "arte", "retratos", "caricaturas", "conhecimentos em arte sequencial", "quadrinista oliver borges", "dan borges", "museu de arte moderna da bahia", "mam", "desenho criativo", "desenho de observa\u00e7\u00e3o", "membro ativo do grupo de quadrinistas da aurora comics", "trabalhos", "p\u00e1ginas das hqs", "forma f\u00edsica", "s\u00e9rie de contos", "autoria", "temas", "universo cultural de matrizes africanas", "fique atento", "or\u00e7amento", "custeio da produ\u00e7\u00e3o", "taxas do catarse", "envio do projeto", "colabora\u00e7\u00e3o", "projeto", "vida"]}