{"origem": "catarse", "categoria_teste_mencoes": {"saloes_humor": false, "hqmix": false, "ccxp": false, "fiq": false, "angelo_agostini": false, "politica": false, "questoes_genero": false, "lgbtqiamais": false, "terror": false, "humor": false, "herois": false, "disputa": false, "ficcao_cientifica": false, "fantasia": false, "folclore": false, "zine": false, "webformatos": false, "erotismo": false, "religiosidade": false, "jogos": false, "midia_independente": false}, "recompensas_menor_nominal": 1500.0, "recompensas_menor_ajustado": 1647.6096409562406, "recompensas_quantidade": 1, "autoria_id": 417340, "autoria_nome": "ev\u00e2nio bezerra da costa", "autoria_nome_publico": "jimmy rus", "autoria_classificacao": "masculino", "autoria_classificacao_id": 3, "social_seguidores": 8, "social_newsletter": true, "social_sub_contribuicoes_amigos": true, "social_sub_novos_seguidores": true, "social_sub_posts_projeto": true, "social_projetos_contribuidos": 1, "social_projetos_publicados": 5, "geral_municipio": "Uberl\u00e2ndia", "geral_uf": "MG", "geral_uf_br": "MG", "geral_city_id": 2393, "geral_content_rating": 1, "geral_contributed_by_friends": false, "geral_capa_imagem": false, "geral_capa_video": true, "geral_dias_campanha": 100, "geral_data_fim": "2023-03-17T02:59:59.999999", "geral_data_ini": "2022-12-07T01:39:33.221524", "geral_meta": 6000.0, "geral_meta_corrigida": 6590.438563824962, "geral_arrecadado": 1110.0, "geral_arrecadado_corrigido": 1219.231134307618, "geral_percentual_arrecadado": 18.5, "geral_conteudo_adulto": false, "geral_posts": 10, "geral_project_id": 160801, "geral_modalidade": "flex", "geral_titulo": "Revista O.Q de Quadrinhos n\u00ba 09", "geral_status": "successful", "geral_total_contribuicoes": 28, "geral_total_apoiadores": 28, "geral_sobre": "Revista O.Q de Quadrinhos- Incentivando sonhos Edi\u00e7\u00e3o 09\nAp\u00f3s produzir a revista O.Q de Quadrinhos n\u00ba 08, estamos de volta para dar sequencia ao projeto reiniciado.\nReiniciado pois a revista O.Q de Quadrinhos \u00e9 produzida e editada pelo artista, cartunista, quadrinista e produtor cultural Jimmy Rus (Ev\u00e2nio B. da Costa), desde 2009.\nEntre os anos de 2014 a 2022 a revista esteve parada e retornou em 2022, com a edi\u00e7\u00e3o do n\u00ba 08, projeto que foi em parte realizado devido ao apoio da Catarse.\nAp\u00f3s toda a repercuss\u00e3o do n\u00ba 08, retornamos ao Catarse mais uma vez para pedir o seu apoio e poder materializar mais essa revista.\nProduzida na cidade de Uberl\u00e2ndia/MG, a revista segue o caminho da produ\u00e7\u00e3o independente, se afastando das leis de incentivo e procurando o patroc\u00ednio coletivo, por seu car\u00e1ter menos burocr\u00e1tico, flexibilidade e rapidez.\nA revista O.Q de Quadrinhos e aberta a artistas iniciantes, amadores ou profissionais e desde sua cria\u00e7\u00e3o em setembro de 2009, mantem suas paginas abertas e dispon\u00edveis a qualquer artista que deseje (desde que passe pelo processo de sele\u00e7\u00e3o) publicar seu primeiro, ou apenas mais uma obra no formato de HQ, Cartum, charge ou ilustra\u00e7\u00e3o.\nDesengavetar material! Criar novos! Receber hist\u00f3rias in\u00e9ditas e autorais e disponibiliza-las ao p\u00fablico por um pre\u00e7o acess\u00edvel. Essa e a proposta da Revista O.Q de Quadrinhos.\nA revista possuir\u00e1 dois formato (impresso e e-book), e a edi\u00e7\u00e3o n\u00ba 09 ser\u00e1 lan\u00e7ada entre Fevereiro e Mar\u00e7o de 2023.\nPor isso pedimos e aguardamos seu apoio.\nRevista O.Q de Quadrinhos n\u00ba 09- Incentivando sonhos.\nPublicando e divulgando HQs e artistas.\nJimmy Rus\nEditor", "categoria_multirrotulo_lda": {"0": 0.0, "1": 0.0, "2": 0.2, "3": 0.4, "4": 0.4, "5": 0.0, "6": 0.0, "7": 0.2, "8": 0.0, "9": 0.0, "10": 0.0, "11": 0.6, "12": 0.2, "13": 0.0, "14": 0.0, "15": 0.4, "16": 0.0, "17": 0.0, "18": 0.0, "19": 0.2, "20": 0.0, "21": 0.0, "22": 0.4, "23": 0.4, "24": 0.0, "25": 0.0, "26": 0.0, "27": 0.2, "28": 0.0, "29": 0.0, "30": 0.4, "31": 0.0, "32": 0.0, "33": 0.0, "34": 0.2, "35": 0.2, "36": 0.4, "37": 0.0, "38": 0.2, "39": 0.2, "40": 0.2, "41": 0.6, "42": 0.4, "43": 0.0, "44": 0.0, "45": 0.0, "46": 0.0, "47": 0.2, "48": 0.4, "49": 0.0}, "categoria_entidades": ["revista o.q de quadrinhos-", "sonhos edi\u00e7\u00e3o 09", "revista", "quadrinhos n\u00ba 08", "volta", "sequencia ao projeto", "quadrinhos", "artista", "produtor cultural jimmy rus", "ev\u00e2nio b. da costa", "anos de 2014 a 2022", "edi\u00e7\u00e3o do n\u00ba 08", "projeto", "parte", "apoio da catarse", "repercuss\u00e3o do n\u00ba 08", "vez", "apoio", "cidade de uberl\u00e2ndia", "mg", "caminho da produ\u00e7\u00e3o independente", "leis de incentivo", "patroc\u00ednio coletivo", "car\u00e1ter", "flexibilidade", "rapidez", "revista o.q de quadrinhos", "artistas iniciantes", "profissionais", "cria\u00e7\u00e3o em setembro de 2009", "paginas", "dispon\u00edveis", "processo de sele\u00e7\u00e3o", "uma obra no formato de hq", "cartum", "charge", "ilustra\u00e7\u00e3o", "material", "hist\u00f3rias in\u00e9ditas", "p\u00fablico", "pre\u00e7o acess\u00edvel", "proposta da revista o.q de quadrinhos", "dois formato", "e-book", "edi\u00e7\u00e3o n\u00ba 09", "fevereiro", "mar\u00e7o de 2023", "revista o.q de quadrinhos n\u00ba", "sonhos", "hqs", "artistas", "jimmy rus", "editor"]}