{"origem": "catarse", "categoria_teste_mencoes": {"saloes_humor": false, "hqmix": false, "ccxp": false, "fiq": false, "angelo_agostini": false, "politica": false, "questoes_genero": false, "lgbtqiamais": false, "terror": false, "humor": false, "herois": true, "disputa": false, "ficcao_cientifica": false, "fantasia": false, "folclore": false, "zine": false, "webformatos": false, "erotismo": false, "religiosidade": true, "jogos": false, "midia_independente": false}, "recompensas_menor_nominal": 60.0, "recompensas_menor_ajustado": 64.71302140376193, "recompensas_quantidade": 1, "autoria_id": 1692890, "autoria_nome": "editora kimera ltda", "autoria_nome_publico": "editora kimera", "autoria_classificacao": "empresa", "autoria_classificacao_id": 1, "social_seguidores": 46, "social_newsletter": true, "social_sub_contribuicoes_amigos": true, "social_sub_novos_seguidores": true, "social_sub_posts_projeto": true, "social_projetos_contribuidos": 13, "social_projetos_publicados": 4, "geral_municipio": "Rio de Janeiro", "geral_uf": "RJ", "geral_uf_br": "RJ", "geral_city_id": 3662, "geral_content_rating": 1, "geral_contributed_by_friends": false, "geral_capa_imagem": false, "geral_capa_video": true, "geral_dias_campanha": null, "geral_data_fim": null, "geral_data_ini": "2023-03-31T18:34:21.799654", "geral_meta": null, "geral_meta_corrigida": null, "geral_arrecadado": 470.0, "geral_arrecadado_corrigido": 506.91866766280185, "geral_percentual_arrecadado": 47.0, "geral_conteudo_adulto": false, "geral_posts": 1, "geral_project_id": 164943, "geral_modalidade": "sub", "geral_titulo": "#QuadrinistasAmigos", "geral_status": "successful", "geral_total_contribuicoes": 10, "geral_total_apoiadores": 10, "geral_sobre": "Foi com enorme tristeza que n\u00f3s, dire\u00e7\u00e3o e colaboradores, da Editora Kimera, recebemos no dia 29 de abril pela manh\u00e3 a not\u00edcia do falecimento do nosso amigo quadrinista e videomaker Cadu, que tanto fez pelos cen\u00e1rios das hist\u00f3rias em quadrinhos e anima\u00e7\u00f5es nacionais. Apesar da perda irrepar\u00e1vel, estamos fazendo de tudo para que o legado deste grande artista permane\u00e7a, por muito tempo entre n\u00f3s, por meio da impress\u00e3o de sua revista em quadrinhos Funda\u00e7\u00e3o Am\u00e1lgama, uma cria\u00e7\u00e3o - dentre tantas outras - de Cadu Artes.\nMeus sentimentos a fam\u00edlia. Que Deus o tenha!\nVanderlei Sadrack (Editora Kimera)\nA DESPEDIDA DE UM GRANDE AMIGO BR\nHOMENAGEM AO SUPER ARTISTA\nSINEVERSO ESPECIAL - CADU ARTES\nCampanha #QuadrinistasAmigos visa arrecadar fundos para ajudar nas despesas do funeral do nosso amigo Cadu (Carlos Macedo), que encontrava-se em um dif\u00edcil momento de sua vida, acometido de 3 tumores no c\u00e9rebro e lutando por sua vida.\nInfelizmente, nosso amigo partiu para os bra\u00e7os do Pai Eterno. Ele ficou  internado no Hospital Quali Ipanema, na rua Bar\u00e3o da Torre, 145, no Rio de Janeiro / RJ, sua cidade natal, e depois foi transferido para outras unidades para tratamento, onde lutou at\u00e9 o fim. Um de seus \u00faltimos desejos era ter seu quadrinho de super-her\u00f3is FUNDA\u00c7\u00c2O AMALGAMA publicado pela nossa Editora.\nAos amigos e parceiros da 9\u00aa Arte, pedimos que colaborem com qualquer valor, mas n\u00e3o deixem de participar deste movimento de uni\u00e3o da categoria, em prol de um amigo t\u00e3o querido.\nTamb\u00e9m agradecemos que, dentro de suas cren\u00e7as, a todos que se intercederam por Carlos Macedo, o Cadu e pediram a Deus, com f\u00e9, por sua recupera\u00e7\u00e3o. Mas foi feita a vontade de nosso criador.\nCarlos Macedo - o nosso Cadu Artes - era quadrinista, videomaker e idealizador do supergrupo conhecido como Funda\u00e7\u00e3o Am\u00e1lgama , al\u00e9m do irreverente Fanito , o primeiro c\u00e3o antroporm\u00f3rfico a apresentar um canal no YouTube.\nCadu sempre foi uma pessoa muito alegre e prestativa, sempre disposta a ajudar aos outros... agora, chegou a nossa vez de homenagia-lo!\nA Meta e continuar com esta campanha por 6 meses.\nFa\u00e7a sua doa\u00e7\u00e3o. Divulgue para os seus amigos. Precisamos de toda ajuda poss\u00edvel... e precisamos AGORA!\nNossa meta \u00e9 arrecadarmos R$1.000,00 mensais . Mas, mesmo que n\u00e3o batamos a meta, independente do valor arrecadado, a soma ser\u00e1 mensalmente transferida para a esposa do Cadu.\nTudo ser\u00e1 feito com a devida presta\u00e7\u00e3o de contas, lembrando que 13% do valor arrecadado fica com a plataforma Catarse.\nAjude-nos a espalhar esta campanha pelas redes sociais!\nAten\u00e7\u00e3o: Importante ressaltar que a responsabilidade pela arrecada\u00e7\u00e3o ficou a cargo da Editora Kimera, dado \u00e0 situa\u00e7\u00e3o de fragilidade e cuidados exigidos \u00e0 esposa do nosso amigo. Mas, qualquer d\u00favida, estamos a disposi\u00e7\u00e3o para prestar os devidos esclarecimentos, em qualquer momento.\nPORTF\u00d3LIO DO CADU - Trabalhos j\u00e1 realizados\nQuadrinhos:\nAnima\u00e7\u00f5es:\nA EDI\u00c7\u00c3O DA CAMPANHA:\nESPECIFICA\u00c7\u00d5ES DA OBRA:\nIMPORTANTE:\nTodos os apoiadores (independentemente do valor de apoio) do projeto, ter\u00e3o seus nomes eternizados na edi\u00e7\u00e3o impressa dos quadrinhos in\u00e9ditos da FUNDA\u00c7\u00c3O AM\u00c1LGAMA, que sair\u00e1, ainda este ano, pela Editora Kimera.\nEnt\u00e3o, n\u00e3o perca tempo! Apoie agora mesmo!", "categoria_multirrotulo_lda": {"0": 0.4, "1": 0.0, "2": 0.0, "3": 0.4, "4": 0.2, "5": 0.0, "6": 0.2, "7": 0.4, "8": 0.4, "9": 0.0, "10": 0.0, "11": 0.2, "12": 0.0, "13": 0.2, "14": 0.0, "15": 0.2, "16": 0.2, "17": 0.0, "18": 0.0, "19": 0.2, "20": 0.2, "21": 0.0, "22": 0.2, "23": 0.0, "24": 0.0, "25": 0.2, "26": 0.0, "27": 0.4, "28": 0.2, "29": 0.0, "30": 0.2, "31": 0.2, "32": 0.0, "33": 0.0, "34": 0.0, "35": 0.2, "36": 0.0, "37": 0.0, "38": 0.2, "39": 0.0, "40": 0.0, "41": 0.4, "42": 0.2, "43": 0.0, "44": 0.0, "45": 0.4, "46": 0.0, "47": 0.0, "48": 0.0, "49": 0.0}, "categoria_entidades": ["enorme tristeza", "dire\u00e7\u00e3o", "colaboradores", "editora kimera", "dia 29 de abril pela manh\u00e3", "not\u00edcia do falecimento", "amigo quadrinista", "videomaker cadu", "cen\u00e1rios das hist\u00f3rias em quadrinhos", "anima\u00e7\u00f5es nacionais", "perda irrepar\u00e1vel", "legado deste grande artista", "tempo", "meio da impress\u00e3o", "revista em quadrinhos funda\u00e7\u00e3o am\u00e1lgama", "cria\u00e7\u00e3o", "cadu artes", "sentimentos", "fam\u00edlia", "vanderlei sadrack", "despedida de um grande amigo br", "homenagem ao super artista", "sineverso especial", "campanha", "quadrinistasamigos", "fundos", "despesas do funeral", "amigo cadu", "carlos macedo", "dif\u00edcil momento", "vida", "3 tumores no c\u00e9rebro", "amigo", "bra\u00e7os do pai eterno", "hospital quali ipanema", "rua bar\u00e3o da torre", "rio de janeiro", "rj", "cidade natal", "unidades para tratamento", "fim", "um", "\u00faltimos desejos", "quadrinho de super-her\u00f3is funda\u00e7\u00e2o amalgama", "editora", "amigos", "parceiros da 9\u00aa arte", "valor", "movimento de uni\u00e3o da categoria", "prol", "cren\u00e7as", "cadu", "deus", "f\u00e9", "recupera\u00e7\u00e3o", "vontade", "criador", "videomaker", "idealizador do supergrupo", "funda\u00e7\u00e3o am\u00e1lgama", "irreverente fanito", "primeiro c\u00e3o antroporm\u00f3rfico", "canal no youtube", "pessoa", "prestativa", "vez", "meta", "campanha por 6 meses", "doa\u00e7\u00e3o", "ajuda poss\u00edvel", "1.000,00 mensais", "soma", "esposa do cadu", "devida presta\u00e7\u00e3o de contas", "plataforma catarse", "campanha pelas redes sociais", "aten\u00e7\u00e3o", "responsabilidade pela arrecada\u00e7\u00e3o", "cargo da editora kimera", "situa\u00e7\u00e3o de fragilidade", "cuidados", "esposa", "d\u00favida", "disposi\u00e7\u00e3o", "devidos esclarecimentos", "momento", "portf\u00f3lio do cadu", "trabalhos", "quadrinhos", "anima\u00e7\u00f5es", "edi\u00e7\u00e3o da campanha", "especifica\u00e7\u00f5es da obra", "importante", "apoiadores", "valor de apoio", "projeto", "nomes", "edi\u00e7\u00e3o impressa dos quadrinhos in\u00e9ditos da funda\u00e7\u00e3o am\u00e1lgama", "ano"]}