{"origem": "catarse", "categoria_teste_mencoes": {"saloes_humor": false, "hqmix": false, "ccxp": false, "fiq": false, "angelo_agostini": false, "politica": false, "questoes_genero": false, "lgbtqiamais": true, "terror": true, "humor": false, "herois": false, "disputa": true, "ficcao_cientifica": false, "fantasia": false, "folclore": false, "zine": false, "webformatos": false, "erotismo": false, "religiosidade": true, "jogos": false, "midia_independente": false}, "recompensas_menor_nominal": 60.0, "recompensas_menor_ajustado": 63.58105232864424, "recompensas_quantidade": 1, "autoria_id": 188439, "autoria_nome": "leonardo melo", "autoria_nome_publico": "leonardo melo", "autoria_classificacao": "masculino", "autoria_classificacao_id": 3, "social_seguidores": 27, "social_newsletter": true, "social_sub_contribuicoes_amigos": true, "social_sub_novos_seguidores": true, "social_sub_posts_projeto": true, "social_projetos_contribuidos": 15, "social_projetos_publicados": 2, "geral_municipio": "Curitiba", "geral_uf": "PR", "geral_uf_br": "PR", "geral_city_id": 2882, "geral_content_rating": 1, "geral_contributed_by_friends": false, "geral_capa_imagem": false, "geral_capa_video": true, "geral_dias_campanha": 30, "geral_data_fim": "2023-07-17T02:59:59.999999", "geral_data_ini": "2023-06-16T11:14:49.473084", "geral_meta": 15000.0, "geral_meta_corrigida": 15895.26308216106, "geral_arrecadado": 2310.0, "geral_arrecadado_corrigido": 2447.8705146528036, "geral_percentual_arrecadado": 15.4, "geral_conteudo_adulto": false, "geral_posts": 1, "geral_project_id": 166363, "geral_modalidade": "flex", "geral_titulo": "Uma Moeda ou um Beijo", "geral_status": "successful", "geral_total_contribuicoes": 32, "geral_total_apoiadores": 32, "geral_sobre": "Uma Moeda ou um Beijo: A Hist\u00f3ria de Gilda\nQuem frequentava a Boca Maldita, em Curitiba, certamente se lembrar\u00e1 de Gilda, uma travesti que, ao mesmo tempo, aterrorizava e alegrava os transeuntes do centro da cidade, especialmente no Carnaval. Gilda, corajosa em se assumir em uma \u00e9poca conturbada, tem sua morte envolta em mist\u00e9rio. Assassinada? Cirrose? Overdose? Hipotermia? Ou os motivos de sua morte seriam muito mais... sombrios?\nViaje de volta \u00e0 Curitiba dos anos 80 para desvendar esse mist\u00e9rio e saber mais sobre uma das figuras mais carism\u00e1ticas que a Cidade das Arauc\u00e1rias j\u00e1 viu.\nA seguir trazemos alguns v\u00eddeos que foram gravados em 2019, durante a produ\u00e7\u00e3o da HQ, que d\u00e3o mais detalhes sobre o projeto. Nos v\u00eddeos, mencionamos o bar \"Gilda\", que na \u00e9poca ainda existia, mas infelizmente fechou as portas durante a pandemia.\nA ideia desse projeto de HQ \u00e9 misturar fato e fic\u00e7\u00e3o. Enquanto um detetive investiga a estranha morte de Gilda, somos apresentados a flashbacks sobre sua vida e vamos, pouco a pouco, descobrindo mais sobre sua hist\u00f3ria e diversos outros acontecimentos, que podem ou n\u00e3o ter a ver com sua morte.\nAutores consagrados\nUma Moeda ou um Beijo tem roteiro de Leonardo Melo e arte de Andr\u00e9 Caliman, a mesma dupla que trabalhou em Undeadman , no conto pulp Oz e na hist\u00f3ria de m\u00e1fia Sequestro em Tr\u00eas Buracos .\nCen\u00e1rios reais: Curitiba dos anos 80\nTodas as loca\u00e7\u00f5es utilizadas de refer\u00eancia s\u00e3o inspiradas em locais reais do centro de Curitiba, que certamente ir\u00e3o provocar a nostalgia de quem cresceu na capital paranaense e acompanhou sua transforma\u00e7\u00e3o.\nGilda: adorada e marginalizada\nComo n\u00e3o poderia deixar de ser, a HQ traz diversas passagens inspiradas em acontecimentos reais. Apesar de ser adorada por muita gente, Gilda era odiada por muitos outros, o que acabava fazendo com que se metesse em situa\u00e7\u00f5es bizarras.\nEssa \u00e9 uma HQ perfeita para quem quer se lembrar ou conhecer Gilda, saber mais sobre a vida de um morador de rua LGBT ou simplesmente apreciar uma bela hist\u00f3ria de detetive nos anos 80.\nVoc\u00ea pode apoiar simplesmente comprando o livro em pr\u00e9-venda ou aproveitar a oportunidade para conhecer tamb\u00e9m a cole\u00e7\u00e3o Cl\u00e1ssicos Revisitados, onde cl\u00e1ssicos da literatura s\u00e3o recontados de uma forma bizarra. Fazem parte das recompensas os volumes \"Hist\u00f3ria & Sci-fi\" e \"Cinema & HQ\".\nDesde j\u00e1 agradecemos pelo seu apoio!", "categoria_multirrotulo_lda": {"0": 0.2, "1": 0.0, "2": 0.4, "3": 0.4, "4": 0.4, "5": 0.0, "6": 0.4, "7": 0.2, "8": 0.0, "9": 0.4, "10": 0.2, "11": 0.4, "12": 0.4, "13": 0.0, "14": 0.0, "15": 0.4, "16": 0.2, "17": 0.0, "18": 0.2, "19": 0.2, "20": 0.0, "21": 0.4, "22": 0.6, "23": 0.4, "24": 0.0, "25": 0.2, "26": 0.0, "27": 0.6, "28": 0.2, "29": 0.0, "30": 0.6, "31": 0.0, "32": 0.2, "33": 0.0, "34": 0.2, "35": 0.4, "36": 0.2, "37": 0.2, "38": 0.4, "39": 0.0, "40": 0.2, "41": 0.2, "42": 0.4, "43": 0.2, "44": 0.0, "45": 0.4, "46": 0.0, "47": 0.2, "48": 0.2, "49": 0.0}, "categoria_entidades": ["moeda", "beijo", "a hist\u00f3ria de gilda", "boca maldita", "curitiba", "gilda", "travesti", "mesmo tempo", "transeuntes do centro da cidade", "carnaval", "corajosa", "\u00e9poca conturbada", "morte", "mist\u00e9rio", "cirrose", "overdose", "hipotermia", "motivos", "viaje de volta \u00e0 curitiba dos anos 80", "uma das figuras", "cidade das arauc\u00e1rias", "v\u00eddeos", "produ\u00e7\u00e3o da hq", "detalhes", "projeto", "bar", "\u00e9poca", "portas", "pandemia", "ideia desse projeto de hq", "fato", "fic\u00e7\u00e3o", "detetive", "estranha morte de gilda", "flashbacks", "vida", "hist\u00f3ria", "acontecimentos", "autores", "roteiro de leonardo melo", "arte de andr\u00e9 caliman", "mesma dupla", "undeadman", "conto pulp oz", "hist\u00f3ria de m\u00e1fia sequestro em tr\u00eas buracos", "cen\u00e1rios reais", "curitiba dos anos 80", "loca\u00e7\u00f5es", "refer\u00eancia", "locais reais do centro de curitiba", "nostalgia", "capital paranaense", "transforma\u00e7\u00e3o", "hq", "passagens", "acontecimentos reais", "gente", "situa\u00e7\u00f5es bizarras", "hq perfeita", "morador de rua lgbt", "bela hist\u00f3ria de detetive nos anos 80", "livro em pr\u00e9-venda", "oportunidade", "cole\u00e7\u00e3o cl\u00e1ssicos revisitados", "cl\u00e1ssicos da literatura", "forma bizarra", "parte das recompensas", "volumes", "sci-fi", "cinema", "apoio"]}