{"origem": "catarse", "categoria_teste_mencoes": {"saloes_humor": false, "hqmix": false, "ccxp": false, "fiq": false, "angelo_agostini": false, "politica": false, "questoes_genero": false, "lgbtqiamais": false, "terror": false, "humor": false, "herois": false, "disputa": false, "ficcao_cientifica": false, "fantasia": false, "folclore": true, "zine": true, "webformatos": false, "erotismo": false, "religiosidade": false, "jogos": false, "midia_independente": false}, "recompensas_menor_nominal": 95.0, "recompensas_menor_ajustado": 96.41293670416687, "recompensas_quantidade": 1, "autoria_id": 1222634, "autoria_nome": "ea damaia", "autoria_nome_publico": "ea damaia", "autoria_classificacao": "outros", "autoria_classificacao_id": 5, "social_seguidores": 22, "social_newsletter": false, "social_sub_contribuicoes_amigos": false, "social_sub_novos_seguidores": false, "social_sub_posts_projeto": false, "social_projetos_contribuidos": 11, "social_projetos_publicados": 1, "geral_municipio": "Guarulhos", "geral_uf": "SP", "geral_uf_br": "SP", "geral_city_id": 4924, "geral_content_rating": 1, "geral_contributed_by_friends": false, "geral_capa_imagem": false, "geral_capa_video": true, "geral_dias_campanha": 60, "geral_data_fim": "2024-10-05T02:59:59.999999", "geral_data_ini": "2024-08-05T13:34:45.101524", "geral_meta": 10000.0, "geral_meta_corrigida": 10148.730179385986, "geral_arrecadado": 14876.0, "geral_arrecadado_corrigido": 15097.251014854592, "geral_percentual_arrecadado": 148.76, "geral_conteudo_adulto": false, "geral_posts": 21, "geral_project_id": 176498, "geral_modalidade": "aon", "geral_titulo": "Lama", "geral_status": "successful", "geral_total_contribuicoes": 192, "geral_total_apoiadores": 190, "geral_sobre": "as primeiras 48 horas de campanha, todos os apoiadores que escolherem a recompensa a partir do Livro F\u00edsico ganhar\u00e3o um Bookplate exclusivo, numerado, assinado e impresso em papel especial !\nLama conta a hist\u00f3ria de uma fam\u00edlia que sofre um despejo s\u00fabito por conta de uma reintegra\u00e7\u00e3o de posse e se mudam para a casa da av\u00f3 em busca de um recome\u00e7o.\nInspirado em casos reais da luta dos moradores da Vila Oper\u00e1ria em Guarulhos contra a reintegra\u00e7\u00e3o de posse.  \u00c9 no apoio, afeto e organiza\u00e7\u00e3o social que Araci e sua fam\u00edlia conseguem aprender a lidar com a nova realidade.\nLama \u00e9 uma hist\u00f3ria em quadrinhos inspirada em casos reais do movimento de luta por moradia na Vila Oper\u00e1ria, em Guarulhos, regi\u00e3o metropolitana de S\u00e3o Paulo. Os moradores enfrentam a batalha contra as reintegra\u00e7\u00f5es de posse que ocorrem no territ\u00f3rio desde 2008.  A hist\u00f3ria resgata a mem\u00f3ria de luta da popula\u00e7\u00e3o de Guarulhos, trazendo a import\u00e2ncia da organiza\u00e7\u00e3o social e da troca que ocorre na vida em comunidade.\nO Catarse \u00e9 uma plataforma de financiamento coletivo (como uma vaquinha online) em que projetos se tornam realidade com sua ajuda! Em troca, voc\u00ea recebe recompensas de acordo com a op\u00e7\u00e3o de apoio que escolher. O modo de campanha deste projeto \u00e9 Tudo ou Nada, ou seja, caso o projeto n\u00e3o atinja a meta de 100% no prazo estipulado pela campanha, voc\u00ea recebe todo seu dinheiro de volta. A campanha fica aberta de 5 de agosto de 2024 at\u00e9 4 de Outubro e funcionar\u00e1 como pr\u00e9-venda do livro. Previs\u00e3o de lan\u00e7amento para outubro.\nComo apoiar?\nComiss\u00e3o digital personalizada - 25 vagas.\nExemplos: Retrato de rosto, com pet, corpo inteiro e cen\u00e1rio.\nComiss\u00e3o tradicional personalizada - 5 vagas .\nMateriais usados: guache, aquarela e l\u00e1pis de cor sobre papel.\nAs comiss\u00f5es ser\u00e3o entregues posteriormente, conforme o combinado do pedido. Os demais itens da recompensa ser\u00e3o enviados normalmente pelos correios.\nLucas Castro (Cucas) \u00e9 quadrinista e ilustrador de Osasco, SP, apaixonado por m\u00fasica, livros, animais e biologia. Atualmente, sua cabe\u00e7a est\u00e1 em hist\u00f3rias sobre o mar e caranguejos, sem nunca se afastar de quest\u00f5es raciais que influenciam sua produ\u00e7\u00e3o art\u00edstica. Em \u201cLama\u201d \u00e9 respons\u00e1vel pelas ilustra\u00e7\u00f5es e arte final.\ninstagram.com/cucaslastro\nEa Damaia \u00e9 artista visual transdisciplinar, designer gr\u00e1fico, ilustrador e quadrinista. Faz publica\u00e7\u00f5es independentes desde 2018, produzindo zines, quadrinhos, serigrafias e aquarelas. Amante de cores vibrantes, trata de temas como g\u00eanero, cria\u00e7\u00e3o de mundos e narrativas a partir de um olhar trans. Em \u201cLama\u201d \u00e9 respons\u00e1vel pelo roteiro, produ\u00e7\u00e3o cultural do projeto e design gr\u00e1fico.\ninstagram.com/eadamaia\nObserva\u00e7\u00f5es", "categoria_multirrotulo_lda": {"0": 0.2, "1": 0.0, "2": 0.2, "3": 0.0, "4": 0.2, "5": 0.0, "6": 0.0, "7": 0.2, "8": 0.0, "9": 0.4, "10": 0.2, "11": 0.4, "12": 0.0, "13": 0.0, "14": 0.0, "15": 0.0, "16": 0.0, "17": 0.0, "18": 0.2, "19": 0.2, "20": 0.0, "21": 0.4, "22": 0.6, "23": 0.2, "24": 0.0, "25": 0.2, "26": 0.0, "27": 0.2, "28": 0.2, "29": 0.0, "30": 0.6, "31": 0.0, "32": 0.2, "33": 0.0, "34": 0.0, "35": 0.2, "36": 0.0, "37": 0.2, "38": 0.2, "39": 0.2, "40": 0.0, "41": 0.2, "42": 0.4, "43": 0.0, "44": 0.0, "45": 0.2, "46": 0.0, "47": 0.0, "48": 0.0, "49": 0.0}, "categoria_entidades": ["primeiras 48 horas de campanha", "apoiadores", "recompensa", "livro f\u00edsico", "bookplate exclusivo", "papel especial", "lama", "hist\u00f3ria", "fam\u00edlia", "despejo s\u00fabito por conta", "reintegra\u00e7\u00e3o de posse", "casa da av\u00f3 em busca", "recome\u00e7o", "casos reais da luta dos moradores da vila oper\u00e1ria em guarulhos", "apoio", "afeto", "organiza\u00e7\u00e3o social", "araci", "nova realidade", "hist\u00f3ria em quadrinhos", "casos reais do movimento de luta por moradia na vila oper\u00e1ria", "guarulhos", "regi\u00e3o metropolitana de s\u00e3o paulo", "moradores", "batalha", "reintegra\u00e7\u00f5es de posse", "territ\u00f3rio desde 2008", "mem\u00f3ria de luta da popula\u00e7\u00e3o de guarulhos", "import\u00e2ncia da organiza\u00e7\u00e3o social", "troca", "vida em comunidade", "catarse", "plataforma de financiamento coletivo", "vaquinha", "projetos", "realidade", "ajuda", "recompensas de acordo", "op\u00e7\u00e3o de apoio", "modo de campanha deste projeto", "projeto", "meta de 100", "prazo", "campanha", "dinheiro de volta", "aberta de 5 de agosto de 2024 at\u00e9 4 de outubro", "pr\u00e9-venda do livro", "previs\u00e3o de lan\u00e7amento para outubro", "comiss\u00e3o digital", "25 vagas", "exemplos", "retrato de rosto", "pet", "corpo inteiro", "cen\u00e1rio", "comiss\u00e3o tradicional", "5 vagas", "materiais", "guache", "aquarela", "l\u00e1pis de cor sobre papel", "comiss\u00f5es", "combinado do pedido", "itens da recompensa", "correios", "lucas castro", "cucas", "ilustrador de osasco", "sp", "m\u00fasica", "livros", "animais", "biologia", "cabe\u00e7a", "hist\u00f3rias", "mar", "caranguejos", "quest\u00f5es raciais", "produ\u00e7\u00e3o art\u00edstica", "respons\u00e1vel pelas ilustra\u00e7\u00f5es", "arte final", "instagram.com/cucaslastro", "ea damaia", "artista visual transdisciplinar", "designer gr\u00e1fico", "ilustrador", "publica\u00e7\u00f5es independentes desde 2018", "zines", "quadrinhos", "serigrafias", "aquarelas", "amante de cores vibrantes", "temas como g\u00eanero", "cria\u00e7\u00e3o de mundos", "narrativas a partir", "olhar trans", "respons\u00e1vel pelo roteiro", "produ\u00e7\u00e3o cultural do projeto", "design gr\u00e1fico", "instagram.com/eadamaia", "observa\u00e7\u00f5es"]}