{"origem": "catarse", "categoria_teste_mencoes": {"saloes_humor": false, "hqmix": false, "ccxp": false, "fiq": false, "angelo_agostini": false, "politica": false, "questoes_genero": false, "lgbtqiamais": false, "terror": true, "humor": false, "herois": false, "disputa": false, "ficcao_cientifica": true, "fantasia": false, "folclore": false, "zine": true, "webformatos": false, "erotismo": true, "religiosidade": true, "jogos": false, "midia_independente": false}, "recompensas_menor_nominal": 434.0, "recompensas_menor_ajustado": 447.9928830791576, "recompensas_quantidade": 1, "autoria_id": 1322422, "autoria_nome": "zarabatana books", "autoria_nome_publico": "zarabatana books", "autoria_classificacao": "empresa", "autoria_classificacao_id": 1, "social_seguidores": 415, "social_newsletter": false, "social_sub_contribuicoes_amigos": true, "social_sub_novos_seguidores": false, "social_sub_posts_projeto": false, "social_projetos_contribuidos": 9, "social_projetos_publicados": 12, "geral_municipio": "Campinas", "geral_uf": "SP", "geral_uf_br": "SP", "geral_city_id": 4818, "geral_content_rating": 18, "geral_contributed_by_friends": false, "geral_capa_imagem": false, "geral_capa_video": true, "geral_dias_campanha": 40, "geral_data_fim": "2024-04-29T02:59:59.999999", "geral_data_ini": "2024-03-19T21:41:22.210924", "geral_meta": 12000.0, "geral_meta_corrigida": 12386.899992972101, "geral_arrecadado": 3200.0, "geral_arrecadado_corrigido": 3303.1733314592266, "geral_percentual_arrecadado": 26.666666666666668, "geral_conteudo_adulto": true, "geral_posts": 3, "geral_project_id": 176799, "geral_modalidade": "flex", "geral_titulo": "Erzs\u00e9bet", "geral_status": "successful", "geral_total_contribuicoes": 22, "geral_total_apoiadores": 21, "geral_sobre": "Nova oportunidade de adquirir a incr\u00edvel HQ Erzs\u00e9bet, do quadrinista portugu\u00eas Nunsky. O livro estava esgotado e recebe agora uma edi\u00e7\u00e3o capa dura pela Zarabatana.\nErzs\u00e9bet B\u00e1thory, a infame condessa h\u00fangara contempor\u00e2nea de Shakespeare, ao contr\u00e1rio deste, incarnou como poucos o lado negro e animalesco do ser humano. Atribuem a Erzs\u00e9bet centenas de crimes inomin\u00e1veis \u2013 e por isso ficou conhecida como Tigresa de Csejthe e Condessa Sanguin\u00e1ria \u2013 que a colocaram no mesmo lend\u00e1rio patamar de Gilles de Rais e Vlad, o Empalador. Por detr\u00e1s de seu rosto p\u00e1lido, de olhar impass\u00edvel e melanc\u00f3lico, ocultava-se o pr\u00f3prio dem\u00f4nio, \u00d6rd\u00f6g. Em Erzs\u00e9bet , o quadrinista portugu\u00eas Nunsky recria com maestria a vida sombria desta personagem misteriosa e assustadora.\nZarabatana Books - Erzs\u00e9bet Formato: 16,6 x 23,6 cm Capa Dura: 4 cores Miolo: 144 p\u00e1gs. papel Alta Alvura 120g/m\u00b2, 1 x 1 cor (preto) Acabamento: Lamina\u00e7\u00e3o Fosca com Verniz UV reserva, Livro Costurado\nMeta: R$ 12.000,00 - Flex Prazo da campanha: 40 dias Prazo para in\u00edcio da entrega dos livros: Junho 2024 Envio: somente para o Brasil. Campanha de curta dura\u00e7\u00e3o. Entrega garantida. [+18] Aconselh\u00e1vel para adultos Veja aqui as p\u00e1ginas de Erzs\u00e9bet:\nNunsky (1972) \u00e9 um autor do norte de Portugal que em 1997 participou do zine Mesinha de Cabeceira, editado pela Associa\u00e7\u00e3o Chili Com Carne. Desenhou todo o n\u00famero 13, uma edi\u00e7\u00e3o comemorativa dos 5 anos de exist\u00eancia da publica\u00e7\u00e3o. A hist\u00f3ria em quadrinhos, intitulada 88, pode ser considerada \u00fanica no panorama portugu\u00eas da \u00e9poca , mas tamb\u00e9m nos dias de hoje, pela tem\u00e1tica psycho-goth e pela qualidade gr\u00e1fica que lembra Love & Rockets e os quadrinhos de Charles Burns. Desde ent\u00e3o o autor esteve afastado das HQs, preferindo tornar-se vocalista da banda The ID\u2019s , cujo destino \u00e9 desconhecido. Nunsky foi um cometa na HQ underground portuguesa e, como sabemos, alguns cometas costumam regressar passado muito tempo... Em 2014 o autor reapareceu com a graphic novel Erzs\u00e9bet , editada em Portugal pela Chili Com Carne, onde em cerca de 140 p\u00e1ginas registra a brutalidade de Erzs\u00e9bet B\u00e1thory, a infame condessa h\u00fangara acusada de assassinar centenas de jovens na busca pela eterna juventude. O livro ganhou o pr\u00eamio de Melhor Desenho no Festival de BD de Amadora em 2015. Em 2015 Nunsky apresentou-nos Nadja - Ninfeta Virgem do Inferno , verdadeiro deboche gr\u00e1fico para f\u00e3s dist\u00f3picos do RanXerox e, em 2016, Espero Chegar Em Breve , baseada em um conto de Philip K. Dick. Seu \u00faltimo trabalho \u00e9 a HQ Companheiros da Penumbra , focada na cena g\u00f3tica em Portugal nos anos 1990.\nMarcador de P\u00e1gina exclusivo em todos os apoios.\nDr\u00e1cula : Conhe\u00e7a tamb\u00e9m este outro t\u00edtulo da Zarabatana Books que traz uma colet\u00e2nea de HQs do mestre Rodolfo Zalla sobre o famoso conde. Formato 16 x 23 cm, P&B, 128 p\u00e1ginas.", "categoria_multirrotulo_lda": {"0": 0.4, "1": 0.0, "2": 0.2, "3": 0.2, "4": 0.2, "5": 0.4, "6": 0.2, "7": 0.0, "8": 0.0, "9": 0.0, "10": 0.2, "11": 0.4, "12": 0.6, "13": 0.0, "14": 0.0, "15": 0.2, "16": 0.2, "17": 0.0, "18": 0.0, "19": 0.0, "20": 0.0, "21": 0.0, "22": 0.2, "23": 0.2, "24": 0.0, "25": 0.2, "26": 0.0, "27": 0.6, "28": 0.0, "29": 0.2, "30": 0.4, "31": 0.2, "32": 0.0, "33": 0.0, "34": 0.2, "35": 0.2, "36": 0.2, "37": 0.0, "38": 0.2, "39": 0.0, "40": 0.2, "41": 0.2, "42": 0.2, "43": 0.0, "44": 0.0, "45": 0.4, "46": 0.0, "47": 0.2, "48": 0.2, "49": 0.0}, "categoria_entidades": ["nova oportunidade", "incr\u00edvel hq erzs\u00e9bet", "quadrinista portugu\u00eas nunsky", "livro", "edi\u00e7\u00e3o capa dura pela zarabatana", "erzs\u00e9bet b\u00e1thory", "infame condessa h\u00fangara contempor\u00e2nea de shakespeare", "contr\u00e1rio", "lado negro", "animalesco do ser humano", "erzs\u00e9bet centenas de crimes inomin\u00e1veis", "conhecida como tigresa de csejthe", "condessa sanguin\u00e1ria", "mesmo lend\u00e1rio patamar de gilles de rais", "vlad", "empalador", "rosto p\u00e1lido", "olhar impass\u00edvel", "dem\u00f4nio", "\u00f6rd\u00f6g", "erzs\u00e9bet", "maestria", "vida sombria desta personagem misteriosa", "zarabatana books", "erzs\u00e9bet formato", "16,6 x 23,6 cm capa dura", "4 cores miolo", "144 p\u00e1gs", "papel alta alvura 120g", "m\u00b2", "1 x 1 cor", "acabamento", "lamina\u00e7\u00e3o fosca com verniz uv reserva", "livro costurado", "meta", "flex prazo da campanha", "40 dias prazo para in\u00edcio da entrega dos livros", "junho 2024 envio", "brasil", "campanha de curta dura\u00e7\u00e3o", "entrega", "+18", "aconselh\u00e1vel para adultos veja", "p\u00e1ginas de erzs\u00e9bet", "nunsky", "autor do norte de portugal", "zine mesinha de cabeceira", "associa\u00e7\u00e3o chili com carne", "n\u00famero 13", "edi\u00e7\u00e3o comemorativa dos 5 anos de exist\u00eancia da publica\u00e7\u00e3o", "hist\u00f3ria em quadrinhos", "\u00fanica no panorama portugu\u00eas da \u00e9poca", "dias", "tem\u00e1tica psycho-goth", "qualidade gr\u00e1fica", "love", "rockets", "quadrinhos de charles burns", "ent\u00e3o", "autor", "hqs", "vocalista da banda the id \u2019s", "destino", "hq underground portuguesa", "cometas", "tempo", "graphic", "portugal pela chili com carne", "140 p\u00e1ginas", "brutalidade de erzs\u00e9bet b\u00e1thory", "infame condessa h\u00fangara", "centenas de jovens na busca pela eterna juventude", "pr\u00eamio de melhor desenho no festival de bd de amadora em 2015", "2015 nunsky", "nadja", "ninfeta virgem do inferno", "verdadeiro deboche gr\u00e1fico para f\u00e3s dist\u00f3picos do ranxerox", "breve", "conto de philip k. dick", "\u00faltimo trabalho", "hq companheiros da penumbra", "cena g\u00f3tica em portugal nos anos 1990", "marcador de p\u00e1gina exclusivo", "apoios", "dr\u00e1cula", "t\u00edtulo da zarabatana books", "colet\u00e2nea de hqs do mestre rodolfo zalla", "famoso conde", "formato 16 x 23 cm", "p&b", "128 p\u00e1ginas"]}