{"origem": "catarse", "categoria_teste_mencoes": {"saloes_humor": false, "hqmix": false, "ccxp": false, "fiq": false, "angelo_agostini": false, "politica": false, "questoes_genero": false, "lgbtqiamais": false, "terror": false, "humor": false, "herois": false, "disputa": true, "ficcao_cientifica": false, "fantasia": false, "folclore": false, "zine": false, "webformatos": false, "erotismo": false, "religiosidade": false, "jogos": false, "midia_independente": false}, "recompensas_menor_nominal": 20.0, "recompensas_menor_ajustado": 20.52767293595327, "recompensas_quantidade": 1, "autoria_id": 2081262, "autoria_nome": "miguel lokia", "autoria_nome_publico": "miguel lokia", "autoria_classificacao": "masculino", "autoria_classificacao_id": 3, "social_seguidores": 102, "social_newsletter": false, "social_sub_contribuicoes_amigos": true, "social_sub_novos_seguidores": true, "social_sub_posts_projeto": true, "social_projetos_contribuidos": 0, "social_projetos_publicados": 2, "geral_municipio": "S\u00e3o Paulo", "geral_uf": "SP", "geral_uf_br": "SP", "geral_city_id": 5274, "geral_content_rating": 1, "geral_contributed_by_friends": false, "geral_capa_imagem": true, "geral_capa_video": true, "geral_dias_campanha": null, "geral_data_fim": null, "geral_data_ini": "2024-05-01T13:00:24.095137", "geral_meta": null, "geral_meta_corrigida": null, "geral_arrecadado": 0, "geral_arrecadado_corrigido": 0.0, "geral_percentual_arrecadado": 0.0, "geral_conteudo_adulto": false, "geral_posts": 17, "geral_project_id": 176985, "geral_modalidade": "sub", "geral_titulo": "Fam\u00edlia Lokia", "geral_status": "successful", "geral_total_contribuicoes": 0, "geral_total_apoiadores": 0, "geral_sobre": "SUPER SAGA: MEMBROS DA FAM\u00cdLIA LOKIA\nMuito obrigado por terem participado desse financiamento recorrente com a gente! Precisei encerrar para me dedicar \u00e0 outros projetos que a Fam\u00edlia Lokia ajudou a realizar. Em breve teremos novidades e vale lembrar que, como prometido, quem fez parte da Fam\u00edlia Lokia a partir do n\u00edvel C\u00f3smico e apoiou o financiamento do livro Super Saga , ter\u00e1 FRETE GR\u00c1TIS . A gente se v\u00ea na pr\u00f3xima!\n--------------------------------------------------------\nOl\u00e1! Como vai? Tudo bem? Eu sou Miguel Lokia e a Fam\u00edlia Lokia aqui no Catarse \u00e9 um projeto de financiamento recorrente que tem como proposta me aproximar de voc\u00eas que acompanham meu trabalho. Com o seu apoio, vou poder oferecer conte\u00fados exclusivo s , trazer voc\u00eas mais pra perto e, ainda, presente\u00e1-los .\nE o nome n\u00e3o foi escolhido \u00e0 toa. Este \u00e9 um passo importante para caminhadas audaciosas na minha vida e .\nJ\u00e1 faz alguns anos que eu vivo s\u00f3 de internet e se engana quem acha que n\u00e3o \u00e9 rala\u00e7\u00e3o di\u00e1ria. No entanto, para expandir conte\u00fados e me jogar em novos projetos , eu precisaria realizar investimentos al\u00e9m dos habituais. E quem me acompanha j\u00e1 sabe que estou sempre procurando inovar e trazer novas abordagens para as minhas produ\u00e7\u00f5es, certo?\nPor isso, criamos este financiamento recorrente com diferentes modalidades de recompensas para todos os bolsos e interesses e escolhi o Catarse para isso pois \u00e9 uma ferramenta extremamente confi\u00e1vel.\nOs parceiros proporcionam qualidade nas recompensas que entregamos para os apoiadores. A lista poder\u00e1 ser alterada mensalmente e, ainda, tendo a possibilidade de novos entrarem. Sente o peso dos nos nossos parceiros atualmente que ir\u00e3o fornecer cupom de desconto, al\u00e9m de quadrinhos e action figures para os sorteios:\nPelo seu apoio voc\u00ea receber\u00e1 recompensas ! Aqui voc\u00ea encontrar\u00e1  dispon\u00edveis com descri\u00e7\u00f5es e valores diferentes.\nOnde ser\u00e3o realizados os sorteios? Os sorteios ser\u00e3o realizados em uma live no YouTube sorteando apenas os apoiadores PLANET\u00c1RIO , C\u00d3SMICO , EXTRADIMENSIONAL e ONISCIENTE . O v\u00eddeo ficar\u00e1 dispon\u00edvel no canal e os sorteados receber\u00e3o um e-mail de confirma\u00e7\u00e3o.\nComo ser\u00e3o as lives? As lives ser\u00e3o feitas no YouTube e apenas os apoiadores de n\u00edvel C\u00d3SMICOS , EXTRADIMENSIONAL e ONISCIENTE poder\u00e3o assistir ao vivo participando nos coment\u00e1rios. O link para o v\u00eddeo ser\u00e1 enviado para voc\u00eas por e-mail de forma antecipada , sendo as lives realizadas sempre na primeira sexta do m\u00eas ap\u00f3s o financiamento. A live ser\u00e1 disponibilizada posteriormente no canal do YouTube .\n* Quando necess\u00e1rio, a data pode ser alterada mediante ocorr\u00eancias n\u00e3o previstas.\nComo ser\u00e3o feitas as enquetes e vota\u00e7\u00f5es? Esta intera\u00e7\u00e3o ser\u00e1 realizada nos \u201camigos pr\u00f3ximos\u201d do Instagram para decidir quest\u00f5es como ideias e escolhas de temas que v\u00e3o entrar no canal.\nQuando serei adicionado aos amigos pr\u00f3ximos? A inclus\u00e3o nos \"amigos pr\u00f3ximos\" do Instagram ir\u00e1 ocorrer sempre \u00e0s segundas-feiras. Ou seja, \u00e9 necess\u00e1rio aguardar a pr\u00f3xima segunda ap\u00f3s ter realizado o seu apoio. \u00c9 importante que os apoiadores respondam o formul\u00e1rio enviado por e-mail para que seja indicado o perfil do Instagram que ser\u00e1 adicionado.\nComo ser\u00e3o oferecidos os descontos? Os descontos ser\u00e3o de lojas, editoras e similares parceiras da Fam\u00edlia Lokia . Estes descontos podem variar em % e/ou valor e podemos ter altern\u00e2ncia de parceiros ao longo do tempo e s\u00e3o de total responsabilidade dos parceiros em quest\u00e3o.\nComo ser\u00e1 feita a participa\u00e7\u00e3o em v\u00eddeo? Voc\u00ea poder\u00e1 enviar um v\u00eddeo respondendo a algum questionamento ou com alguma mensagem previamente escolhida seguindo as diretrizes enviadas pela equipe Miguel Lokia. Este v\u00eddeo ser\u00e1 editado e incorporado a algum v\u00eddeo lan\u00e7ado no canal do YouTube .", "categoria_multirrotulo_lda": {"0": 0.4, "1": 0.0, "2": 0.2, "3": 0.4, "4": 0.2, "5": 0.0, "6": 0.8, "7": 0.0, "8": 0.4, "9": 0.0, "10": 0.2, "11": 0.2, "12": 0.8, "13": 0.0, "14": 0.0, "15": 0.4, "16": 0.6, "17": 0.0, "18": 0.0, "19": 0.0, "20": 0.2, "21": 0.0, "22": 0.2, "23": 0.2, "24": 0.0, "25": 0.2, "26": 0.0, "27": 0.4, "28": 0.2, "29": 0.0, "30": 0.4, "31": 0.2, "32": 0.0, "33": 0.0, "34": 0.2, "35": 0.4, "36": 0.2, "37": 0.0, "38": 0.6, "39": 0.0, "40": 0.2, "41": 0.4, "42": 0.4, "43": 0.2, "44": 0.0, "45": 0.2, "46": 0.0, "47": 0.0, "48": 0.4, "49": 0.0}, "categoria_entidades": ["super saga", "membros da fam\u00edlia lokia", "financiamento recorrente", "projetos", "fam\u00edlia lokia", "breve", "novidades", "parte da fam\u00edlia lokia", "n\u00edvel c\u00f3smico", "financiamento do livro super saga", "frete gr\u00e1tis", "gente", "pr\u00f3xima", "miguel lokia", "catarse", "projeto de financiamento recorrente", "proposta", "voc\u00eas", "trabalho", "apoio", "conte\u00fados exclusivo s", "perto", "nome", "toa", "passo importante para caminhadas audaciosas", "vida", "anos", "internet", "rala\u00e7\u00e3o di\u00e1ria", "entanto", "conte\u00fados", "novos projetos", "investimentos", "habituais", "novas abordagens", "produ\u00e7\u00f5es", "modalidades de recompensas", "bolsos", "interesses", "ferramenta", "parceiros", "qualidade nas recompensas", "apoiadores", "lista", "possibilidade de novos", "peso", "cupom de desconto", "quadrinhos", "action figures", "sorteios", "recompensas", "dispon\u00edveis com descri\u00e7\u00f5es", "valores diferentes", "live no youtube", "c\u00f3smico", "extradimensional", "onisciente", "v\u00eddeo", "dispon\u00edvel no canal", "e-mail de confirma\u00e7\u00e3o", "lives", "youtube", "apoiadores de n\u00edvel c\u00f3smicos", "vivo", "coment\u00e1rios", "link", "e-mail de forma", "primeira sexta do m\u00eas", "financiamento", "live", "canal do youtube", "data", "ocorr\u00eancias", "enquetes", "vota\u00e7\u00f5es", "intera\u00e7\u00e3o", "amigos pr\u00f3ximos", "instagram", "quest\u00f5es como ideias", "escolhas de temas", "canal", "inclus\u00e3o", "segundas-feiras", "pr\u00f3xima segunda", "formul\u00e1rio", "e-mail", "perfil do instagram", "descontos", "lojas", "editoras", "similares parceiras da fam\u00edlia lokia", "valor", "altern\u00e2ncia de parceiros ao longo do tempo", "total responsabilidade dos parceiros em quest\u00e3o", "participa\u00e7\u00e3o em v\u00eddeo", "questionamento", "mensagem", "diretrizes", "equipe miguel lokia"]}