{"origem": "catarse", "categoria_teste_mencoes": {"saloes_humor": false, "hqmix": true, "ccxp": true, "fiq": false, "angelo_agostini": true, "politica": false, "questoes_genero": false, "lgbtqiamais": false, "terror": false, "humor": true, "herois": false, "disputa": false, "ficcao_cientifica": false, "fantasia": false, "folclore": false, "zine": false, "webformatos": false, "erotismo": false, "religiosidade": false, "jogos": false, "midia_independente": true}, "recompensas_menor_nominal": 200.0, "recompensas_menor_ajustado": 201.23998369557566, "recompensas_quantidade": 1, "autoria_id": 25990, "autoria_nome": "rodrigo de arruda carvalho freitas", "autoria_nome_publico": "digo freitas", "autoria_classificacao": "masculino", "autoria_classificacao_id": 3, "social_seguidores": 213, "social_newsletter": false, "social_sub_contribuicoes_amigos": false, "social_sub_novos_seguidores": true, "social_sub_posts_projeto": true, "social_projetos_contribuidos": 202, "social_projetos_publicados": 6, "geral_municipio": "Campinas", "geral_uf": "SP", "geral_uf_br": "SP", "geral_city_id": 4818, "geral_content_rating": 1, "geral_contributed_by_friends": false, "geral_capa_imagem": false, "geral_capa_video": true, "geral_dias_campanha": 30, "geral_data_fim": "2024-12-14T02:59:59.999999", "geral_data_ini": "2024-11-13T10:49:36.044299", "geral_meta": 1000.0, "geral_meta_corrigida": 1006.1999184778783, "geral_arrecadado": 4180.0, "geral_arrecadado_corrigido": 4205.915659237531, "geral_percentual_arrecadado": 418.0, "geral_conteudo_adulto": false, "geral_posts": 5, "geral_project_id": 184725, "geral_modalidade": "flex", "geral_titulo": "Receitas para Fingir que Sabe Confeitar", "geral_status": "successful", "geral_total_contribuicoes": 60, "geral_total_apoiadores": 59, "geral_sobre": "Receitas para Fingir que Sabe Confeitar \u00e9 uma colet\u00e2nea de hist\u00f3rias em quadrinhos recheada de receitas. Ou um livro de receitas recheado de quadrinhos. Como preferir.\nHavia um prazo e um objetivo: em 2023, eu precisava lan\u00e7ar uma nova hist\u00f3ria em quadrinhos.\nClaro, j\u00e1 sabia que seria uma colet\u00e2nea de tirinhas da minha s\u00e9rie Minha Vida de C\u00e3o ,  mas eu buscava um tema, um conceito. Olhando tudo que fiz com os personagens desde  2018, percebi um padr\u00e3o: muitas tirinhas sobre cozinhar. Muitas. Foi a\u00ed  que, no ano passado (2023), lancei um livro de receitas expandindo esse  conceito de cozinha e quadrinhos: Receitas para Fingir que Sabe Cozinhar . A primeira ideia deu muito certo, muitos leitores felizes, ent\u00e3o por que n\u00e3o fazer mais e melhor? Agora, s\u00f3 receitas doces!\nTodas as 20 receitas doces deste  novo livro foram selecionadas entre as minhas favoritas, simplificadas e  ilustradas com carinho. Al\u00e9m das receitas nas p\u00e1ginas \u00edmpares,  acompanhas de uma tirinha de humor, nas p\u00e1ginas pares entram tirinhas sobre o mundo da cozinha, da confeitaria e afins.\nEspecifica\u00e7\u00f5es do livro:\nPrazo e entregas\nO livro ser\u00e1 lan\u00e7ado em dezembro de 2024 na CCXP. Todos que desejarem poder\u00e3o retirar suas recompensas no evento, por\u00e9m n\u00e3o haver\u00e1 recompensa sem frete nesta campanha. Os envios para os apoiadores ser\u00e3o feitos apenas ap\u00f3s o fim do evento e da campanha.\nO autor\nOl\u00e1! Eu sou o Digo Freitas , quadrinista de Campinas/SP que produz tirinhas e hist\u00f3rias em quadrinhos desde 2010. J\u00e1 fui cinco vezes indicado ao Trof\u00e9u HQMIX e uma vez indicado ao Trof\u00e9u Angelo Agostini. Tenho mais de 1.200 tirinhas publicadas em meu site, dezenas delas publicadas em livros did\u00e1ticos das maiores editoras do Brasil. Atualmente, produzo a s\u00e9rie de tirinhas de humor autobiogr\u00e1ficas Minha Vida de C\u00e3o, que alcan\u00e7a milhares de pessoas nas redes sociais.\nConfira o meu Instagram para conhecer minhas tirinhas!\nOu confira meu site .\nEsta \u00e9 a minha quinta campanha aqui no Catarse , no qual financio meus projetos desde 2016. Qualquer d\u00favida, confira no meu perfil todas as minhas campanhas anteriores!", "categoria_multirrotulo_lda": {"0": 0.2, "1": 0.2, "2": 0.2, "3": 0.0, "4": 0.4, "5": 0.4, "6": 0.2, "7": 0.0, "8": 0.2, "9": 0.2, "10": 0.0, "11": 0.4, "12": 0.0, "13": 0.0, "14": 0.2, "15": 0.0, "16": 0.4, "17": 0.0, "18": 0.0, "19": 0.0, "20": 0.4, "21": 0.0, "22": 0.0, "23": 0.0, "24": 0.0, "25": 0.0, "26": 0.0, "27": 0.2, "28": 0.0, "29": 0.2, "30": 0.2, "31": 0.0, "32": 0.0, "33": 0.0, "34": 0.0, "35": 0.2, "36": 0.2, "37": 0.0, "38": 0.0, "39": 0.0, "40": 0.2, "41": 0.0, "42": 0.2, "43": 0.2, "44": 0.0, "45": 0.4, "46": 0.0, "47": 0.0, "48": 0.4, "49": 0.4}, "categoria_entidades": ["receitas", "confeitar", "colet\u00e2nea de hist\u00f3rias em quadrinhos", "livro de receitas", "quadrinhos", "prazo", "objetivo", "nova hist\u00f3ria em quadrinhos", "colet\u00e2nea de tirinhas", "s\u00e9rie minha vida de c\u00e3o", "tema", "conceito", "personagens", "padr\u00e3o", "tirinhas", "ano passado", "conceito de cozinha", "cozinhar", "primeira ideia", "leitores felizes", "receitas doces", "20 receitas doces", "novo livro", "favoritas", "carinho", "receitas nas p\u00e1ginas \u00edmpares", "tirinha de humor", "p\u00e1ginas pares", "mundo da cozinha", "confeitaria", "especifica\u00e7\u00f5es do livro", "entregas", "livro", "dezembro de 2024 na ccxp", "recompensas no evento", "recompensa sem frete nesta campanha", "envios", "apoiadores", "fim do evento", "campanha", "autor", "digo freitas", "quadrinista de campinas", "sp", "hist\u00f3rias em quadrinhos desde 2010", "cinco vezes", "trof\u00e9u hqmix", "vez", "trof\u00e9u angelo agostini", "1.200 tirinhas", "site", "livros did\u00e1ticos das maiores editoras do brasil", "s\u00e9rie de tirinhas de humor autobiogr\u00e1ficas minha vida de c\u00e3o", "milhares de pessoas nas redes sociais", "instagram", "quinta campanha", "catarse", "projetos desde 2016", "d\u00favida", "perfil", "campanhas anteriores"]}