{"origem": "catarse", "categoria_teste_mencoes": {"saloes_humor": false, "hqmix": false, "ccxp": false, "fiq": false, "angelo_agostini": false, "politica": false, "questoes_genero": false, "lgbtqiamais": false, "terror": false, "humor": false, "herois": true, "disputa": true, "ficcao_cientifica": false, "fantasia": false, "folclore": false, "zine": false, "webformatos": false, "erotismo": false, "religiosidade": true, "jogos": false, "midia_independente": false}, "recompensas_menor_nominal": 15.0, "recompensas_menor_ajustado": 24.137778448661, "recompensas_quantidade": 1, "autoria_id": 16084, "autoria_nome": "alan souza dos santos", "autoria_nome_publico": "alan yango", "autoria_classificacao": "masculino", "autoria_classificacao_id": 3, "social_seguidores": 57, "social_newsletter": false, "social_sub_contribuicoes_amigos": false, "social_sub_novos_seguidores": true, "social_sub_posts_projeto": true, "social_projetos_contribuidos": 9, "social_projetos_publicados": 3, "geral_municipio": "Bel\u00e9m", "geral_uf": "PA", "geral_uf_br": "PA", "geral_city_id": 2440, "geral_content_rating": 1, "geral_contributed_by_friends": false, "geral_capa_imagem": false, "geral_capa_video": true, "geral_dias_campanha": 60, "geral_data_fim": "2016-01-10T01:59:59.999999", "geral_data_ini": "2015-11-10T17:53:24.917563", "geral_meta": 7000.0, "geral_meta_corrigida": 11264.296609375133, "geral_arrecadado": 430.0, "geral_arrecadado_corrigido": 691.9496488616153, "geral_percentual_arrecadado": 6.142857142857143, "geral_conteudo_adulto": false, "geral_posts": 0, "geral_project_id": 21649, "geral_modalidade": "aon", "geral_titulo": "O PODEROSO MAXIMUS N\u00ba 5", "geral_status": "failed", "geral_total_contribuicoes": 12, "geral_total_apoiadores": 12, "geral_sobre": "SOBRE O MAXIMUS\nO heroi \u00e9 na verdade o jovem professor de Literatura Brasileira Max Marins , que de posse do Medalh\u00e3o do Sol , artefato m\u00edstico encontrado por seu irm\u00e3o arque\u00f3logo Bruno Marins , \u00e9 agraciado por poderes extraordin\u00e1rios.\nCriado por Alan Yango em 1999, Maximus \u00e9 um heroi cujas hist\u00f3rias em quadrinhos s\u00e3o totalmente produzidas por artistas paraenses, visando fortalecer a arte dos quadrinhos na regi\u00e3o e servir de vitrine para os artistas que est\u00e3o entrando nesse mercado.\nEdi\u00e7\u00f5es anteriores.\nO Poderoso Maximus N\u00ba 1 (PDF)\nSOBRE A REVISTA\nA revista O PODEROSO MAXIMUS come\u00e7ou a ser publicada de forma independente em janeiro de 2011. tendo chegado a 4 edi\u00e7\u00f5es nos \u00faltimos anos.\nA inten\u00e7\u00e3o de trazer o projeto da edi\u00e7\u00e3o 5 para o Catarse foi tanto para superar as dificuldades de publica\u00e7\u00e3o, que toda revista independente enfrenta, como para dar-lhe maior alcance entre o p\u00fablico leitor, pois a plataforma de financiamento coletivo, por si s\u00f3, j\u00e1 d\u00e1 uma grande visibilidade aos projetos nela expostos.\nArte da capa por Joe Bennett , que estampar\u00e1 o p\u00f4ster e a camisa.\nO PODEROSO MAXIMUS N\u00ba 5\nG\u00eanero: super-heroi.\nCapa couch\u00e9, em cores, miolo em P&B\nFormato 17 x 26 cm\n36 p\u00e1ginas\nArte da capa: Joe Bennet, M\u00e1rcio Loerzer e Fernando Carvalho.\n- Maximus: Interven\u00e7\u00e3o (Roteiro: Alan Yango; arte: Fl\u00e1vio Rodrigues);\n- Maximus: A Amea\u00e7a de Kalymah (Roteiro: Alan Yango; arte M\u00e1rcio Loerzer)\n- Extensor: Breve Origem (Roteiro: Alan Yango; arte: F\u00e1bio Nahon, Alexandre Nascimento e M\u00e1rcio Loerzer).\n- Sepulcro: O Sacrif\u00edcio (Roteiro: Alan Yango; Arte: Emmanuel Thomaz)\n- Ca\u00e7ador Urbano: Sequestro (Roteiro: Alan Yango; Arte: Carlos Paul)\nDetalhe da HQ \"Interven\u00e7\u00e3o\". Arte de Fl\u00e1vio Rodrigues\nP\u00e1gina da HQ \"A Amea\u00e7a de Kalymah\", desenhada por M\u00e1rcio Loerzer.\nDetalhe da HQ \"Breve Origem\". Arte de F\u00e1bio Nahon.\nDetalhe da HQ \"Breve Origem\". Arte de Alexandre Nascimento.\nO Ca\u00e7ador Urbano, na arte de Carlos Paul.\nSepulcro, por Emmanuel Thomaz.\nArte de Peter Vale que tamb\u00e9m estampar\u00e1 a caneca.\nSOBRE AS RECOMPENSAS\nAs recompensas do projeto, descritas ao lado, s\u00e3o acumulativas.\nTodos os originais que comp\u00f5em a revista fazem parte dos pacotes de recompensas.\nArte de Fl\u00e1vio Rodrigues , para os prints inclusos entre as recompensas.\nArtes do Peter Vale dispon\u00edveis entre as recompensas.\nMETAS ESTENDIDAS\nR$ 12.000 : P\u00f4ster com a arte do Peter Vale para todos.\nR$ 15.000 : Revista Yangoverso Aventura com a publica\u00e7\u00e3o das primeiras HQs do Sepulcro e da Defensora postadas no blog. para contribui\u00e7\u00f5es acima de R$ 50,00 .", "categoria_multirrotulo_lda": {"0": 0.0, "1": 0.0, "2": 0.4, "3": 0.2, "4": 0.4, "5": 0.0, "6": 0.0, "7": 0.8, "8": 0.2, "9": 0.2, "10": 0.2, "11": 0.4, "12": 0.2, "13": 0.0, "14": 0.0, "15": 0.2, "16": 0.0, "17": 0.0, "18": 0.2, "19": 0.6, "20": 0.0, "21": 0.2, "22": 0.4, "23": 0.4, "24": 0.0, "25": 0.2, "26": 0.0, "27": 0.4, "28": 0.2, "29": 0.0, "30": 0.4, "31": 0.2, "32": 0.2, "33": 0.0, "34": 0.2, "35": 0.4, "36": 0.2, "37": 0.2, "38": 0.4, "39": 0.0, "40": 0.4, "41": 0.2, "42": 0.4, "43": 0.2, "44": 0.0, "45": 0.0, "46": 0.0, "47": 0.0, "48": 0.2, "49": 0.0}, "categoria_entidades": ["maximus", "heroi", "verdade", "jovem professor de literatura brasileira max marins", "posse do medalh\u00e3o do sol", "artefato m\u00edstico", "irm\u00e3o arque\u00f3logo bruno marins", "poderes extraordin\u00e1rios", "alan yango em 1999", "hist\u00f3rias em quadrinhos", "artistas paraenses", "arte dos quadrinhos na regi\u00e3o", "vitrine", "artistas", "mercado", "edi\u00e7\u00f5es anteriores", "poderoso maximus n\u00ba 1", "pdf", "revista", "poderoso maximus", "forma independente em janeiro de 2011", "4 edi\u00e7\u00f5es nos \u00faltimos anos", "inten\u00e7\u00e3o", "projeto da edi\u00e7\u00e3o 5", "catarse", "dificuldades de publica\u00e7\u00e3o", "revista independente", "maior alcance", "p\u00fablico leitor", "plataforma de financiamento coletivo", "grande visibilidade aos projetos", "arte da capa por joe bennett", "p\u00f4ster", "camisa", "poderoso maximus n\u00ba 5", "g\u00eanero", "super-heroi", "capa couch\u00e9", "cores", "miolo em p&b", "formato 17 x 26 cm", "36 p\u00e1ginas", "arte da capa", "joe bennet", "m\u00e1rcio loerzer", "fernando carvalho", "interven\u00e7\u00e3o", "roteiro", "alan yango", "arte", "fl\u00e1vio rodrigues", "amea\u00e7a de kalymah", "arte m\u00e1rcio loerzer", "extensor", "breve origem", "f\u00e1bio nahon", "alexandre nascimento", "sepulcro", "sacrif\u00edcio", "emmanuel thomaz", "ca\u00e7ador urbano", "sequestro", "carlos paul", "detalhe da hq", "arte de fl\u00e1vio rodrigues", "p\u00e1gina da hq", "arte de f\u00e1bio nahon", "arte de alexandre nascimento", "arte de carlos paul", "arte de peter vale", "caneca", "as recompensas", "recompensas do projeto", "lado", "originais", "parte dos pacotes de recompensas", "prints inclusos", "recompensas", "artes do peter vale dispon\u00edveis", "metas estendidas", "arte do peter vale", "revista yangoverso aventura", "publica\u00e7\u00e3o das primeiras hqs do sepulcro", "defensora", "blog", "contribui\u00e7\u00f5es"]}