{"origem": "catarse", "categoria_teste_mencoes": {"saloes_humor": false, "hqmix": false, "ccxp": false, "fiq": false, "angelo_agostini": false, "politica": false, "questoes_genero": false, "lgbtqiamais": true, "terror": true, "humor": false, "herois": false, "disputa": false, "ficcao_cientifica": true, "fantasia": false, "folclore": false, "zine": true, "webformatos": false, "erotismo": true, "religiosidade": false, "jogos": false, "midia_independente": false}, "recompensas_menor_nominal": 15.0, "recompensas_menor_ajustado": 23.111383896440344, "recompensas_quantidade": 1, "autoria_id": 449985, "autoria_nome": "edegar marmille agostinho", "autoria_nome_publico": "edegar agostinho", "autoria_classificacao": "masculino", "autoria_classificacao_id": 3, "social_seguidores": 33, "social_newsletter": false, "social_sub_contribuicoes_amigos": true, "social_sub_novos_seguidores": true, "social_sub_posts_projeto": true, "social_projetos_contribuidos": 15, "social_projetos_publicados": 2, "geral_municipio": "Campinas", "geral_uf": "SP", "geral_uf_br": "SP", "geral_city_id": 4818, "geral_content_rating": 1, "geral_contributed_by_friends": false, "geral_capa_imagem": false, "geral_capa_video": true, "geral_dias_campanha": 60, "geral_data_fim": "2016-05-10T02:59:59.999999", "geral_data_ini": "2016-03-10T19:58:53.448486", "geral_meta": 8500.0, "geral_meta_corrigida": 13096.450874649528, "geral_arrecadado": 10361.0, "geral_arrecadado_corrigido": 15963.80323673456, "geral_percentual_arrecadado": 121.89411764705882, "geral_conteudo_adulto": false, "geral_posts": 7, "geral_project_id": 26384, "geral_modalidade": "aon", "geral_titulo": "M\u00e3e, eu quero um apocalipse zumbi!", "geral_status": "successful", "geral_total_contribuicoes": 123, "geral_total_apoiadores": 123, "geral_sobre": "UPDATE!!!\nMETAS ESTENDIDAS!\nSobreviver a um apocalipse zumbi \u00e9 uma tarefa muito f\u00e1cil. Sim, f\u00e1cil. Na grande maioria das vezes os sobreviventes parecem j\u00e1 ter passado por algum tipo de treinamento militar, ou s\u00e3o, simplesmente, badass o suficiente pra encarar a tarefa. Mas, e se quem sobrevivesse a esse apocalipse fosse um bando de nerds que s\u00f3 sabem jogar rpg e ler gibis? Esse \u00e9 o caso dos protagonistas do nonsense M\u00e3e, eu quero um apocalipse zumbi! .\nAp\u00f3s um repentino apag\u00e3o, teve azar quem pode ver as luzes acesas novamente: todos os seres vivos, humanos e animais, se transformaram em zumbis. Bruno, Vitor, Murilo e Menegalli, quatro estudantes colegiais acreditando serem os \u00fanicos humanos restantes, se unem para tentar sobreviver a esse mundo p\u00f3s apocal\u00edptico com todas as suas (nenhuma) habilidades de sobreviv\u00eancia.\nO que poderia ser a cura para essa tal pandemia? N\u00e3o espere o \u00f3bvio em uma realidade t\u00e3o sem sentido quanto um apocalipse zumbi. A l\u00f3gica n\u00e3o \u00e9 uma aliada.\nO texto acima resume o livro M\u00e3e, eu quero um apocalipse zumbi!, de Edegar Agostinho. O financiamento coletivo ir\u00e1 cobrir os custos de impress\u00e3o, as recompensas e o envio dos livros aos apoiadores, al\u00e9m do percentual do catarse, afinal, esse brinquedo \u00e9 deles.\n- 152 p\u00e1ginas;\n- 14,5 x 21,5 cm;\n- Capa cartonada com lamina\u00e7\u00e3o fosca;\n- Miolo em preto e branco em papel p\u00f3len bold 90g;\n- Todos os exemplares ser\u00e3o enviados autografados pelo autor.\nImagem ilustrativa do livro\nEdegar Agostinho nasceu na long\u00ednqua terra de Nova Odessa em 1994 e est\u00e1 cursando o \u00faltimo ano do curso de Artes Visuais pela Universidade Estadual de Campinas (UNICAMP).\nQuando crian\u00e7a, sonhava em ser comediante ou quadrinista, ent\u00e3o resolveu juntar os dois sonhos do jeito mais charmoso poss\u00edvel. Lan\u00e7ou em 2015 seu primeiro quadrinho, intitulado Tale Tracker , al\u00e9m da zine O Churros Encantado , em parceria com Mario Cau, Didi Mamushka e Fer Gaspar. M\u00e3e, eu quero um apocalipse zumbi! \u00e9 seu primeiro \u00e1lbum com uma lombada de por respeito em uma prateleira.\nAl\u00e9m de quadrinhos, tamb\u00e9m trabalha como ilustrador freelancer, professor e tem uma banda, ou seja, ele quase zerou as profiss\u00f5es que pagam pouco.\nContribuindo com o projeto, voc\u00ea poder\u00e1 escolher entre diversos pacotes de recompensas que lhe ser\u00e3o entregues at\u00e9 voc\u00ea no conforto da sua casa. A n\u00e3o ser que voc\u00ea more fora do Brasil, a\u00ed conversar\u00edamos por e-mail.\nAl\u00e9m do livro M\u00e3e, eu quero um apocalipse zumbi! impresso, voc\u00ea tamb\u00e9m pode receber:\n- Pdf com todo o conte\u00fado do livro impresso;\n- Marca p\u00e1ginas;\n- HQ Tale Tracker , de Edegar Agostinho;\n- Zine O Churros Encantado , de Edegar Agostinho, Mario Cau, Didi Mamushka e Fer Gaspar;\n- P\u00f4ster A3 exclusivo da campanha no Catarse;\n- Print A5 personalizado (voc\u00ea zumbi!);\n- Arte original exclusiva de Edegar Agostinho em nanquim do personagem que voc\u00ea escolher (n\u00e3o precisa ser do \u201cM\u00e3e, eu quero um apocalipse zumbi!\u201d).\nCapa da HQ Tale Tracker , de Edegar Agostinho e da Zine O Churros Encantado , de Edegar Agostinho, Mario Cau, Didi Mamushka e Fer Gaspar\nexemplo do print A5 personalizado (voc\u00ea zumbi!)\nP\u00f4ster A3 exclusivo da campanha do Catarse!", "categoria_multirrotulo_lda": {"0": 0.2, "1": 0.2, "2": 0.2, "3": 0.2, "4": 0.4, "5": 0.2, "6": 0.6, "7": 0.0, "8": 0.2, "9": 0.0, "10": 0.0, "11": 0.4, "12": 0.4, "13": 0.0, "14": 0.0, "15": 0.2, "16": 0.4, "17": 0.0, "18": 0.0, "19": 0.0, "20": 0.2, "21": 0.0, "22": 0.0, "23": 0.0, "24": 0.0, "25": 0.4, "26": 0.0, "27": 0.4, "28": 0.2, "29": 0.4, "30": 0.0, "31": 0.2, "32": 0.0, "33": 0.0, "34": 0.0, "35": 0.2, "36": 0.4, "37": 0.2, "38": 0.4, "39": 0.2, "40": 0.0, "41": 0.6, "42": 0.2, "43": 0.2, "44": 0.0, "45": 0.2, "46": 0.0, "47": 0.0, "48": 0.2, "49": 0.2}, "categoria_entidades": ["update", "metas estendidas", "sobreviver", "apocalipse zumbi", "tarefa", "grande maioria das vezes", "sobreviventes", "tipo de treinamento militar", "suficiente", "apocalipse", "bando de nerds", "rpg", "gibis", "caso dos protagonistas do nonsense m\u00e3e", "repentino apag\u00e3o", "luzes acesas", "seres vivos", "humanos", "animais", "zumbis", "bruno", "vitor", "murilo", "menegalli", "quatro estudantes colegiais", "\u00fanicos humanos restantes", "mundo p\u00f3s apocal\u00edptico", "habilidades de sobreviv\u00eancia", "cura", "pandemia", "\u00f3bvio", "realidade", "sentido", "l\u00f3gica", "aliada", "texto", "livro m\u00e3e", "agostinho", "financiamento coletivo", "custos de impress\u00e3o", "recompensas", "envio dos livros aos apoiadores", "percentual do catarse", "brinquedo", "152 p\u00e1ginas", "14,5 x 21,5 cm", "capa", "lamina\u00e7\u00e3o fosca", "miolo em preto", "branco em papel p\u00f3len bold 90 g", "exemplares", "autor", "imagem ilustrativa do livro", "long\u00ednqua terra de nova odessa em 1994", "\u00faltimo ano do curso de artes visuais pela universidade estadual de campinas", "unicamp", "crian\u00e7a", "dois sonhos do jeito", "charmoso poss\u00edvel", "primeiro quadrinho", "tale tracker", "zine", "churros encantado", "parceria com mario cau", "didi mamushka", "fer gaspar", "m\u00e3e", "primeiro \u00e1lbum", "lombada de por respeito", "prateleira", "quadrinhos", "ilustrador freelancer", "professor", "banda", "profiss\u00f5es", "projeto", "pacotes de recompensas", "conforto", "casa", "brasil", "e-mail", "pdf", "conte\u00fado do livro", "marca p\u00e1ginas", "hq tale tracker", "mario cau", "p\u00f4ster a3 exclusivo da campanha no catarse", "print a5", "zumbi", "arte original exclusiva", "agostinho em nanquim do personagem", "capa da hq tale tracker", "exemplo do print a5", "p\u00f4ster a3 exclusivo da campanha do catarse"]}