{"origem": "catarse", "categoria_teste_mencoes": {"saloes_humor": false, "hqmix": false, "ccxp": false, "fiq": false, "angelo_agostini": false, "politica": false, "questoes_genero": false, "lgbtqiamais": false, "terror": false, "humor": true, "herois": false, "disputa": false, "ficcao_cientifica": false, "fantasia": false, "folclore": false, "zine": false, "webformatos": false, "erotismo": false, "religiosidade": false, "jogos": false, "midia_independente": false}, "recompensas_menor_nominal": 15.0, "recompensas_menor_ajustado": 21.875193753123494, "recompensas_quantidade": 1, "autoria_id": 494833, "autoria_nome": "carla pilla", "autoria_nome_publico": "carla pilla", "autoria_classificacao": "feminino", "autoria_classificacao_id": 4, "social_seguidores": 32, "social_newsletter": false, "social_sub_contribuicoes_amigos": true, "social_sub_novos_seguidores": true, "social_sub_posts_projeto": true, "social_projetos_contribuidos": 16, "social_projetos_publicados": 1, "geral_municipio": "Porto Alegre", "geral_uf": "RS", "geral_uf_br": "RS", "geral_city_id": 4178, "geral_content_rating": 1, "geral_contributed_by_friends": false, "geral_capa_imagem": false, "geral_capa_video": true, "geral_dias_campanha": 39, "geral_data_fim": "2017-07-15T02:59:59.999999", "geral_data_ini": "2017-06-05T03:25:00.217174", "geral_meta": 16000.0, "geral_meta_corrigida": 23333.540003331727, "geral_arrecadado": 20130.0, "geral_arrecadado_corrigido": 29356.510016691733, "geral_percentual_arrecadado": 125.8125, "geral_conteudo_adulto": false, "geral_posts": 19, "geral_project_id": 32649, "geral_modalidade": "aon", "geral_titulo": "Pelica + Felpudo", "geral_status": "successful", "geral_total_contribuicoes": 237, "geral_total_apoiadores": 226, "geral_sobre": "Pelica + Felpudo ser\u00e1 o segundo livro do Fil\u00e9 de Gato. Vai ser um livro de 60 p\u00e1ginas, todo colorido em aquarela, com tirinhas que mostram v\u00e1rias novas perip\u00e9cias de Felpudo e Pelica, desse jeito fofo e divertido que s\u00f3 os gatos sabem ser.\nAl\u00e9m de divertir crian\u00e7as e gateiros, o livro tamb\u00e9m vai contribuir para a prote\u00e7\u00e3o e o bem estar de v\u00e1rios outros peludos, atrav\u00e9s de uma entidade escolhida pelos pr\u00f3prios apoiadores do projeto.\nO financiamento coletivo ir\u00e1 cobrir os gastos com a cria\u00e7\u00e3o e impress\u00e3o do livro, com as recompensas e envio dos livros aos apoiadores, al\u00e9m das taxas do Catarse e da doa\u00e7\u00e3o para a entidade escolhida.\nCaso o projeto n\u00e3o atinja a meta, o Catarse devolve todo o dinheiro para os apoiadores. Eu mesma j\u00e1 apoiei alguns projetos e confirmo que n\u00e3o tem risco. Pode confiar e apoiar! :-)\nAlguns dos quadrinhos do livro:\nCaso o financiamento atinja esse valor, todos os livros ser\u00e3o AUTOGRAFADOS e ser\u00e1 sorteado um ESBO\u00c7O ORIGINAL (sketch) do livro.\nCaso o financiamento atinja esse valor, al\u00e9m dos livros autografados e do sorteio do sketch, tamb\u00e9m ser\u00e1 sorteado um ORIGINAL EM AQUARELA do livro.\nCaso o financiamento atinja esse valor, al\u00e9m dos livros autografados e dos sorteios do sketch e do original, todos os livros ser\u00e3o feitos com LOMBADA.\nCarla Pilla \u00e9 ilustradora, aquarelista e quadrinista, formada em Publicidade e Propaganda e p\u00f3s-graduada em Express\u00e3o Gr\u00e1fica. \u00c9 autora dos quadrinhos de humor felino Fil\u00e9 de Gato, que j\u00e1 t\u00eam um livro publicado. Ilustrou por tr\u00eas anos a coluna de Martha Medeiros na Revista Donna do jornal Zero Hora. J\u00e1 ilustrou em torno de trinta livros infantis e infanto-juvenis para editoras de Porto Alegre, S\u00e3o Paulo e Rio de Janeiro.\nFelpudo e Pelica s\u00e3o dois gatos de rua, adotados bem filhotinhos pela autora e seu marido, e que agora j\u00e1 t\u00eam 11 anos de gatice. Al\u00e9m de inspirarem o humor de suas tiras, enchem seu apartamento de pelos e sua vida de ternura.\n10% do valor total arrecadado ir\u00e1 diretamente para uma entidade protetora de animais, que ser\u00e1 votada pelos pr\u00f3prios apoiadores deste projeto. Quanto mais arrecadarmos, maior ser\u00e1 a doa\u00e7\u00e3o!\nAo apoiar o projeto, voc\u00ea poder\u00e1 escolher entre v\u00e1rios pacotes de recompensas, que incluem desde cart\u00f5es postais at\u00e9 um original do livro em aquarela!\nTodos os pacotes de recompensas incluem frete para todo o Brasil (em caso de frete internacional, me contate por e-mail).\nEscolha o pacote de recompensas que cabe no seu bolso, contribua para garantir seu exemplar do livro e n\u00e3o esque\u00e7a de AJUDAR A DIVULGAR este projeto para todos seus amigos, para atingirmos a meta e, quem sabe, alcan\u00e7armos tamb\u00e9m as metas estendidas.\nExemplos de recompensas (veja a lista completa ao lado na p\u00e1gina):", "categoria_multirrotulo_lda": {"0": 0.2, "1": 0.0, "2": 0.2, "3": 0.4, "4": 0.2, "5": 0.0, "6": 0.2, "7": 0.0, "8": 0.2, "9": 0.0, "10": 0.0, "11": 0.4, "12": 0.2, "13": 0.0, "14": 0.2, "15": 0.4, "16": 0.2, "17": 0.0, "18": 0.0, "19": 0.0, "20": 0.2, "21": 0.0, "22": 0.2, "23": 0.2, "24": 0.0, "25": 0.2, "26": 0.0, "27": 0.4, "28": 0.2, "29": 0.0, "30": 0.6, "31": 0.2, "32": 0.0, "33": 0.2, "34": 0.2, "35": 0.4, "36": 0.4, "37": 0.4, "38": 0.4, "39": 0.0, "40": 0.2, "41": 0.4, "42": 0.6, "43": 0.0, "44": 0.0, "45": 0.2, "46": 0.0, "47": 0.0, "48": 0.2, "49": 0.0}, "categoria_entidades": ["pelica", "felpudo", "segundo livro do fil\u00e9 de gato", "livro de 60 p\u00e1ginas", "aquarela", "tirinhas", "novas perip\u00e9cias de felpudo", "jeito fofo", "gatos", "crian\u00e7as", "gateiros", "livro", "prote\u00e7\u00e3o", "bem", "peludos", "entidade", "apoiadores do projeto", "financiamento coletivo", "gastos", "cria\u00e7\u00e3o", "impress\u00e3o do livro", "recompensas", "envio dos livros aos apoiadores", "taxas do catarse", "doa\u00e7\u00e3o", "projeto", "meta", "catarse", "dinheiro", "apoiadores", "projetos", "risco", "quadrinhos do livro", "financiamento", "valor", "livros", "esbo\u00e7o original", "sketch", "sorteio do sketch", "original em aquarela do livro", "sorteios do sketch", "original", "lombada", "carla pilla", "ilustradora", "aquarelista", "publicidade", "propaganda", "p\u00f3s-graduada em express\u00e3o gr\u00e1fica", "autora dos quadrinhos de humor felino fil\u00e9 de gato", "tr\u00eas anos", "coluna de martha medeiros na revista donna do jornal zero hora", "torno de trinta livros infantis", "infanto-juvenis para editoras de porto alegre", "s\u00e3o paulo", "rio de janeiro", "dois gatos de rua", "filhotinhos pela autora", "marido", "11 anos de gatice", "humor", "tiras", "apartamento", "vida de ternura", "valor total", "entidade protetora de animais", "apoiadores deste projeto", "pacotes de recompensas", "cart\u00f5es postais", "original do livro em aquarela", "frete", "brasil", "caso de frete internacional", "e-mail", "pacote de recompensas", "bolso", "exemplar do livro", "ajudar", "amigos", "metas", "exemplos de recompensas", "lista completa ao lado na p\u00e1gina"]}