{"origem": "catarse", "categoria_teste_mencoes": {"saloes_humor": false, "hqmix": false, "ccxp": false, "fiq": true, "angelo_agostini": false, "politica": false, "questoes_genero": false, "lgbtqiamais": false, "terror": false, "humor": false, "herois": false, "disputa": false, "ficcao_cientifica": false, "fantasia": false, "folclore": false, "zine": false, "webformatos": false, "erotismo": false, "religiosidade": false, "jogos": false, "midia_independente": false}, "recompensas_menor_nominal": 60.0, "recompensas_menor_ajustado": 89.17638773929616, "recompensas_quantidade": 1, "autoria_id": 559747, "autoria_nome": "pedro ferreira", "autoria_nome_publico": "pedro ferreira", "autoria_classificacao": "masculino", "autoria_classificacao_id": 3, "social_seguidores": 79, "social_newsletter": false, "social_sub_contribuicoes_amigos": true, "social_sub_novos_seguidores": true, "social_sub_posts_projeto": true, "social_projetos_contribuidos": 37, "social_projetos_publicados": 2, "geral_municipio": "S\u00e3o Paulo", "geral_uf": "SP", "geral_uf_br": "SP", "geral_city_id": 5274, "geral_content_rating": 1, "geral_contributed_by_friends": false, "geral_capa_imagem": false, "geral_capa_video": true, "geral_dias_campanha": 24, "geral_data_fim": "2016-12-02T01:59:59.999999", "geral_data_ini": "2016-11-07T16:32:45.727239", "geral_meta": 5000.0, "geral_meta_corrigida": 7431.365644941347, "geral_arrecadado": 1540.0, "geral_arrecadado_corrigido": 2288.860618641935, "geral_percentual_arrecadado": 30.8, "geral_conteudo_adulto": false, "geral_posts": 0, "geral_project_id": 45405, "geral_modalidade": "flex", "geral_titulo": "Post Mortem Volume 2", "geral_status": "successful", "geral_total_contribuicoes": 39, "geral_total_apoiadores": 37, "geral_sobre": "Post Mortem \u00e9 uma mini s\u00e9rie de quadrinhos em 3 partes escrita e ilustrada por Pedro Ferreira.\nA hist\u00f3ria conta sobre a jornada de Ahran, um jovem necromante que est\u00e1 em busca do seu irm\u00e3o e sobrinho, ap\u00f3s um tr\u00e1gico acontecimento na pequena vila onde viviam.\n\u00c9 uma hist\u00f3ria sobre a persegui\u00e7\u00e3o dos objetivos imposs\u00edveis, e o qu\u00e3o longe o protagonista pretende ir para alcan\u00e7ar os seus objetivos.\nDurante o tempo em que essa campanha estiver rolando, eu estou disponibilizando o download da vers\u00e3o digital em PDF do volume 1 DE GRA\u00c7A!\nN\u00e3o precisa se registrar em nada, me mandar seu email, dar like na minha page, \u00e9 s\u00f3 baixar. =)\nLeia online ou fa\u00e7a o download nesse link aqui: Download Post Mortem Vol 1\nLancei o primeiro volume da hist\u00f3ria no FIQ 2015, financiado por mim mesmo, e pela boa recep\u00e7\u00e3o dele, e do trailer animado do quadrinho , achei que seria pertinente fazer um financiamento coletivo para a segunda parte da hist\u00f3ria.\nTrailer do quadrinho\nO segundo volume come\u00e7a diretamente de onde o outro parou, e mostra Ahran chegando cada vez mais perto do seu objetivo, enquanto revela um pouco mais sobre o passado dele, e o caminho que o trouxe at\u00e9 aqui.\nAl\u00e9m das c\u00f3pias das partes 1 e 2 da hist\u00f3ria, os brindes nas recompensas incluem Prints A5 e A4, e Sketches Originais A5 e A4.\nExemplos Prints\nExemplo Sketches\nO lan\u00e7amento do Post Mortem volume 2 vai ser na Comic Con experience , na mesa H32.\nEssa campanha \u00e9 do tipo \"Flex\", o que significa que n\u00e3o importa o quanto ela arrecade, voc\u00ea garante as suas c\u00f3pias batendo a meta ou n\u00e3o. =)\nPost Mortem 2 ter\u00e1 64 p\u00e1ginas, tamanho, 16cm x 23cm em papel polen bold 90g e capa com papel supremo 250g", "categoria_multirrotulo_lda": {"0": 0.0, "1": 0.0, "2": 0.0, "3": 0.0, "4": 0.2, "5": 0.2, "6": 0.2, "7": 0.0, "8": 0.4, "9": 0.0, "10": 0.0, "11": 0.2, "12": 0.0, "13": 0.0, "14": 0.2, "15": 0.0, "16": 0.4, "17": 0.0, "18": 0.0, "19": 0.0, "20": 0.2, "21": 0.0, "22": 0.0, "23": 0.0, "24": 0.0, "25": 0.0, "26": 0.2, "27": 0.2, "28": 0.0, "29": 0.0, "30": 0.0, "31": 0.0, "32": 0.0, "33": 0.0, "34": 0.0, "35": 0.0, "36": 0.0, "37": 0.0, "38": 0.0, "39": 0.0, "40": 0.2, "41": 0.2, "42": 0.0, "43": 0.0, "44": 0.0, "45": 0.2, "46": 0.0, "47": 0.0, "48": 0.0, "49": 0.2}, "categoria_entidades": ["post mortem", "mini s\u00e9rie de quadrinhos em 3 partes", "pedro ferreira", "hist\u00f3ria", "jornada de ahran", "jovem necromante", "busca", "irm\u00e3o", "sobrinho", "tr\u00e1gico acontecimento na pequena vila", "persegui\u00e7\u00e3o dos objetivos imposs\u00edveis", "protagonista", "objetivos", "tempo", "campanha", "download da vers\u00e3o digital em pdf do volume 1 de gra\u00e7a", "email", "page", "leia online", "download nesse link", "download post mortem vol 1", "primeiro volume da hist\u00f3ria no fiq 2015", "boa recep\u00e7\u00e3o", "trailer", "quadrinho", "financiamento coletivo", "segunda parte da hist\u00f3ria", "trailer do quadrinho", "segundo volume", "ahran", "cada vez mais", "objetivo", "passado", "caminho", "c\u00f3pias das partes 1", "2 da hist\u00f3ria", "brindes nas recompensas", "prints a5", "a4", "sketches originais a5", "exemplos prints", "exemplo sketches", "lan\u00e7amento do post mortem volume 2", "comic con experience", "mesa h32", "tipo", "flex", "c\u00f3pias", "meta", "post mortem 2", "64 p\u00e1ginas", "tamanho", "16 cm x 23 cm em papel polen bold 90 g", "capa com papel supremo 250 g"]}