{"origem": "catarse", "categoria_teste_mencoes": {"saloes_humor": false, "hqmix": false, "ccxp": false, "fiq": true, "angelo_agostini": false, "politica": false, "questoes_genero": false, "lgbtqiamais": false, "terror": true, "humor": false, "herois": false, "disputa": false, "ficcao_cientifica": false, "fantasia": false, "folclore": false, "zine": false, "webformatos": false, "erotismo": false, "religiosidade": false, "jogos": false, "midia_independente": false}, "recompensas_menor_nominal": 10.0, "recompensas_menor_ajustado": 14.750354606499764, "recompensas_quantidade": 1, "autoria_id": 710180, "autoria_nome": "m\u00e1rio guedes de almeida junior", "autoria_nome_publico": "ronaldo felipe", "autoria_classificacao": "masculino", "autoria_classificacao_id": 3, "social_seguidores": 2, "social_newsletter": true, "social_sub_contribuicoes_amigos": true, "social_sub_novos_seguidores": true, "social_sub_posts_projeto": true, "social_projetos_contribuidos": 0, "social_projetos_publicados": 1, "geral_municipio": "Belo Horizonte", "geral_uf": "MG", "geral_uf_br": "MG", "geral_city_id": 1634, "geral_content_rating": 1, "geral_contributed_by_friends": false, "geral_capa_imagem": false, "geral_capa_video": true, "geral_dias_campanha": 60, "geral_data_fim": "2017-04-22T02:59:59.999999", "geral_data_ini": "2017-02-21T02:26:28.492067", "geral_meta": 3500.0, "geral_meta_corrigida": 5162.624112274917, "geral_arrecadado": 215.0, "geral_arrecadado_corrigido": 317.13262403974494, "geral_percentual_arrecadado": 6.142857142857143, "geral_conteudo_adulto": false, "geral_posts": 1, "geral_project_id": 50755, "geral_modalidade": "aon", "geral_titulo": "The Graveman", "geral_status": "failed", "geral_total_contribuicoes": 4, "geral_total_apoiadores": 4, "geral_sobre": "Ol\u00e1,\r pessoal! Eu sou Ronaldo Felipe. Moro em Belo horizonte e tenho 28 anos de\r idade. Trabalho com ilustra\u00e7\u00f5es e servi\u00e7os de designer gr\u00e1fico. Al\u00e9m de fazer\r quadrinhos independentes. Em 2011 consegui\r lan\u00e7ar minha primeira HQ chamada TAMASHII no FIQ (Festival Internacional de\r Quadrinho). Na \u00e9poca investi todo meu dinheiro de f\u00e9rias do trabalho e\r economias na impress\u00e3o da revista. Quando descobri sobre o catarse fiquei muito contente, e tenho acompanhado v\u00e1rios\r projetos sendo financiados atrav\u00e9s dele, e se tornando poss\u00edveis gra\u00e7as ao\r p\u00fablico. Agora estou aqui contando com o seu apoio para a vers\u00e3o impressa de                   The Graveman se tornar real.\nThe Graveman \u00e9 uma hist\u00f3ria de a\u00e7\u00e3o, terror com elementos gore.                          Em uma cidade marcada pela criminalidade e viol\u00eancia um homem se ergue de seu  tumulo se transformando em algo ainda mais grotesco. Gravemans as criaturas  revestidas de ossos que devoram a carne de suas vitimas. \u00c9 um pecado perder este  lan\u00e7amento! Ah sim, s\u00f3 lembrando que essa HQ \u00e9 indicada para maiores de 18 anos !\nO CATARSE\nPra quem n\u00e3o conhece o catarse e um site de financiamento colaborativo.          Um espa\u00e7o onde pessoas com boas propostas que n\u00e3o tem recursos para realiza-lo buscam o apoio do p\u00fablico para conseguir este valor. Neste caso o objetivo desta campanha e a impress\u00e3o de uma revista em quadrinhos. E qualquer pessoa que gostar pode escolher uma das recompensas ao lado e me ajudar a  alcan\u00e7ar a meta.\nA campanha tem 60 dias, e voc\u00ea pode pagar via boleto banc\u00e1rio ou cart\u00e3o de credito \r com\r a maior comodidade. Alcan\u00e7ando\r a meta eu recebo esse dinheiro ao final da campanha e os apoiadores\r recebem suas recompensas.                                                                     Caso\r contrario o site devolvera o seu dinheiro.\nA revista ter\u00e1 capa colorida em papel couche 250g, o miolo vai ter 38 p\u00e1ginas de quadrinho e 10 com extras especiais em papel offset 75g, formato  14x21cm. Lombada quadrada e colada.\nRECOMPENSAS", "categoria_multirrotulo_lda": {"0": 0.2, "1": 0.0, "2": 0.4, "3": 0.4, "4": 0.2, "5": 0.0, "6": 0.6, "7": 0.0, "8": 0.2, "9": 0.0, "10": 0.2, "11": 0.2, "12": 0.6, "13": 0.0, "14": 0.0, "15": 0.4, "16": 0.6, "17": 0.0, "18": 0.0, "19": 0.0, "20": 0.0, "21": 0.0, "22": 0.2, "23": 0.2, "24": 0.0, "25": 0.0, "26": 0.0, "27": 0.4, "28": 0.2, "29": 0.0, "30": 0.2, "31": 0.0, "32": 0.0, "33": 0.0, "34": 0.2, "35": 0.2, "36": 0.2, "37": 0.0, "38": 0.2, "39": 0.0, "40": 0.2, "41": 0.2, "42": 0.2, "43": 0.0, "44": 0.0, "45": 0.4, "46": 0.0, "47": 0.0, "48": 0.2, "49": 0.0}, "categoria_entidades": ["ol\u00e1", "pessoal", "ronaldo felipe", "belo horizonte", "28 anos", "idade", "ilustra\u00e7\u00f5es", "servi\u00e7os de designer gr\u00e1fico", "quadrinhos independentes", "primeira hq", "tamashii no fiq", "festival internacional", "quadrinho", "\u00e9poca", "dinheiro de f\u00e9rias do trabalho", "economias na impress\u00e3o da revista", "catarse", "projetos", "p\u00fablico", "apoio", "vers\u00e3o impressa", "the graveman", "hist\u00f3ria de a\u00e7\u00e3o", "terror com elementos gore", "cidade", "criminalidade", "viol\u00eancia", "homem", "tumulo", "gravemans", "criaturas", "ossos", "carne", "vitimas", "pecado", "lan\u00e7amento", "hq", "maiores de 18 anos", "site de financiamento colaborativo", "espa\u00e7o", "pessoas com boas propostas", "recursos", "apoio do p\u00fablico", "valor", "caso", "objetivo desta campanha", "impress\u00e3o", "revista em quadrinhos", "pessoa", "uma das recompensas ao lado", "meta", "campanha", "60 dias", "via boleto banc\u00e1rio", "cart\u00e3o de credito", "maior comodidade", "dinheiro ao final da campanha", "apoiadores", "recompensas", "contrario", "site", "dinheiro", "revista", "capa", "papel couche 250 g", "miolo", "38 p\u00e1ginas de quadrinho", "10 com extras especiais em papel offset 75 g", "formato", "14x21 cm", "lombada"]}