{"origem": "catarse", "categoria_teste_mencoes": {"saloes_humor": false, "hqmix": false, "ccxp": false, "fiq": false, "angelo_agostini": false, "politica": false, "questoes_genero": false, "lgbtqiamais": false, "terror": false, "humor": false, "herois": false, "disputa": false, "ficcao_cientifica": false, "fantasia": false, "folclore": false, "zine": false, "webformatos": false, "erotismo": true, "religiosidade": false, "jogos": false, "midia_independente": false}, "recompensas_menor_nominal": 20.0, "recompensas_menor_ajustado": 29.500709212999528, "recompensas_quantidade": 1, "autoria_id": 690180, "autoria_nome": "raimundo guimar\u00e3es de cerqueira junior", "autoria_nome_publico": "rai guimar\u00e3es", "autoria_classificacao": "masculino", "autoria_classificacao_id": 3, "social_seguidores": 18, "social_newsletter": true, "social_sub_contribuicoes_amigos": true, "social_sub_novos_seguidores": true, "social_sub_posts_projeto": true, "social_projetos_contribuidos": 27, "social_projetos_publicados": 4, "geral_municipio": "S\u00e3o Paulo", "geral_uf": "SP", "geral_uf_br": "SP", "geral_city_id": 5274, "geral_content_rating": 1, "geral_contributed_by_friends": false, "geral_capa_imagem": false, "geral_capa_video": true, "geral_dias_campanha": 25, "geral_data_fim": "2017-03-21T02:59:59.999999", "geral_data_ini": "2017-02-23T23:27:57.696909", "geral_meta": 4400.0, "geral_meta_corrigida": 6490.156026859896, "geral_arrecadado": 640.0, "geral_arrecadado_corrigido": 944.0226948159849, "geral_percentual_arrecadado": 14.545454545454545, "geral_conteudo_adulto": false, "geral_posts": 1, "geral_project_id": 51636, "geral_modalidade": "flex", "geral_titulo": "Galo Costa", "geral_status": "successful", "geral_total_contribuicoes": 11, "geral_total_apoiadores": 11, "geral_sobre": "Agora a campanha funciona como pr\u00e9-venda. N\u00e3o ha mais recompensas adicionais.\nComo \u00e9 uma campanha Flex vou imprimir a revista mesmo que n\u00e3o alcance a meta, ent\u00e3o sua revista vai estar garantida por mim.\nPor\u00e9m:\nNova Revista do Galo Costa .\nO Galo Costa \u00e9 um detetive particular que, juntamente com sua secret\u00e1ria S\u00f4nia e seu ajudante  Pequeno, tentam desvendar os mais diversos casos.\nSempre precisando sair do vermelho, o Galo termina topando tudo por dinheiro.\nA primeira apari\u00e7\u00e3o do personagem foi em publica\u00e7\u00e3o da editora Escala no ano de 2003. O Galo Costa teve revista pr\u00f3pria pelo selo Graphic Talents e posteriormente foi lan\u00e7ado numa colet\u00e2nea com as melhores hqs publicadas pela editora.\nDepois em 2008,  de forma independente, saiu o n\u00famero 2 do Galo Costa na Aventura: Galo Costa em a f\u00f3rmula da Beleza.\nAgora para o projeto do catarse criei uma nova aventura que est\u00e1 quase toda desenhada e arte-finalizada. Nessa Nova aventura o Galo Costa \u00e9 contratado para desvendar o desaparecimento de um professor de educa\u00e7\u00e3o f\u00edsica de uma escola p\u00fablica. Pra isso ele vai assumir o papel desse professor e vai investigar os principais suspeitos pelo desaparecimento: Os alunos.\nO Autor:\nRai Guimar\u00e3es\nIlustrador, desenhista e professor de desenho. Trabalhou na Editora Abril criando roteiros de hist\u00f3rias em quadrinhos para o personagem Z\u00e9 Carioca e na Editora Globo criando roteiros e desenhos para a turma do S\u00edtio do Picapau Amarelo e turma do menino maluquinho.\nCriador do personagem Galo Costa.\nEstudou Artes Pl\u00e1sticas na UNESP  e Educa\u00e7\u00e3o Art\u00edstica no Claretiano. Foi professor do SENAC sp de Caricaturas, quadrinhos e desenho durante 5 anos. Criador do curso EAD de roteiro para hist\u00f3rias em quadrinhos do SENAC sp. Atualmente \u00e9 Cartunista, caricaturista e ilustrador.\nMarca p\u00e1gina Sal\u00e1rio M\u00ednimo", "categoria_multirrotulo_lda": {"0": 0.2, "1": 0.0, "2": 0.4, "3": 0.2, "4": 0.4, "5": 0.0, "6": 0.2, "7": 0.2, "8": 0.4, "9": 0.4, "10": 0.4, "11": 0.4, "12": 0.2, "13": 0.0, "14": 0.0, "15": 0.2, "16": 0.4, "17": 0.0, "18": 0.2, "19": 0.2, "20": 0.0, "21": 0.4, "22": 0.6, "23": 0.6, "24": 0.0, "25": 0.4, "26": 0.2, "27": 0.4, "28": 0.2, "29": 0.2, "30": 0.4, "31": 0.2, "32": 0.2, "33": 0.0, "34": 0.2, "35": 0.4, "36": 0.2, "37": 0.4, "38": 0.4, "39": 0.0, "40": 0.2, "41": 0.2, "42": 0.4, "43": 0.4, "44": 0.0, "45": 0.2, "46": 0.2, "47": 0.0, "48": 0.2, "49": 0.0}, "categoria_entidades": ["campanha", "pr\u00e9-venda", "ha", "recompensas adicionais", "campanha flex", "revista", "meta", "garantida", "nova revista do galo costa", "galo costa", "detetive particular", "secret\u00e1ria s\u00f4nia", "ajudante", "pequeno", "diversos casos", "vermelho", "galo", "dinheiro", "primeira apari\u00e7\u00e3o do personagem", "publica\u00e7\u00e3o da editora escala no ano de 2003", "revista pr\u00f3pria pelo selo graphic talents", "colet\u00e2nea", "melhores hqs", "editora", "forma independente", "n\u00famero 2 do galo costa na aventura", "f\u00f3rmula da beleza", "projeto do catarse", "nova aventura", "desaparecimento", "professor de educa\u00e7\u00e3o f\u00edsica", "escola p\u00fablica", "papel desse professor", "principais suspeitos pelo desaparecimento", "alunos", "autor", "rai guimar\u00e3es", "ilustrador", "professor de desenho", "editora abril", "roteiros de hist\u00f3rias em quadrinhos", "personagem z\u00e9 carioca", "editora globo", "roteiros", "desenhos", "turma do s\u00edtio do picapau amarelo", "turma do menino maluquinho", "criador do personagem galo costa", "estudou artes pl\u00e1sticas na unesp", "educa\u00e7\u00e3o art\u00edstica no claretiano", "professor do senac sp de caricaturas", "quadrinhos", "desenho durante 5 anos", "criador do curso ead de roteiro para hist\u00f3rias em quadrinhos do senac sp", "cartunista", "caricaturista", "marca p\u00e1gina sal\u00e1rio m\u00ednimo"]}