{"origem": "catarse", "categoria_teste_mencoes": {"saloes_humor": false, "hqmix": true, "ccxp": true, "fiq": true, "angelo_agostini": false, "politica": false, "questoes_genero": false, "lgbtqiamais": false, "terror": false, "humor": false, "herois": false, "disputa": false, "ficcao_cientifica": false, "fantasia": false, "folclore": false, "zine": false, "webformatos": true, "erotismo": false, "religiosidade": true, "jogos": true, "midia_independente": false}, "recompensas_menor_nominal": 90.0, "recompensas_menor_ajustado": 131.56615460665094, "recompensas_quantidade": 1, "autoria_id": 549438, "autoria_nome": "frederico camargo cassar", "autoria_nome_publico": "fred cassar", "autoria_classificacao": "masculino", "autoria_classificacao_id": 3, "social_seguidores": 144, "social_newsletter": false, "social_sub_contribuicoes_amigos": true, "social_sub_novos_seguidores": true, "social_sub_posts_projeto": true, "social_projetos_contribuidos": 44, "social_projetos_publicados": 2, "geral_municipio": "Niter\u00f3i", "geral_uf": "RJ", "geral_uf_br": "RJ", "geral_city_id": 3642, "geral_content_rating": 1, "geral_contributed_by_friends": false, "geral_capa_imagem": false, "geral_capa_video": true, "geral_dias_campanha": 60, "geral_data_fim": "2017-07-21T02:59:59.999999", "geral_data_ini": "2017-05-21T18:09:01.658862", "geral_meta": 15000.0, "geral_meta_corrigida": 21927.692434441826, "geral_arrecadado": 21312.0, "geral_arrecadado_corrigido": 31154.865410854945, "geral_percentual_arrecadado": 142.08, "geral_conteudo_adulto": false, "geral_posts": 18, "geral_project_id": 54735, "geral_modalidade": "aon", "geral_titulo": "Space Punch", "geral_status": "successful", "geral_total_contribuicoes": 364, "geral_total_apoiadores": 362, "geral_sobre": "Space Punch conta a hist\u00f3ria de Mari, que na inf\u00e2ncia fez um grande amigo atrav\u00e9s de um aclamado jogo retr\u00f4. Agora, anos ap\u00f3s se afastarem, \u00e9 este mesmo jogo que torna poss\u00edvel um reencontro inesperado. Se questionando sobre sua decis\u00e3o de tentar se aproximar do velho amigo, Mari avan\u00e7a pelas chaves do campeonato, cercada de lembran\u00e7as e pancadaria espacial.\nJ\u00e1 temos v\u00e1rias p\u00e1ginas do quadrinho finalizadas! Abaixo voc\u00eas podem ver uma sequ\u00eancia de 3 p\u00e1ginas tirada da introdu\u00e7\u00e3o da hist\u00f3ria. Clicando no link abaixo, uma pr\u00e9via do quadrinho, com as 18 primeiras p\u00e1ginas finalizadas!\nVoc\u00ea pode ler as 18 primeiras p\u00e1ginas da hist\u00f3ria clicando aqui em baixo \\/\nO livro impresso ter\u00e1:\nPlanejamos mandar o livro para a gr\u00e1fica em outubro/17, e disponibiliz\u00e1-lo para venda na FIQ e CCXP 2017.\nBruno Moraes mora em B\u00fazios - RJ e \u00e9 formado em Ci\u00eancia da Computa\u00e7\u00e3o pela UFF. \u00c9 fascinado por explora\u00e7\u00e3o espacial e uma de suas maiores frustra\u00e7\u00f5es \u00e9 ter consci\u00eancia de que n\u00e3o vai viver o suficiente para sair e dar uma olhada no que tem l\u00e1 fora. Ele tamb\u00e9m gosta muito mesmo de cinema e quadrinhos. H\u00e1 2 anos faz pixel art para jogos e ilustra\u00e7\u00e3o editorial, e muito recentemente descobriu que n\u00e3o gosta de se referir a ele mesmo na terceira pessoa. Ent\u00e3o agora ele decidiu parar.\nFred Cassar mora em Niter\u00f3i - RJ, e \u00e9 formado em Design de Produto pela PUC-Rio. Ele trabalha como quadrinista e ilustrador freelancer e \u00e9 autor dos webcomics Santu\u00e1rios (finalista do trof\u00e9u HQmix 2016 na categoria web quadrinhos) e Nocturne (leia o meu webcomic). Fred gosta muito de Smash Bros. Ele gosta de outras coisas tamb\u00e9m, como m\u00fasica barulhenta, curry e mang\u00e1s. Mas o que ele gosta mesmo \u00e9 de Smash Bros. Ele gosta tanto de Smash Bros que a chance de ele estar jogando enquanto voc\u00ea l\u00ea esta bio \u00e9 de aproximadamente 60%.\nO Catarse \u00e9 a maior plataforma de financiamento coletivo do Brasil, e h\u00e1 alguns anos tem sido a melhor maneira de muitos projetos independentes colocarem a cara no sol. \u00c9 o nosso caso!\nEle funciona assim:\nPara apoiar, \u00e9 s\u00f3:\nN\u00f3s preparamos v\u00e1rias recompensas bacanas para os apoiadores do projeto. Voc\u00ea pode escolher um pacote que caiba no seu bolso, ajudando o projeto a ser financiado e ainda receber em casa!\nFrete gr\u00e1tis para todo o Brasil!\n-Camisetas nos modelos Buster & Nyana:\n-Seu retrato personalizado em pixel art, impresso em tamanho A5 (exemplo):\n-Sketches originais em tamanho A5 (exemplo):\n-Cena espacial personalizada em pixel art, impressa em tamanho A4 (exemplo):\n-Nocturne Volume #1:\n-(NOVIDADE) Beads artesanais limitados, incluem argola de chaveiro*:\n*diferentes dos chaveiros de acr\u00edlico, que n\u00e3o s\u00e3o artesanais e ser\u00e3o produzidos ap\u00f3s o t\u00e9rmino da campanha\nCaso o projeto atinja a meta inicial (!!!),  tamb\u00e9m temos algumas metas estendidas planejadas. No momento elas ainda s\u00e3o um sonho distante, mas voc\u00eas podem acompanhar a jornada at\u00e9 elas atrav\u00e9s desta linda imagem.png que vamos manter atualizada!!\n15mil - Projeto Financiado!\n20mil- Verniz localizado na capa!\n25mil- Mais op\u00e7\u00f5es de chaveiros! (Nyana e Buster)\n30mil- ?????", "categoria_multirrotulo_lda": {"0": 0.0, "1": 0.0, "2": 0.4, "3": 0.2, "4": 0.4, "5": 0.2, "6": 0.6, "7": 0.0, "8": 0.2, "9": 0.0, "10": 0.0, "11": 0.4, "12": 0.4, "13": 0.2, "14": 0.0, "15": 0.4, "16": 0.4, "17": 0.0, "18": 0.2, "19": 0.0, "20": 0.0, "21": 0.0, "22": 0.2, "23": 0.2, "24": 0.0, "25": 0.0, "26": 0.0, "27": 0.4, "28": 0.0, "29": 0.0, "30": 0.2, "31": 0.0, "32": 0.0, "33": 0.0, "34": 0.2, "35": 0.2, "36": 0.2, "37": 0.2, "38": 0.2, "39": 0.2, "40": 0.2, "41": 0.4, "42": 0.2, "43": 0.2, "44": 0.0, "45": 0.0, "46": 0.0, "47": 0.0, "48": 0.2, "49": 0.0}, "categoria_entidades": ["space punch", "hist\u00f3ria de mari", "inf\u00e2ncia", "grande amigo", "aclamado jogo retr\u00f4", "anos", "mesmo jogo", "reencontro inesperado", "decis\u00e3o", "velho amigo", "mari", "chaves do campeonato", "lembran\u00e7as", "pancadaria espacial", "p\u00e1ginas do quadrinho", "sequ\u00eancia de 3 p\u00e1ginas", "introdu\u00e7\u00e3o da hist\u00f3ria", "link", "pr\u00e9via do quadrinho", "18 primeiras p\u00e1ginas", "18 primeiras p\u00e1ginas da hist\u00f3ria", "baixo \\/", "livro", "gr\u00e1fica em outubro/17", "venda na fiq", "ccxp 2017", "bruno moraes", "b\u00fazios", "rj", "ci\u00eancia da computa\u00e7\u00e3o pela uff", "explora\u00e7\u00e3o espacial", "uma", "maiores frustra\u00e7\u00f5es", "consci\u00eancia", "suficiente", "olhada", "cinema", "quadrinhos", "2 anos", "pixel", "jogos", "ilustra\u00e7\u00e3o editorial", "mesmo na terceira pessoa", "fred cassar", "niter\u00f3i", "design de produto pela puc-rio", "quadrinista", "ilustrador freelancer", "autor dos webcomics santu\u00e1rios", "finalista do trof\u00e9u hqmix 2016 na categoria", "nocturne", "webcomic", "fred", "smash bros", "coisas", "m\u00fasica barulhenta", "curry", "mang\u00e1s", "chance", "catarse", "maior plataforma de financiamento coletivo do brasil", "melhor maneira", "projetos independentes", "cara no sol", "caso", "recompensas bacanas", "apoiadores do projeto", "pacote", "bolso", "projeto", "casa", "frete gr\u00e1tis", "brasil", "-camisetas nos modelos buster", "nyana", "retrato", "tamanho a5", "exemplo", "-sketches originais em tamanho a5", "-cena espacial", "tamanho a4", "-nocturne volume", "-(novidade", "beads artesanais", "argola de chaveiro", "chaveiros de acr\u00edlico", "t\u00e9rmino da campanha", "meta inicial", "metas", "planejadas", "momento", "sonho distante", "jornada", "linda", "projeto financiado", "20mil- verniz", "capa", "op\u00e7\u00f5es de chaveiros", "buster"]}