{"origem": "apoia.se", "categoria_teste_mencoes": {"saloes_humor": false, "hqmix": false, "ccxp": false, "fiq": false, "angelo_agostini": false, "politica": false, "questoes_genero": false, "lgbtqiamais": false, "terror": false, "humor": false, "herois": false, "disputa": false, "ficcao_cientifica": false, "fantasia": false, "folclore": false, "zine": false, "webformatos": false, "erotismo": false, "religiosidade": false, "jogos": false, "midia_independente": false}, "recompensas_menor_nominal": 1.0, "recompensas_menor_ajustado": 1.4992378481004045, "recompensas_quantidade": 5, "autoria_id": "747f4fc9-730e-43d8-b60b-5168a430f6c6", "autoria_nome": "hqbr", "autoria_nome_publico": "hqbr", "autoria_classificacao": "coletivo", "autoria_classificacao_id": 2, "social_seguidores": 0, "social_newsletter": false, "social_sub_contribuicoes_amigos": 0, "social_sub_novos_seguidores": 0, "social_sub_posts_projeto": 0, "social_projetos_contribuidos": 0, "social_projetos_publicados": 0, "geral_municipio": "S\u00e3o Paulo", "geral_uf": "SP", "geral_uf_br": "SP", "geral_city_id": 5274, "geral_content_rating": null, "geral_contributed_by_friends": null, "geral_capa_imagem": false, "geral_capa_video": false, "geral_dias_campanha": 3154, "geral_data_fim": "", "geral_data_ini": "2016-08-17T14:31:23.067", "geral_meta": 60, "geral_meta_corrigida": 89.95427088602428, "geral_arrecadado": 0, "geral_arrecadado_corrigido": 0.0, "geral_percentual_arrecadado": 0.05, "geral_conteudo_adulto": false, "geral_posts": 0, "geral_project_id": "57b4753bd7d2d2160024b989", "geral_modalidade": "sub", "geral_titulo": "HQBR", "geral_status": "published", "geral_total_contribuicoes": 0, "geral_total_apoiadores": 0, "geral_sobre": "Yo! Depois de mais de 3 longos e dif\u00edceis anos online n\u00f3s da equipe HQBR decidimos experimentar o apoio coletivo de nossos f\u00e3s. Ao longo desses anos temos nos mantido com alguma renda vinda de publicidade e, principalmente, de nosso pr\u00f3prio bolso; a ideia seria finalmente nos livrar de quaisquer propagandas no site, em especial do Adfly.\nEste site \u00e9 fruto de um sonho, foi o primeiro site a realmente oferecer leitura online de Hqs no Brasil, e n\u00f3s acreditamos que voc\u00eas, nossos fieis leitores e f\u00e3s, acreditam em nosso sonho, e est\u00e3o dispostos a ajudar a perpetuar nosso trabalho de divulga\u00e7\u00e3o da nona arte. Cremos que esse \u00e9 um trabalho importante, que precisa continuar, e que a populariza\u00e7\u00e3o de quadrinhos tem a capacidade de ampliar a consci\u00eancia, promovendo uma transforma\u00e7\u00e3o na forma das pessoas enxergarem a realidade e agirem perante o mundo.\nRecompensas\nPelo menos a principio n\u00e3o teremos nenhum sistema muito complexo de recompensas, preciso ser bem sincero quanto a isso, a pr\u00f3pria recompensa inicial ser\u00e1 o fato de conseguirmos manter o site online e atualizado, e, quem sabe, como disse acima, nos livrarmos de qualquer publicidade.\nContamos com seu apoio, obrigado!", "categoria_multirrotulo_lda": {"0": 0.2, "1": 0.2, "2": 0.6, "3": 0.2, "4": 0.8, "5": 0.0, "6": 0.2, "7": 0.2, "8": 0.0, "9": 0.2, "10": 0.4, "11": 0.6, "12": 0.4, "13": 0.0, "14": 0.0, "15": 0.2, "16": 0.0, "17": 0.0, "18": 0.2, "19": 0.2, "20": 0.0, "21": 0.2, "22": 0.4, "23": 0.4, "24": 0.0, "25": 0.2, "26": 0.0, "27": 0.4, "28": 0.2, "29": 0.2, "30": 0.4, "31": 0.0, "32": 0.2, "33": 0.0, "34": 0.2, "35": 0.4, "36": 0.4, "37": 0.2, "38": 0.4, "39": 0.0, "40": 0.2, "41": 0.4, "42": 0.4, "43": 0.4, "44": 0.0, "45": 0.4, "46": 0.0, "47": 0.0, "48": 0.4, "49": 0.2}, "categoria_entidades": ["yo", "3 longos", "dif\u00edceis anos", "equipe hqbr", "apoio coletivo", "f\u00e3s", "longo desses anos", "renda vinda de publicidade", "pr\u00f3prio bolso", "ideia", "propagandas no site", "especial do adfly", "site", "fruto", "sonho", "primeiro site", "leitura online de hqs no brasil", "fieis leitores", "trabalho de divulga\u00e7\u00e3o da nona arte", "trabalho importante", "populariza\u00e7\u00e3o de quadrinhos", "capacidade", "consci\u00eancia", "transforma\u00e7\u00e3o na forma das pessoas", "realidade", "mundo", "recompensas", "menos a principio", "sistema", "complexo de recompensas", "recompensa inicial", "fato", "site online", "publicidade", "apoio"]}