{"origem": "apoia.se", "categoria_teste_mencoes": {"saloes_humor": false, "hqmix": false, "ccxp": false, "fiq": false, "angelo_agostini": false, "politica": false, "questoes_genero": false, "lgbtqiamais": false, "terror": false, "humor": false, "herois": false, "disputa": false, "ficcao_cientifica": false, "fantasia": false, "folclore": false, "zine": false, "webformatos": false, "erotismo": false, "religiosidade": false, "jogos": false, "midia_independente": true}, "recompensas_menor_nominal": 1.0, "recompensas_menor_ajustado": 1.4925215794237583, "recompensas_quantidade": 7, "autoria_id": "36b06046-0539-4961-b234-b60c49e27a54", "autoria_nome": "clube do blue", "autoria_nome_publico": "clube do blue", "autoria_classificacao": "masculino", "autoria_classificacao_id": 3, "social_seguidores": 0, "social_newsletter": false, "social_sub_contribuicoes_amigos": 0, "social_sub_novos_seguidores": 0, "social_sub_posts_projeto": 0, "social_projetos_contribuidos": 0, "social_projetos_publicados": 0, "geral_municipio": "Campinas", "geral_uf": "SP", "geral_uf_br": "SP", "geral_city_id": 4818, "geral_content_rating": null, "geral_contributed_by_friends": null, "geral_capa_imagem": false, "geral_capa_video": false, "geral_dias_campanha": 3114, "geral_data_fim": "", "geral_data_ini": "2016-09-26T02:21:25.124", "geral_meta": 75, "geral_meta_corrigida": 111.93911845678187, "geral_arrecadado": 30, "geral_arrecadado_corrigido": 44.77564738271275, "geral_percentual_arrecadado": 0.4, "geral_conteudo_adulto": false, "geral_posts": 5, "geral_project_id": "57e886259cc94e1200d0b528", "geral_modalidade": "sub", "geral_titulo": "Clube do BLUE", "geral_status": "published", "geral_total_contribuicoes": 5, "geral_total_apoiadores": 5, "geral_sobre": "Ol\u00e1 pessoal!\n\u200b\nSe voc\u00ea chegou at\u00e9 aqui, quer dizer que gosta dos quadrinhos que publico na internet. Isso \u00e9 \u00f3timo, mas e se voc\u00ea pudesse ajudar o seu autor favorito a produzir mais conte\u00fado?\nEsse \u00e9 o objetivo do Apoia-se , um sistema de financiamento recorrente onde o f\u00e3 contribui mensalmente com os custos de produ\u00e7\u00e3o do material que gosta. Podendo apoiar e cancelar quando e quanto achar melhor.\nCom apenas R$1 voc\u00ea j\u00e1 pode fazer parte deste seleto grupo de adoradores de gatos e quadrinhos. Como troca, beneficiarei voc\u00ea com conte\u00fados extra, sorteios e descontos na lojinha do BLUE.\nA ideia \u00e9 que seja bom para todos e com isso posso focar na produ\u00e7\u00e3o de novos materiais da turma do BLUE e os Gatos .\nConfira ao lado as op\u00e7\u00f5es de apoio e metas, uma das novidades \u00e9 a moeda do clube chamada BLUETICOIN :\nAssim fica mais f\u00e1cil adquirir produtos e novidades da turma do BLUE, basta acumular e solicitar a troca para gerar o desconto. ;)\nQualquer d\u00favida \u00e9 s\u00f3 entrar em contato.\nAinda n\u00e3o conhece o PicPay ?\n\u00c9 um app para pagamentos diversos que serve para comprar cr\u00e9ditos do Uber, Steam Xbox Live, Deezer, Google Play, recarga para celular e transporte, pagar boletos, assinaturas de conte\u00fado e todos os estabelecimentos com m\u00e1quina Cielo aceitam o pagamento via QR-code do aplicativo sem taxa alguma.\nUmas das funcionalidades mais importantes \u00e9 o CASHBACK. Sim, dinheiro de volta!\nFiz uma p\u00e1gina no PicPay tipo a do Apoia.se como uma op\u00e7\u00e3o para ajudar o Clube do Blue . \u00c9 s\u00f3 procurar o perfil @blueeosgatos no aplicativo que funcionar\u00e1 da mesma forma.\u00a0A ideia \u00e9 somar o valor dos dois sites para atingirmos as metas e termos mais conte\u00fado.\nBaixe AQUI o aplicativo. Use o meu c\u00f3digo de convite DYE1 e nos primeiros R$10 que gastar, voc\u00ea ganha R$10 de volta para usar como quiser\u2026 inclusive reverter para seu produtor de conte\u00fado favorito.\nUm grande abra\u00e7o do Paulo, Blue e os gatos!", "categoria_multirrotulo_lda": {"0": 0.0, "1": 0.0, "2": 0.0, "3": 0.0, "4": 0.2, "5": 0.2, "6": 0.2, "7": 0.0, "8": 0.0, "9": 0.0, "10": 0.0, "11": 0.2, "12": 0.2, "13": 0.0, "14": 0.0, "15": 0.2, "16": 0.4, "17": 0.0, "18": 0.0, "19": 0.0, "20": 0.0, "21": 0.0, "22": 0.0, "23": 0.0, "24": 0.0, "25": 0.0, "26": 0.0, "27": 0.4, "28": 0.0, "29": 0.0, "30": 0.0, "31": 0.0, "32": 0.0, "33": 0.0, "34": 0.0, "35": 0.0, "36": 0.0, "37": 0.0, "38": 0.0, "39": 0.0, "40": 0.0, "41": 0.0, "42": 0.0, "43": 0.2, "44": 0.0, "45": 0.2, "46": 0.0, "47": 0.0, "48": 0.2, "49": 0.0}, "categoria_entidades": ["\u200b", "quadrinhos", "publico na internet", "autor favorito", "conte\u00fado", "objetivo do apoia-se", "sistema de financiamento recorrente", "f\u00e3", "custos de produ\u00e7\u00e3o do material", "parte deste seleto grupo de adoradores de gatos", "troca", "voc\u00ea com conte\u00fados extra", "sorteios", "descontos na lojinha do blue", "ideia", "bom", "produ\u00e7\u00e3o de novos materiais da turma do blue", "gatos", "lado", "op\u00e7\u00f5es de apoio", "metas", "uma das novidades", "moeda do clube", "blueticoin", "produtos", "novidades da turma do blue", "desconto", "d\u00favida", "contato", "picpay", "app para pagamentos diversos", "cr\u00e9ditos do uber", "steam xbox live", "deezer", "google play", "recarga para celular", "transporte", "boletos", "assinaturas de conte\u00fado", "estabelecimentos com m\u00e1quina cielo", "pagamento", "aplicativo sem taxa", "funcionalidades", "cashback", "dinheiro de volta", "p\u00e1gina no picpay tipo", "op\u00e7\u00e3o", "clube do blue", "perfil", "aplicativo", "mesma forma", "valor dos dois sites", "termos", "baixe aqui", "c\u00f3digo de convite dye1", "10 de volta", "produtor de conte\u00fado favorito", "grande abra\u00e7o do paulo", "blue"]}