{"origem": "apoia.se", "categoria_teste_mencoes": {"saloes_humor": false, "hqmix": false, "ccxp": false, "fiq": false, "angelo_agostini": false, "politica": false, "questoes_genero": false, "lgbtqiamais": false, "terror": false, "humor": false, "herois": false, "disputa": false, "ficcao_cientifica": false, "fantasia": false, "folclore": false, "zine": false, "webformatos": false, "erotismo": false, "religiosidade": false, "jogos": false, "midia_independente": true}, "recompensas_menor_nominal": 1.0, "recompensas_menor_ajustado": 1.4796079448257335, "recompensas_quantidade": 7, "autoria_id": "9d542de3-11d8-49f5-8b32-16e465c8617f", "autoria_nome": "nerd tatuado", "autoria_nome_publico": "nerd tatuado", "autoria_classificacao": "masculino", "autoria_classificacao_id": 3, "social_seguidores": 0, "social_newsletter": false, "social_sub_contribuicoes_amigos": 0, "social_sub_novos_seguidores": 0, "social_sub_posts_projeto": 0, "social_projetos_contribuidos": 0, "social_projetos_publicados": 0, "geral_municipio": "Arapiraca", "geral_uf": "AL", "geral_uf_br": "AL", "geral_city_id": 107, "geral_content_rating": null, "geral_contributed_by_friends": null, "geral_capa_imagem": false, "geral_capa_video": false, "geral_dias_campanha": 3007, "geral_data_fim": "", "geral_data_ini": "2017-01-11T12:01:49.726", "geral_meta": 100, "geral_meta_corrigida": 147.96079448257333, "geral_arrecadado": 0, "geral_arrecadado_corrigido": 0.0, "geral_percentual_arrecadado": 0.0, "geral_conteudo_adulto": false, "geral_posts": 0, "geral_project_id": "58761ead8330820400a47d05", "geral_modalidade": "sub", "geral_titulo": "Nerd Tatuado", "geral_status": "published", "geral_total_contribuicoes": 0, "geral_total_apoiadores": 0, "geral_sobre": "Fala galera nerd! Sejam muito bem vindos ao nosso Apoia.se !\nComo voc\u00eas podem ver, atualmente o nosso site n\u00e3o tem patrocinadores, nem o nosso canal ou podcast. Tudo que j\u00e1 foi feito em nossas plataformas foi por iniciativa dos nossos colaboradores ou em forma de parceria.\nO nosso principal conceito sempre foi a honestidade e dar a nossa opini\u00e3o sobre o conte\u00fado que estamos divulgando. At\u00e9 hoje no nosso site tudo foi feito sem ganhar nada, mas precisamos da ajuda de voc\u00ea para, em 2017, ter uma maior dedica\u00e7\u00e3o ao conte\u00fado que produzimos. N\u00f3s queremos produzir mais para voc\u00eas!\nSEJA NOSSO APOIADOR !\nSe voc\u00ea curte o nosso conte\u00fado e a nossa plataforma, nos apoie! Queremos ter um contato maior com voc\u00ea: iremos ter um grupo s\u00f3 nosso para conversar sobre as pautas, e voc\u00ea poder\u00e1 at\u00e9 ajudar na constru\u00e7\u00e3o do nosso conte\u00fado!\nO que for arrecadado, com a sua grandiosa doa\u00e7\u00e3o, vai nos ajudar a produzir mais v\u00eddeos, textos, podcast\u2026 mais tudo! Ajudar\u00e1 tamb\u00e9m as nossas redes sociais e custos de divulga\u00e7\u00e3o.\nE os apoiadores poder\u00e3o tamb\u00e9m participar de sorteios exclusivos de itens da nossa NTBox!\nPara finalizar, queremos agradecer a voc\u00ea que dedicou um pouquinho do seu tempo para ler o nosso pedido. Se estiver afim e quiser ajudar iremos agradecer a voc\u00ea com todo amor dos nossos cora\u00e7\u00f5ezinhos tatuados.\nCUMPRIR METAS, N\u00d3S DEVEMOS!\nO Nerd Tatuado se compromete com voc\u00ea, querido apoiador, a cumprir algumas metas se a nossa campanha alcan\u00e7ar os seguintes valores:\nLembrando que os apoiadores receber\u00e3o n\u00fameros adicionais para participar dos sorteios! \u00c9 isso mesmo! Mais chances de ganhar!\nINFORMA\u00c7\u00c3O IMPORTANTE:\nSabemos que algumas pessoas querem ajudar, mas n\u00e3o conseguem fazer o pagamento via cart\u00e3o de cr\u00e9dito ou boleto. N\u00e3o se preocupe pequeno Padawan! Vamos deixar aqui o n\u00ba da conta corrente do chefinho para quem quiser fazer o dep\u00f3sito de maneira direta:\nJos\u00e9 Faustino de Oliveira Neto\nCaixa\nAg.0056\nCC.00033489-1\nCPF068.555.514-32\nAh! E n\u00e3o esque\u00e7a de enviar os comprovantes de dep\u00f3sito para o nosso email ( contato@nerdtatuado.com.br ). Assim saberemos quem contribuiu e ficaremos muito felizes de inclu\u00ed-lo nas premia\u00e7\u00f5es e sorteios!\nMUITO OBRIGADO! QUE A FOR\u00c7A ESTEJA COM VOC\u00ca!\n** Os objetivos e recompensas ser\u00e3o conclu\u00eddas sempre no m\u00eas seguinte \u00e0 doa\u00e7\u00e3o, de acordo com o pagamento: cart\u00e3o, paypal ou dep\u00f3sito banc\u00e1rio. Para que possamos, com o dinheiro dos padrinhos, comprar os itens a serem sorteados. Tamb\u00e9m evita que algum Sith diga que vai pagar mas suspenda o pagamento ap\u00f3s o recebimento dos pr\u00eamios sorteados.", "categoria_multirrotulo_lda": {"0": 0.0, "1": 0.0, "2": 0.0, "3": 0.0, "4": 0.0, "5": 0.0, "6": 0.2, "7": 0.0, "8": 0.4, "9": 0.0, "10": 0.0, "11": 0.0, "12": 0.0, "13": 0.0, "14": 0.0, "15": 0.0, "16": 0.6, "17": 0.0, "18": 0.0, "19": 0.0, "20": 0.0, "21": 0.0, "22": 0.0, "23": 0.0, "24": 0.0, "25": 0.0, "26": 0.0, "27": 0.0, "28": 0.0, "29": 0.0, "30": 0.0, "31": 0.0, "32": 0.0, "33": 0.0, "34": 0.0, "35": 0.0, "36": 0.0, "37": 0.0, "38": 0.0, "39": 0.0, "40": 0.0, "41": 0.0, "42": 0.0, "43": 0.2, "44": 0.0, "45": 0.2, "46": 0.0, "47": 0.0, "48": 0.0, "49": 0.0}, "categoria_entidades": ["galera nerd", "site", "patrocinadores", "canal", "podcast", "plataformas", "iniciativa", "colaboradores", "forma de parceria", "principal conceito", "honestidade", "opini\u00e3o", "conte\u00fado", "ajuda", "maior dedica\u00e7\u00e3o ao conte\u00fado", "apoiador", "plataforma", "contato maior", "grupo", "pautas", "constru\u00e7\u00e3o", "grandiosa doa\u00e7\u00e3o", "v\u00eddeos", "textos", "redes sociais", "custos de divulga\u00e7\u00e3o", "apoiadores", "sorteios exclusivos de itens", "ntbox", "pouquinho", "tempo", "pedido", "voc\u00ea", "amor", "cora\u00e7\u00f5ezinhos tatuados", "cumprir metas", "n\u00f3s devemos", "nerd", "querido apoiador", "metas", "campanha", "seguintes valores", "n\u00fameros adicionais", "sorteios", "chances", "informa\u00e7\u00e3o importante", "pessoas", "pagamento", "cart\u00e3o de cr\u00e9dito", "boleto", "pequeno padawan", "n\u00ba da conta corrente do chefinho", "dep\u00f3sito de maneira direta", "jos\u00e9 faustino de oliveira neto", "caixa", "ag.0056", "cpf068.555. 514-32", "comprovantes de dep\u00f3sito", "email", "felizes", "premia\u00e7\u00f5es", "for\u00e7a", "objetivos", "m\u00eas seguinte \u00e0 doa\u00e7\u00e3o", "acordo", "cart\u00e3o", "paypal", "dep\u00f3sito banc\u00e1rio", "dinheiro dos padrinhos", "itens", "sith", "recebimento dos pr\u00eamios"]}