{"origem": "apoia.se", "categoria_teste_mencoes": {"saloes_humor": false, "hqmix": false, "ccxp": false, "fiq": false, "angelo_agostini": false, "politica": false, "questoes_genero": false, "lgbtqiamais": false, "terror": false, "humor": false, "herois": false, "disputa": false, "ficcao_cientifica": false, "fantasia": false, "folclore": false, "zine": false, "webformatos": false, "erotismo": false, "religiosidade": false, "jogos": false, "midia_independente": false}, "recompensas_menor_nominal": 10.0, "recompensas_menor_ajustado": 14.618461622961215, "recompensas_quantidade": 1, "autoria_id": "c564fa65-2a90-456a-919d-147a5f2a0027", "autoria_nome": "comic club br", "autoria_nome_publico": "comic club br", "autoria_classificacao": "outros", "autoria_classificacao_id": 5, "social_seguidores": 0, "social_newsletter": false, "social_sub_contribuicoes_amigos": 0, "social_sub_novos_seguidores": 0, "social_sub_posts_projeto": 0, "social_projetos_contribuidos": 0, "social_projetos_publicados": 0, "geral_municipio": "Americana", "geral_uf": "SP", "geral_uf_br": "SP", "geral_city_id": 4728, "geral_content_rating": null, "geral_contributed_by_friends": null, "geral_capa_imagem": false, "geral_capa_video": false, "geral_dias_campanha": 2872, "geral_data_fim": "", "geral_data_ini": "2017-05-25T23:04:42.268", "geral_meta": 50, "geral_meta_corrigida": 73.09230811480609, "geral_arrecadado": 0, "geral_arrecadado_corrigido": 0.0, "geral_percentual_arrecadado": 0.0, "geral_conteudo_adulto": false, "geral_posts": 0, "geral_project_id": "5927630af6a15f0300ec7066", "geral_modalidade": "sub", "geral_titulo": "Comic Club BR", "geral_status": "published", "geral_total_contribuicoes": 0, "geral_total_apoiadores": 0, "geral_sobre": "E ae, quadrinheiros! Tudo bem com voc\u00eas?\nSomos o Comic Club BR , clube de descontos e sorteios de quadrinhos que voc\u00ea ter\u00e1 todos os meses, voc\u00ea s\u00f3 encontra aqui!\nClaro, que para isso, precisamos da colabora\u00e7\u00e3o de todos para investirmos nas HQs a serem sorteadas.\nA partir de R$ 10,00 voc\u00ea j\u00e1 concorre (assim que o valor da meta for atingida) a sorteios mensais de quadrinhos para aumentar a sua cole\u00e7\u00e3o e deixar cada vez mais bonita a sua estante.\nA cada R$ 10,00 de apoio, voc\u00ea entra na fila com um n\u00famero que ser\u00e1 usado para sortear um quadrinho ou brinde pelo site www.sorteador.com.br .\nAtingindo a meta necess\u00e1ria, come\u00e7aremos os sorteios e a partir da\u00ed, quanto maior o valor arrecadado maior a quantidade de quadrinhos e brindes sorteados por m\u00eas. Podendo ser cole\u00e7\u00f5es, combos entre outros.\nTodo o dinheiro aqui arrecadado ser\u00e1 convertido em quadrinhos e brindes a serem sorteados para voc\u00eas!\nAguardamos o apoio de todos!\nN\u00daMERO DA SORTE:\n1.\n2.\n3.\n4.\n5.\n6.\n7.\n8.\n9.\n10.\n11.\n12.\n13.\n14.\n15.\n16.\n17.\n18.\n19.\n20.\n21.\n22.\n23.\n24.\n25.\n26.\n27.\n28.\n29.\n30.\n31.\n32.\n33.\n34.\n35.\n36.\n37.\n38.\n39.\n40.\n41.\n42.\n43.\n44.\n45.\n46.\n47.\n48.\n49.\n50.", "categoria_multirrotulo_lda": {"0": 0.0, "1": 0.0, "2": 0.0, "3": 0.0, "4": 0.0, "5": 0.0, "6": 0.0, "7": 0.0, "8": 0.2, "9": 0.0, "10": 0.0, "11": 0.0, "12": 0.0, "13": 0.0, "14": 0.2, "15": 0.0, "16": 0.0, "17": 0.0, "18": 0.0, "19": 0.0, "20": 0.0, "21": 0.0, "22": 0.0, "23": 0.0, "24": 0.0, "25": 0.0, "26": 0.2, "27": 0.0, "28": 0.0, "29": 0.0, "30": 0.0, "31": 0.0, "32": 0.0, "33": 0.0, "34": 0.0, "35": 0.0, "36": 0.0, "37": 0.0, "38": 0.0, "39": 0.0, "40": 0.0, "41": 0.0, "42": 0.0, "43": 0.2, "44": 0.0, "45": 0.0, "46": 0.0, "47": 0.0, "48": 0.0, "49": 0.0}, "categoria_entidades": ["voc\u00eas", "comic club br", "clube de descontos", "sorteios de quadrinhos", "meses", "colabora\u00e7\u00e3o", "hqs", "partir", "valor da meta", "sorteios mensais de quadrinhos", "cole\u00e7\u00e3o", "cada", "estante", "10,00 de apoio", "fila", "n\u00famero", "quadrinho", "brinde pelo site www.sorteador.com.br", "meta necess\u00e1ria", "sorteios", "valor", "quantidade de quadrinhos", "brindes", "m\u00eas", "cole\u00e7\u00f5es", "combos", "dinheiro", "quadrinhos", "apoio", "n\u00famero da sorte"]}