{"origem": "catarse", "categoria_teste_mencoes": {"saloes_humor": false, "hqmix": false, "ccxp": true, "fiq": false, "angelo_agostini": false, "politica": false, "questoes_genero": false, "lgbtqiamais": false, "terror": true, "humor": true, "herois": false, "disputa": false, "ficcao_cientifica": false, "fantasia": false, "folclore": false, "zine": false, "webformatos": false, "erotismo": false, "religiosidade": false, "jogos": true, "midia_independente": false}, "recompensas_menor_nominal": 60.0, "recompensas_menor_ajustado": 87.51855672359277, "recompensas_quantidade": 1, "autoria_id": 282849, "autoria_nome": "werllen holanda", "autoria_nome_publico": "werllen holanda", "autoria_classificacao": "masculino", "autoria_classificacao_id": 3, "social_seguidores": 71, "social_newsletter": false, "social_sub_contribuicoes_amigos": true, "social_sub_novos_seguidores": true, "social_sub_posts_projeto": true, "social_projetos_contribuidos": 26, "social_projetos_publicados": 1, "geral_municipio": "Mau\u00e1", "geral_uf": "SP", "geral_uf_br": "SP", "geral_city_id": 5042, "geral_content_rating": 1, "geral_contributed_by_friends": false, "geral_capa_imagem": false, "geral_capa_video": true, "geral_dias_campanha": 60, "geral_data_fim": "2017-10-08T02:59:59.999999", "geral_data_ini": "2017-08-08T06:53:32.201297", "geral_meta": 5000.0, "geral_meta_corrigida": 7293.213060299398, "geral_arrecadado": 5525.0, "geral_arrecadado_corrigido": 8059.000431630835, "geral_percentual_arrecadado": 110.5, "geral_conteudo_adulto": false, "geral_posts": 8, "geral_project_id": 59583, "geral_modalidade": "aon", "geral_titulo": "Love of the Dead", "geral_status": "successful", "geral_total_contribuicoes": 141, "geral_total_apoiadores": 136, "geral_sobre": "Love of the Dead \u00e9 uma HQ com hist\u00f3ria fechada, sem di\u00e1logos e uma grande homenagem ao universo de zumbis e filmes de terror.\nGeorge \u00e9 um zumbi que vive numa mon\u00f3tona horda de mortos vivos. Mas ele \u00e9 um pouco diferente. Ao inv\u00e9s de dilacerar corpos e devorar c\u00e9rebros, a \u00fanica coisa que George quer \u00e9 encontrar algu\u00e9m para amar. Nessa busca, ele passa seus dias perambulando a procura de algu\u00e9m que retribua esse sentimento. Mas um dia, George resolve dar um passo al\u00e9m de sua vizinhan\u00e7a \u00e0 procura de seu grande amor. \u00c9 a\u00ed que nossa aventura come\u00e7a. Acompanhe nosso amigo nessa jornada cheia de amor, romance, descobrimento e, claro, miolos.\nO financiamento coletivo ir\u00e1 cobrir os custos de impress\u00e3o, recompensas e envio. A previs\u00e3o de entrega do \u00e1lbum \u00e9 dezembro. Os apoidores tamb\u00e9m ter\u00e3o a op\u00e7\u00e3o de retirar as suas recompensas diretamente comigo durante a CCXP \u2013 ComiconCon Experience.\nWerllen Holanda \u00e9 ilustrador, tem 28 anos e veio da cidade de Mau\u00e1-SP. Atua h\u00e1 6 anos na \u00e1rea de ilustra\u00e7\u00e3o e anima\u00e7\u00e3o, e atualmente trabalha na produ\u00e7\u00e3o de jogos mobile. Em 2016 lan\u00e7ou seu primeiro trabalho autoral, a HQ \"Emy e o \u00faltimo gato do mundo\", desde ent\u00e3o segue se aventurando no mundo dos quadrinhos. \u00c9 apaixonado por rock'n'roll cl\u00e1ssico, anos 80 e gatinhos, tudo isso, sempre acompanhado de uma boa x\u00edcara de caf\u00e9.\nConhe\u00e7a mais do meu trabalho em: Instragram Facebook Behance\nO Catarse \u00e9 um site brasileiro de financiamento coletivo que tem ajudado v\u00e1rias pessoas a concretizar seus projetos em sua plataforma. Ele funciona mais ou menos assim: - O autor cria a campanha, estipula uma meta e cria as recompensas para os apoiadores - Voc\u00ea escolhe a recompensa que mais lhe agradar, e isso ir\u00e1 colaborar para que o projeto alcance o valor necess\u00e1rio para ser financiado. - Alcan\u00e7ando a meta, o projeto \u00e9 financiado e todos os apoiadores recebem suas recompensas. - Se a meta n\u00e3o for atingida, n\u00e3o se preocupe, o Catarse devolver\u00e1 seu dinheiro .", "categoria_multirrotulo_lda": {"0": 0.2, "1": 0.2, "2": 0.4, "3": 0.6, "4": 0.6, "5": 0.2, "6": 0.2, "7": 0.0, "8": 0.2, "9": 0.0, "10": 0.2, "11": 0.8, "12": 0.4, "13": 0.2, "14": 0.0, "15": 0.2, "16": 0.2, "17": 0.0, "18": 0.0, "19": 0.0, "20": 0.2, "21": 0.0, "22": 0.2, "23": 0.2, "24": 0.2, "25": 0.2, "26": 0.0, "27": 0.6, "28": 0.4, "29": 0.2, "30": 0.4, "31": 0.2, "32": 0.0, "33": 0.0, "34": 0.2, "35": 0.4, "36": 0.6, "37": 0.0, "38": 0.4, "39": 0.4, "40": 0.2, "41": 0.6, "42": 0.6, "43": 0.4, "44": 0.4, "45": 0.6, "46": 0.0, "47": 0.0, "48": 0.4, "49": 0.2}, "categoria_entidades": ["love of the dead", "hq com hist\u00f3ria", "di\u00e1logos", "grande homenagem ao universo de zumbis", "filmes de terror", "george", "zumbi", "mon\u00f3tona horda de mortos vivos", "inv\u00e9s", "corpos", "c\u00e9rebros", "\u00fanica coisa", "busca", "dias", "procura", "sentimento", "um dia", "passo", "vizinhan\u00e7a \u00e0 procura", "grande amor", "aventura", "amigo nessa jornada cheia de amor", "romance", "descobrimento", "miolos", "financiamento coletivo", "custos de impress\u00e3o", "envio", "previs\u00e3o de entrega do \u00e1lbum", "dezembro", "apoidores", "op\u00e7\u00e3o", "recompensas", "comigo", "ccxp", "comiconcon experience", "werllen holanda", "ilustrador", "28 anos", "cidade de mau\u00e1-sp", "6 anos na \u00e1rea de ilustra\u00e7\u00e3o", "anima\u00e7\u00e3o", "produ\u00e7\u00e3o de jogos mobile", "primeiro trabalho autoral", "hq", "emy", "\u00faltimo gato do mundo", "ent\u00e3o", "mundo dos quadrinhos", "rock'n'roll cl\u00e1ssico", "anos 80", "gatinhos", "boa x\u00edcara de caf\u00e9", "trabalho", "instragram facebook behance", "catarse", "site brasileiro de financiamento coletivo", "pessoas", "projetos", "plataforma", "menos", "autor", "campanha", "meta", "apoiadores", "recompensa", "projeto", "valor necess\u00e1rio", "dinheiro"]}