{"origem": "apoia.se", "categoria_teste_mencoes": {"saloes_humor": false, "hqmix": false, "ccxp": false, "fiq": false, "angelo_agostini": false, "politica": false, "questoes_genero": false, "lgbtqiamais": false, "terror": false, "humor": false, "herois": false, "disputa": false, "ficcao_cientifica": false, "fantasia": false, "folclore": false, "zine": false, "webformatos": false, "erotismo": false, "religiosidade": false, "jogos": false, "midia_independente": false}, "recompensas_menor_nominal": 10.0, "recompensas_menor_ajustado": 14.586426120598796, "recompensas_quantidade": 4, "autoria_id": "1d586158-53e8-4ca4-b83b-aa791d0f1f49", "autoria_nome": "viva sp", "autoria_nome_publico": "viva sp", "autoria_classificacao": "outros", "autoria_classificacao_id": 5, "social_seguidores": 0, "social_newsletter": false, "social_sub_contribuicoes_amigos": 0, "social_sub_novos_seguidores": 0, "social_sub_posts_projeto": 0, "social_projetos_contribuidos": 0, "social_projetos_publicados": 0, "geral_municipio": "S\u00e3o Paulo", "geral_uf": "SP", "geral_uf_br": "SP", "geral_city_id": 5274, "geral_content_rating": null, "geral_contributed_by_friends": null, "geral_capa_imagem": false, "geral_capa_video": false, "geral_dias_campanha": 2788, "geral_data_fim": "", "geral_data_ini": "2017-08-18T00:55:32.750", "geral_meta": 5000, "geral_meta_corrigida": 7293.213060299398, "geral_arrecadado": 0, "geral_arrecadado_corrigido": 0.0, "geral_percentual_arrecadado": 0.0, "geral_conteudo_adulto": false, "geral_posts": 0, "geral_project_id": "59963b0464a4320300cd4d15", "geral_modalidade": "sub", "geral_titulo": "Viva SP", "geral_status": "published", "geral_total_contribuicoes": 0, "geral_total_apoiadores": 0, "geral_sobre": "N\u00f3s do Viva SP acreditamos que a cultura contribui para o crescimento pessoal e profissional das pessoas. Com essa ideia em mente, temos trabalhado numa quest\u00e3o muito importante: a valoriza\u00e7\u00e3o do trabalho dos artistas e da cultura produzida na cidade de S\u00e3o Paulo.\nPara isso, desenvolvemos um projeto multim\u00eddia composto por uma Plataforma Colaborativa (no formato de site) e um canal de v\u00eddeos. At\u00e9 o momento conseguimos realizar 5 v\u00eddeos mostrando atividades de lazer e cultura em S\u00e3o Paulo. Um desses v\u00eddeos (demonstrado abaixo ainda com o antigo nome de Agenda Cultural), fez com que o grupo de teatro divulgado fosse contratado para apresentar seu espet\u00e1culo no Estado de Minas Gerais. A l\u00e9m disso, com nosso projeto para fazer o nova Plataforma Colaborativa sobre lazer e cultura da cidade, vencemos edital da Prefeitura\u00a0 ficando entre as melhores iniciativas tecnol\u00f3gicas da cidade. A Plataforma est\u00e1 em fase final de desenvolvimento e tem previs\u00e3o de lan\u00e7amento para o m\u00eas de Novembro de 2017.\nV\u00eddeo gravado com o grupo N\u00facleo Teatral Simbi\u00f3tico na Galeria Olido\nV\u00eddeo sobre passeio de bicicleta gratuito na Avenida Paulista\nV\u00eddeo com os vencedores do premio de melhor \"hot-dog\" da cidade", "categoria_multirrotulo_lda": {"0": 0.2, "1": 0.0, "2": 0.0, "3": 0.2, "4": 0.2, "5": 0.0, "6": 0.2, "7": 0.2, "8": 0.0, "9": 0.0, "10": 0.2, "11": 0.0, "12": 0.2, "13": 0.0, "14": 0.0, "15": 0.2, "16": 0.2, "17": 0.0, "18": 0.0, "19": 0.2, "20": 0.0, "21": 0.0, "22": 0.0, "23": 0.0, "24": 0.0, "25": 0.0, "26": 0.0, "27": 0.0, "28": 0.0, "29": 0.0, "30": 0.0, "31": 0.0, "32": 0.0, "33": 0.0, "34": 0.0, "35": 0.0, "36": 0.0, "37": 0.0, "38": 0.0, "39": 0.0, "40": 0.0, "41": 0.0, "42": 0.0, "43": 0.0, "44": 0.0, "45": 0.2, "46": 0.0, "47": 0.0, "48": 0.0, "49": 0.0}, "categoria_entidades": ["viva sp", "cultura", "crescimento pessoal", "profissional das pessoas", "ideia em mente", "quest\u00e3o", "valoriza\u00e7\u00e3o do trabalho dos artistas", "cidade de s\u00e3o paulo", "projeto multim\u00eddia", "plataforma colaborativa", "formato de site", "canal de v\u00eddeos", "momento", "5 v\u00eddeos", "atividades de lazer", "cultura em s\u00e3o paulo", "um desses v\u00eddeos", "antigo nome de agenda cultural", "grupo de teatro", "espet\u00e1culo no estado de minas gerais", "l\u00e9m", "projeto", "nova plataforma colaborativa sobre lazer", "cultura da cidade", "edital da prefeitura", "melhores iniciativas tecnol\u00f3gicas da cidade", "plataforma", "fase final de desenvolvimento", "previs\u00e3o de lan\u00e7amento", "m\u00eas de novembro de 2017", "v\u00eddeo", "grupo n\u00facleo teatral simbi\u00f3tico na galeria olido", "v\u00eddeo sobre passeio de bicicleta gratuito na avenida paulista", "vencedores do premio de melhor", "hot-dog", "cidade"]}