{"origem": "apoia.se", "categoria_teste_mencoes": {"saloes_humor": false, "hqmix": false, "ccxp": false, "fiq": false, "angelo_agostini": false, "politica": false, "questoes_genero": false, "lgbtqiamais": false, "terror": false, "humor": false, "herois": false, "disputa": false, "ficcao_cientifica": false, "fantasia": false, "folclore": false, "zine": false, "webformatos": false, "erotismo": false, "religiosidade": true, "jogos": false, "midia_independente": false}, "recompensas_menor_nominal": 30.0, "recompensas_menor_ajustado": 43.27268402252839, "recompensas_quantidade": 4, "autoria_id": "538f0330-38c0-4bba-8d85-c18ddf482ee3", "autoria_nome": "arrecadando sonhos", "autoria_nome_publico": "arrecadando sonhos", "autoria_classificacao": "outros", "autoria_classificacao_id": 5, "social_seguidores": 0, "social_newsletter": false, "social_sub_contribuicoes_amigos": 0, "social_sub_novos_seguidores": 0, "social_sub_posts_projeto": 0, "social_projetos_contribuidos": 0, "social_projetos_publicados": 0, "geral_municipio": "Belo Horizonte", "geral_uf": "MG", "geral_uf_br": "MG", "geral_city_id": 1634, "geral_content_rating": null, "geral_contributed_by_friends": null, "geral_capa_imagem": false, "geral_capa_video": false, "geral_dias_campanha": 2670, "geral_data_fim": "", "geral_data_ini": "2017-12-14T12:35:24.288", "geral_meta": 67000, "geral_meta_corrigida": 96642.3276503134, "geral_arrecadado": 0, "geral_arrecadado_corrigido": 0.0, "geral_percentual_arrecadado": 0.0, "geral_conteudo_adulto": false, "geral_posts": 0, "geral_project_id": "5a32700c652d1d766089eee1", "geral_modalidade": "sub", "geral_titulo": "Arrecadando Sonhos", "geral_status": "published", "geral_total_contribuicoes": 0, "geral_total_apoiadores": 0, "geral_sobre": "A Cidade dos Meninos S\u00e3o Vicente de Paulo, institui\u00e7\u00e3o filantr\u00f3pica atuante no atendimento \u00e0 popula\u00e7\u00e3o carente, j\u00e1 assistiu, em 21 anos de exist\u00eancia, quase 100 mil crian\u00e7as e jovens, promovendo moradia, alimenta\u00e7\u00e3o, sa\u00fade, educa\u00e7\u00e3o em tempo integral, cultura, esporte, lazer, forma\u00e7\u00e3o profissional, moral e religiosa.\nLocalizada em Ribeir\u00e3o das Neves, regi\u00e3o metropolitana de Belo Horizonte, MG, e com uma \u00e1rea de 540 mil m2, a Cidade dos Meninos oferece uma estrutura composta por escolas, alojamentos, refeit\u00f3rio, quadras de esportes, gin\u00e1sio coberto, oficinas profissionalizantes, fazenda-escola, audit\u00f3rio, campos de futebol, sal\u00e3o de festas e igreja.\nTodos os nossos funcion\u00e1rios atuam como educadores, um trabalho que vai al\u00e9m de simplesmente transferir conhecimento. Ele cria possibilidades para que esses alunos sejam inseridos no mercado de trabalho, aumentando as chances de gera\u00e7\u00e3o de renda de suas fam\u00edlias.\nA campanha Arrecadando Sonhos nasceu da necessidade de trocar os colch\u00f5es dos dormit\u00f3rios da Cidade dos Meninos que, com mais de 10 anos de uso, j\u00e1 se encontram em condi\u00e7\u00f5es prec\u00e1rias, muitas vezes mofados, rasgados e/ou furados. Al\u00e9m dos danos causados pela deprecia\u00e7\u00e3o, enfrentamos, em nosso dia a dia, agravantes como:\n-uma alta rotatividade, uma vez que os alojamentos atendem mais de 3 mil crian\u00e7as e adolescentes a cada ano.\n-enurese noturna (xixi na cama) manifestada por alguns alunos, muitas vezes desencadeada por dist\u00farbios psicol\u00f3gicos consequentes de traumas e/ou problemas emocionais diversos.\nAcreditamos na constru\u00e7\u00e3o de um futuro melhor, mas precisamos da sua ajuda para continuar transformando vidas. Seu apoio \u00e9 muito importante. Juntos n\u00f3s podemos mais!", "categoria_multirrotulo_lda": {"0": 0.4, "1": 0.0, "2": 0.2, "3": 0.4, "4": 0.4, "5": 0.0, "6": 0.2, "7": 0.0, "8": 0.4, "9": 0.0, "10": 0.4, "11": 0.2, "12": 0.4, "13": 0.2, "14": 0.2, "15": 0.2, "16": 0.2, "17": 0.0, "18": 0.0, "19": 0.0, "20": 0.2, "21": 0.0, "22": 0.2, "23": 0.4, "24": 0.0, "25": 0.2, "26": 0.4, "27": 0.4, "28": 0.2, "29": 0.0, "30": 0.2, "31": 0.2, "32": 0.0, "33": 0.0, "34": 0.2, "35": 0.4, "36": 0.2, "37": 0.0, "38": 0.4, "39": 0.0, "40": 0.2, "41": 0.4, "42": 0.4, "43": 0.0, "44": 0.0, "45": 0.0, "46": 0.0, "47": 0.0, "48": 0.2, "49": 0.0}, "categoria_entidades": ["cidade dos meninos", "vicente de paulo", "institui\u00e7\u00e3o filantr\u00f3pica atuante no atendimento \u00e0 popula\u00e7\u00e3o carente", "21 anos de exist\u00eancia", "100 mil crian\u00e7as", "jovens", "moradia", "alimenta\u00e7\u00e3o", "sa\u00fade", "educa\u00e7\u00e3o em tempo integral", "cultura", "esporte", "lazer", "forma\u00e7\u00e3o profissional", "ribeir\u00e3o das neves", "regi\u00e3o metropolitana de belo horizonte", "mg", "\u00e1rea de 540 mil m2", "estrutura", "escolas", "alojamentos", "refeit\u00f3rio", "quadras de esportes", "gin\u00e1sio coberto", "oficinas profissionalizantes", "fazenda-escola", "audit\u00f3rio", "campos de futebol", "sal\u00e3o de festas", "igreja", "funcion\u00e1rios", "educadores", "trabalho", "conhecimento", "possibilidades", "alunos", "mercado de trabalho", "chances de gera\u00e7\u00e3o de renda", "fam\u00edlias", "campanha arrecadando sonhos", "necessidade", "colch\u00f5es dos dormit\u00f3rios da cidade dos meninos", "10 anos de uso", "condi\u00e7\u00f5es prec\u00e1rias", "vezes", "danos", "deprecia\u00e7\u00e3o", "dia a dia", "agravantes", "alta rotatividade", "vez", "3 mil crian\u00e7as", "adolescentes", "ano", "-enurese noturna", "cama", "dist\u00farbios psicol\u00f3gicos consequentes de traumas", "problemas emocionais diversos", "constru\u00e7\u00e3o", "futuro melhor", "ajuda", "vidas", "apoio"]}