{"origem": "apoia.se", "categoria_teste_mencoes": {"saloes_humor": false, "hqmix": false, "ccxp": false, "fiq": false, "angelo_agostini": false, "politica": false, "questoes_genero": false, "lgbtqiamais": false, "terror": false, "humor": false, "herois": false, "disputa": false, "ficcao_cientifica": true, "fantasia": false, "folclore": false, "zine": false, "webformatos": false, "erotismo": false, "religiosidade": false, "jogos": false, "midia_independente": false}, "recompensas_menor_nominal": 5.0, "recompensas_menor_ajustado": 7.131940550391927, "recompensas_quantidade": 4, "autoria_id": "6177a5e4-81e6-4c7c-8c0a-44d4a134d87b", "autoria_nome": "o cabe\u00e7a de saco", "autoria_nome_publico": "o cabe\u00e7a de saco", "autoria_classificacao": "outros", "autoria_classificacao_id": 5, "social_seguidores": 0, "social_newsletter": false, "social_sub_contribuicoes_amigos": 0, "social_sub_novos_seguidores": 0, "social_sub_posts_projeto": 0, "social_projetos_contribuidos": 0, "social_projetos_publicados": 0, "geral_municipio": "S\u00e3o Benedito", "geral_uf": "CE", "geral_uf_br": "CE", "geral_city_id": 862, "geral_content_rating": null, "geral_contributed_by_friends": null, "geral_capa_imagem": false, "geral_capa_video": false, "geral_dias_campanha": 2572, "geral_data_fim": "", "geral_data_ini": "2018-03-22T12:04:14.335", "geral_meta": 300, "geral_meta_corrigida": 427.9164330235156, "geral_arrecadado": 0, "geral_arrecadado_corrigido": 0.0, "geral_percentual_arrecadado": 0.0, "geral_conteudo_adulto": false, "geral_posts": 0, "geral_project_id": "5ab39bbe674aa2f4182b44de", "geral_modalidade": "sub", "geral_titulo": "o cabe\u00e7a de saco", "geral_status": "published", "geral_total_contribuicoes": 0, "geral_total_apoiadores": 0, "geral_sobre": "E ai, eu sou o Cabe\u00e7a de Saco (CS), e para quem n\u00e3o sabe crio tirinhas originais para redes sociais com esse mesmo nome, onde tento aborda tudo aquilo que nos enche o saco durante o dia a dia, sejam coisas simples e casuais ou algo mais complexo e cr\u00edtico.\nTamb\u00e9m criei recentemente um canal no YouTube, onde postarei vlogs animados, anima\u00e7\u00f5es com temas casuais, desenhos e outras coisas. Infelizmente por se tratar de um canal novo e com um conte\u00fado que fere o family friendly do YouTube eu n\u00e3o serei monetizado, ou seja n\u00e3o ganharei nada naquela porra!\nMas o meu principal objetivo \u00e9 criar e lan\u00e7ar e-comics, isso mesmo, hist\u00f3rias em quadrinhos digitais, que ser\u00e3o disponibilizadas em primeira m\u00e3o para meus apoiadores no formato pdf e cbr (para quem n\u00e3o sabe cbr e cbz s\u00e3o os melhores formatos para l\u00ea quadrinhos digitais) e quem sabe um dia lan\u00e7ar no formato impresso, um dos t\u00edtulos j\u00e1 est\u00e1 bem elaborado e planejado, j\u00e1 criei algumas hist\u00f3rias, roteiros e artes conceituais.\nEsse quadrinho chama-se: O C\u00e9u N\u00e3o \u00e9 Azul uma s\u00e9rie de comics curtas, e trar\u00e1 em breves cap\u00edtulos hist\u00f3rias originais e descompromissadas, focadas na com\u00e9dia suja e na desgra\u00e7a alheia, e n\u00e3o se engane com o estilo de arte aparentemente infantil, isso n\u00e3o quer dizer que vai ser algo bobo e para criancinha, pelo contr\u00e1rio ser\u00e1 algo bobo, por\u00e9m pesado, voltado mais para o p\u00fablico jovem e adulto, para ficar melhor de entender \u00e9 como se a turma da M\u00f4nica colidisse com a galera do South Park (\u00e9 mais ou menos isso).\nJ\u00e1 a segunda comic ser\u00e1 algo bem mais s\u00e9rio e dram\u00e1tico, e ter\u00e1 um estilo de arte diferente e mais adulta, com uma hist\u00f3ria principal focada e linear. At\u00e9 o momento s\u00f3 criei a hist\u00f3ria bruta, mas estou e continuo trabalhando nela, ent\u00e3o precisarei de mais tempo para amadurecer a ideia, e \u00e9 claro vai depender mais se o primeiro projeto de comic der certo. Vou logo adiantando o t\u00edtulo com base no que tenho at\u00e9 o momento (mas ele pode mudar)\nO apoia-se disponibiliza varias op\u00e7\u00f5es para voc\u00ea realizar o apoio como cart\u00e3o de credito e boleto, basta escolher o que for melhor para voc\u00ea e n\u00e3o se preocupe \u00e9\u00a0sem compromisso e voc\u00ea pode cancelar quando quiser.\nAs recompensas ser\u00e3o justamente as minhas e-comics e tamb\u00e9m pr\u00eamios de sorteios que v\u00e3o desde gift cards (Netflix, googleplay entre outros), gadgets maneiros, e at\u00e9 materiais para desenho digital ou tradicional, bom dependendo do valor arrecado em determinado m\u00eas.\n\u201cOl\u00e1 pessoal meu nome \u00e9 B. Oliveira criador dessa bodega toda, e meu maior sonho \u00e9 ser um grande designer algum dia e lan\u00e7ar quadrinhos que tenham alguma relev\u00e2ncia, espero realmente que esses projetos deem certo e v\u00e1 para frente e se n\u00e3o der, tudo bem desistir nunca vai ser uma op\u00e7\u00e3o. \u201d\nps: caso queira acessar as tirinhas basta clicar nos \u00edcones\u00a0das redes sociais em CONTATOS.", "categoria_multirrotulo_lda": {"0": 0.0, "1": 0.0, "2": 0.2, "3": 0.0, "4": 0.6, "5": 0.2, "6": 0.4, "7": 0.2, "8": 0.4, "9": 0.2, "10": 0.2, "11": 0.6, "12": 0.2, "13": 0.2, "14": 0.0, "15": 0.0, "16": 0.6, "17": 0.0, "18": 0.2, "19": 0.2, "20": 0.4, "21": 0.2, "22": 0.2, "23": 0.2, "24": 0.0, "25": 0.2, "26": 0.0, "27": 0.4, "28": 0.2, "29": 0.0, "30": 0.4, "31": 0.0, "32": 0.2, "33": 0.0, "34": 0.0, "35": 0.2, "36": 0.0, "37": 0.4, "38": 0.4, "39": 0.2, "40": 0.2, "41": 0.4, "42": 0.4, "43": 0.0, "44": 0.0, "45": 0.2, "46": 0.2, "47": 0.0, "48": 0.0, "49": 0.2}, "categoria_entidades": ["cabe\u00e7a de saco", "cs", "tirinhas originais para redes sociais", "mesmo nome", "saco", "dia a dia", "coisas simples", "canal no youtube", "vlogs", "anima\u00e7\u00f5es com temas casuais", "desenhos", "coisas", "canal novo", "conte\u00fado", "family friendly do youtube", "porra", "principal objetivo", "e-comics", "hist\u00f3rias em quadrinhos digitais", "primeira m\u00e3o", "apoiadores no formato pdf", "cbr", "cbz", "melhores formatos", "quadrinhos digitais", "um dia", "formato", "um dos t\u00edtulos", "hist\u00f3rias", "roteiros", "artes conceituais", "quadrinho", "c\u00e9u", "s\u00e9rie de comics curtas", "breves cap\u00edtulos hist\u00f3rias originais", "com\u00e9dia suja", "desgra\u00e7a alheia", "estilo de arte", "criancinha", "contr\u00e1rio", "p\u00fablico jovem", "adulto", "turma da m\u00f4nica", "galera do south park", "mais ou menos", "segunda comic", "estilo de arte diferente", "hist\u00f3ria principal", "momento", "hist\u00f3ria bruta", "tempo", "ideia", "primeiro projeto de comic", "t\u00edtulo com base", "varias op\u00e7\u00f5es", "apoio como cart\u00e3o de credito", "boleto", "melhor", "compromisso", "recompensas", "pr\u00eamios de sorteios", "cards", "netflix", "googleplay", "gadgets maneiros", "materiais para desenho digital", "valor", "m\u00eas", "nome", "b. oliveira criador dessa bodega", "maior sonho", "grande designer", "dia", "quadrinhos", "relev\u00e2ncia", "projetos", "frente", "op\u00e7\u00e3o", "ps", "tirinhas", "\u00edcones", "redes sociais em contatos"]}