{"origem": "apoia.se", "categoria_teste_mencoes": {"saloes_humor": false, "hqmix": false, "ccxp": false, "fiq": false, "angelo_agostini": false, "politica": false, "questoes_genero": false, "lgbtqiamais": false, "terror": true, "humor": false, "herois": false, "disputa": false, "ficcao_cientifica": false, "fantasia": false, "folclore": false, "zine": true, "webformatos": false, "erotismo": false, "religiosidade": false, "jogos": true, "midia_independente": false}, "recompensas_menor_nominal": 10.0, "recompensas_menor_ajustado": 14.24963268280431, "recompensas_quantidade": 1, "autoria_id": "a52bfbc0-bb4f-451f-acdf-acb0f9940197", "autoria_nome": "ltg", "autoria_nome_publico": "ltg", "autoria_classificacao": "outros", "autoria_classificacao_id": 5, "social_seguidores": 0, "social_newsletter": false, "social_sub_contribuicoes_amigos": 0, "social_sub_novos_seguidores": 0, "social_sub_posts_projeto": 0, "social_projetos_contribuidos": 0, "social_projetos_publicados": 0, "geral_municipio": "Bras\u00edlia", "geral_uf": "DF", "geral_uf_br": "DF", "geral_city_id": 886, "geral_content_rating": null, "geral_contributed_by_friends": null, "geral_capa_imagem": false, "geral_capa_video": false, "geral_dias_campanha": 2558, "geral_data_fim": "", "geral_data_ini": "2018-04-05T14:30:50.494", "geral_meta": 800, "geral_meta_corrigida": 1139.9706146243448, "geral_arrecadado": 75, "geral_arrecadado_corrigido": 106.87224512103231, "geral_percentual_arrecadado": 0.11875, "geral_conteudo_adulto": false, "geral_posts": 566, "geral_project_id": "5ac6331a60bba1c1105d4f43", "geral_modalidade": "sub", "geral_titulo": "LTG", "geral_status": "published", "geral_total_contribuicoes": 6, "geral_total_apoiadores": 6, "geral_sobre": "Meu nome \u00e9 Lucas Gehre, e assino meus trabalhos como LTG. H\u00e1 alguns anos eu produzo a s\u00e9rie di\u00e1ria de tirinhas intituladas Quadradinhas. Em 2016 fiz um livro reunindo as primeiras 200 tiras, e em 2019 imprimi o segundo volume. Confira essas e outras publica\u00e7\u00f5es impressas e prints na minha loja online . Atualmente a s\u00e9rie j\u00e1 tem mais de 1500 tiras. Produzo regularmente zines e quadrinhos desde 2002, somando mais de 18 anos de trabalho. Acompanhe as Quadradinhas no insta , onde eu publico uma tirinha todos os dias, \u00e9 o canal mais ativo no momento. Atualmente mais de mil Quadradinhas j\u00e1 podem ser lidas gratuitamente por l\u00e1. Mas a partir de agora, se voc\u00ea quiser acompanhar as Quadradinhas novas, com pelo menos seis meses de anteced\u00eancia elas estar\u00e3o dispon\u00edveis apenas para quem me apoia por aqui. Al\u00e9m disso, vou disponibilizar tamb\u00e9m outros conte\u00fados em primeira m\u00e3o por aqui, al\u00e9m de oferecer eventuais descontos na lojinha online.\nAl\u00e9m das Quadradinhas, produzo e publico outros quadrinhos, em formatos diversos, como Quimera , uma s\u00e9rie de horror em Parceria com Rafael Lobo, atualmente sendo produzida, e o Labirinto do Necromante , um livro-jogo feito junto com a Lovelove6. Ainda junto com a Lovelove6, desde 2020, fazemos o podcast Sequ\u00eancia , onde falamos sobre quadrinhos da perspectiva de autores independentes.\nSe voc\u00ea curte meu trabalho, considere a possibilidade me apoiar diretamente por meio dessa plataforma. Cada apoio \u00e9 muito importante, garantindo a continuidade da minha produ\u00e7\u00e3o e reduzindo a necessidade de me comprometer com trabalhos que me paguem, mas nem sempre representam o melhor uso do meu tempo.\nVoc\u00ea pode apoiar com qualquer valor, e todos os apoiadores que apoiarem com R$ 5,00 ou mais por m\u00eas, receber\u00e3o acesso ao conte\u00fado fechado para apoiadores.\nSeja bem vindo, acompanhe as Quadradinhas, apoie meu trabalho e mostre para os seus amigos! Se cada um dos meus seguidores me desse apenas um real por ano, eu ganharia mais do que ganho atualmente. Quero continuar produzindo e publicando gratuitamente, e para isso preciso do seu apoio.", "categoria_multirrotulo_lda": {"0": 0.4, "1": 0.0, "2": 0.2, "3": 0.4, "4": 0.4, "5": 0.2, "6": 0.2, "7": 0.0, "8": 0.2, "9": 0.0, "10": 0.2, "11": 0.4, "12": 0.6, "13": 0.2, "14": 0.2, "15": 0.2, "16": 0.2, "17": 0.0, "18": 0.0, "19": 0.0, "20": 0.4, "21": 0.0, "22": 0.2, "23": 0.2, "24": 0.0, "25": 0.2, "26": 0.2, "27": 0.6, "28": 0.2, "29": 0.0, "30": 0.4, "31": 0.2, "32": 0.0, "33": 0.2, "34": 0.2, "35": 0.4, "36": 0.4, "37": 0.0, "38": 0.4, "39": 0.0, "40": 0.4, "41": 0.4, "42": 0.6, "43": 0.0, "44": 0.0, "45": 0.2, "46": 0.0, "47": 0.0, "48": 0.4, "49": 0.2}, "categoria_entidades": ["nome", "lucas gehre", "trabalhos como ltg", "anos", "s\u00e9rie di\u00e1ria de tirinhas", "quadradinhas", "livro", "primeiras 200 tiras", "segundo volume", "publica\u00e7\u00f5es impressas", "prints", "loja", "s\u00e9rie", "1500 tiras", "zines", "quadrinhos desde 2002", "18 anos de trabalho", "quadradinhas no insta", "tirinha todos os dias", "canal", "ativo no momento", "mil quadradinhas", "partir", "quadradinhas novas", "menos seis meses de anteced\u00eancia", "conte\u00fados em primeira m\u00e3o", "eventuais descontos na lojinha online", "publico", "quadrinhos", "formatos diversos", "quimera", "s\u00e9rie de horror em parceria com rafael lobo", "labirinto do necromante", "livro-jogo", "lovelove6", "podcast sequ\u00eancia", "quadrinhos da perspectiva de autores independentes", "trabalho", "possibilidade", "meio dessa plataforma", "apoio", "continuidade", "produ\u00e7\u00e3o", "necessidade", "trabalhos", "melhor uso", "tempo", "valor", "apoiadores", "m\u00eas", "acesso ao conte\u00fado", "amigos", "um", "seguidores", "um real por ano", "preciso"]}