{"origem": "apoia.se", "categoria_teste_mencoes": {"saloes_humor": false, "hqmix": false, "ccxp": false, "fiq": false, "angelo_agostini": false, "politica": false, "questoes_genero": false, "lgbtqiamais": false, "terror": false, "humor": false, "herois": false, "disputa": false, "ficcao_cientifica": false, "fantasia": false, "folclore": false, "zine": false, "webformatos": false, "erotismo": false, "religiosidade": false, "jogos": false, "midia_independente": false}, "recompensas_menor_nominal": 2.0, "recompensas_menor_ajustado": 2.767930937429058, "recompensas_quantidade": 4, "autoria_id": "5d0d1074-c313-4920-b48b-4988755ab9f2", "autoria_nome": "mecenato l\u00eddico", "autoria_nome_publico": "mecenato l\u00eddico", "autoria_classificacao": "outros", "autoria_classificacao_id": 5, "social_seguidores": 0, "social_newsletter": false, "social_sub_contribuicoes_amigos": 0, "social_sub_novos_seguidores": 0, "social_sub_posts_projeto": 0, "social_projetos_contribuidos": 0, "social_projetos_publicados": 0, "geral_municipio": "ENGENHEIRO COELHO", "geral_uf": "SP", "geral_uf_br": "SP", "geral_city_id": -1, "geral_content_rating": null, "geral_contributed_by_friends": null, "geral_capa_imagem": false, "geral_capa_video": false, "geral_dias_campanha": 2259, "geral_data_fim": "", "geral_data_ini": "2019-01-29T18:36:58.014", "geral_meta": 600, "geral_meta_corrigida": 830.3792812287174, "geral_arrecadado": 0, "geral_arrecadado_corrigido": 0.0, "geral_percentual_arrecadado": 0.0, "geral_conteudo_adulto": false, "geral_posts": 0, "geral_project_id": "5c509d4a4d30eba71774046f", "geral_modalidade": "sub", "geral_titulo": "Mecenato L\u00eddico", "geral_status": "published", "geral_total_contribuicoes": 0, "geral_total_apoiadores": 0, "geral_sobre": "Sauda\u00e7\u00f5es, mecenas!\nN\u00f3s somos os autores das tirinhas Ensinamentos L\u00eddicos : Allan Novaes no texto e Felipe Carmo na arte. Criamos este mecenato para arrecadar doa\u00e7\u00f5es de quem curte nosso trabalho e quer nos ajudar. Pra voc\u00ea se contextualizar, os mecenas eram incentivadores, protetores e patrocinadores das letras e das artes, cujo nome vem de Caio Mecenas (68\u20138 a.C.), conselheiro do imperador Augusto que criou e sustentou um circuito de poetas e artistas na Roma Antiga.\n\u00c9 bem f\u00e1cil ser um mecenas da nossa produ\u00e7\u00e3o de tirinhas e quadrinhos: voc\u00ea doa mensalmente uma pequena quantia para nosso projeto e, de quebra, ganha recompensas exclusivas de acordo com o valor da sua contribui\u00e7\u00e3o! O apoiador ter\u00e1 acesso a conte\u00fado exclusivo, sorteio de produtos, artes originais, descontos e muito mais.\nO que s\u00e3o os Ensinamentos L\u00eddicos?\nAs tirinhas Ensinamentos L\u00eddicos contam a hist\u00f3ria do s\u00e1bio, querido e rabugento V\u00f4 L\u00eddio e seus prov\u00e9rbios sobre o mundo e a vida atrav\u00e9s da intera\u00e7\u00e3o com seu neto Al\u00e3. As tirinhas s\u00e3o uma excelente forma de rir e refletir sobre o poder dos ditados populares, conflitos geracionais e uma s\u00e9rie de situa\u00e7\u00f5es do cotidiano.\nComo posso fazer parte do mecenato?\nParticipar do mecenato l\u00eddico \u00e9 seguro e pr\u00e1tico. O projeto foi criado aqui no site do Apoia.se , uma ferramenta de financiamento coletivo para quem quer patrocinar os artistas e as produ\u00e7\u00f5es que gosta. A contribui\u00e7\u00e3o financeira \u00e9 feita aos autores em pequenas quantias mensais. Voc\u00ea pode cancelar a assinatura ou alterar o valor de sua contribui\u00e7\u00e3o a qualquer momento.\nQuer fazer parte do mecenato? Cadastre-se aqui no site e escolha com qual valor voc\u00ea deseja contribuir m\u00eas a m\u00eas, conferindo quais ser\u00e3o as suas respectivas recompensas. Em caso de d\u00favidas ou sugest\u00f5es, leia o FAQ do site e/ou entre em contato com a gente: ensinamentoslidicos@gmail.com", "categoria_multirrotulo_lda": {"0": 0.4, "1": 0.2, "2": 0.4, "3": 0.0, "4": 0.4, "5": 0.2, "6": 0.4, "7": 0.4, "8": 0.0, "9": 0.2, "10": 0.4, "11": 0.2, "12": 0.4, "13": 0.0, "14": 0.0, "15": 0.0, "16": 0.4, "17": 0.0, "18": 0.2, "19": 0.4, "20": 0.2, "21": 0.2, "22": 0.2, "23": 0.2, "24": 0.0, "25": 0.2, "26": 0.0, "27": 0.2, "28": 0.2, "29": 0.2, "30": 0.4, "31": 0.0, "32": 0.2, "33": 0.0, "34": 0.0, "35": 0.2, "36": 0.2, "37": 0.2, "38": 0.2, "39": 0.0, "40": 0.2, "41": 0.0, "42": 0.2, "43": 0.4, "44": 0.0, "45": 0.4, "46": 0.0, "47": 0.0, "48": 0.2, "49": 0.4}, "categoria_entidades": ["sauda\u00e7\u00f5es", "mecenas", "autores das tirinhas ensinamentos l\u00eddicos", "allan novaes no texto", "felipe carmo na arte", "mecenato", "doa\u00e7\u00f5es", "trabalho", "protetores", "patrocinadores das letras", "artes", "nome", "caio mecenas", "68\u20138 a. c.", "conselheiro do imperador augusto", "circuito de poetas", "artistas na roma antiga", "produ\u00e7\u00e3o de tirinhas", "quadrinhos", "pequena quantia", "projeto", "quebra", "recompensas exclusivas de acordo", "valor", "contribui\u00e7\u00e3o", "apoiador", "acesso a conte\u00fado exclusivo", "sorteio de produtos", "artes originais", "descontos", "ensinamentos l\u00eddicos", "tirinhas ensinamentos l\u00eddicos", "hist\u00f3ria do s\u00e1bio", "rabugento v\u00f4 l\u00eddio", "prov\u00e9rbios", "mundo", "vida", "intera\u00e7\u00e3o", "neto al\u00e3", "tirinhas", "excelente forma", "poder", "conflitos geracionais", "s\u00e9rie de situa\u00e7\u00f5es do cotidiano", "parte do mecenato", "mecenato l\u00eddico", "site", "ferramenta de financiamento coletivo", "artistas", "produ\u00e7\u00f5es", "contribui\u00e7\u00e3o financeira", "autores em pequenas quantias mensais", "assinatura", "momento", "escolha", "m\u00eas a m\u00eas", "respectivas recompensas", "caso de d\u00favidas", "sugest\u00f5es", "faq do site", "contato", "gente"]}