{"origem": "apoia.se", "categoria_teste_mencoes": {"saloes_humor": false, "hqmix": false, "ccxp": false, "fiq": false, "angelo_agostini": false, "politica": false, "questoes_genero": false, "lgbtqiamais": false, "terror": false, "humor": false, "herois": false, "disputa": false, "ficcao_cientifica": false, "fantasia": false, "folclore": false, "zine": false, "webformatos": false, "erotismo": false, "religiosidade": false, "jogos": false, "midia_independente": false}, "recompensas_menor_nominal": 1.0, "recompensas_menor_ajustado": 1.3532513528855443, "recompensas_quantidade": 5, "autoria_id": "74c4267f-ef33-4606-a8c7-5e1980270c0f", "autoria_nome": "tiraz", "autoria_nome_publico": "tiraz", "autoria_classificacao": "outros", "autoria_classificacao_id": 5, "social_seguidores": 0, "social_newsletter": false, "social_sub_contribuicoes_amigos": 0, "social_sub_novos_seguidores": 0, "social_sub_posts_projeto": 0, "social_projetos_contribuidos": 0, "social_projetos_publicados": 0, "geral_municipio": "Vila Velha", "geral_uf": "ES", "geral_uf_br": "ES", "geral_city_id": 81, "geral_content_rating": null, "geral_contributed_by_friends": null, "geral_capa_imagem": false, "geral_capa_video": false, "geral_dias_campanha": 2117, "geral_data_fim": "", "geral_data_ini": "2019-06-20T19:00:00.000", "geral_meta": 100, "geral_meta_corrigida": 135.32513528855446, "geral_arrecadado": 0, "geral_arrecadado_corrigido": 0.0, "geral_percentual_arrecadado": 0.02, "geral_conteudo_adulto": false, "geral_posts": 3, "geral_project_id": "5d0be86cc80a0fff03bda7c5", "geral_modalidade": "sub", "geral_titulo": "tiraZ", "geral_status": "published", "geral_total_contribuicoes": 0, "geral_total_apoiadores": 0, "geral_sobre": "Oi meu nome \u00e9 Ogui e m\u00eas que vem faz ano que eu criei o tiraZ (pois \u00e9, o tempo passa rapido quando a gente se diverte), tiraZ \u00e9 um projeto de quadrinhos inspirados na cultura negra/perif\u00e9rica onde eu posto conte\u00fado toda semana.\nAl\u00e9m das tiras n\u00e3o terem nenhum tipo de retorno financeiro , \u00e9 muito dif\u00edcil manter a pagina com um conte\u00fado frequente e de qualidade, o \u00fanico retorno financeiro que eu recebo \u00e9 por aqui, por leitores que querem incentivar meu trabalho.\nE com seu apoio poderei a dedicar mais tempo pro tiraZ e entregar um conte\u00fado ainda melhor, ent\u00e3o se voc\u00ea curte meu trabalho e oque ele significa e quer me dar algum tipo de retorno: nos apoie!\nMantendo a pagina ativa voc\u00ea tamb\u00e9m vai estar me ajudando a investir em futuros produtos do Tiraz como livros, camisetas, canecas entre outros", "categoria_multirrotulo_lda": {"0": 0.4, "1": 0.0, "2": 0.0, "3": 0.0, "4": 0.2, "5": 0.0, "6": 0.4, "7": 0.0, "8": 0.2, "9": 0.0, "10": 0.2, "11": 0.0, "12": 0.2, "13": 0.0, "14": 0.0, "15": 0.2, "16": 0.2, "17": 0.0, "18": 0.0, "19": 0.0, "20": 0.0, "21": 0.0, "22": 0.0, "23": 0.0, "24": 0.0, "25": 0.0, "26": 0.0, "27": 0.2, "28": 0.0, "29": 0.0, "30": 0.0, "31": 0.0, "32": 0.0, "33": 0.2, "34": 0.0, "35": 0.0, "36": 0.2, "37": 0.0, "38": 0.0, "39": 0.0, "40": 0.0, "41": 0.0, "42": 0.0, "43": 0.0, "44": 0.0, "45": 0.2, "46": 0.0, "47": 0.0, "48": 0.0, "49": 0.0}, "categoria_entidades": ["oi", "nome", "ogui", "m\u00eas", "ano", "tiraz", "tempo", "rapido", "gente", "projeto de quadrinhos", "cultura negra", "conte\u00fado", "semana", "tiras", "tipo de retorno financeiro", "pagina", "conte\u00fado frequente", "qualidade", "\u00fanico retorno financeiro", "leitores", "trabalho", "apoio", "tempo pro tiraz", "tipo de retorno", "pagina ativa", "futuros produtos do tiraz como livros", "camisetas", "canecas"]}