{"origem": "apoia.se", "categoria_teste_mencoes": {"saloes_humor": false, "hqmix": false, "ccxp": false, "fiq": false, "angelo_agostini": false, "politica": false, "questoes_genero": false, "lgbtqiamais": false, "terror": false, "humor": false, "herois": true, "disputa": false, "ficcao_cientifica": false, "fantasia": false, "folclore": false, "zine": false, "webformatos": false, "erotismo": false, "religiosidade": false, "jogos": false, "midia_independente": false}, "recompensas_menor_nominal": 5.0, "recompensas_menor_ajustado": 6.762200130377541, "recompensas_quantidade": 4, "autoria_id": "ea78602c-d6dc-49cf-a5d1-a3dd4e9da55c", "autoria_nome": "comic city", "autoria_nome_publico": "comic city", "autoria_classificacao": "outros", "autoria_classificacao_id": 5, "social_seguidores": 0, "social_newsletter": false, "social_sub_contribuicoes_amigos": 0, "social_sub_novos_seguidores": 0, "social_sub_posts_projeto": 0, "social_projetos_contribuidos": 0, "social_projetos_publicados": 0, "geral_municipio": "Campinas", "geral_uf": "SP", "geral_uf_br": "SP", "geral_city_id": 4818, "geral_content_rating": null, "geral_contributed_by_friends": null, "geral_capa_imagem": false, "geral_capa_video": false, "geral_dias_campanha": 2079, "geral_data_fim": "", "geral_data_ini": "2019-07-28T17:09:15.503", "geral_meta": 3000, "geral_meta_corrigida": 4057.320078226525, "geral_arrecadado": 0, "geral_arrecadado_corrigido": 0.0, "geral_percentual_arrecadado": 0.0, "geral_conteudo_adulto": false, "geral_posts": 2, "geral_project_id": "5d3dd6bbc870e09d224bf193", "geral_modalidade": "sub", "geral_titulo": "Comic City", "geral_status": "published", "geral_total_contribuicoes": 0, "geral_total_apoiadores": 0, "geral_sobre": "Meu nome \u00e9 Marcio Roberto do Carmo , e eu trabalho com venda e Feiras de Quadrinhos \u00e1 quase 15 anos ..e ja era fan desse mundo fant\u00e1stico muito antes disso! Sempre estive envolvido em projetos Culturais, Eventos com Artistas da \u00c1rea, e Construi uma Comic Shop em Campinas/SP Chamada Comic City Store , juntamente com sua loja Virtual (www.ComicCityStore.com.br)! Tamb\u00e9m acumulei uma cole\u00e7\u00e3o de 30 mil Gibis! Minha Paix\u00e3o por isso me fez adquirir muito conhecimento atrav\u00e9s dos anos, ent\u00e3o juntei isso com uma certa aptid\u00e3o pra contar hist\u00f3rias, e levei pro Canal da Comic City no Youtube.\nO Canal Comic City Brasil, trabalha em 3 linhas Gerais:\n- Construir uma Biblioteca visual com Informa\u00e7\u00f5es sobre Personagens Diversos. Herois, Suas Aventuras, seus Grandes Momentos, Mas Tamb\u00e9m um pouco mais sobre seus Criadores, e curiosidades sobre suas cria\u00e7\u00f5es\n- Gerar discuss\u00f5es dentro do Tema postando reflex\u00f5es sobre Filmes Marcantes, Decis\u00f5es da Industria dos quadrinhos e Cinema, de maneira divertida e Informativa!\n- Divulgar Lan\u00e7amentos Semanalmente , na inten\u00e7\u00e3o de auxiliar outros colecionadores e criar novos leitores e amigos dentro do universo Fant\u00e1stico!\nVeja alguns Temas que ja abordamos no Canal:\nCriamos esses Videos pra mostrar como \u00e9 Rico esse universo, al\u00e9m de muito Din\u00e2mico! Com isso, temos sempre temas Nost\u00e1lgicos , com grandes momentos Nerds e Geeks, e Temas extremamente atuais , mostrando o que esta acontecendo no Universo Fant\u00e1stico aqui no Brasil..e No mundo!\nO Canal tem gastos mensais com editores de Video , o Pr\u00f3prio APOIA.se, uma reserva para Manuten\u00e7\u00e3o de equipamentos caso haja necessidade de conserto, e Licensas de programas e Softwares utilizados. Uma parte tamb\u00e9m ser\u00e1 dedicada a Sorteios.\nE Tudo isso, \u00e9 apenas pra manter o Canal Funionando como ele existe hoje ! Para deixar a Comic City cada vez melhor, tamb\u00e9m \u00e9 preciso investir no crescimento , ou seja, novos equipamentos pra melhorar a qualidade dos Videos, Marketing Digital, Livros pra aprimorarmos nosso Conhecimento, Etc.\nEnt\u00e3o se voc\u00ea se tornar apoiador , al\u00e9m de Contribuir pra manter o Canal vivo, vai poder nos ajudar a crescer, e consequentemente oferecer cada vez mais, e cada vez Melhor!\nLegal! Pra se tornar um apoiador da Comic City, basta voc\u00ea criar uma Conta no APOIA.se , e clicar no Bot\u00e3o verde no todo ou no fim desta p\u00e1gina , escolher o valor da Contribui\u00e7\u00e3o, e sua forma de Pagamento, (Cart\u00e3o de Cr\u00e9dito ou Boleto Banc\u00e1rio) e esta Dentro! E N\u00e3o se preocupe: Se precisar, pode interromper quando quiser.\nA equipe Comic City agradece a Considera\u00e7\u00e3o pelo nosso projeto, e o Seu Apoio! Participe da nossa Comunidade, e venha com a gente aproveitar o melhor do mundo dos qudrinhos, Cinemas, e Colecion\u00e1veis! Uh huuu!", "categoria_multirrotulo_lda": {"0": 0.2, "1": 0.2, "2": 0.4, "3": 0.4, "4": 0.6, "5": 0.0, "6": 0.8, "7": 0.0, "8": 0.6, "9": 0.0, "10": 0.2, "11": 0.2, "12": 0.8, "13": 0.0, "14": 0.2, "15": 0.2, "16": 0.6, "17": 0.0, "18": 0.0, "19": 0.0, "20": 0.2, "21": 0.0, "22": 0.2, "23": 0.2, "24": 0.0, "25": 0.2, "26": 0.2, "27": 0.4, "28": 0.2, "29": 0.2, "30": 0.2, "31": 0.2, "32": 0.0, "33": 0.0, "34": 0.2, "35": 0.4, "36": 0.4, "37": 0.0, "38": 0.6, "39": 0.0, "40": 0.2, "41": 0.4, "42": 0.4, "43": 0.4, "44": 0.0, "45": 0.2, "46": 0.0, "47": 0.0, "48": 0.6, "49": 0.2}, "categoria_entidades": ["nome", "marcio roberto do carmo", "trabalho com venda", "feiras de quadrinhos", "15 anos", "ja", "fan desse mundo fant\u00e1stico", "envolvido em projetos culturais", "eventos com artistas da \u00e1rea", "construi", "comic shop em campinas", "sp", "comic city store", "loja virtual", "www.comiccitystore.com.br", "cole\u00e7\u00e3o de 30 mil gibis", "minha paix\u00e3o", "conhecimento", "anos", "aptid\u00e3o", "hist\u00f3rias", "canal da comic city no youtube", "canal comic city brasil", "3 linhas gerais", "biblioteca visual com informa\u00e7\u00f5es sobre personagens diversos", "herois", "suas aventuras", "grandes momentos", "criadores", "curiosidades", "cria\u00e7\u00f5es", "discuss\u00f5es", "tema", "reflex\u00f5es sobre filmes marcantes", "decis\u00f5es da industria dos quadrinhos", "cinema", "maneira", "informativa", "lan\u00e7amentos semanalmente", "inten\u00e7\u00e3o", "colecionadores", "novos leitores", "amigos", "universo fant\u00e1stico", "temas", "canal", "videos", "rico", "universo", "din\u00e2mico", "temas nost\u00e1lgicos", "grandes momentos nerds", "geeks", "brasil", "mundo", "gastos mensais com editores de video", "pr\u00f3prio apoia.se", "reserva para manuten\u00e7\u00e3o de equipamentos", "necessidade de conserto", "licensas de programas", "softwares", "parte", "sorteios", "tudo", "canal funionando", "comic city cada vez melhor", "crescimento", "novos equipamentos", "qualidade dos videos", "marketing digital", "livros", "etc", "apoiador", "canal vivo", "poder", "cada vez mais", "cada vez melhor", "legal", "apoiador da comic city", "conta no apoia.se", "bot\u00e3o verde no todo", "fim desta p\u00e1gina", "valor da contribui\u00e7\u00e3o", "forma de pagamento", "cart\u00e3o de cr\u00e9dito", "boleto banc\u00e1rio", "dentro", "equipe comic city", "considera\u00e7\u00e3o", "projeto", "apoio", "comunidade", "gente", "melhor do mundo dos qudrinhos", "cinemas", "colecion\u00e1veis", "huuu"]}