{"origem": "apoia.se", "categoria_teste_mencoes": {"saloes_humor": false, "hqmix": false, "ccxp": false, "fiq": false, "angelo_agostini": false, "politica": false, "questoes_genero": false, "lgbtqiamais": false, "terror": false, "humor": true, "herois": false, "disputa": false, "ficcao_cientifica": true, "fantasia": false, "folclore": false, "zine": false, "webformatos": false, "erotismo": false, "religiosidade": false, "jogos": false, "midia_independente": false}, "recompensas_menor_nominal": 2.0, "recompensas_menor_ajustado": 2.70028802549332, "recompensas_quantidade": 3, "autoria_id": "ed4ecbc0-742c-4d8f-b716-6173fc662bbc", "autoria_nome": "hq nuux", "autoria_nome_publico": "hq nuux", "autoria_classificacao": "outros", "autoria_classificacao_id": 5, "social_seguidores": 0, "social_newsletter": false, "social_sub_contribuicoes_amigos": 0, "social_sub_novos_seguidores": 0, "social_sub_posts_projeto": 0, "social_projetos_contribuidos": 0, "social_projetos_publicados": 0, "geral_municipio": "Goi\u00e2nia", "geral_uf": "GO", "geral_uf_br": "GO", "geral_city_id": 981, "geral_content_rating": null, "geral_contributed_by_friends": null, "geral_capa_imagem": false, "geral_capa_video": false, "geral_dias_campanha": 2017, "geral_data_fim": "", "geral_data_ini": "2019-09-28T05:40:19.257", "geral_meta": 0, "geral_meta_corrigida": 0.0, "geral_arrecadado": 0, "geral_arrecadado_corrigido": 0.0, "geral_percentual_arrecadado": 0, "geral_conteudo_adulto": false, "geral_posts": 0, "geral_project_id": "5d8ef24363806a0100e752f2", "geral_modalidade": "sub", "geral_titulo": "HQ NUUX", "geral_status": "published", "geral_total_contribuicoes": 0, "geral_total_apoiadores": 0, "geral_sobre": "O projeto HQ NUUX , tem como objetivo trazer humor de v\u00e1rios formatos: Tirinhas (o principal), v\u00eddeos/anima\u00e7\u00f5es, podcasts, textos etc. Enfim, entretenimento em geral na \u00e1rea de tecnologia, que trata de diversos assuntos tais como: Software Livre, programa\u00e7\u00e3o, design, ci\u00eancia, engenharia, seguran\u00e7a, biologia, privacidade, explora\u00e7\u00e3o espacial, filosofia, sustentabilidade, hacking etc.\nO dinheiro recebido ser\u00e1 convertido em muito mais tempo dedicado ao projeto,\u00a0 assim aumentando consideravelmente a relev\u00e2ncia e qualidade\u00a0 dos conte\u00fados. Para isso, tamb\u00e9m o dinheiro ser\u00e1 investido em equipamentos, infraestrutura, livros, cursos, eventos, estudos em geral.\u00a0 \u00c0s vezes h\u00e1 muitas ideias a serem realizadas ou aprimoradas, mas devido ao tempo e dinheiro n\u00e3o podem sair do papel. Conto com a sua ajuda ;)\nVale lembrar que, como tamb\u00e9m sou criador do projeto de anima\u00e7\u00f5es retardadas: Desanimation ,\u00a0 e tamb\u00e9m participante dos podcasts de Tecnologia da Informa\u00e7\u00e3o na Tribo do C.I . , com certeza\u00a0investirei algum tempo neles tamb\u00e9m. No caso ent\u00e3o, estar\u00e1 apoiando indiretamente outros projetos ao mesmo tempo.\nObrigado, desde j\u00e1 :D", "categoria_multirrotulo_lda": {"0": 0.0, "1": 0.0, "2": 0.0, "3": 0.0, "4": 0.0, "5": 0.0, "6": 0.0, "7": 0.0, "8": 0.0, "9": 0.0, "10": 0.0, "11": 0.2, "12": 0.0, "13": 0.0, "14": 0.0, "15": 0.0, "16": 0.0, "17": 0.0, "18": 0.0, "19": 0.0, "20": 0.0, "21": 0.0, "22": 0.0, "23": 0.0, "24": 0.0, "25": 0.0, "26": 0.0, "27": 0.0, "28": 0.0, "29": 0.0, "30": 0.2, "31": 0.0, "32": 0.0, "33": 0.0, "34": 0.0, "35": 0.0, "36": 0.0, "37": 0.0, "38": 0.0, "39": 0.0, "40": 0.0, "41": 0.0, "42": 0.2, "43": 0.2, "44": 0.0, "45": 0.0, "46": 0.0, "47": 0.0, "48": 0.0, "49": 0.0}, "categoria_entidades": ["projeto hq nuux", "objetivo", "humor", "formatos", "tirinhas", "principal", "v\u00eddeos", "anima\u00e7\u00f5es", "podcasts", "textos", "entretenimento em geral na \u00e1rea de tecnologia", "assuntos", "software livre", "programa\u00e7\u00e3o", "design", "ci\u00eancia", "engenharia", "seguran\u00e7a", "biologia", "privacidade", "explora\u00e7\u00e3o espacial", "filosofia", "sustentabilidade", "hacking", "dinheiro", "tempo", "projeto", "relev\u00e2ncia", "qualidade", "conte\u00fados", "equipamentos", "infraestrutura", "livros", "cursos", "eventos", "estudos em geral", "vezes", "ideias", "papel", "conto", "ajuda", "criador do projeto de anima\u00e7\u00f5es", "desanimation", "participante dos podcasts de tecnologia da informa\u00e7\u00e3o na tribo do c.i", "certeza", "caso", "projetos ao mesmo tempo", ":d"]}