{"origem": "apoia.se", "categoria_teste_mencoes": {"saloes_humor": false, "hqmix": false, "ccxp": false, "fiq": false, "angelo_agostini": false, "politica": false, "questoes_genero": false, "lgbtqiamais": false, "terror": false, "humor": true, "herois": false, "disputa": false, "ficcao_cientifica": false, "fantasia": false, "folclore": false, "zine": false, "webformatos": false, "erotismo": false, "religiosidade": false, "jogos": false, "midia_independente": false}, "recompensas_menor_nominal": 3.0, "recompensas_menor_ajustado": 4.046789949329624, "recompensas_quantidade": 4, "autoria_id": "0c10cd27-7835-41b1-aeb7-ef43f9a64c9f", "autoria_nome": "turma do pato papaco", "autoria_nome_publico": "turma do pato papaco", "autoria_classificacao": "outros", "autoria_classificacao_id": 5, "social_seguidores": 0, "social_newsletter": false, "social_sub_contribuicoes_amigos": 0, "social_sub_novos_seguidores": 0, "social_sub_posts_projeto": 0, "social_projetos_contribuidos": 0, "social_projetos_publicados": 0, "geral_municipio": "S\u00e3o Paulo", "geral_uf": "SP", "geral_uf_br": "SP", "geral_city_id": 5274, "geral_content_rating": null, "geral_contributed_by_friends": null, "geral_capa_imagem": false, "geral_capa_video": false, "geral_dias_campanha": 1986, "geral_data_fim": "", "geral_data_ini": "2019-10-29T13:21:55.036", "geral_meta": 0, "geral_meta_corrigida": 0.0, "geral_arrecadado": 0, "geral_arrecadado_corrigido": 0.0, "geral_percentual_arrecadado": 0, "geral_conteudo_adulto": false, "geral_posts": 3, "geral_project_id": "5db83cf3450e8c4767300fbb", "geral_modalidade": "sub", "geral_titulo": "Turma do Pato Papaco", "geral_status": "published", "geral_total_contribuicoes": 0, "geral_total_apoiadores": 0, "geral_sobre": "Ol\u00e1,\u00a0sejam bem vindos ao curral! Para quem ainda n\u00e3o conhece, aqui \u00e9 onde desenvolvo o meu trabalho que \u00e9 o de dar vida \u00e0 Turma do Pato Papaco!\nPor meio dessa campanha quero viabilizar a continuidade e o aprimoramento dessa atividade, assim como presentear meus apoiadores carinhosamente com lembran\u00e7as de sua imensa generosidade a ssim que tiver recursos. S er\u00e3o pequenos regalos baseados nesse trabalho (d\u00ea uma olhada nas recompensas ao lado) .\nJ\u00e1 imaginou voc\u00ea com uma camiseta do Pinscher Papaco dizendo adoro crian\u00e7as, ou aparecendo por a\u00ed com um caderno do Pato Papaco, usando um adesivo do Le\u00e3o Papaco no carro, ou indo dormir com um bichinho de pel\u00facia da Capivara Papaca? Demais n\u00e3o \u00e9 mesmo?\nA Turma do Pato Papaco \u00e9 uma maneira que encontrei de trazer ou resgatar um humor ing\u00eanuo, c\u00e2ndido e bonach\u00e3o, por\u00e9m sem perder a oportunidade de eventualmente suscitar reflex\u00e3o e um jeito cr\u00edtico \u00ad de ver nosso mundo, representado de forma aleg\u00f3rica e l\u00fadica pelo curral.\nComo\u00a0\u00e9 sabiamente incentivado pelo APOIA.SE, espero que essa atividade possa ter um impacto social positivo, tanto com o conte\u00fado das tirinhas e hist\u00f3rias quanto com livros educativos e anima\u00e7\u00f5es, que pretendo lan\u00e7ar num futuro pr\u00f3ximo, se conseguir captar recursos suficientes para contrata\u00e7\u00e3o de empresas e profissionais qualificados para me auxiliar nessa empreitada. Por enquanto, consigo produzir duas tirinhas semanais a serem disponibilizadas nos canais descritos abaixo, mas pretendo intensificar essa produ\u00e7\u00e3o com conte\u00fado exclusivo assim que o apoio me der condi\u00e7\u00f5es de me dedicar mais.\nFico imensamente agradecido aos que puderem me apoiar de quaisquer formas, e espero poder retribuir com momentos de alegria e reflex\u00e3o e com pequenos presentes assim que tiver recursos suficientes.\nAqui est\u00e3o os links dos canais por onde veiculo o conte\u00fado atualmente:\nhttps://www.patopapaco.com.br/\nhttps://www.facebook.com/turmadopatopapaco/\nMuito obrigado e um\u00a0grande abra\u00e7o,\nLeandro Pinheiro.\n\u200b", "categoria_multirrotulo_lda": {"0": 0.4, "1": 0.2, "2": 0.2, "3": 0.0, "4": 0.2, "5": 0.0, "6": 0.4, "7": 0.0, "8": 0.0, "9": 0.0, "10": 0.2, "11": 0.0, "12": 0.2, "13": 0.0, "14": 0.0, "15": 0.2, "16": 0.0, "17": 0.0, "18": 0.0, "19": 0.0, "20": 0.0, "21": 0.0, "22": 0.0, "23": 0.0, "24": 0.0, "25": 0.0, "26": 0.0, "27": 0.2, "28": 0.0, "29": 0.2, "30": 0.2, "31": 0.0, "32": 0.0, "33": 0.0, "34": 0.0, "35": 0.0, "36": 0.2, "37": 0.0, "38": 0.0, "39": 0.0, "40": 0.0, "41": 0.0, "42": 0.0, "43": 0.6, "44": 0.0, "45": 0.6, "46": 0.0, "47": 0.0, "48": 0.2, "49": 0.2}, "categoria_entidades": ["ol\u00e1", "curral", "trabalho", "vida \u00e0 turma do pato papaco", "meio dessa campanha", "continuidade", "aprimoramento dessa atividade", "apoiadores", "lembran\u00e7as", "imensa generosidade", "recursos", "s", "pequenos regalos", "olhada nas recompensas ao lado", "camiseta do pinscher papaco", "crian\u00e7as", "caderno do pato papaco", "adesivo do le\u00e3o papaco no carro", "bichinho de pel\u00facia da capivara papaca", "turma do pato papaco", "maneira", "humor ing\u00eanuo", "bonach\u00e3o", "oportunidade", "reflex\u00e3o", "jeito cr\u00edtico", "mundo", "forma aleg\u00f3rica", "l\u00fadica pelo curral", "apoia.se", "atividade", "impacto social positivo", "conte\u00fado das tirinhas", "hist\u00f3rias", "livros educativos", "anima\u00e7\u00f5es", "futuro pr\u00f3ximo", "recursos suficientes para contrata\u00e7\u00e3o de empresas", "profissionais", "empreitada", "enquanto", "duas tirinhas semanais", "canais", "produ\u00e7\u00e3o com conte\u00fado exclusivo", "apoio", "condi\u00e7\u00f5es", "formas", "momentos de alegria", "pequenos presentes", "recursos suficientes", "links dos canais", "veiculo", "conte\u00fado", "https://www.patopapaco.com.br/", "grande abra\u00e7o", "leandro pinheiro", "\u200b"]}