{"origem": "apoia.se", "categoria_teste_mencoes": {"saloes_humor": false, "hqmix": false, "ccxp": false, "fiq": false, "angelo_agostini": false, "politica": false, "questoes_genero": false, "lgbtqiamais": false, "terror": false, "humor": false, "herois": false, "disputa": false, "ficcao_cientifica": false, "fantasia": false, "folclore": false, "zine": false, "webformatos": false, "erotismo": false, "religiosidade": true, "jogos": true, "midia_independente": false}, "recompensas_menor_nominal": 1.0, "recompensas_menor_ajustado": 1.3477172187597812, "recompensas_quantidade": 9, "autoria_id": "9112e136-636c-4b42-a222-aaa14722a703", "autoria_nome": "yuyu", "autoria_nome_publico": "yuyu", "autoria_classificacao": "outros", "autoria_classificacao_id": 5, "social_seguidores": 0, "social_newsletter": false, "social_sub_contribuicoes_amigos": 0, "social_sub_novos_seguidores": 0, "social_sub_posts_projeto": 0, "social_projetos_contribuidos": 0, "social_projetos_publicados": 0, "geral_municipio": "S\u00e3o Paulo", "geral_uf": "SP", "geral_uf_br": "SP", "geral_city_id": 5274, "geral_content_rating": null, "geral_contributed_by_friends": null, "geral_capa_imagem": false, "geral_capa_video": false, "geral_dias_campanha": 1983, "geral_data_fim": "", "geral_data_ini": "2019-11-01T05:32:51.355", "geral_meta": 100, "geral_meta_corrigida": 134.77172187597813, "geral_arrecadado": 0, "geral_arrecadado_corrigido": 0.0, "geral_percentual_arrecadado": 0.0, "geral_conteudo_adulto": false, "geral_posts": 0, "geral_project_id": "5dbbc3830746eb81402c6fcb", "geral_modalidade": "sub", "geral_titulo": "YuYu", "geral_status": "published", "geral_total_contribuicoes": 0, "geral_total_apoiadores": 0, "geral_sobre": "O Apoia.se \u00e9 uma plataforma pela qual voc\u00ea pode contribuir mensalmente, escolha o valor e, de acordo com ele, eu te ofere\u00e7o recompensas. N\u00e3o existe nenhum tipo de contrato , voc\u00ea pode cancelar o apoio quando quiser. O site aceita boleto e cart\u00e3o de cr\u00e9dito. F\u00e1cil, r\u00e1pido e seguro.\nO conte\u00fado \u00e9 um misto de lapse desenhando com coment\u00e1rios e opini\u00f5es baseados nesse 28 anos de vida e experi\u00eancias... Pretendo fazer mais v\u00eddeos sobre budismo e filosofia, quem sabe come\u00e7ar com anima\u00e7\u00e3o e produzir um conte\u00fado de qualidade ser\u00e1 dif\u00edcil pois a plataforma prioriza quantidade al\u00e9m de nem ser monetizado ainda...\nPretendo como recompensas futuras mostrar aos apoiadores todo o processo de cria\u00e7\u00e3o, cada p\u00e1gina do roteiro escrito a m\u00e3o em um caderno, \u00e1udio completo sem cortes, imagens e m\u00fasicas usadas com direito copyrigth livre.\nQuem apoiar tamb\u00e9m ter\u00e1 direito a sugerir qual estilo de v\u00eddeo atrai mais, caso jogo poderemos jogar juntos e o apoiador aparecer\u00e1 no v\u00eddeo, pode pedir um tema espec\u00edfico dentro da minha \u00e1rea de conhecimento pra fazer um v\u00eddeo mais aprofundado ou sugerir um anime de prefer\u00eancia para ser analisado! Entre os benef\u00edcios tamb\u00e9m estar\u00e3o as aulas de como criar thumbnail, editar o v\u00eddeo ou aulas de como desenhar melhor com direito a exerc\u00edcios e an\u00e1lise dos seus desenhos! Yuyu Sensei~ Tamb\u00e9m ser\u00e3o realizados sorteios entre os apoiadores valendo um desenho em arte tradicional, enviado pelo correio.\nPretendo trazer ao canal outros tipos de artes como pintura em quadros, artesanato em biscuit, entre outras formas criativas de se\u00a0 passar o tempo! Quem sabe aprendendo tudo voc\u00ea possa produzir e ganhar seu pr\u00f3prio dinheiro tamb\u00e9m?\nMe ajude a te ajudar!\nEm breve, conforme mais apoiadores poderemos criar um grupo secreto, farei podcasts exclusivos e v\u00eddeos extras especiais!\nConfira o canal no link abaixo: https://www.youtube.com/channel/UCG_VV96eNDoqK7gqtQFyfLg\nInstagram: https://www.instagram.com/yuyu_fujimoto/\nQuem \u00e9...", "categoria_multirrotulo_lda": {"0": 0.2, "1": 0.0, "2": 0.4, "3": 0.4, "4": 0.6, "5": 0.0, "6": 0.6, "7": 0.2, "8": 0.6, "9": 0.4, "10": 0.2, "11": 0.4, "12": 0.6, "13": 0.2, "14": 0.2, "15": 0.4, "16": 0.8, "17": 0.0, "18": 0.2, "19": 0.2, "20": 0.2, "21": 0.4, "22": 0.6, "23": 0.4, "24": 0.0, "25": 0.4, "26": 0.2, "27": 0.6, "28": 0.4, "29": 0.0, "30": 0.6, "31": 0.2, "32": 0.2, "33": 0.0, "34": 0.2, "35": 0.6, "36": 0.2, "37": 0.4, "38": 0.8, "39": 0.0, "40": 0.2, "41": 0.4, "42": 0.6, "43": 0.0, "44": 0.0, "45": 0.2, "46": 0.0, "47": 0.0, "48": 0.2, "49": 0.0}, "categoria_entidades": ["plataforma", "valor", "acordo", "tipo de contrato", "apoio", "site", "boleto", "cart\u00e3o de cr\u00e9dito", "conte\u00fado", "misto de lapse", "coment\u00e1rios", "opini\u00f5es", "28 anos de vida", "experi\u00eancias", "v\u00eddeos sobre budismo", "filosofia", "anima\u00e7\u00e3o", "conte\u00fado de qualidade", "quantidade", "recompensas futuras", "apoiadores", "processo de cria\u00e7\u00e3o", "p\u00e1gina do roteiro", "m\u00e3o", "caderno", "\u00e1udio completo sem cortes", "imagens", "m\u00fasicas", "direito", "estilo de v\u00eddeo", "jogo", "apoiador", "v\u00eddeo", "tema espec\u00edfico", "\u00e1rea de conhecimento", "anime de prefer\u00eancia", "benef\u00edcios", "aulas", "thumbnail", "direito a exerc\u00edcios", "an\u00e1lise", "desenhos", "yuyu", "sorteios", "desenho em arte tradicional", "correio", "canal", "tipos de artes como pintura em quadros", "artesanato em biscuit", "formas criativas", "tempo", "pr\u00f3prio dinheiro", "breve", "grupo secreto", "podcasts exclusivos", "v\u00eddeos", "canal no link", "https://www.youtube.com/channel/ucg_vv96endoqk7gqtqfyflg", "instagram", "https://www.instagram.com/yuyu_fujimoto/"]}