{"origem": "apoia.se", "categoria_teste_mencoes": {"saloes_humor": false, "hqmix": false, "ccxp": false, "fiq": false, "angelo_agostini": false, "politica": false, "questoes_genero": false, "lgbtqiamais": false, "terror": false, "humor": false, "herois": false, "disputa": false, "ficcao_cientifica": true, "fantasia": false, "folclore": false, "zine": false, "webformatos": false, "erotismo": false, "religiosidade": false, "jogos": false, "midia_independente": false}, "recompensas_menor_nominal": 1.0, "recompensas_menor_ajustado": 1.331848798423422, "recompensas_quantidade": 2, "autoria_id": "51839806-53dc-4052-9d83-8959d6050ec9", "autoria_nome": "finch e o anjo", "autoria_nome_publico": "finch e o anjo", "autoria_classificacao": "outros", "autoria_classificacao_id": 5, "social_seguidores": 0, "social_newsletter": false, "social_sub_contribuicoes_amigos": 0, "social_sub_novos_seguidores": 0, "social_sub_posts_projeto": 0, "social_projetos_contribuidos": 0, "social_projetos_publicados": 0, "geral_municipio": "Jo\u00e3o Pessoa", "geral_uf": "PB", "geral_uf_br": "PB", "geral_city_id": 2659, "geral_content_rating": null, "geral_contributed_by_friends": null, "geral_capa_imagem": false, "geral_capa_video": false, "geral_dias_campanha": 1904, "geral_data_fim": "", "geral_data_ini": "2020-01-19T03:27:48.000", "geral_meta": 200, "geral_meta_corrigida": 266.36975968468437, "geral_arrecadado": 0, "geral_arrecadado_corrigido": 0.0, "geral_percentual_arrecadado": 0.0, "geral_conteudo_adulto": false, "geral_posts": 0, "geral_project_id": "5df593705adb5b6abb2ae589", "geral_modalidade": "sub", "geral_titulo": "Finch e o Anjo", "geral_status": "published", "geral_total_contribuicoes": 0, "geral_total_apoiadores": 0, "geral_sobre": "Ol\u00e1, aliens!\nDa\u00ed que eu estava na aula de artes num s\u00e1bado e tive a brilhante ideia de criar uma hist\u00f3ria em quadrinhos, como se j\u00e1 n\u00e3o tivesse umas dez fanfics para escrever e a faculdade soprando no meu ouvido como um anjo do apocalipse anunciando a subida do Satan\u00e1s com uma caixa de som tocando k-pop .\nE a\u00ed o Finch e o Thomas nasceram, e junto a eles uma pataquada de outros personagens que eu tento trabalhar, mas que nunca arranjo tempo.\nComo grande parte dos artistas brasileiros, viver s\u00f3 da arte n\u00e3o \u00e9 poss\u00edvel, ent\u00e3o eu trabalho e estudo tamb\u00e9m, o que reduz ainda mais o meu tempo. Por isso, para que eu possa continuar e me dedicar mais aos meus filhotes sem surtar de saudades.\nE \u00e9 a\u00ed que voc\u00ea, leitor, entra. Com o apoio mensal, eu posso melhorar os meus materiais e trabalhar com mais frequ\u00eancia. E voc\u00ea ainda ganha uma recompensa!\nVoc\u00ea pode ler a s\u00e9rie Finch e o Anjo gratuitamente no tapas: https://tapas.io/series/Finch-e-o-Anjo\nOu seguir meu instagram e ver os poucos desenhos que tenho tempo de publicar:\nhttps://www.instagram.com/eumultiverso/?hl=pt-br", "categoria_multirrotulo_lda": {"0": 0.2, "1": 0.0, "2": 0.2, "3": 0.0, "4": 0.2, "5": 0.2, "6": 0.4, "7": 0.4, "8": 0.0, "9": 0.4, "10": 0.4, "11": 0.2, "12": 0.4, "13": 0.0, "14": 0.0, "15": 0.2, "16": 0.2, "17": 0.0, "18": 0.2, "19": 0.4, "20": 0.2, "21": 0.2, "22": 0.2, "23": 0.2, "24": 0.0, "25": 0.2, "26": 0.0, "27": 0.2, "28": 0.2, "29": 0.0, "30": 0.2, "31": 0.0, "32": 0.2, "33": 0.0, "34": 0.0, "35": 0.4, "36": 0.0, "37": 0.4, "38": 0.2, "39": 0.0, "40": 0.2, "41": 0.0, "42": 0.2, "43": 0.0, "44": 0.0, "45": 0.0, "46": 0.0, "47": 0.0, "48": 0.0, "49": 0.2}, "categoria_entidades": ["ol\u00e1", "aliens", "aula de artes num s\u00e1bado", "brilhante ideia", "hist\u00f3ria em quadrinhos", "dez fanfics", "faculdade", "ouvido", "anjo do apocalipse", "subida do satan\u00e1s", "caixa de som", "k-pop", "finch", "thomas", "pataquada", "personagens", "arranjo tempo", "grande parte dos artistas brasileiros", "arte", "trabalho", "estudo", "tempo", "filhotes", "saudades", "leitor", "apoio mensal", "materiais", "frequ\u00eancia", "recompensa", "s\u00e9rie finch", "anjo", "tapas", "instagram", "desenhos", "https://www.instagram.com/eumultiverso/?hl=pt-br"]}