{"origem": "apoia.se", "categoria_teste_mencoes": {"saloes_humor": false, "hqmix": false, "ccxp": false, "fiq": false, "angelo_agostini": false, "politica": false, "questoes_genero": false, "lgbtqiamais": false, "terror": false, "humor": false, "herois": false, "disputa": true, "ficcao_cientifica": true, "fantasia": false, "folclore": false, "zine": false, "webformatos": false, "erotismo": false, "religiosidade": false, "jogos": true, "midia_independente": true}, "recompensas_menor_nominal": 3.0, "recompensas_menor_ajustado": 3.9955463952702654, "recompensas_quantidade": 6, "autoria_id": "055d9351-c784-457e-b227-bcea7572158d", "autoria_nome": "isa danoninho", "autoria_nome_publico": "isa danoninho", "autoria_classificacao": "feminino", "autoria_classificacao_id": 4, "social_seguidores": 0, "social_newsletter": false, "social_sub_contribuicoes_amigos": 0, "social_sub_novos_seguidores": 0, "social_sub_posts_projeto": 0, "social_projetos_contribuidos": 0, "social_projetos_publicados": 0, "geral_municipio": "Ribeir\u00e3o Preto", "geral_uf": "SP", "geral_uf_br": "SP", "geral_city_id": 5199, "geral_content_rating": null, "geral_contributed_by_friends": null, "geral_capa_imagem": false, "geral_capa_video": false, "geral_dias_campanha": 1920, "geral_data_fim": "", "geral_data_ini": "2020-01-03T13:44:12.000", "geral_meta": 150, "geral_meta_corrigida": 199.7773197635133, "geral_arrecadado": 0, "geral_arrecadado_corrigido": 0.0, "geral_percentual_arrecadado": 0.0, "geral_conteudo_adulto": false, "geral_posts": 0, "geral_project_id": "5e0e723fcaddf9416853cbda", "geral_modalidade": "sub", "geral_titulo": "Isa Danoninho", "geral_status": "published", "geral_total_contribuicoes": 0, "geral_total_apoiadores": 0, "geral_sobre": "Ol\u00e1 amigos, sejam bem vindos a esse cantinho especial onde tudo pode mudar na minha vida! Quem sou? Pra quem n\u00e3o me conhece, eu sou a Isa, tenho 27 anos, desenho desde sempre e em agosto de 2018 decidi que desenhar seria a minha profiss\u00e3o. Em outubro de 2018 comecei a fazer aquarelas personalizadas para vender, o que me ajudou a arcar com muitos custos de materiais e workshops. Em maio de 2019 entrei para o mundo digital e em julho eu j\u00e1 estava trabalhando com Storyboard. Atualmente sou freelancer. O que fa\u00e7o? Digamos que vida de freelancer n\u00e3o \u00e9 f\u00e1cil, apesar de amar a \u00e1rea e querer me desenvolver nela, n\u00e3o \u00e9 o suficiente para continuar sobrevivendo. Atendo a apenas uma produtora. Al\u00e9m do trabalho com Storyboard, eu fa\u00e7o ADM na p\u00e1gina do Inktober Brasil, ajudo a manter os conte\u00fados e a divulga\u00e7\u00e3o dos trabalhos de outros artistas. Tamb\u00e9m cuido da minha p\u00e1gina no Instagram, que d\u00e1 mais trabalho, a mais de um ano postando minhas artes l\u00e1, fazendo stories dos processos de cria\u00e7\u00e3o, tirando d\u00favidas, falando de arte, gerando conte\u00fado. A maioria dessas artes que eu produzo s\u00e3o vendidas ou no pr\u00f3prio Instagram ou em exposi\u00e7\u00f5es. Minhas metas Estou vivendo um momento de impasse, moro sozinha e somente a venda das artes e dos freelas de Storyboard n\u00e3o est\u00e3o sendo suficientes para continuar me dedicando a coisa que eu mais gosto de fazer: desenhar. Os materiais s\u00e3o caros, as pessoas n\u00e3o acham que arte vale o pre\u00e7o, enfim, quero continuar fazendo o fa\u00e7o, evoluir, melhorar, aprender coisas novas, e acho justo compartilhar isso com vcs que me apoiam e n\u00e3o me deixam desistir em todos os momentos que eu j\u00e1 disse que ia parar. O que \u00e9 esse projeto do apoia.se? O apoia.se \u00e9 uma plataforma de financiamento coletivo, onde o apoiador pode apoiar um projeto de forma financeira. Os apoiadores s\u00e3o cobrados uma vez por m\u00eas, como em um sistema de assinatura, sem prazo pra terminar, mas tamb\u00e9m sem tempo de perman\u00eancia m\u00ednima. O valor total arrecadado no mes tem o desconto de 13%, valor que fica com o site, e resto \u00e9 repassado para o criador do projeto, nesse caso aqui, sou eu. Por que participar? Caso voc\u00ea goste dos conte\u00fados que crio no Instagram, seu apoio vai me ajudar a manter a p\u00e1gina no ar, dedicarei um tempo di\u00e1rio espec\u00edfico para que todo o apoio dado aqui seja revertido para voc\u00eas. O foco principal do apoio \u00e9 custear materiais e cursos. Inicialmente n\u00e3o tenho como colocar recompensas f\u00edsicas, tipo adesivos, prints e im\u00e3s; mas se esse projeto der certo e crescer vou poder recompensar todo mundo dessa, e de outras maneiras. Contato https://www.instagram.com/isa_danoninho/ Conto com o apoio de voc\u00eas! E minha eterna gratid\u00e3o por me ajudarem a continuar a fazer o que amo! \u2764\ufe0f Isa Danoninho :)", "categoria_multirrotulo_lda": {"0": 0.6, "1": 0.2, "2": 0.6, "3": 0.2, "4": 0.6, "5": 0.0, "6": 0.8, "7": 0.4, "8": 0.6, "9": 0.2, "10": 0.4, "11": 0.6, "12": 0.8, "13": 0.0, "14": 0.0, "15": 0.2, "16": 1.0, "17": 0.0, "18": 0.2, "19": 0.4, "20": 0.0, "21": 0.2, "22": 0.4, "23": 0.4, "24": 0.0, "25": 0.2, "26": 0.0, "27": 0.6, "28": 0.2, "29": 0.2, "30": 0.8, "31": 0.0, "32": 0.2, "33": 0.0, "34": 0.2, "35": 0.4, "36": 0.4, "37": 0.2, "38": 0.6, "39": 0.0, "40": 0.2, "41": 0.2, "42": 0.6, "43": 0.4, "44": 0.0, "45": 0.8, "46": 0.0, "47": 0.0, "48": 0.6, "49": 0.2}, "categoria_entidades": ["amigos", "cantinho especial", "vida", "isa", "27 anos", "desenho", "agosto de 2018", "profiss\u00e3o", "outubro de 2018", "aquarelas", "custos de materiais", "workshops", "maio de 2019", "mundo digital", "julho", "storyboard", "vida de freelancer", "\u00e1rea", "suficiente", "uma produtora", "trabalho com storyboard", "adm na p\u00e1gina do inktober brasil", "conte\u00fados", "divulga\u00e7\u00e3o dos trabalhos", "artistas", "p\u00e1gina no instagram", "trabalho", "um ano", "artes", "stories dos processos de cria\u00e7\u00e3o", "d\u00favidas", "arte", "conte\u00fado", "maioria dessas artes", "pr\u00f3prio instagram", "exposi\u00e7\u00f5es", "metas", "momento de impasse", "venda das artes", "freelas de storyboard", "suficientes", "coisa", "gosto", "materiais", "pessoas", "pre\u00e7o", "coisas novas", "vcs", "momentos", "projeto do apoia.se", "apoia.se", "plataforma de financiamento coletivo", "apoiador", "projeto de forma financeira", "apoiadores", "vez por m\u00eas", "sistema de assinatura", "prazo", "tempo de perman\u00eancia m\u00ednima", "valor total", "mes", "desconto de 13", "valor", "site", "resto", "criador do projeto", "caso", "instagram", "apoio", "p\u00e1gina no ar", "tempo di\u00e1rio espec\u00edfico", "foco principal do apoio", "cursos", "recompensas f\u00edsicas", "tipo adesivos", "prints", "im\u00e3s", "projeto", "mundo", "maneiras", "contato https://www.instagram.com/isa_danoninho/ conto", "apoio de voc\u00eas", "eterna gratid\u00e3o", "\ufe0f isa danoninho"]}