{"origem": "apoia.se", "categoria_teste_mencoes": {"saloes_humor": false, "hqmix": false, "ccxp": false, "fiq": false, "angelo_agostini": false, "politica": false, "questoes_genero": false, "lgbtqiamais": false, "terror": false, "humor": false, "herois": false, "disputa": false, "ficcao_cientifica": false, "fantasia": false, "folclore": false, "zine": false, "webformatos": false, "erotismo": false, "religiosidade": false, "jogos": false, "midia_independente": true}, "recompensas_menor_nominal": 2.0, "recompensas_menor_ajustado": 2.6391131343343677, "recompensas_quantidade": 6, "autoria_id": "8aba350c-0069-4942-925b-8027232381e6", "autoria_nome": "sorteios", "autoria_nome_publico": "sorteios", "autoria_classificacao": "outros", "autoria_classificacao_id": 5, "social_seguidores": 0, "social_newsletter": false, "social_sub_contribuicoes_amigos": 0, "social_sub_novos_seguidores": 0, "social_sub_posts_projeto": 0, "social_projetos_contribuidos": 0, "social_projetos_publicados": 0, "geral_municipio": "S\u00e3o Paulo", "geral_uf": "SP", "geral_uf_br": "SP", "geral_city_id": 5274, "geral_content_rating": null, "geral_contributed_by_friends": null, "geral_capa_imagem": false, "geral_capa_video": false, "geral_dias_campanha": 1846, "geral_data_fim": "", "geral_data_ini": "2020-03-17T16:56:41.946", "geral_meta": 2, "geral_meta_corrigida": 2.6391131343343677, "geral_arrecadado": 0, "geral_arrecadado_corrigido": 0.0, "geral_percentual_arrecadado": 0.0, "geral_conteudo_adulto": false, "geral_posts": 0, "geral_project_id": "5e70f5a597de8383a52a350a", "geral_modalidade": "sub", "geral_titulo": "Sorteios", "geral_status": "published", "geral_total_contribuicoes": 0, "geral_total_apoiadores": 0, "geral_sobre": "Ol\u00e1 Pessoa! Seja Bem Vindo Ao meu Apoia.se...\nAntes De Tudo Queria Te Agradecer Por Ter Tirado Um Tempinho Para Conhecer Minha P\u00e1gina.\nAqui Voc\u00ea Poder\u00e1 Me Ajudar Diretamente,Apoiando o Canal Eo Restante Dos Meus Trabalhos...\n\ud83d\udc9e\u00a0Sobre\u00a0\ud83d\udc9e\nOii,Eu Sou O Guilherme :3 Comecei Um Canal No Youtube Pois Sempre Quis Ser Que Nem Aqueles Youtubers Famosos Quando Crian\u00e7a ( Authentic,Rezeende Evil Entre Outros ),Porem Parei De Assistir Eles E Agora So To Tentando Crescer No Youtube Pra Mim Ajudar Minha M\u00e3e Em Casa,E Amo Editar Videos E Amo Editar Fotos Tambem <3 .\n\ud83d\udc9e Por Que O Apoia.Se? \ud83d\udc9e Meu Canal Do Youtube \u00c9 Pequeno E Ainda N\u00e3o Ganho Nada Com Ele,E N\u00e3o Consigo Fechar Patrocinios Com Lojas E Sites,E Ent\u00e3o Escolhi O Apoia.Se Pois O Achei Interessante\n\ud83d\udc9e\u00a0Como O Dinheiro Ser\u00e1 Utilizado? \ud83d\udc9e Todo O Dinheiro Arrecadado Ser\u00e1 Usado Para Auxiliar Na Produ\u00e7\u00e3o E Melhoria Dos V\u00eddeos, Na Compra De Equipamentos,Ferramentas De Trabalho E Sorteios , E Em Casa Se Sobrar..\n\ud83d\udc8c Caso Torne-Se Um Apoiador Gostaria De Agradecer Muito A Confian\u00e7a Ea Ajuda :3\nDe Qual Quer Forma,Muito Obrigado Por Sua Aten\u00e7\u00e3o E Por Ter Lido Ate Aqui :3 <3\n\ud83d\udc9e \ud83d\udc8c\ud83d\udc9e \ud83d\udc8c \ud83d\udc9e \ud83d\udc8c\n-> Avisos Importantes <-\nCaso Decida Ser Apoiador Do Canal Usando O Cart\u00e3o De Cr\u00e9dito o Apoia.Se Ir\u00e1 Debitar R$1 Da Sua Conta Independente Da Categoria De Apoiador . Essa Quantia Serve Apenas Para O Cadastro Do Cart\u00e3o E Ser\u00e1 Reembolsada Depois...\nLembre-Se De Registrar Um E-mail V\u00e1lido Durante o Cadastro , Caso Precise Entrarei Em Contato Por E-mail Que Voc\u00ea Se Cadastrou.", "categoria_multirrotulo_lda": {"0": 0.0, "1": 0.0, "2": 0.0, "3": 0.0, "4": 0.0, "5": 0.0, "6": 0.0, "7": 0.0, "8": 0.0, "9": 0.0, "10": 0.0, "11": 0.0, "12": 0.0, "13": 0.0, "14": 0.0, "15": 0.0, "16": 0.0, "17": 0.0, "18": 0.0, "19": 0.0, "20": 0.0, "21": 0.0, "22": 0.0, "23": 0.0, "24": 0.0, "25": 0.0, "26": 0.0, "27": 0.0, "28": 0.0, "29": 0.0, "30": 0.0, "31": 0.0, "32": 0.0, "33": 0.0, "34": 0.0, "35": 0.0, "36": 0.0, "37": 0.0, "38": 0.0, "39": 0.0, "40": 0.0, "41": 0.0, "42": 0.0, "43": 0.0, "44": 0.0, "45": 0.0, "46": 0.0, "47": 0.0, "48": 0.0, "49": 0.0}, "categoria_entidades": ["ol\u00e1 pessoa", "apoia.se", "ter tirado um tempinho", "minha p\u00e1gina", "canal eo restante dos meus trabalhos", "oii", "guilherme :3", "canal no youtube", "ser", "aqueles youtubers famosos", "crian\u00e7a", "authentic", "rezeende evil entre outros", "assistir", "so to tentando crescer no youtube pra mim", "minha m\u00e3e em casa", "editar videos", "fotos tambem <3", "que", "canal do youtube", "pequeno", "patrocinios com lojas", "sites", "apoia", "dinheiro", "dinheiro arrecadado", "auxiliar na produ\u00e7\u00e3o", "melhoria dos v\u00eddeos", "compra de equipamentos", "ferramentas de trabalho", "sorteios", "casa se sobrar", "apoiador", "muito", "confian\u00e7a ea ajuda", "qual quer forma", "obrigado por sua aten\u00e7\u00e3o", "ter lido ate aqui :3", "avisos importantes", "ser apoiador do canal", "cart\u00e3o de cr\u00e9dito", "debitar", "1", "conta independente da categoria de apoiador", "quantia", "cadastro do cart\u00e3o", "reembolsada", "e-mail v\u00e1lido", "cadastro", "precise", "contato por e-mail"]}