{"origem": "apoia.se", "categoria_teste_mencoes": {"saloes_humor": false, "hqmix": false, "ccxp": false, "fiq": false, "angelo_agostini": false, "politica": false, "questoes_genero": false, "lgbtqiamais": false, "terror": false, "humor": false, "herois": false, "disputa": false, "ficcao_cientifica": true, "fantasia": false, "folclore": false, "zine": true, "webformatos": false, "erotismo": false, "religiosidade": false, "jogos": false, "midia_independente": false}, "recompensas_menor_nominal": 1.0, "recompensas_menor_ajustado": 1.2373554514258756, "recompensas_quantidade": 2, "autoria_id": "6d83aa80-0f1f-405a-b2ef-841b9e01d215", "autoria_nome": "megafauna", "autoria_nome_publico": "megafauna", "autoria_classificacao": "outros", "autoria_classificacao_id": 5, "social_seguidores": 0, "social_newsletter": false, "social_sub_contribuicoes_amigos": 0, "social_sub_novos_seguidores": 0, "social_sub_posts_projeto": 0, "social_projetos_contribuidos": 0, "social_projetos_publicados": 0, "geral_municipio": "S\u00e3o Paulo", "geral_uf": "SP", "geral_uf_br": "SP", "geral_city_id": 5274, "geral_content_rating": null, "geral_contributed_by_friends": null, "geral_capa_imagem": false, "geral_capa_video": false, "geral_dias_campanha": 1392, "geral_data_fim": "", "geral_data_ini": "2021-06-13T22:36:55.283", "geral_meta": 0, "geral_meta_corrigida": 0.0, "geral_arrecadado": 0, "geral_arrecadado_corrigido": 0.0, "geral_percentual_arrecadado": 0, "geral_conteudo_adulto": false, "geral_posts": 6, "geral_project_id": "60c68887059abf34c4a24133", "geral_modalidade": "sub", "geral_titulo": "MEGAFAUNA", "geral_status": "published", "geral_total_contribuicoes": 0, "geral_total_apoiadores": 0, "geral_sobre": "MEGAFAUNA \u00e9 um projeto de hist\u00f3ria em quadrinhos assando nas ideias a algum tempo, esse apoia-se vem pra tornar o projeto vi\u00e1vel na sua cria\u00e7\u00e3o e eventual publica\u00e7\u00e3o.\nA ideia \u00e9 que seja uma tira de aventura/fic\u00e7\u00e3o-cient\u00edfica que vai aos poucos compondo uma novela maior, tamb\u00e9m vai ser acompanhada de material do processo que vou postar toda semana.\nA hist\u00f3ria se passa num futuro dist\u00f3pico na Ant\u00e1rtica, que se constituiu como uma confedera\u00e7\u00e3o soberana afastada de suas antigas na\u00e7\u00f5es dominantes. Sua geografia radicalmente alterada pela explora\u00e7\u00e3o agressiva que vem sofrendo.\nOs colonos de Marte e da \u00f3rbita da terra s\u00e3o seus verdadeiros senhores, ilhando o continente do resto do planeta e controlando suas diversas fac\u00e7\u00f5es na base da bala, assim exploram a m\u00e3o de obra e os recursos da terra enquanto reinam do espa\u00e7o.\nQuem apoiar o projeto a partir de 1 real j\u00e1 vai poder acompanhar a produ\u00e7\u00e3o do quadrinho com posts semanais dos meus esbo\u00e7os, estudos, p\u00e1ginas prontas e outros.\nNa medida que 'cap\u00edtulos' se fecharem (por volta de 20pgs) , vou publicar eles no formato de zines e enviar uma edi\u00e7\u00e3o pra apoiadores que contribu\u00edrem a partir de 20 reais! Todos os outros apoiadores podem comprar a zine a pre\u00e7o camarada, com desconto no envio.", "categoria_multirrotulo_lda": {"0": 0.0, "1": 0.0, "2": 0.0, "3": 0.0, "4": 0.0, "5": 0.0, "6": 0.4, "7": 0.0, "8": 0.4, "9": 0.0, "10": 0.0, "11": 0.0, "12": 0.2, "13": 0.0, "14": 0.0, "15": 0.0, "16": 0.4, "17": 0.0, "18": 0.0, "19": 0.0, "20": 0.0, "21": 0.0, "22": 0.0, "23": 0.2, "24": 0.0, "25": 0.0, "26": 0.2, "27": 0.0, "28": 0.0, "29": 0.0, "30": 0.0, "31": 0.2, "32": 0.0, "33": 0.0, "34": 0.0, "35": 0.0, "36": 0.2, "37": 0.0, "38": 0.2, "39": 0.0, "40": 0.0, "41": 0.0, "42": 0.0, "43": 0.2, "44": 0.0, "45": 0.2, "46": 0.0, "47": 0.2, "48": 0.0, "49": 0.0}, "categoria_entidades": ["megafauna", "projeto de hist\u00f3ria em quadrinhos", "ideias", "tempo", "projeto vi\u00e1vel", "cria\u00e7\u00e3o", "eventual publica\u00e7\u00e3o", "ideia", "uma tira de aventura", "poucos", "novela maior", "material do processo", "semana", "hist\u00f3ria", "futuro dist\u00f3pico na ant\u00e1rtica", "confedera\u00e7\u00e3o soberana", "antigas na\u00e7\u00f5es dominantes", "geografia", "explora\u00e7\u00e3o agressiva", "colonos de marte", "\u00f3rbita da terra", "verdadeiros senhores", "continente do resto do planeta", "fac\u00e7\u00f5es na base da bala", "m\u00e3o de obra", "recursos da terra", "espa\u00e7o", "projeto a partir de 1 real", "produ\u00e7\u00e3o do quadrinho com posts semanais", "esbo\u00e7os", "estudos", "p\u00e1ginas prontas", "que", "cap\u00edtulos", "volta de 20pgs", "formato de zines", "edi\u00e7\u00e3o pra apoiadores", "partir de 20 reais", "apoiadores", "zine a pre\u00e7o camarada", "desconto no envio"]}