{"origem": "catarse", "categoria_teste_mencoes": {"saloes_humor": false, "hqmix": false, "ccxp": false, "fiq": false, "angelo_agostini": false, "politica": false, "questoes_genero": false, "lgbtqiamais": false, "terror": false, "humor": false, "herois": false, "disputa": false, "ficcao_cientifica": false, "fantasia": false, "folclore": false, "zine": false, "webformatos": false, "erotismo": false, "religiosidade": false, "jogos": true, "midia_independente": false}, "recompensas_menor_nominal": 25.0, "recompensas_menor_ajustado": 35.49973771513177, "recompensas_quantidade": 1, "autoria_id": 429713, "autoria_nome": "anderson vieira", "autoria_nome_publico": "anderson vieira", "autoria_classificacao": "masculino", "autoria_classificacao_id": 3, "social_seguidores": 28, "social_newsletter": true, "social_sub_contribuicoes_amigos": true, "social_sub_novos_seguidores": true, "social_sub_posts_projeto": true, "social_projetos_contribuidos": 0, "social_projetos_publicados": 1, "geral_municipio": "Mairinque", "geral_uf": "SP", "geral_uf_br": "SP", "geral_city_id": 5031, "geral_content_rating": 1, "geral_contributed_by_friends": false, "geral_capa_imagem": false, "geral_capa_video": true, "geral_dias_campanha": 60, "geral_data_fim": "2018-08-29T02:59:59.999999", "geral_data_ini": "2018-06-29T16:37:33.30468", "geral_meta": 6000.0, "geral_meta_corrigida": 8519.937051631627, "geral_arrecadado": 2010.0, "geral_arrecadado_corrigido": 2854.1789122965947, "geral_percentual_arrecadado": 33.5, "geral_conteudo_adulto": false, "geral_posts": 4, "geral_project_id": 61324, "geral_modalidade": "aon", "geral_titulo": "Confiss\u00f5es de Atendente", "geral_status": "failed", "geral_total_contribuicoes": 49, "geral_total_apoiadores": 44, "geral_sobre": "Confiss\u00f5es de Atendente \u00e9 um quadrinho que retrata a vida de Abelino, funcion\u00e1rio de uma rede de fast food. Aqui ele conta os acontecimentos e apuros de seu trabalho, e assim voc\u00ea conhece o cotidiano de quem prepara seus lanches em 4 minutos e meio.\nAlguns cap\u00edtulos est\u00e3o dispon\u00edveis online e voc\u00ea pode ler pela plataforma Tapas. CLIQUE AQUI\nO Catarse \u00e9 uma plataforma de financiamento coletivo, onde qualquer pessoa consegue contribuir para que projetos saiam do papel.\nPara quadrinhos, o Catarse funciona como uma pr\u00e9 venda onde voc\u00ea pode ajudar contribuindo com valores que cabem no bolso e levar al\u00e9m do quadrinho, recompensas exclusivas.\nMas como funciona?\n- As metas ficam na lateral e voc\u00ea escolhe a que lhe agradar mais.- Apoiando o projeto, caso a meta seja atingida o projeto \u00e9 financiado e voc\u00ea recebe na sua casa a HQ e as recompensas.\n- Mas n\u00e3o se preocupe caso o projeto n\u00e3o seja financiado, o Catarse devolve seu dinheiro.\nVAMOS L\u00c1 , APOIA A\u00cd !!!!\nOl\u00e1, sou o Anderson Vieira, tenho 23 anos,formado em Jogos Digitais pela UNISO e no momento sou estudante de Design, estou tentando me encontrar no mundo dos quadrinhos e ilustra\u00e7\u00e3o. Esse \u00e9 o primeiro projeto de muitos que est\u00e3o por vir .\nFacebook : https://www.facebook.com/artedeandersonvieira\nInstagram : https://www.instagram.com/devieira27/\nBehance : https://www.behance.net/andersonvieirart", "categoria_multirrotulo_lda": {"0": 0.4, "1": 0.2, "2": 0.4, "3": 0.4, "4": 0.6, "5": 0.0, "6": 0.4, "7": 0.0, "8": 0.0, "9": 0.0, "10": 0.2, "11": 0.4, "12": 0.6, "13": 0.0, "14": 0.0, "15": 0.2, "16": 0.2, "17": 0.0, "18": 0.0, "19": 0.0, "20": 0.2, "21": 0.0, "22": 0.2, "23": 0.2, "24": 0.0, "25": 0.2, "26": 0.0, "27": 0.6, "28": 0.2, "29": 0.2, "30": 0.4, "31": 0.2, "32": 0.0, "33": 0.0, "34": 0.2, "35": 0.4, "36": 0.4, "37": 0.0, "38": 0.4, "39": 0.0, "40": 0.2, "41": 0.6, "42": 0.4, "43": 0.4, "44": 0.0, "45": 0.6, "46": 0.0, "47": 0.0, "48": 0.4, "49": 0.2}, "categoria_entidades": ["confiss\u00f5es de atendente", "quadrinho", "vida de abelino", "funcion\u00e1rio", "rede de fast", "acontecimentos", "apuros", "trabalho", "cotidiano", "lanches em 4 minutos", "cap\u00edtulos", "dispon\u00edveis online", "plataforma tapas", "clique aqui", "catarse", "plataforma de financiamento coletivo", "pessoa", "projetos", "papel", "quadrinhos", "uma pr\u00e9 venda", "valores", "bolso", "recompensas exclusivas", "metas", "lateral", "projeto", "meta", "casa a hq", "recompensas", "dinheiro", "l\u00e1", "apoia a\u00ed", "ol\u00e1", "anderson vieira", "23 anos", "jogos digitais pela uniso", "momento", "estudante de design", "mundo dos quadrinhos", "ilustra\u00e7\u00e3o", "primeiro projeto", "facebook", "instagram", "behance", "https://www.behance.net/andersonvieirart"]}