{"origem": "apoia.se", "categoria_teste_mencoes": {"saloes_humor": false, "hqmix": false, "ccxp": false, "fiq": false, "angelo_agostini": false, "politica": false, "questoes_genero": false, "lgbtqiamais": false, "terror": false, "humor": false, "herois": false, "disputa": false, "ficcao_cientifica": true, "fantasia": false, "folclore": false, "zine": false, "webformatos": false, "erotismo": false, "religiosidade": false, "jogos": false, "midia_independente": false}, "recompensas_menor_nominal": 1.0, "recompensas_menor_ajustado": 1.166234662224873, "recompensas_quantidade": 8, "autoria_id": "6573f8a0-9ee6-4336-b0c5-a837b80ee0f2", "autoria_nome": "end", "autoria_nome_publico": "end", "autoria_classificacao": "feminino", "autoria_classificacao_id": 4, "social_seguidores": 0, "social_newsletter": false, "social_sub_contribuicoes_amigos": 0, "social_sub_novos_seguidores": 0, "social_sub_posts_projeto": 0, "social_projetos_contribuidos": 0, "social_projetos_publicados": 0, "geral_municipio": "Natal", "geral_uf": "RN", "geral_uf_br": "RN", "geral_city_id": 3774, "geral_content_rating": null, "geral_contributed_by_friends": null, "geral_capa_imagem": false, "geral_capa_video": false, "geral_dias_campanha": 1201, "geral_data_fim": "", "geral_data_ini": "2021-12-21T22:22:31.335", "geral_meta": 100, "geral_meta_corrigida": 116.6234662224873, "geral_arrecadado": 0, "geral_arrecadado_corrigido": 0.0, "geral_percentual_arrecadado": 0.0, "geral_conteudo_adulto": false, "geral_posts": 0, "geral_project_id": "61c253a7f732ee89372350fe", "geral_modalidade": "sub", "geral_titulo": "END", "geral_status": "published", "geral_total_contribuicoes": 0, "geral_total_apoiadores": 0, "geral_sobre": "Do altivo \u00e0 par\u00f3quia. Nas d\u00e1divas eclesi\u00e1sticas hei de vos acalantar... Por\u00e9m da forma mais sucinta poss\u00edvel. Temos o projeto END em andamento por mais de meia d\u00e9cada, mas a luz do dia s\u00f3 raiou a ele nos \u00faltimos 2 anos. Por estarmos aqui pedindo ajuda, faz voc\u00eas pensarem: \"essa luz est\u00e1 enfraquecida?\" E N\u00e3o, nosso projeto est\u00e1 radiante como nunca antes, por\u00e9m h\u00e1 raiar, o sol at\u00e9 sentir\u00e1 inveja, se voc\u00ea contribuir com o nosso projeto aqui na plataforma apoia.se.\nIlustrador; Editor; Diretor; Pesquisadores; Repartidor P\u00fablico; Anfitri\u00f5es; Temos um elenco unido para a constru\u00e7\u00e3o, elabora\u00e7\u00e3o e execu\u00e7\u00e3o do projeto END e para que continuemos de imensa ajuda seria a colabora\u00e7\u00e3o financeira atrelada a j\u00e1 forte divulga\u00e7\u00e3o e carinho de voc\u00eas - p\u00fablico - Assim, fa\u00e7o de minhas palavras mais curtas: Se puder corroborar, agradecer-vos-\u00edamos. Contudo, n\u00e3o os for\u00e7aremos a nada, se n\u00e3o puder designar essas parcelas monet\u00e1rias conosco, divulgue o projeto sempre que poss\u00edvel e, claro, o nosso apoia.se. Obrigado pela leitura.", "categoria_multirrotulo_lda": {"0": 0.0, "1": 0.0, "2": 0.2, "3": 0.2, "4": 0.2, "5": 0.0, "6": 0.0, "7": 0.0, "8": 0.0, "9": 0.0, "10": 0.0, "11": 0.2, "12": 0.2, "13": 0.2, "14": 0.0, "15": 0.2, "16": 0.0, "17": 0.0, "18": 0.0, "19": 0.0, "20": 0.0, "21": 0.0, "22": 0.2, "23": 0.2, "24": 0.0, "25": 0.0, "26": 0.0, "27": 0.2, "28": 0.0, "29": 0.0, "30": 0.2, "31": 0.0, "32": 0.0, "33": 0.0, "34": 0.2, "35": 0.2, "36": 0.2, "37": 0.0, "38": 0.2, "39": 0.0, "40": 0.2, "41": 0.2, "42": 0.2, "43": 0.2, "44": 0.0, "45": 0.0, "46": 0.0, "47": 0.0, "48": 0.2, "49": 0.0}, "categoria_entidades": ["altivo \u00e0 par\u00f3quia", "d\u00e1divas eclesi\u00e1sticas", "acalantar", "forma", "sucinta poss\u00edvel", "projeto end em andamento", "meia d\u00e9cada", "luz do dia", "raiou", "\u00faltimos 2 anos", "ajuda", "luz", "projeto", "sol", "inveja", "plataforma", "ilustrador", "editor", "diretor", "pesquisadores", "repartidor p\u00fablico", "anfitri\u00f5es", "elenco", "constru\u00e7\u00e3o", "elabora\u00e7\u00e3o", "execu\u00e7\u00e3o do projeto end", "imensa ajuda", "colabora\u00e7\u00e3o financeira", "forte divulga\u00e7\u00e3o", "carinho de voc\u00eas", "p\u00fablico", "palavras", "parcelas monet\u00e1rias conosco", "apoia.se", "leitura"]}