{"origem": "apoia.se", "categoria_teste_mencoes": {"saloes_humor": false, "hqmix": false, "ccxp": false, "fiq": false, "angelo_agostini": false, "politica": false, "questoes_genero": false, "lgbtqiamais": false, "terror": false, "humor": false, "herois": false, "disputa": true, "ficcao_cientifica": true, "fantasia": false, "folclore": false, "zine": false, "webformatos": false, "erotismo": false, "religiosidade": false, "jogos": false, "midia_independente": false}, "recompensas_menor_nominal": 1.0, "recompensas_menor_ajustado": 1.0592606244666232, "recompensas_quantidade": 3, "autoria_id": "9fc89553-cf39-461d-b97f-eaaabeeea47b", "autoria_nome": "man\u00e1o", "autoria_nome_publico": "man\u00e1o", "autoria_classificacao": "outros", "autoria_classificacao_id": 5, "social_seguidores": 0, "social_newsletter": false, "social_sub_contribuicoes_amigos": 0, "social_sub_novos_seguidores": 0, "social_sub_posts_projeto": 0, "social_projetos_contribuidos": 0, "social_projetos_publicados": 0, "geral_municipio": "Manaus", "geral_uf": "AM", "geral_uf_br": "AM", "geral_city_id": 260, "geral_content_rating": null, "geral_contributed_by_friends": null, "geral_capa_imagem": false, "geral_capa_video": false, "geral_dias_campanha": 629, "geral_data_fim": "", "geral_data_ini": "2023-07-17T18:30:38.765", "geral_meta": 360, "geral_meta_corrigida": 381.33382480798434, "geral_arrecadado": 46, "geral_arrecadado_corrigido": 48.72598872546467, "geral_percentual_arrecadado": 0.12777777777777777, "geral_conteudo_adulto": false, "geral_posts": 0, "geral_project_id": "64b588ce0887cb8a9ca281fa", "geral_modalidade": "sub", "geral_titulo": "Man\u00e1o", "geral_status": "published", "geral_total_contribuicoes": 3, "geral_total_apoiadores": 3, "geral_sobre": "\u201cMAN\u00c1O\u201d \u00e9 o povo que deu origem ao nome da cidade de Manaus. E \u00e9 o t\u00edtulo de uma antologia que re\u00fane artistas de diferentes ancestralidades para contar uma nova Hist\u00f3ria, criando personagens que alteram o rumo dos eventos nos s\u00e9culos 15, 16, 17 em diante at\u00e9 chegar numa Manaus, em um tempo presente, que \u00e9 futurista, mas \u00e9 tamb\u00e9m mais inclusivo, mais diverso. Tramas que podem ser lidas de forma independente, mas que tamb\u00e9m se conectam.\nQUEM \u00c9 \"MAN\u00c1O?\" \u00c9 MAN\u00c1O OU MANA\u00d3? Durante as nossas consultas com historiadores, vimos que antes de \"Manaus\", nossa cidade se chamava \"Mana\u00f3s\", mas essa popular grafia decorreu de um erro de acentua\u00e7\u00e3o que se tornou comum. Nosso nome original era MAN\u00c1OS. E o povo que nos deu nome eram tamb\u00e9m os \"man\u00e1os\", com acento agudo no segundo \"a\". Um man\u00e1o, originalmente, era um membro desse povo, que bravamente lutaram sob o comando de Ajuricaba contra a opress\u00e3o dos colonizadores.\nMas, com o tempo, os mana\u00f3s se tornaram os cidad\u00e3os da cidade de mesmo nome. Mana\u00f3 \u00e9 o manauara, nascido em Manaus. \u00c9 tamb\u00e9m o \"manauense\", gent\u00edlico alternativo para os habitantes da cidade. Man\u00e1o \u00e9 o descedente dos povos origin\u00e1rios. Mas \u00e9 tamb\u00e9m o descendente do colonizador. E \u00e9 tamb\u00e9m o descendente do imigrante que veio para Manaus da \u00c1frica Subsaariana. Do L\u00edbano. Da S\u00edria. Do Jap\u00e3o. Da It\u00e1lia. Da Inglaterra. Mas tamb\u00e9m do Brasil\u00a0- do nordeste e do pr\u00f3prio norte, em especial do estado vizinho, o Par\u00e1. Mais recentemente, do Haiti e da Venezuela. Todos esses povos se misturam e formam o caldeir\u00e3o cultural que \u00e9 Manaus. S\u00e9rgio Bonelli criou \u201cMister No\u201d, personagem cujas hist\u00f3rias fict\u00edcias se passavam em uma Manaus na d\u00e9cada de 1950. Louvado seja o trabalho dos italianos, mas n\u00e3o seria prefer\u00edvel um trabalho feito por n\u00f3s, amaz\u00f4nidas, j\u00e1 que \u00e9 sobre n\u00f3s e sobre nossa cidade? Fantasia medieval no s\u00e9culo 15, mas com guerreiros inspirados no Imp\u00e9rio Mali ao inv\u00e9s da Europa. Um romance com aventura no s\u00e9culo 18, mas sem uma princesa \u201cpadr\u00e3o Disney\u201d, e sim uma princesa-guerreira africana em hist\u00f3rias que n\u00e3o resumem a mulher aos seus interesses amorosos. Fic\u00e7\u00e3o no s\u00e9culo 19, revisitando a obra de grandes autores brancos como Edgar Rice Burroughs e H.G. Wells, com um olhar mais favor\u00e1vel \u00e0 diversidade. Guerra no s\u00e9culo 20, mas com todo o impacto das altera\u00e7\u00f5es hist\u00f3ricas das tramas passadas. Afinal, se h\u00e1 Burroughs e Wells, h\u00e1 marcianos\u2026 \u2026e no s\u00e9culo 21, ao inv\u00e9s de um cyberpunk tradicional, algo que s\u00f3 existiria em Manaus. \u00c9 high-tech, low-life? \u00c9, mas \u00e9 low-life com high-hopes. \u00c9 TECNOBRIGA.", "categoria_multirrotulo_lda": {"0": 0.2, "1": 0.0, "2": 0.2, "3": 0.2, "4": 0.0, "5": 0.0, "6": 0.0, "7": 0.2, "8": 0.0, "9": 0.2, "10": 0.2, "11": 0.0, "12": 0.2, "13": 0.0, "14": 0.0, "15": 0.0, "16": 0.0, "17": 0.0, "18": 0.0, "19": 0.2, "20": 0.0, "21": 0.0, "22": 0.0, "23": 0.2, "24": 0.0, "25": 0.2, "26": 0.0, "27": 0.0, "28": 0.0, "29": 0.2, "30": 0.0, "31": 0.0, "32": 0.0, "33": 0.0, "34": 0.0, "35": 0.2, "36": 0.2, "37": 0.2, "38": 0.0, "39": 0.0, "40": 0.0, "41": 0.0, "42": 0.0, "43": 0.2, "44": 0.0, "45": 0.2, "46": 0.0, "47": 0.2, "48": 0.0, "49": 0.0}, "categoria_entidades": ["man\u00e1o", "povo", "origem ao nome da cidade de manaus", "t\u00edtulo", "antologia", "artistas", "ancestralidades", "nova hist\u00f3ria", "personagens", "rumo dos eventos nos s\u00e9culos 15", "17", "manaus", "tempo presente", "tramas", "forma independente", "mana\u00f3", "consultas com historiadores", "cidade", "mana\u00f3s", "popular grafia", "erro de acentua\u00e7\u00e3o", "nome original", "man\u00e1os", "nome", "acento agudo no segundo", "membro desse povo", "comando de ajuricaba", "opress\u00e3o dos colonizadores", "tempo", "cidad\u00e3os da cidade de mesmo nome", "manauara", "manauense", "gent\u00edlico alternativo", "habitantes da cidade", "descedente dos povos origin\u00e1rios", "descendente do colonizador", "descendente do imigrante", "manaus da \u00e1frica subsaariana", "l\u00edbano", "s\u00edria", "jap\u00e3o", "it\u00e1lia", "inglaterra", "brasil", "nordeste", "norte", "especial do estado vizinho", "par\u00e1", "haiti", "venezuela", "povos", "caldeir\u00e3o cultural", "s\u00e9rgio bonelli", "mister", "personagem", "hist\u00f3rias fict\u00edcias", "manaus na d\u00e9cada de 1950", "trabalho dos italianos", "trabalho", "amaz\u00f4nidas", "fantasia medieval no s\u00e9culo 15", "guerreiros", "imp\u00e9rio mali ao inv\u00e9s da europa", "romance com aventura no s\u00e9culo 18", "princesa", "padr\u00e3o disney", "princesa-guerreira africana em hist\u00f3rias", "mulher", "interesses amorosos", "fic\u00e7\u00e3o no s\u00e9culo 19", "obra de grandes autores brancos como edgar rice burroughs", "h.g. wells", "olhar", "favor\u00e1vel \u00e0 diversidade", "guerra no s\u00e9culo 20", "impacto das altera\u00e7\u00f5es hist\u00f3ricas das tramas", "burroughs", "wells", "marcianos", "s\u00e9culo 21", "inv\u00e9s", "cyberpunk tradicional", "low-life", "low-life com high-hopes", "tecnobriga"]}