{"origem": "apoia.se", "categoria_teste_mencoes": {"saloes_humor": false, "hqmix": false, "ccxp": false, "fiq": false, "angelo_agostini": false, "politica": true, "questoes_genero": false, "lgbtqiamais": false, "terror": false, "humor": false, "herois": false, "disputa": false, "ficcao_cientifica": false, "fantasia": false, "folclore": false, "zine": false, "webformatos": false, "erotismo": false, "religiosidade": false, "jogos": false, "midia_independente": false}, "recompensas_menor_nominal": 5.0, "recompensas_menor_ajustado": 5.28521553892127, "recompensas_quantidade": 5, "autoria_id": "c9287735-b7f7-43f2-9c2f-50ea7650c99a", "autoria_nome": "est\u00fadio daniel brand\u00e3o", "autoria_nome_publico": "est\u00fadio daniel brand\u00e3o", "autoria_classificacao": "coletivo", "autoria_classificacao_id": 2, "social_seguidores": 0, "social_newsletter": false, "social_sub_contribuicoes_amigos": 0, "social_sub_novos_seguidores": 0, "social_sub_posts_projeto": 0, "social_projetos_contribuidos": 0, "social_projetos_publicados": 0, "geral_municipio": "Fortaleza", "geral_uf": "CE", "geral_uf_br": "CE", "geral_city_id": 760, "geral_content_rating": null, "geral_contributed_by_friends": null, "geral_capa_imagem": false, "geral_capa_video": false, "geral_dias_campanha": 568, "geral_data_fim": "", "geral_data_ini": "2023-09-16T12:51:02.336", "geral_meta": 3000, "geral_meta_corrigida": 3171.1293233527617, "geral_arrecadado": 335, "geral_arrecadado_corrigido": 354.1094411077251, "geral_percentual_arrecadado": 0.10333333333333333, "geral_conteudo_adulto": false, "geral_posts": 0, "geral_project_id": "6505a4b68ba2e51d2cd09622", "geral_modalidade": "sub", "geral_titulo": "EST\u00daDIO DANIEL BRAND\u00c3O", "geral_status": "published", "geral_total_contribuicoes": 6, "geral_total_apoiadores": 6, "geral_sobre": "O Est\u00fadio Daniel Brand\u00e3o tem como maior objetivo ajudar pessoas a se expressarem atrav\u00e9s do desenho com prazer, independente da idade. Para isso, acreditamos que seja fundamental a democratiza\u00e7\u00e3o do ensino de artes e o compartilhamento dos processos de produ\u00e7\u00e3o.\nPara n\u00f3s, estudar e praticar desenho e quadrinhos \u00e9 desenvolver\u00a0linguagens important\u00edssimas para nos conectarmos melhor com o mundo, com o outro e consigo mesmo. Portanto, trabalhamos para que o Est\u00fadio seja\u00a0um ambiente f\u00e9rtil para a constru\u00e7\u00e3o de conhecimento coletivo, com trocas e generosidade.\nPara mantermos e ampliarmos o alcance destes objetivos resolvemos criar um APOIA.se com recompensas de aulas ao vivo, processos de produ\u00e7\u00e3o de desenhos e quadrinhos e sorteios para apoiadores.\n.", "categoria_multirrotulo_lda": {"0": 0.0, "1": 0.2, "2": 0.2, "3": 0.0, "4": 0.4, "5": 0.0, "6": 0.2, "7": 0.0, "8": 0.0, "9": 0.0, "10": 0.0, "11": 0.0, "12": 0.0, "13": 0.0, "14": 0.0, "15": 0.0, "16": 0.0, "17": 0.0, "18": 0.0, "19": 0.0, "20": 0.0, "21": 0.0, "22": 0.0, "23": 0.0, "24": 0.0, "25": 0.0, "26": 0.0, "27": 0.0, "28": 0.0, "29": 0.2, "30": 0.0, "31": 0.0, "32": 0.0, "33": 0.0, "34": 0.0, "35": 0.0, "36": 0.2, "37": 0.2, "38": 0.0, "39": 0.0, "40": 0.0, "41": 0.0, "42": 0.0, "43": 0.2, "44": 0.0, "45": 0.4, "46": 0.0, "47": 0.0, "48": 0.2, "49": 0.2}, "categoria_entidades": ["est\u00fadio daniel brand\u00e3o", "maior objetivo", "pessoas", "desenho com prazer", "idade", "democratiza\u00e7\u00e3o do ensino de artes", "compartilhamento dos processos de produ\u00e7\u00e3o", "desenho", "quadrinhos", "linguagens important\u00edssimas", "mundo", "est\u00fadio", "ambiente f\u00e9rtil", "constru\u00e7\u00e3o de conhecimento coletivo", "trocas", "generosidade", "alcance destes objetivos", "apoia.se com recompensas de aulas ao vivo", "processos de produ\u00e7\u00e3o de desenhos", "sorteios para apoiadores"]}