{"origem": "catarse", "categoria_teste_mencoes": {"saloes_humor": false, "hqmix": false, "ccxp": true, "fiq": true, "angelo_agostini": false, "politica": false, "questoes_genero": false, "lgbtqiamais": false, "terror": false, "humor": false, "herois": false, "disputa": true, "ficcao_cientifica": false, "fantasia": false, "folclore": false, "zine": false, "webformatos": false, "erotismo": false, "religiosidade": false, "jogos": false, "midia_independente": true}, "recompensas_menor_nominal": 40.0, "recompensas_menor_ajustado": 71.26932576735284, "recompensas_quantidade": 1, "autoria_id": 166605, "autoria_nome": "diego ferreira contreras sanches", "autoria_nome_publico": "diego sanches", "autoria_classificacao": "masculino", "autoria_classificacao_id": 3, "social_seguidores": 305, "social_newsletter": false, "social_sub_contribuicoes_amigos": true, "social_sub_novos_seguidores": true, "social_sub_posts_projeto": true, "social_projetos_contribuidos": 57, "social_projetos_publicados": 6, "geral_municipio": "S\u00e3o Paulo", "geral_uf": "SP", "geral_uf_br": "SP", "geral_city_id": 5274, "geral_content_rating": 1, "geral_contributed_by_friends": false, "geral_capa_imagem": false, "geral_capa_video": true, "geral_dias_campanha": 60, "geral_data_fim": "2014-11-08T01:59:59", "geral_data_ini": "2014-09-08T03:00:23.376322", "geral_meta": 15000.0, "geral_meta_corrigida": 26725.997162757318, "geral_arrecadado": 33551.0, "geral_arrecadado_corrigido": 59778.92872051137, "geral_percentual_arrecadado": 223.67333333333332, "geral_conteudo_adulto": false, "geral_posts": 17, "geral_project_id": 6958, "geral_modalidade": "aon", "geral_titulo": "QUAD 2", "geral_status": "successful", "geral_total_contribuicoes": 575, "geral_total_apoiadores": 562, "geral_sobre": "O QUAD \u00e9 uma revista de hist\u00f3rias em quadrinhos de fic\u00e7\u00e3o cient\u00edfica produzida por quatro autores: Alu\u00edsio Cervelle Santos, Eduardo Ferigato, Diego Sanches e Eduardo Schaal.\nQuatro artistas, quatro hist\u00f3rias, dentro do mesmo universo de fic\u00e7\u00e3o.\nA primeira edi\u00e7\u00e3o foi financiada aqui no Catarse no ano passado, e lan\u00e7ada durante o FIQ em Belo Horizonte.\nCapa e contra-capa do QUAD 1 .\nAgora, voltamos aqui para anunciarmos a segunda!\nEsta edi\u00e7\u00e3o ter\u00e1 mais p\u00e1ginas de hist\u00f3ria do que a primeira, mantendo a mesma qualidade gr\u00e1fica , miolo em preto e branco e capa colorida.\nCapa do QUAD 2 .\nO lan\u00e7amento do QUAD 2 ser\u00e1 em Dezembro/2014, durante a Comic-Con Experience (CCXP), em S\u00e3o Paulo.\nPara acompanhar a produ\u00e7\u00e3o do projeto, entre no nosso site e na nossa p\u00e1gina do facebook\nMas se voc\u00ea quer receber novidades e making ofs exclusivos, n\u00e3o perca tempo e adquira seu QUAD 2 aqui no Catarse. Os apoiadores receber\u00e3o atualiza\u00e7\u00f5es antes de todo mundo!\nLIVRO QUAD 2\nTer\u00e1 136 p\u00e1ginas, miolo em papel couche, preto e branco, com capa cartonada colorida e lombada quadrada. Tamanho A4\nSer\u00e3o novamente quatro hist\u00f3rias, algumas com liga\u00e7\u00e3o mais forte com as hist\u00f3rias do primeiro QUAD , outras nem tanto, mas as quatro poder\u00e3o ser lidas de forma completamente independente.\nSKETCHBOOK Um sketchbook com desenhos de pr\u00e9 produ\u00e7\u00e3o das hist\u00f3rias do QUAD 2 de cerca de 24 p\u00e1ginas em papel couche, preto e branco, com tiragem bem limitada e numerado \u00e0 m\u00e3o.\nPACOTES QUAD 1 + 2 Perdeu o primeiro QUAD? N\u00e3o se preocupe! Ainda temos algumas c\u00f3pias que voc\u00ea pode adquirir junto com o QUAD 2!\nACTION FIGURE Action Figure do Capit\u00e3o Lucas, personagem da \u00faltima hist\u00f3ria do primeiro QUAD , esculpida e reproduzida em resina de alta qualidade por Daniel Adami e pintada a m\u00e3o por Diego Sanches. A est\u00e1tua ter\u00e1 cerca de 18 cm de altura. Foi esculpida digitalmente e feita uma impress\u00e3o 3D no Garagem Fab Lab .\nModelo 3D do Capit\u00e3o Lucas.\nPrimeiro prot\u00f3tipo com pintura. Esta vers\u00e3o tem tamanho menor do que ter\u00e1 a vers\u00e3o final.\nSKETCHES ORIGINAIS Desenhos originais em tamanho A4 em papel de gramatura alta. Cada desenho \u00e9 \u00fanico e exclusivo para o apoiador. Cada um dos autores do QUAD vai produzir a mesma quantidade de sketches.\nARTE ORIGINAL DAVI CALIL Esta arte original pintada por Davi Calil, em formato A3:\nARTE ORIGINAL GREG TOCCHINI Esta arte original desenhada por Greg Tocchini:\nARTE ORIGINAL WILL MURAI Esta arte original desenhada por Will Murai:\nPACOTES PARA LOJISTAS Para o lojista que deseja ter o QUAD 2 dispon\u00edvel a um pre\u00e7o especial da pr\u00e9-venda do Catarse.", "categoria_multirrotulo_lda": {"0": 0.2, "1": 0.2, "2": 0.4, "3": 0.0, "4": 0.6, "5": 0.2, "6": 0.6, "7": 0.4, "8": 0.2, "9": 0.2, "10": 0.2, "11": 0.4, "12": 0.2, "13": 0.0, "14": 0.0, "15": 0.0, "16": 0.4, "17": 0.0, "18": 0.2, "19": 0.4, "20": 0.0, "21": 0.2, "22": 0.2, "23": 0.2, "24": 0.0, "25": 0.4, "26": 0.2, "27": 0.2, "28": 0.2, "29": 0.4, "30": 0.2, "31": 0.0, "32": 0.2, "33": 0.0, "34": 0.0, "35": 0.2, "36": 0.2, "37": 0.6, "38": 0.2, "39": 0.0, "40": 0.0, "41": 0.2, "42": 0.2, "43": 0.4, "44": 0.0, "45": 0.2, "46": 0.0, "47": 0.0, "48": 0.2, "49": 0.2}, "categoria_entidades": ["quad", "revista de hist\u00f3rias em quadrinhos de fic\u00e7\u00e3o cient\u00edfica", "quatro autores", "alu\u00edsio cervelle santos", "eduardo ferigato", "diego sanches", "eduardo schaal", "quatro artistas", "quatro hist\u00f3rias", "mesmo universo de fic\u00e7\u00e3o", "primeira edi\u00e7\u00e3o", "catarse no ano passado", "fiq em belo horizonte", "capa", "contra-capa do quad 1", "edi\u00e7\u00e3o", "p\u00e1ginas de hist\u00f3ria", "mesma qualidade gr\u00e1fica", "miolo em preto", "capa colorida", "capa do quad 2", "lan\u00e7amento do quad 2", "dezembro/2014", "comic-con experience", "ccxp", "s\u00e3o paulo", "produ\u00e7\u00e3o do projeto", "site", "p\u00e1gina do facebook", "novidades", "making ofs exclusivos", "tempo", "quad 2", "catarse", "apoiadores", "atualiza\u00e7\u00f5es", "mundo", "livro quad 2", "136 p\u00e1ginas", "miolo em papel couche", "lombada", "tamanho a4", "liga\u00e7\u00e3o", "forte", "hist\u00f3rias do primeiro quad", "tanto", "forma", "sketchbook", "sketchbook com desenhos", "produ\u00e7\u00e3o das hist\u00f3rias do quad 2", "24 p\u00e1ginas em papel couche", "tiragem", "numerado \u00e0 m\u00e3o", "pacotes quad 1", "primeiro quad", "c\u00f3pias", "figure action figure do capit\u00e3o lucas", "personagem da \u00faltima hist\u00f3ria do primeiro quad", "resina de alta qualidade por daniel adami", "m\u00e3o por diego sanches", "est\u00e1tua", "18 cm de altura", "impress\u00e3o 3d no garagem fab lab", "modelo 3d do capit\u00e3o lucas", "primeiro prot\u00f3tipo com pintura", "vers\u00e3o", "tamanho menor", "vers\u00e3o final", "sketches originais desenhos originais em tamanho a4 em papel de gramatura alta", "desenho", "exclusivo", "apoiador", "um dos autores do quad", "mesma quantidade de sketches", "arte original davi calil", "arte original", "davi calil", "formato a3", "arte original greg tocchini", "greg tocchini", "murai", "will murai", "pacotes para lojistas", "lojista", "quad 2 dispon\u00edvel", "pre\u00e7o especial da pr\u00e9-venda do catarse"]}