{"origem": "catarse", "categoria_teste_mencoes": {"saloes_humor": false, "hqmix": false, "ccxp": false, "fiq": false, "angelo_agostini": false, "politica": true, "questoes_genero": false, "lgbtqiamais": false, "terror": true, "humor": false, "herois": false, "disputa": true, "ficcao_cientifica": false, "fantasia": false, "folclore": false, "zine": false, "webformatos": false, "erotismo": false, "religiosidade": false, "jogos": false, "midia_independente": false}, "recompensas_menor_nominal": 220.0, "recompensas_menor_ajustado": 308.96816643172616, "recompensas_quantidade": 1, "autoria_id": 154400, "autoria_nome": "eder modanez", "autoria_nome_publico": "eder modanez", "autoria_classificacao": "feminino", "autoria_classificacao_id": 4, "social_seguidores": 13, "social_newsletter": true, "social_sub_contribuicoes_amigos": true, "social_sub_novos_seguidores": false, "social_sub_posts_projeto": true, "social_projetos_contribuidos": 49, "social_projetos_publicados": 1, "geral_municipio": "Cordeir\u00f3polis", "geral_uf": "SP", "geral_uf_br": "SP", "geral_city_id": 4849, "geral_content_rating": 1, "geral_contributed_by_friends": false, "geral_capa_imagem": false, "geral_capa_video": true, "geral_dias_campanha": 45, "geral_data_fim": "2018-08-28T02:59:59.999999", "geral_data_ini": "2018-07-13T14:31:09.279011", "geral_meta": 5000.0, "geral_meta_corrigida": 7022.003782539231, "geral_arrecadado": 350.0, "geral_arrecadado_corrigido": 491.5402647777462, "geral_percentual_arrecadado": 7.0, "geral_conteudo_adulto": false, "geral_posts": 4, "geral_project_id": 71672, "geral_modalidade": "flex", "geral_titulo": "Ot\u00e1vio Martinez | \"Abra seus Olhos\"", "geral_status": "successful", "geral_total_contribuicoes": 15, "geral_total_apoiadores": 15, "geral_sobre": "Ot\u00e1vio Mart\u00ednez outrora um executivo de uma multinacional, inexplicavelmente se torna um sem-teto. Vivendo como um p\u00e1ria em uma sociedade sedenta por dinheiro e almas. Certa noite, ao encontrar um gato preto, sua vida muda completamente, de uma maneira que n\u00e3o haver\u00e1 retorno.\nExatamente quando estava desenhando as \u00faltimas p\u00e1ginas algo terr\u00edvel aconteceu: o pr\u00e9dio \"Wilton Paes de Almeida\" pegou fogo no Largo do Paissandu, no centro de S\u00e3o Paulo. O horror em forma de fuma\u00e7a e chamas tomou conta de todo o pr\u00e9dio, deixando centenas de pessoas sem terem um local para irem, novamente sem um lugar para chamarem de lar. \"Um deles nasceu em uma ocupa\u00e7\u00e3o, outro j\u00e1 nasceu em outra. Eles mesmos  j\u00e1 n\u00e3o t\u00eam aquele la\u00e7o de se apegar, porque sabem que, a qualquer  momento, v\u00e3o se mudar\"   d isse Vilma de Freitas, de 44 anos \u00e0 Ag\u00eancia Brasil. Ela est\u00e1 acampada no largo com quatro filhos com idades entre 5 e 10 anos. ( veja mais aqui ) Vinte e tr\u00eas dias foi o tempo que Justi\u00e7a Federal demorou para se manifestar, ordenando a instala\u00e7\u00e3o de banheiros qu\u00edmicos no local onde as fam\u00edlias estavam acampadas; Nove dias, foi o tempo que a Prefeitura demorou para cumprir a decis\u00e3o judicial.\nTodas essas pessoas poderiam ser conhecidos de Ot\u00e1vio, afinal vivem na  mesma situa\u00e7\u00e3o e na mesma cidade. Por isso eu acredito que possamos fazer algo a mais do que publicar uma hist\u00f3ria em quadrinhos, acredito que possamos ajudar essas fam\u00edlias a passarem por esse estado de caos em suas vidas, no entanto preciso da SUA AJUDA. A cada apoio aqui pelo CATARSE, R$10 ser\u00e1 destinado \u00e0 CRUZ VERMELHA organiza\u00e7\u00e3o que tem atuado em campo, arrecadando doa\u00e7\u00f5es e distribuindo para as fam\u00edlias desde o in\u00edcio dessa trag\u00e9dia (que voc\u00ea pode conferir aqui e acol\u00e1 )\nE ent\u00e3o, vamos juntos fazer algo mais?\nPara terminar, a categoria desse projeto \u00e9 FLEX, o que indica que ele quem colaborar receber\u00e1 as recompensas - de qualquer maneira. Mas caso voc\u00ea tenha ainda alguma d\u00favida quanto \u00e0 plataforma do CATARSE, esse v\u00eddeo:\nTodas as imagens est\u00e3o em car\u00e1ter ilustrativo.\nSou Eder Modanez e sou formado em Design Gr\u00e1fico, trabalho no Ateli\u00ea Gigante Guerreiro com ilustra\u00e7\u00f5es, quadrinhos e projetos gr\u00e1ficos para livros, jornais e revistas. Antes de Ot\u00e1vio, desenhou algumas hist\u00f3rias em quadrinhos, entre elas O Girassol e o Samurai . Como profissional freelancer n\u00e3o consigo fazer mais do meu trabalho,  mas anseio  por fazer mais pelas pessoas nesse mundo, mas sozinho n\u00e3o consigo fazer  mais do que j\u00e1 fa\u00e7o. Por isso reuni alguns amigos para fazer esse gibi: Jack Fern\u00e1ndez (roteiro) Formado em Letras, \u00e9 professor em escola p\u00fablica e autor de As aventuras de Argus e Galadi l (independente).\nTa\u00eds Cruz (capa) Formada Artes Visuais, \u00e9 tatuadora e ilustradora freelancer.\nLua Gomes Modanez (encaderna\u00e7\u00e3o) Formada em Artes Visuais e Pedagogia, produz cadernos artesanais sob encomenda no Ateli\u00ea Gigante Guerreiro , al\u00e9m de ministrar oficinas sobre arte e encaderna\u00e7\u00e3o.\nAgora pe\u00e7o a sua ajuda para concretizar esse projeto e ajudar outras pessoas, como voc\u00ea ou eu.", "categoria_multirrotulo_lda": {"0": 0.4, "1": 0.2, "2": 0.6, "3": 0.6, "4": 0.6, "5": 0.2, "6": 0.6, "7": 0.2, "8": 0.2, "9": 0.4, "10": 0.4, "11": 0.8, "12": 0.6, "13": 0.0, "14": 0.2, "15": 0.4, "16": 0.4, "17": 0.0, "18": 0.2, "19": 0.2, "20": 0.2, "21": 0.4, "22": 0.6, "23": 0.4, "24": 0.0, "25": 0.4, "26": 0.2, "27": 1.0, "28": 0.4, "29": 0.2, "30": 0.8, "31": 0.2, "32": 0.2, "33": 0.0, "34": 0.2, "35": 0.6, "36": 0.4, "37": 0.2, "38": 0.6, "39": 0.0, "40": 0.2, "41": 0.4, "42": 0.8, "43": 0.4, "44": 0.0, "45": 0.8, "46": 0.0, "47": 0.0, "48": 0.4, "49": 0.2}, "categoria_entidades": ["ot\u00e1vio mart\u00ednez", "executivo", "multinacional", "sem-teto", "p\u00e1ria", "sociedade", "dinheiro", "almas", "certa noite", "gato preto", "vida", "maneira", "retorno", "\u00faltimas p\u00e1ginas", "pr\u00e9dio", "wilton paes de almeida", "fogo no largo do paissandu", "centro de s\u00e3o paulo", "horror em forma de fuma\u00e7a", "chamas", "conta", "centenas de pessoas", "local", "lugar", "lar", "ocupa\u00e7\u00e3o", "la\u00e7o", "momento", "vilma de freitas", "44 anos \u00e0 ag\u00eancia brasil", "acampada no largo com quatro filhos com idades entre 5", "10 anos", "tr\u00eas dias", "tempo", "justi\u00e7a federal", "instala\u00e7\u00e3o de banheiros qu\u00edmicos no local", "fam\u00edlias", "nove dias", "prefeitura", "decis\u00e3o judicial", "pessoas", "ot\u00e1vio", "mesma situa\u00e7\u00e3o", "mesma cidade", "hist\u00f3ria em quadrinhos", "estado de caos", "vidas", "entanto preciso da sua ajuda", "apoio", "catarse", "cruz vermelha organiza\u00e7\u00e3o", "campo", "doa\u00e7\u00f5es", "in\u00edcio dessa trag\u00e9dia", "categoria desse projeto", "flex", "recompensas", "d\u00favida", "plataforma do catarse", "v\u00eddeo", "imagens", "car\u00e1ter ilustrativo", "eder modanez", "design gr\u00e1fico", "trabalho no ateli\u00ea gigante guerreiro com ilustra\u00e7\u00f5es", "quadrinhos", "projetos gr\u00e1ficos para livros", "jornais", "revistas", "hist\u00f3rias em quadrinhos", "girassol", "samurai", "profissional freelancer", "trabalho", "anseio", "pessoas nesse mundo", "amigos", "gibi", "jack fern\u00e1ndez", "roteiro", "letras", "professor em escola p\u00fablica", "autor", "aventuras de argus", "galadi l", "ta\u00eds cruz", "capa", "formada artes visuais", "ilustradora freelancer", "lua gomes modanez", "encaderna\u00e7\u00e3o", "artes visuais", "pedagogia", "cadernos artesanais sob encomenda no ateli\u00ea gigante guerreiro", "oficinas sobre arte", "ajuda", "projeto"]}