{"origem": "catarse", "categoria_teste_mencoes": {"saloes_humor": false, "hqmix": false, "ccxp": false, "fiq": true, "angelo_agostini": false, "politica": false, "questoes_genero": false, "lgbtqiamais": false, "terror": true, "humor": false, "herois": false, "disputa": true, "ficcao_cientifica": false, "fantasia": true, "folclore": false, "zine": true, "webformatos": true, "erotismo": false, "religiosidade": true, "jogos": true, "midia_independente": true}, "recompensas_menor_nominal": 60.0, "recompensas_menor_ajustado": 85.31863725011753, "recompensas_quantidade": 1, "autoria_id": 891512, "autoria_nome": "sheila cruz bastos", "autoria_nome_publico": "omamori studio", "autoria_classificacao": "coletivo", "autoria_classificacao_id": 2, "social_seguidores": 210, "social_newsletter": false, "social_sub_contribuicoes_amigos": false, "social_sub_novos_seguidores": true, "social_sub_posts_projeto": true, "social_projetos_contribuidos": 9, "social_projetos_publicados": 2, "geral_municipio": "Juiz de Fora", "geral_uf": "MG", "geral_uf_br": "MG", "geral_city_id": 1987, "geral_content_rating": 1, "geral_contributed_by_friends": false, "geral_capa_imagem": false, "geral_capa_video": true, "geral_dias_campanha": 30, "geral_data_fim": "2018-06-02T02:59:59.999999", "geral_data_ini": "2018-05-02T18:09:25.205359", "geral_meta": 8000.0, "geral_meta_corrigida": 11375.818300015671, "geral_arrecadado": 2020.0, "geral_arrecadado_corrigido": 2872.3941207539565, "geral_percentual_arrecadado": 25.25, "geral_conteudo_adulto": false, "geral_posts": 7, "geral_project_id": 76283, "geral_modalidade": "flex", "geral_titulo": "Love Up! ", "geral_status": "successful", "geral_total_contribuicoes": 27, "geral_total_apoiadores": 26, "geral_sobre": "BEM-VINDO VIAJANTE! TENHO UMA NOVA QUEST PARA VOC\u00ca.\nJunte-se guerreira Ruby, o cl\u00e9rigo Liam e o ninja Aidan  e viva incr\u00edveis aventuras no mundo m\u00e1gico de Kairos, um lugar habitado por criaturas fant\u00e1sticas e cheio de perigos. Juntos eles ir\u00e3o enfrentar monstros, explorar dungeons, coletar itens e tesouros, e claro, subir de n\u00edvel para ficarem cada vez mais fortes. Voc\u00ea aceita esta miss\u00e3o?\nO projeto Love Up! foi criado a partir das aventuras que os pr\u00f3prios autores, Sheila Bastos (ilustradora)  e Rodrigo Dilon (roteirista e designer gr\u00e1fico) vivenciam jogando seus jogos de MMORPG favoritos. Toda a constru\u00e7\u00e3o do mundo fantasia, criaturas e principalmente os personagens do quadrinho tamb\u00e9m s\u00e3o baseados em seus pr\u00f3prios personagens nos jogos online.\nO volume ter\u00e1 52 p\u00e1ginas totalmente coloridas . A capa ser\u00e1 em papel cart\u00e3o triplex 300g com lamina\u00e7\u00e3o fosca e lombada quadrada e o miolo ser\u00e1 em papel couch\u00e9 fosco 90g.\nO Omamori Studio surgiu da vontade do casal Sheila Bastos e Rodrigo Dilon de contar hist\u00f3rias fant\u00e1sticas e \u00fanicas em forma de quadrinhos. Desde 2015 o est\u00fadio cria ilustra\u00e7\u00f5es, concept art e projetos de design gr\u00e1fico e paralelamente produz suas hist\u00f3rias em quadrinhos, as quais s\u00e3o disponibilizadas para leitura gratuita online nas plataformas Tapas e Webtoons.\nLeia nossas hist\u00f3rias aqui: https://tapas.io/omamoristudio\nPara quem n\u00e3o conhece, o Catarse \u00e9 uma plataforma de financiamento coletivo onde voc\u00ea apoia um projeto e em troca recebe recompensas de acordo com a quantia investida.\nPara nos apoiar \u00e9 muito simples. Escolha a recompensa que voc\u00ea achar mais interessante para voc\u00ea e clique no bot\u00e3o \u201cAPOIAR ESTE PROJETO\u201d. \u00c9 muito simples e voc\u00ea pode fazer o pagamento por cart\u00e3o de cr\u00e9dito ou boleto banc\u00e1rio.\nWallpapers Love Up! nos formatos para desktop (1920x1080px) e smartphone (1440x2560px)\nQuadrinho Love Up! impresso com dedicat\u00f3ria e assinado pelos autores. N\u00f3s fazemos quest\u00e3o de agradecer a TODOS os apoiadores individualmente.\nZine Lost and Found impressa \u2013 Uma colet\u00e2nea de pequenas hist\u00f3rias em preto e branco que criamos desde 2016 impressas no formato A5 (15x21cm) em papel p\u00f3len 90g e capa em papel reciclato 180g.\nP\u00f4steres Love Up! \u2013 Escolha entre as 3 op\u00e7\u00f5es de p\u00f4steres com ilustra\u00e7\u00f5es exclusivas no formato A4 (21x29,7cm) impressos em papel glossy 180g.\nAdesivos Love Up! \u2013 Escolha entre as 3 op\u00e7\u00f5es de cartelas de adesivos com ilustra\u00e7\u00f5es exclusivas.\nOBS: O valor do envio est\u00e1 incluso em todas as recompensas.\nPode ficar tranquilo que voc\u00ea n\u00e3o vai perder dinheiro . Este projeto est\u00e1 na categoria FLEX que funciona como uma pr\u00e9-venda j\u00e1 que o Love Up! est\u00e1 pronto e o seu lan\u00e7amento oficial ser\u00e1 no FIQ 2018 , festival internacional de quadrinhos que acontecer\u00e1 em Belo Horizonte-MG do dia 30 de maio at\u00e9 3 de junho. Ent\u00e3o, n\u00e3o tem como voc\u00ea ficar sem o seu!\nOBS: por causa da viagem ao evento e da separa\u00e7\u00e3o de todos os pedidos, os envios ser\u00e3o feitos a partir do dia 11 de junho de 2018.\nSe poss\u00edvel, pedimos para compartilhar este projeto com seus amigos e parentes em seus perfis nas redes sociais e n\u00e3o esque\u00e7am de curtir nossa p\u00e1gina no Facebook e nosso perfil no Instagram para mais novidades sobre o Omamori Studio e nossos pr\u00f3ximos quadrinhos.\nDesde j\u00e1, nosso MUITO OBRIGADO a todos que est\u00e3o fazendo parte da realiza\u00e7\u00e3o desse sonho.", "categoria_multirrotulo_lda": {"0": 0.0, "1": 0.2, "2": 0.2, "3": 0.0, "4": 0.2, "5": 0.0, "6": 0.6, "7": 0.0, "8": 0.4, "9": 0.2, "10": 0.0, "11": 0.2, "12": 0.2, "13": 0.2, "14": 0.2, "15": 0.0, "16": 0.6, "17": 0.0, "18": 0.0, "19": 0.0, "20": 0.0, "21": 0.0, "22": 0.0, "23": 0.0, "24": 0.2, "25": 0.0, "26": 0.2, "27": 0.2, "28": 0.0, "29": 0.2, "30": 0.2, "31": 0.0, "32": 0.0, "33": 0.2, "34": 0.0, "35": 0.2, "36": 0.2, "37": 0.0, "38": 0.0, "39": 0.4, "40": 0.0, "41": 0.2, "42": 0.2, "43": 0.4, "44": 0.2, "45": 0.4, "46": 0.0, "47": 0.0, "48": 0.2, "49": 0.2}, "categoria_entidades": ["bem-vindo viajante", "uma nova quest para voc\u00ea", "guerreira ruby", "cl\u00e9rigo liam", "ninja aidan", "viva incr\u00edveis aventuras no mundo m\u00e1gico de kairos", "lugar", "criaturas fant\u00e1sticas", "cheio de perigos", "monstros", "dungeons", "itens", "tesouros", "n\u00edvel", "mais fortes", "miss\u00e3o", "projeto love up", "aventuras", "pr\u00f3prios autores", "sheila bastos", "ilustradora", "rodrigo dilon", "designer gr\u00e1fico", "jogos de mmorpg favoritos", "constru\u00e7\u00e3o do mundo fantasia", "criaturas", "personagens do quadrinho", "personagens nos jogos online", "volume", "52 p\u00e1ginas", "capa", "papel cart\u00e3o triplex 300 g com lamina\u00e7\u00e3o fosca", "lombada", "miolo", "papel", "fosco 90 g.", "omamori studio", "vontade do casal sheila bastos", "hist\u00f3rias fant\u00e1sticas", "\u00fanicas em forma de quadrinhos", "est\u00fadio", "ilustra\u00e7\u00f5es", "concept", "projetos de design gr\u00e1fico", "hist\u00f3rias em quadrinhos", "leitura gratuita online nas plataformas tapas", "webtoons", "hist\u00f3rias", "catarse", "plataforma de financiamento coletivo", "projeto", "troca", "recompensas de acordo", "quantia investida", "recompensa", "interessante para voc\u00ea", "bot\u00e3o", "apoiar", "pagamento por cart\u00e3o de cr\u00e9dito", "boleto banc\u00e1rio", "wallpapers love up", "formatos para desktop", "1920x1080px", "smartphone", "quadrinho love up", "dedicat\u00f3ria", "autores", "quest\u00e3o", "apoiadores", "zine lost and found", "colet\u00e2nea de pequenas hist\u00f3rias em preto", "2016 impressas no formato a5", "papel p\u00f3len 90 g", "capa em papel reciclato 180 g.", "p\u00f4steres love up", "3 op\u00e7\u00f5es de p\u00f4steres com ilustra\u00e7\u00f5es exclusivas no formato a4", "21x29,7 cm", "impressos em papel glossy 180 g.", "adesivos love up", "3 op\u00e7\u00f5es de cartelas de adesivos com ilustra\u00e7\u00f5es exclusivas", "obs", "valor do envio", "incluso", "recompensas", "dinheiro", "categoria flex", "pr\u00e9-venda", "love up", "lan\u00e7amento oficial", "fiq 2018", "festival internacional de quadrinhos", "belo horizonte-mg do dia 30 de maio at\u00e9 3 de junho", "causa da viagem ao evento", "separa\u00e7\u00e3o", "pedidos", "envios", "dia 11 de junho de 2018", "amigos", "parentes", "perfis nas redes sociais", "p\u00e1gina no facebook", "perfil no instagram", "novidades", "pr\u00f3ximos quadrinhos", "parte da realiza\u00e7\u00e3o desse sonho"]}