{"origem": "catarse", "categoria_teste_mencoes": {"saloes_humor": false, "hqmix": false, "ccxp": false, "fiq": false, "angelo_agostini": false, "politica": false, "questoes_genero": false, "lgbtqiamais": false, "terror": false, "humor": false, "herois": false, "disputa": false, "ficcao_cientifica": false, "fantasia": false, "folclore": false, "zine": false, "webformatos": false, "erotismo": false, "religiosidade": false, "jogos": false, "midia_independente": false}, "recompensas_menor_nominal": 10.0, "recompensas_menor_ajustado": 17.74811725124836, "recompensas_quantidade": 1, "autoria_id": 236239, "autoria_nome": "luara almeida", "autoria_nome_publico": "luara almeida", "autoria_classificacao": "feminino", "autoria_classificacao_id": 4, "social_seguidores": 25, "social_newsletter": false, "social_sub_contribuicoes_amigos": true, "social_sub_novos_seguidores": true, "social_sub_posts_projeto": true, "social_projetos_contribuidos": 44, "social_projetos_publicados": 1, "geral_municipio": "S\u00e3o Paulo", "geral_uf": "SP", "geral_uf_br": "SP", "geral_city_id": 5274, "geral_content_rating": 1, "geral_contributed_by_friends": false, "geral_capa_imagem": false, "geral_capa_video": true, "geral_dias_campanha": 40, "geral_data_fim": "2014-11-13T01:59:59", "geral_data_ini": "2014-10-03T17:00:04.542207", "geral_meta": 16500.0, "geral_meta_corrigida": 29284.39346455979, "geral_arrecadado": 20018.0, "geral_arrecadado_corrigido": 35528.18111354896, "geral_percentual_arrecadado": 121.32121212121211, "geral_conteudo_adulto": false, "geral_posts": 5, "geral_project_id": 7752, "geral_modalidade": "aon", "geral_titulo": "Carolina, sua vida vai ser linda", "geral_status": "successful", "geral_total_contribuicoes": 195, "geral_total_apoiadores": 180, "geral_sobre": "Ol\u00e1, meu nome \u00e9 Luara Almeida, tenho 21 anos e estou cursando o \u00faltimo ano do curso de Design Gr\u00e1fico da Universidade Mackenzie. Atualmente realizo o meu trabalho de conclus\u00e3o de curso (TCC): uma hist\u00f3ria em quadrinhos biogr\u00e1fica.\nDesde que nasci, cuidou de mim uma pessoa com muitas hist\u00f3rias pra contar. Cresci em meio a essas hist\u00f3rias, imaginando os cen\u00e1rios e personagens que se tornaram familiares para mim. Hist\u00f3rias de pessoas fortes, sonhadoras e alegres, hist\u00f3rias de lutas, revolu\u00e7\u00f5es, alegrias, algumas tristezas, mas muito amor, em diversos cen\u00e1rios e \u00e9pocas da cidade de S\u00e3o Paulo, que cresceu e se desenvolveu com esses personagens.  Nascida em 1920, atualmente com 94 anos, continua contando suas hist\u00f3rias para todos ouvirem, nos encontros de fam\u00edlia: almo\u00e7os e jantares bem italianos, com todos em volta da mesa, comendo, bebendo, rindo e falando. Falando muito. Essa pessoa \u00e9 minha bisav\u00f3, Carolina. Mas n\u00e3o \u00e9 s\u00f3 minha. A V\u00f3 Carol, V\u00f3, Voca, Vov\u00f3 Ina, ou como queiram chama-la, conquista a todos que a conhecem e que logo passam a ser da fam\u00edlia.  Hoje eu conto a voc\u00eas, da forma como sempre ouvi e imaginei, cada uma de suas hist\u00f3rias. Muitas lembran\u00e7as e uma pequena homenagem.\nO livro ter\u00e1 o tamanho 17,5x22cm, com 72 p\u00e1ginas de hist\u00f3ria, colorida e bem bonita e um acervo fotogr\u00e1fico com fotos da vida de Carolina, em papel P\u00f3len Rustic 90g. A capa ser\u00e1 em Cart\u00e3o Triplex 300g e ter\u00e1 at\u00e9 orelhas! :D (assim que estiver pronta eu coloco aqui para voc\u00eas verem).\nA hist\u00f3ria j\u00e1 est\u00e1 toda desenhada e est\u00e1 em fase de coloriza\u00e7\u00e3o, e aos poucos vou colocando algumas imagens aqui para voc\u00eas acompanharem!\nO que seria somente um trabalho universit\u00e1rio se tornou um projeto com um valor sentimental inestim\u00e1vel. Al\u00e9m disso e por tudo o que mencionei acima, muitas pessoas come\u00e7aram a demonstrar o desejo de obter um exemplar do livro. Pensando em viabilizar a proposta de forma amplificada e possibilitar a confec\u00e7\u00e3o de muitos exemplares resolvi procurar o Catarse.  Para quem n\u00e3o sabe, o Catarse \u00e9 um site de financiamento coletivo para diversos fins e funciona atrav\u00e9s de contribui\u00e7\u00f5es das pessoas que se interessarem por determinado projeto.\nSe voc\u00ea gostou da minha proposta, pode contribuir com uma das cotas ao lado, ganhando recompensas proporcionais com a contribui\u00e7\u00e3o feita. O dinheiro arrecadado, ser\u00e1 utilizado par a impress\u00e3o dos livros, produ\u00e7\u00e3o das recompensas e frete de envio. Ah, e tem ainda 13% dos servi\u00e7os prestados pelo Catarse.  Tenho certeza que v\u00e3o adorar, al\u00e9m do livro, as recompensas que eu pensei para voc\u00eas. S\u00e3o marcadores de p\u00e1ginas, cart\u00f5es postais, bottons, desenhos originais e moleskines, todos personalizados e feitos com muito carinho! E outra coisa, todos as cotas incluem o FRETE GR\u00c1TIS, ou seja, todos que contribu\u00edrem receber\u00e3o as recompensas na pr\u00f3pria casa!\nO or\u00e7amento ficar\u00e1 assim distribu\u00eddo:\nOutra coisa, se eu n\u00e3o alcan\u00e7ar a meta proposta, todo o dinheiro ser\u00e1 devolvido, ent\u00e3o n\u00e3o precisam se preocupar!\nSe voc\u00ea se interessou e quer acompanhar mais de perto o projeto, curta a p\u00e1gina no facebook: https://www.facebook.com/carolinasuavidavaiserlinda\nalguns sites em que o projeto j\u00e1 saiu: universo hq armazem de cultura lady's comics\nEsse \u00e9 o meu primeiro projeto aqui no Catarse e estou muito animada e ansiosa para que ele d\u00ea certo! Voc\u00ea pode ajudar contribuindo e tamb\u00e9m divulgando este trabalho com seus amigos. Conto com voc\u00eas! Muito obrigada desde j\u00e1!\nLuara Almeida", "categoria_multirrotulo_lda": {"0": 0.6, "1": 0.0, "2": 0.2, "3": 0.6, "4": 0.4, "5": 0.0, "6": 0.6, "7": 0.0, "8": 0.6, "9": 0.2, "10": 0.2, "11": 0.6, "12": 0.8, "13": 0.0, "14": 0.4, "15": 0.4, "16": 0.6, "17": 0.2, "18": 0.0, "19": 0.0, "20": 0.2, "21": 0.0, "22": 0.2, "23": 0.2, "24": 0.0, "25": 0.2, "26": 0.2, "27": 0.4, "28": 0.2, "29": 0.0, "30": 0.6, "31": 0.2, "32": 0.0, "33": 0.0, "34": 0.2, "35": 0.6, "36": 0.2, "37": 0.2, "38": 0.8, "39": 0.0, "40": 0.2, "41": 0.6, "42": 0.6, "43": 0.4, "44": 0.0, "45": 0.4, "46": 0.2, "47": 0.2, "48": 0.2, "49": 0.0}, "categoria_entidades": ["ol\u00e1", "nome", "luara almeida", "21 anos", "\u00faltimo ano do curso de design gr\u00e1fico da universidade mackenzie", "trabalho de conclus\u00e3o de curso", "tcc", "hist\u00f3ria em quadrinhos biogr\u00e1fica", "pessoa", "hist\u00f3rias", "meio", "cen\u00e1rios", "personagens", "familiares", "hist\u00f3rias de pessoas fortes", "sonhadoras", "hist\u00f3rias de lutas", "revolu\u00e7\u00f5es", "alegrias", "tristezas", "amor", "\u00e9pocas da cidade de s\u00e3o paulo", "94 anos", "encontros de fam\u00edlia", "almo\u00e7os", "jantares", "volta da mesa", "bisav\u00f3", "carolina", "v\u00f3 carol", "v\u00f3", "voca", "vov\u00f3 ina", "conquista", "fam\u00edlia", "conto", "forma", "uma", "lembran\u00e7as", "pequena homenagem", "livro", "tamanho 17,5x22 cm", "72 p\u00e1ginas de hist\u00f3ria", "acervo fotogr\u00e1fico com fotos da vida de carolina", "papel p\u00f3len rustic 90 g.", "capa", "cart\u00e3o triplex 300 g", "orelhas", "hist\u00f3ria", "desenhada", "fase de coloriza\u00e7\u00e3o", "poucos", "imagens", "trabalho universit\u00e1rio", "projeto", "valor sentimental inestim\u00e1vel", "pessoas", "desejo", "exemplar do livro", "proposta de forma", "confec\u00e7\u00e3o", "exemplares", "catarse", "site de financiamento coletivo", "fins", "contribui\u00e7\u00f5es das pessoas", "proposta", "uma das cotas ao lado", "recompensas proporcionais", "contribui\u00e7\u00e3o", "dinheiro", "par", "impress\u00e3o dos livros", "produ\u00e7\u00e3o das recompensas", "frete de envio", "servi\u00e7os", "certeza", "recompensas", "marcadores de p\u00e1ginas", "cart\u00f5es postais", "bottons", "desenhos originais", "moleskines", "personalizados", "carinho", "coisa", "cotas", "frete gr\u00e1tis", "casa", "or\u00e7amento", "meta", "perto", "p\u00e1gina no facebook", "https://www.facebook.com/carolinasuavidavaiserlinda", "sites", "universo hq armazem de cultura lady 's comics", "primeiro projeto", "ansiosa", "trabalho", "amigos", "obrigada"]}