{"origem": "catarse", "categoria_teste_mencoes": {"saloes_humor": false, "hqmix": false, "ccxp": true, "fiq": false, "angelo_agostini": false, "politica": false, "questoes_genero": false, "lgbtqiamais": false, "terror": false, "humor": false, "herois": false, "disputa": true, "ficcao_cientifica": true, "fantasia": true, "folclore": false, "zine": false, "webformatos": false, "erotismo": false, "religiosidade": false, "jogos": false, "midia_independente": false}, "recompensas_menor_nominal": 36.0, "recompensas_menor_ajustado": 49.837540509448154, "recompensas_quantidade": 1, "autoria_id": 168674, "autoria_nome": "sam ruben ati hart", "autoria_nome_publico": "sam ruben ati hart", "autoria_classificacao": "masculino", "autoria_classificacao_id": 3, "social_seguidores": 240, "social_newsletter": false, "social_sub_contribuicoes_amigos": false, "social_sub_novos_seguidores": false, "social_sub_posts_projeto": true, "social_projetos_contribuidos": 131, "social_projetos_publicados": 15, "geral_municipio": "S\u00e3o Paulo", "geral_uf": "SP", "geral_uf_br": "SP", "geral_city_id": 5274, "geral_content_rating": 1, "geral_contributed_by_friends": false, "geral_capa_imagem": false, "geral_capa_video": true, "geral_dias_campanha": 20, "geral_data_fim": "2018-12-16T01:59:59.999999", "geral_data_ini": "2018-11-25T14:17:47.284359", "geral_meta": 2600.0, "geral_meta_corrigida": 3599.3779256823664, "geral_arrecadado": 7194.0, "geral_arrecadado_corrigido": 9959.201845138055, "geral_percentual_arrecadado": 276.6923076923077, "geral_conteudo_adulto": false, "geral_posts": 30, "geral_project_id": 87679, "geral_modalidade": "flex", "geral_titulo": "10 Dias Perdidos", "geral_status": "successful", "geral_total_contribuicoes": 238, "geral_total_apoiadores": 237, "geral_sobre": "Sam Hart , desenhista de At\u00f4mica, Tropas Estelares, Robin Hood e Juiz Dredd , e autor do Projeto Mega-Ultra e WAR - Uma Eternidade de Guerra traz seu novo projeto autoral para uma campanha rel\u00e2mpago de apenas 20 dias.\nEm 1582, 10 dias foram pulados na mudan\u00e7a do calend\u00e1rio Juliano para o Gregoriano. 10 DIAS PERDIDOS conta o que aconteceu nesse espa\u00e7o de tempo: em um mundo onde magia e ci\u00eancia se confundem, humanos e deidades est\u00e3o sendo congelados e Sophya, uma jovem astr\u00f3loga - assistente de Tycho Brahe e Johannes Kepler - tem apenas 240 horas para salvar toda a magia e a pr\u00f3pria humanidade.\nO que Antony Johnston , criador de At\u00f4mica e roteirista do Demolidor, falou sobre 10 Dias Perdidos : \"Parece que uma xilogravura renascentista tomou vida para contar essa hist\u00f3ria ex\u00f3tica e surpreendente. N\u00e3o perca.\u201d\nCom posf\u00e1cio da editora da Marvel/Panini, ex-diretora da Escola Municipal de Astrof\u00edsica e roteirista independente, Carol Pimentel .\nDetalhes: 24 p\u00e1ginas internas PB (20 p\u00e1ginas de HQ) + capa colorida\nFormato: 23 x 15.5cm\nLan\u00e7amentos: na CCXP , dias 06 a 09/12, Artists' Alley mesa F-14 e Loja Monstra , Pra\u00e7a Benedito Calixto, S\u00e3o Paulo, dia 15/12\nNOVIDADE: Batemos a meta em 24 horas! Obrigado a todos!\nAGORA TEM META ESTENDIDA! Se chegarmos a R$4.500,00 at\u00e9 o dia 05/12, ter\u00e1 um mini-p\u00f4ster exclusivo para apoiadores do projeto no Catarse, com a arte da capa, sem logos! Formato 21 x 14.5 cm, para caber na sua revista!\nNOVIDADE 2: Projeto Mega-Ultra Super Secreto tem uma fanpage no facebook com preview  das primeiras 8 p\u00e1ginas https://m.facebook.com/ProjetoMegaUltra/ e quem  apoiar a campanha nessa op\u00e7\u00e3o de recompensa tamb\u00e9m recebe um mini-p\u00f4ster do Mega-Ultra , 21 x 14.5 cm com a arte da capa sem logos, exclusivo para  apoiadores do Catarse!\nNOVIDADE 3: Batemos a meta estendida em 9 DIAS, contando com mais de 100 apoiadores! Novamente, obrigado a todos!\nEnt\u00e3o agora tem uma NOVA META ESTENDIDA! Se chegarmos a R$5.400,00 at\u00e9 o dia 15/12, farei uma arte exclusiva para apoiadores do projeto no Catarse, para ser usada de wallpaper de computador, tablet ou celular!\nObrigado!!! Atingimos  a 2a meta estendida , contando agora com mais de 150 apoios - e todos  os apoiadores v\u00e3o receber um PDF com uma arte  10 Dias Perdidos EX-CLU-SIVA! ainda esse ano!\n2o lan\u00e7amento - Para quem n\u00e3o conseguiu ir na CCXP, ou apoiou depois, vai acontecer nesse s\u00e1bado dia 15 a tarde de aut\u00f3grafos na Loja Monstra, das 15h \u00e0s 18h.\n15 de dezembro, 15h \u00e0s 18h\nEndere\u00e7o: Pra\u00e7a Benedito Calixto 158, 1o andar, Pinheiros, S\u00e3o Paulo\nCapa e preview:", "categoria_multirrotulo_lda": {"0": 0.4, "1": 0.2, "2": 0.4, "3": 0.0, "4": 0.4, "5": 0.2, "6": 0.6, "7": 0.2, "8": 0.2, "9": 0.2, "10": 0.2, "11": 0.4, "12": 0.0, "13": 0.2, "14": 0.0, "15": 0.2, "16": 0.2, "17": 0.0, "18": 0.2, "19": 0.2, "20": 0.2, "21": 0.2, "22": 0.2, "23": 0.2, "24": 0.0, "25": 0.2, "26": 0.0, "27": 0.6, "28": 0.2, "29": 0.2, "30": 0.4, "31": 0.0, "32": 0.2, "33": 0.0, "34": 0.0, "35": 0.2, "36": 0.2, "37": 0.2, "38": 0.2, "39": 0.0, "40": 0.0, "41": 0.0, "42": 0.2, "43": 0.2, "44": 0.0, "45": 0.6, "46": 0.0, "47": 0.0, "48": 0.4, "49": 0.2}, "categoria_entidades": ["sam hart", "desenhista de at\u00f4mica", "tropas estelares", "robin hood", "juiz dredd", "autor do projeto mega-ultra", "war", "uma eternidade de guerra", "novo projeto autoral", "campanha rel\u00e2mpago", "20 dias", "10 dias", "mudan\u00e7a do calend\u00e1rio juliano", "gregoriano", "10 dias perdidos", "espa\u00e7o de tempo", "mundo", "magia", "ci\u00eancia", "humanos", "deidades", "sophya", "jovem astr\u00f3loga", "assistente de tycho brahe", "johannes kepler", "240 horas", "humanidade", "antony johnston", "criador de at\u00f4mica", "roteirista do demolidor", "xilogravura renascentista", "vida", "hist\u00f3ria ex\u00f3tica", "posf\u00e1cio da editora da marvel", "panini", "ex-diretora da escola municipal de astrof\u00edsica", "roteirista independente", "carol pimentel", "detalhes", "24 p\u00e1ginas internas pb", "20 p\u00e1ginas de hq", "capa", "formato", "23 x 15.5 cm", "lan\u00e7amentos", "ccxp", "dias 06 a 09/12", "artists", "alley mesa f-14", "loja monstra", "pra\u00e7a benedito calixto", "s\u00e3o paulo", "dia 15/12", "novidade", "meta em 24 horas", "meta estendida", "4.500,00", "dia 05/12", "mini-p\u00f4ster exclusivo para apoiadores do projeto no catarse", "arte da capa", "logos", "formato 21 x 14.5 cm", "revista", "novidade 2", "projeto mega-ultra super secreto", "fanpage no facebook com preview", "primeiras 8 p\u00e1ginas", "campanha nessa op\u00e7\u00e3o de recompensa", "mini-p\u00f4ster do mega-ultra", "21 x 14.5 cm", "arte da capa sem logos", "exclusivo", "apoiadores do catarse", "novidade 3", "meta", "9 dias", "100 apoiadores", "estendida", "5.400,00", "arte exclusiva para apoiadores do projeto no catarse", "wallpaper de computador", "2a meta", "150 apoios", "apoiadores", "pdf", "arte", "ex-clu-siva", "ano", "2o lan\u00e7amento", "s\u00e1bado dia 15", "tarde de aut\u00f3grafos na loja monstra", "15h \u00e0s 18h", "15 de dezembro", "endere\u00e7o", "pra\u00e7a benedito calixto 158", "1o andar", "pinheiros", "preview"]}