{"origem": "catarse", "categoria_teste_mencoes": {"saloes_humor": false, "hqmix": false, "ccxp": false, "fiq": false, "angelo_agostini": false, "politica": false, "questoes_genero": false, "lgbtqiamais": false, "terror": false, "humor": false, "herois": false, "disputa": false, "ficcao_cientifica": false, "fantasia": false, "folclore": false, "zine": false, "webformatos": false, "erotismo": false, "religiosidade": false, "jogos": false, "midia_independente": false}, "recompensas_menor_nominal": 50.0, "recompensas_menor_ajustado": 68.38824729051655, "recompensas_quantidade": 1, "autoria_id": 615356, "autoria_nome": "jhonatan freire", "autoria_nome_publico": "jhonatan freire", "autoria_classificacao": "masculino", "autoria_classificacao_id": 3, "social_seguidores": 1, "social_newsletter": true, "social_sub_contribuicoes_amigos": true, "social_sub_novos_seguidores": true, "social_sub_posts_projeto": true, "social_projetos_contribuidos": 1, "social_projetos_publicados": 3, "geral_municipio": "Teodoro Sampaio", "geral_uf": "SP", "geral_uf_br": "SP", "geral_city_id": 5318, "geral_content_rating": 1, "geral_contributed_by_friends": false, "geral_capa_imagem": false, "geral_capa_video": true, "geral_dias_campanha": 3, "geral_data_fim": "2019-07-17T02:59:59.999999", "geral_data_ini": "2019-04-25T19:05:35.687477", "geral_meta": 15000.0, "geral_meta_corrigida": 20516.47418715496, "geral_arrecadado": 740.0, "geral_arrecadado_corrigido": 1012.1460598996448, "geral_percentual_arrecadado": 4.933333333333334, "geral_conteudo_adulto": false, "geral_posts": 3, "geral_project_id": 95315, "geral_modalidade": "flex", "geral_titulo": "JUBA o mico-le\u00e3o-preto", "geral_status": "successful", "geral_total_contribuicoes": 14, "geral_total_apoiadores": 14, "geral_sobre": "A hist\u00f3ria em quadrinhos apresenta a aventura de Juba, um mico-le\u00e3o-preto que ap\u00f3s perder sua fam\u00edlia em um desmatamento florestal no parque Estadual Morro do Diabo, se encontra sozinho e amea\u00e7ado de extin\u00e7\u00e3o. Mas com a ajuda de novos amigos que tamb\u00e9m se encontram na mesma situa\u00e7\u00e3o, Juba vive uma educativa aventura ecol\u00f3gica pela mata onde faz grande amizades que resolvem dar uma for\u00e7a para salvar a esp\u00e9cie do jovem primata. Entre as novas amizades Juba conhece Nina, uma on\u00e7a pintada e Nanda uma anta e juntos lutam para protegem o Mico-le\u00e3o-preto.\nA revista ter\u00e1 24 paginas de historia e ser\u00e1 impressa em Papel Reciclato 90g em paginas todas coloridas, exeto as de atividades e desenhos para colorir.\nCapa - Offset 240 g\nP\u00e1ginas - Reciclato 90 g\nO Projeto consiste na publica\u00e7\u00e3o de 10.000 resvistas em quadrinhos do JUBA o mico-le\u00e3o-preto e a distribui\u00e7\u00e3o de 3.000 Exemplares gratuitamente para os alunos da rede municipal de Teodoro Sampaio-SP em encontros liter\u00e1rios realizados com o autor Jhonatan Freire, para um bate-papo sobre literatura e conserva\u00e7\u00e3o ambiental.\nPara desenvolvimento de atividades s\u00f3cio-educativas do IP\u00ca (Instituto de Pesquisas Ecol\u00f3gicas) ser\u00e3o destinadas 3.000 exemplares, para o Parque Estadual Morro Diabo ser\u00e3o mais 3.000 exemplares e 1000 exemplares para o autor.\nJhonatan Freire \u00e9 de Teodoro Sampaio-SP, membro e um dos fundadores da AEITS (Associa\u00e7\u00e3o de Escritores e Ilustradores de Teodoro Sampaio), t\u00eam participado ativamente de projetos e eventos culturais na regi\u00e3o. J\u00e1 produziu capas e ilustra\u00e7\u00f5es de diversas obras dos associados e tamb\u00e9m tem divertido muitas pessoas fazendo caricaturas. T\u00e9cnico em gest\u00e3o de pequenas empresas e graduando de Publicidade e Propaganda na Unoeste, a criatividade e a facilidade para desenhar sempre fizeram parte de sua vida. Aos vinte e dois anos transformou isso em seu pr\u00f3prio neg\u00f3cio a favor da cultura e da educa\u00e7\u00e3o, fundou o Studio JH Comics, onde produz seus trabalhos profissionalmente.", "categoria_multirrotulo_lda": {"0": 0.2, "1": 0.0, "2": 0.2, "3": 0.2, "4": 0.2, "5": 0.2, "6": 0.0, "7": 0.0, "8": 0.0, "9": 0.0, "10": 0.2, "11": 0.4, "12": 0.2, "13": 0.0, "14": 0.0, "15": 0.4, "16": 0.0, "17": 0.0, "18": 0.0, "19": 0.0, "20": 0.0, "21": 0.0, "22": 0.2, "23": 0.4, "24": 0.0, "25": 0.0, "26": 0.2, "27": 0.6, "28": 0.0, "29": 0.0, "30": 0.4, "31": 0.2, "32": 0.0, "33": 0.2, "34": 0.2, "35": 0.2, "36": 0.2, "37": 0.2, "38": 0.2, "39": 0.0, "40": 0.2, "41": 0.2, "42": 0.2, "43": 0.0, "44": 0.0, "45": 0.8, "46": 0.0, "47": 0.0, "48": 0.2, "49": 0.0}, "categoria_entidades": ["hist\u00f3ria em quadrinhos", "aventura de juba", "mico-le\u00e3o-preto", "fam\u00edlia", "desmatamento florestal no parque estadual morro do diabo", "extin\u00e7\u00e3o", "ajuda de novos amigos", "mesma situa\u00e7\u00e3o", "juba", "educativa aventura ecol\u00f3gica pela mata", "grande amizades", "for\u00e7a", "esp\u00e9cie do jovem primata", "novas amizades juba", "nina", "on\u00e7a", "nanda", "anta", "revista", "24 paginas de historia", "impressa em papel reciclato 90 g em paginas", "coloridas", "atividades", "desenhos", "capa", "offset 240 g", "p\u00e1ginas", "reciclato 90 g", "projeto", "publica\u00e7\u00e3o de 10.000 resvistas em quadrinhos do juba", "distribui\u00e7\u00e3o de 3.000 exemplares", "alunos da rede municipal de teodoro sampaio-sp em encontros liter\u00e1rios", "autor jhonatan freire", "bate-papo sobre literatura", "conserva\u00e7\u00e3o ambiental", "desenvolvimento de atividades s\u00f3cio-educativas do ip\u00ea", "instituto de pesquisas ecol\u00f3gicas", "3.000 exemplares", "parque estadual morro diabo", "1000 exemplares", "autor", "jhonatan freire", "teodoro sampaio-sp", "membro", "um dos fundadores da aeits", "associa\u00e7\u00e3o de escritores", "ilustradores de teodoro sampaio", "projetos", "eventos culturais na regi\u00e3o", "capas", "ilustra\u00e7\u00f5es", "obras dos associados", "pessoas", "caricaturas", "t\u00e9cnico em gest\u00e3o de pequenas empresas", "publicidade", "propaganda na unoeste", "criatividade", "facilidade", "parte", "vida", "dois anos", "pr\u00f3prio neg\u00f3cio a favor da cultura", "educa\u00e7\u00e3o", "studio jh comics", "trabalhos"]}